thread_id,comment_id,context
t3_1h5k81,carb58q,"Christianity has played a tremendously important role in Western history, but understanding cultural history should not always be about re-inforcing the dominant cultural forces. Lastly, I'd argue that, though the Bible has long been the most important book, that it's influence at present has waned. One could make a legitimate case for Darwin's The Origin of Species , because of its profound influence on contemporary biological sciences, or some combination of Smith's Wealth of Nations / Marx's Kapital being more influential on today's society."
t3_1h5k81,carb58q,"They might also have more explanatory power than does the Bible. And in fact, I think that most high schools should and often do touch on basic tenets of biology or capitalism, though without necessarily teaching those originary texts themselves. "
t3_1h5k81,cargoo8,"The problem with framing such meaning making as a fundamentally religious question is that religion in general, and Christianity in particular usually presents itself not as an answer, not as one partial explanation , but as a totalizing and exclusive explanation (what Northorp Frye, himself a devout Christian, referred to as an apocalyptic symbolic regime). By contrast, most smart teachers within an individual secular discipline acknowledge the limited explanatory power of what they teach (though they'll also argue that their discipline has more explanatory power than it's usually given credit for--gotta be defending one's turf, right?). It's hard, though, to present Christianity in such a limited fashion, and I think it's particularly hard for kids in high school to grasp it, since they're likely still living at home and are probably forced to conform their religious practices to those of the family in which they were raised."
t3_1h5k81,cargoo8,"By contrast, most smart teachers within an individual secular discipline acknowledge the limited explanatory power of what they teach (though they'll also argue that their discipline has more explanatory power than it's usually given credit for--gotta be defending one's turf, right?). It's hard, though, to present Christianity in such a limited fashion, and I think it's particularly hard for kids in high school to grasp it, since they're likely still living at home and are probably forced to conform their religious practices to those of the family in which they were raised. For high school kids (and even a lot of the college kids I teach at one of the most prestigious universities on earth), there are very real, practical ways in which religion is the totalizing force it claims to be."
t3_1h5bo4,car3t1w,"Race, for example, always triggers strict scrutiny. Gender, on the other hand, only warrants intermediate scrutiny, though it has gotten to the point in some cases where it's closer to strict than anything. Age and disability trigger deferential scrutiny."
t3_1h5bo4,car3t1w,"Usually, if a state invokes its police powers - as is the case with marriage laws - it will pass deferential scrutiny. Intermediate scrutiny came about during a spree of gender-based discrimination cases and has mostly been reserved for gender alone though, on some occasions, legitimacy (as in ""illegitimate"" children) as well. The test for this is that the ends must be important governmental ends and the means must be substantially related to those ends."
t3_1h5bo4,car3t1w,"The test for this is that the ends must be important governmental ends and the means must be substantially related to those ends. It is more fatal than deferential scrutiny, though not as fatal as strict scrutiny. Strict scrutiny is the most fatal of all three and the biggest hurdle for the state to overcome when defending a law it has enacted."
t3_1h4fc4,caquh1j,"Everyone knew that the NSA had surveillance, what's unsettling is the realistic possibility of insufficient oversight of the program's usage, and the classification of the FISA court rulings which may have indicated the unconstitutionality of NSA projects. Specifically with regards to your points though: 1. Through one of the leaked papers we did not only receive information that the NSA was gathering private data, but also received information on which companies had agreed to be used for surveillance."
t3_1h3tmi,caqo3iu,"The process of using data to extrapolate universal laws is inductive reasoning, so to say that you believe in inductive reasoning because it has successfully solved your problems such as data points A,B and C and therefore you can expect it to solve future problems is really tautological. Your main point is really interesting though. I meant to tailor my response more to your question, but honestly I got sidetracked in my comment and started to ramble a bit."
t3_1h3tmi,caqo3iu,"I merely consult my own consciousness and accept that intuition of whether I am happy. If I want to know whether I am sad, even though there might be behavioral correlates I cannot collect evidence for whether I feel sad in my own mind. The only way to answer such a question definitively is to accept the intuition at face value and go from there based on faith."
t3_1gzggd,capcxm0,"Even if you reduce your initial premise to ""Arguments that use [term] are not worth reading,"" you are criticizing the tone of the argument (again, see Graham's Hierarchy of Disagreement) rather than the argument itself. One could make a perfectly valid point in text lingo and that makes it no less valid (though perhaps it would be harder to read). The same is true of any particular terms you may or may not like."
t3_1gt2ny,canlnes,"I like jello.' These are traditionally understood as more childish treats when the alcohol is not added, even though there is nothing about them that makes them age specific. It would be the responsibility of parents to limit exposure or not give into giving their children alcoholic treats, but it is not a problem having to do with the items themselves."
t3_1gqfyr,camsoga,"So while you and I, not being Americans, might not feel as passionately or strongly about 9/11 - it has affected global foreign policy and been the spark that started full-scale wars in two countries in the middle east. As such, even though there is a never-ending onslaught of increasingly brazen terrorist attacks around the world, 9/11 by itself may only be a ""big deal"" for most Americans, but the consequences it has had are a big deal for everyone in the world. TL;DR : it is the consequences that 9/11 has had on the global population that make it a big deal."
t3_1go0nk,cam94e3,"So his argument is this: Let's suppose that the physical description of our world accounts for everything. This view is called physicalism , and though you didn't explicitly endorse it in your post, it is quite likely similar to the opinion you seem to hold. URL has a more thorough form of the argument, if you are interested."
t3_1go0nk,cam94e3,"Much has been written about this specific argument, both in favor and in opposition. I'd like to return, though, to qualia. Any worldview has to account for qualia."
t3_1gndd7,calx3a2,"Like I said at the end, you seem to be confusing these categorizations for premises, because you appear to think that saying ""x is a prototype concept"" somehow leads to a ""therefore"" with respect to its role in philosophy. There are no other premises which allow for any ""therefore"" to be drawn from that categorization though, which is a lot of the problem here. It looks like you're defending the question about creating AI or something, even though that wasn't the one I quoted and responded to."
t3_1gndd7,calx3a2,"There are no other premises which allow for any ""therefore"" to be drawn from that categorization though, which is a lot of the problem here. It looks like you're defending the question about creating AI or something, even though that wasn't the one I quoted and responded to. Your claim was that we are p-zombies, i.e."
t3_1gndd7,calx3a2,"I'm not sure why doing exactly what it was designed for would take away importance. Again though, you haven't done anything to show that your categorizations being accurate demonstrates triviality. That's kind of an important step in advancing the argument that they are trivial."
t3_1glkkw,caljuen,"So they'd likely have religious conflicts every week. This is kind of the case in Israel, though it isn't so strict legally in many areas. The issue is that there's very little you can do without some things open."
t3_1gk7i3,cal9gz2,"And how many stories do you hear of someone saving his family from getting shot with his quick reflexes with his revolver he has under his bed? - URL (though if you look in that article you'll find that often simply brandishing a weapon is enough to stop an attacker, I'll discuss why that's important in more detail later) They serve only one purpose - Hunting, self-defense, being a guard against tyranny, and coldblooded murder are not the same thing. Tough, your few hours of fun a month is not, and should not be placed above the safety of everyone who pisses you off."
t3_1gjtcs,cal0tb3,"(There's a struggle going on right here on Earth that some say is the result of a particular culture shamed by the rise of another, and which repudiates their scripture's predicted destiny. You didn't hear it from me, though.) The above hypothetical might not happen, but the risk that it _could_ happen is so high that it would probably be in the Federation's best interests to withhold the truth."
t3_1ghuhk,cakst8b,"A baby isn't going to mess with them out of boredom/excitement/etc. In my opinion though, once you pass baby-stage it's all the same. Young kids are going to do all those same things as an adult would do."
t3_1ghg9u,cakhjuz,"The Koran, like many religious texts (including the bible), often appears contradictory. I admit I don't know as much about the history of the Koran as I should, but for the bible, it is fairly easy to explain why - all the books were written by different people, and though divinely inspired, they simply didn't cross-check everything to make sure the points were the same. For 8.065 specifically, it seems like that verse is the Koran equivalent of Luke 1:37 - ""Nothing is impossible with god""."
t3_1g8ye7,caiqwaz,"By the way, the right to vote, just like freedom of religion, should certainly include the right to not vote just as a person can choose to not follow a religion. What about senatorial elections though? Do you even know who your representatives are for the state you live in?"
t3_1g8dms,cahqtw0,"Literary realism was championed and developed by writers way before him and he was largely traveling down a well-trod path. What Dickens did well that others didn't, though, was write for mass appeal. Hence his immense popularity both in his own time and posthumously."
t3_1fm8eb,caboa00,"I would finally like to know why you propose grouping homosexuality with paedophilia and incest, when the circumstances and repercussions of each of them are so different? A homosexual relationship is purely consensual and carries none of the problems of reproduction via incest (though personally I hold no problem against purely consensual relationships between relatives). Thank you for coming with an open mind, and I hope you re-evaluate your stance on the matter."
t3_1fm8eb,cabxdab,"I don't agree illness is the right word since it implies that an individual is somewhat inhibited by it. I totally agree though. Biologically, homosexuality doesn't make sense but as far as I'm aware there is no consensus on what causes homosexuality or why it exists so perhaps it's not possible to say for sure that it is a defect."
t3_1fl90i,cabjfyp,"So the secularism of a state is in no way linked to the kinds of laws they make regarding religious freedoms (the UK and Iran are not secular states that take vastly different approaches to religious freedoms). Second, the United States is famously a secular state but it is rife with religious justification for laws (though, not regarding the right to worship). It is also institutionally Christian - the US president swears an oath on the Bible, the pledge of allegiance cites union under God and the national motto is ""In God We Trust""."
t3_1fl90i,cabjfyp,"In spite of this and it's overwhelmingly Christian population, the US has yet to bar worship of any religion. So far we see that while a given state may be officially or unofficially secular, this has no bearing on a) it's capacity or willingness to accept religious argument as a basis for legislation and b) just because a state legislates in line with a particular religion's belief's doesn't mean that it will begin to encroach on the right to worship - though the rights of non worshipers suffer, discussed below. The last point I want to make is the one you raise about being part of a minority."
t3_1fkqyp,cabi5pb,"Sure, should my parents have made better decisions about my dietary habits, absolutely. It's not abusive in any way shape or form though. I was in no way harmed by what they chose to feed me."
t3_1f5j5p,ca7188z,"(which will be transferred into attention whore and snowflake stats, I'm sure.) Whether or not gender queer is recognized (and I'm friends with many people who'd sooner die than admit I'm not an ordinary straight male, even though I've experiences in life that make it easier for me to talk to women and the LGBT community, than to other straight men), it exists, as itself. There is nothing else quite like it...for now, anyways."
t3_1f3esr,ca6fmh9,"What you're saying, functionally, is: ""unless you already hold our negative view of your own beliefs, you shouldn't be allowed to discuss them here."" That's not going to get many people involved, though. "
t3_1evztt,ca4bru8,"I think al-Awlaki raises an interesting question: what do you do about an American citizen who is actively committing treason against the country, but is doing so while on the run and who may be difficult or impossible to capture? Do you allow him to continue coordinating terrorist attacks against you because you can't capture and try him, even though you could kill him? "
t3_1er14x,ca2wyds,"I think this position is rooted in acknowledging what a grey area it is for many people. By the time a fetus is 8 months in, it's perfectly viable and ending the pregnancy seems to many people to be equivalent to murder (though some religions hold that ensoulment occurs at the moment of birth, and not before, so maybe a view from that quarter would be different). On the other hand, many people do not consider a fertilized egg to be a full human."
t3_1er14x,ca2wyds,"If the fetus is a full person with all human rights, those are not suspended just because of the person's origins. The idea of jailing a rape victim for an abortion is abhorrent to many people, though, so the pro-life movement mostly does not seem to demand ideological consistency on this point (which is fine with me, since I'm pro-choice anyway). Anyway, the point is pro-choice does not always equal pro-abortion."
t3_1enop4,ca26n3f,"Reflections on Unwed Fathers' Rights and Sex URL ; Taking Custody of Motherhood: Fathers' Rights Activists and the Politics of URL On the draft Gender, War, and Militarism: Making and Questioning the URL ; Women Disarmed: The Militarization of Politics in Ireland URL ; Disintegration Conflicts and the Restructuring of URL From my understanding (I come from a political science background) feminist theory attempts to uncover the hidden gender power structures in supposedly neutral theories and social norms; and, as shown by the extensive literature on the subject, the gender usually left out or given less power is women. For example, to put it simplistically if you are analyzing states from a realist perspective you would primarily be looking at conflict/war and, (though feminist literature shows how women have participated and been affected by war) as historically men have done the fighting this theory really only analyses men's behavior in conflict completely ignoring women's behavior and perspective. To analyse the gender bias in realist theory on a deeper level, it was based on a theory of human nature formed during the enlightenment and only considered contemporary versions of masculinity calling it human nature; and again completely leaving out women."
t3_1ejwsi,ca0z4yj,"Toy Story ) stuck to subject matter that would be obstructively hard to film in live-action; and films that will make use of the 48 FPS standard in the future will be more bold in their digital effects given the greater scope the format provides for seamless integration. The desirability of the latter thing is a whole other debate, though, and I don't want to get into it here -- I'm just offering it up as a further example. I'll note as well that this point is a totally neutral one, even though you're offering it up as though it's negative."
t3_1ejwsi,ca0z4yj,"The desirability of the latter thing is a whole other debate, though, and I don't want to get into it here -- I'm just offering it up as a further example. I'll note as well that this point is a totally neutral one, even though you're offering it up as though it's negative. It's like complaining that formal poetry often contains rhymes."
t3_1ejwsi,ca0z4yj,"The children's market is a vast and important one, and if you really want to argue that Disney and Dreamworks have made a mistake in choosing to produce works that are aimed squarely in that direction, go right ahead. I won't get in your way, though I also won't agree. Certainly, but it doesn't do this any more or less than other regular features of mainstream, big-budget film-making."
t3_1ejwsi,ca0z4yj,"I'd like to have offered a longer response to all of your points, but I'm a bit busy at the moment! If you have any follow-up questions or challenges to offer, though, I'll be glad to do what I can. "
t3_1ejwsi,ca14g2z,"Not to mention it will likely become cheaper and more accessible as technology progresses. My post is a little late, but I want to address 3D being used to bring depth and meaning to a film, since I don't think it was as well addressed in this thread (though I haven't read through all of it so I apologize if it has). Coraline is a prime example of 3D being used to bring depth into a movie."
t3_1eeqwi,c9zk246,I am an atheist living in Turkey which is the only secular Muslim country. The majority of my country prefers secular system rather than Sharia law even though some fundamentalists want Sharia. I completely agree that countries that use Sharia as their official constitution are incompatible with others.
t3_1edqbg,c9z8lj2,"Sometimes specific items have sentimental value. I own a violin that belonged to my great grandfather at the time he immigrated from Europe to the US, and though it isn't worth much, you can bet that I want to pass it on to my own kids someday. This would not change if the violin were instead worth $100k."
t3_1e74qq,c9xfppc,"I would hope you would say 'of course not'. Even though you're entirely physically capable of stabbing yourself, every part of your brain will fight you. Your brain will say that the pain induced by ramming a knife into your hand is to be feared and avoided; and it's the same brain systems involved with addiction that are informing a person to avoid that pain."
t3_1e0dd7,c9vvh9i,"Sure it might be a long way from internment to killing and we did end up going back on our decision but I definitely think it's possible. I wouldn't expect us to do it outside of a time we are in war though for the reasons you mentioned... But it seems that we take our most draconian measures in times of war and I, while thinking it is far fetched, could see this happening if the situation was set up perfectly."
t3_1dyb7o,c9v8bw6,"Nobody would argue that Bob Dylan the singer deserves more credit than Bob Dylan the composer. On the other hand there are singers that could bring you to tears with Amazing Grace, even though the melody is fairly boring. A great singer can make a decent song sound great, and a decent singer can make a great song sound good."
t3_1dj741,c9tg98h,"Like saying that storing ice cream has, as a benefit, providing you with a freezer. In actuality, you need a freezer first, so the ice cream does not provide that benefit (though is still delicious). "
t3_1di0zr,c9ra475,"You don't choose to believe in honor because if everybody follows honor society is better off, you follow it because it was taught to you as an ideal, something to believe in and it satisfies an urge to transcend beyond our basic human nature. Love probably developed as part of procreation, that doesn't help in understanding it though as you yourself are a product of the same process that caused love to exist. If evolution happened to instill in us a burning longing for being underground then the great kingdom of the earth's core would be our ideal, it doesn't matter where it comes from or why."
t3_1dgj00,c9q3kq9,"I just don't see a practical way to implement it. It's an interesting thought, though. EDIT: Small wording change."
t3_1dgj00,c9q4k0c,"You're giving ideological reasons in favor of the policy. I've already stated, though, that my argument is not ideological, it's practical. For the sake of this discussion, the problem with the policy is its implementation."
t3_1dfy2a,c9px836,"If instead we stopped trying to place blame on one or the other sex and focus on teaching, advocating and displaying personal responsibility to both sexes in all matters sexual, then we would see a dramatic improvement over time. You're basically asking humans (read, not men or women, but both) to just control some very powerful urges as though it's as easy as flipping a light switch. I think you know that's not possible."
t3_1dfnx1,c9pwrti,"Probably because this is a very general subreddit, and music appreciation is a very specialized thing. So, musical tastes are disputable, though I would recommend going elsewhere if you want to discuss it. /r/letstalkmusic is great."
t3_1dahpy,c9oloe7,"Part of those changes were being less judgmental, and other people drinking was a big thing for me. I largely misunderstood what it would be like when you got drunk, even though I had the descriptions right, the reality of it wasn't the same. I won't get into it now."
t3_1d44p3,c9mq0ns,"Sometimes they feel better but the side effects are not worth it. - Alcohol always makes you drunk in a relatively predictable way, right (even though some people act different when drunk than others)? Antidepressants are not so predictable."
t3_1d44p3,c9mq0ns,"Antidepressants are not so predictable. If an antidepressant works though, that is pretty great. Mood starts to improve slowly and you start to realize things you did not even take into account before anymore."
t3_1d44p3,c9msi95,"Right now if she misses two straight pills she'll realize it because she's started crying in public, so maybe she's dependent on them. The alternative, though, even if they're completely out of her system, not just cold turkey withdrawal, is serious mental anguish. The dreams she described having on a nightly basis are completely beyond what I'd considered a nightmare till that point in my life; I don't think anyone can argue against medicating for it in some situations."
t3_1d44p3,c9msi95,"Bottom line I do think they're overprescribed (and overzealously so, thanks Doc for putting me on 4 at once) and I think that's even recognized (sheepishly) by the field, but they have a place in the treatment of depression for some sufferers. I'd advise giving it as fair a shake as you can stand and seeing if it's worth it for you; at no point did I find them any of them psychologically addictive so if you're not happy with your treatment I think you should be able to get back to good old 'depressed but not medicated' without too much trouble (though coming off some of them was a fucking pain from just the physical effects, lookin' at you Effexor) "
t3_1d3iw3,c9mr6i0,"But never one to truly usurp the Americans. The Russians, as the Chinese today, were always in competition with the Americans (though the Chinese rely on the Americans in reality). Russia was always a superpower, but in terms of global influence the US was still far ahead."
t3_1cymw8,c9l9z8j,"So in a way you deserve it. More than even that, though, is that a belief in hell gives you the comfort of knowing that even if someone who does great evil in this life gets away without corporeal punishment, God will not let them get away without any punishment. Atheism, on the other hand, takes away all of that."
t3_1ctkhw,c9juokl,"The problem is that people in general tend to gravitate towards people who seem sure of themselves and a lot of studies/theories kind of propose a ""this is most likely to work scenario"" in terms of the economy and social policy. I would like to see a panel of scientific experts for candidate's debates or speeches though, just to see the BS in their arguments. Also part of the problem is that power corrupts and once you put anyone in power there is a good chance they will eventually abuse it or at least loosen their initial resolve."
t3_1cocdc,c9j13yk,"My dad lives in London but travels two hours to see the GP he went to when he lived further North. One reason we might not want people doing that for routine surgery, though, is that it directly impacts a hospital's competence at the harder stuff. If you read the Daily Mail you will be aware the NHS is closing a lot of child heart surgery units because of... immigrants or something (it's the Mail , what are you going to do?)"
