thread_id,comment_id,context
t3_1yst0y,cfngu5x,"I do think the education system has gotten off course from that purpose, and that a wider veriety of courses should be offered, including those you listed. I don't really think that that, in particular, is a cause for he current problems in society, though. Since even blue collar jobs require training and some level of education."
t3_1ysjvs,cfnejdg,"It's not without humor, as he cheekily describing characters who manifest their own problems into these absurd, malevolent worlds that only superficially resemble the real. These are all things representative to his time period, though. Since he grew up within an authoritarian government and his own father was very exacting man."
t3_1yoc2s,cfmrnqs,"I would state that both (a) and (b) are true. (a), since there can be information reasonably inferred, though it isn't the most reliable of information. (b) is also true, since ""male"" and ""female"" are defined only as societal constructs, not with any underlying absolute definition."
t3_1yf0hw,cfk3gzm,"So each page of the great gatsby must contain a completeness that embraces its pageness just like each episode of The Wire MUST have a completeness that embraces its episode-ness. Sometimes though it takes a few pages to build up to those epic lines, dialog and scenes that we all remember In the book. Not every page can be a work of literary genius compact into itself, nor should it be."
t3_1yc8z3,cfj8dok,"Such codes help prevent artists from taking advantage of those whose judgment is compromised, but are not legally enforceable. It's my understanding that such a code exists, though I'm not aware of the extent to which this tenet is strictly adhered to. "
t3_1yc8x2,cfjqxyk,"It doesn't require University to hold these views. I think you should dismiss these views because they're arrived at though needs that have to do with emotion and identity and belonging, not function or experience or deliberate, focused study. In the Western world it is very political, so just having a point-of-view and choosing a side, regardless (and often in spite of) the reality is valued."
t3_1y8r7h,cfibmko,"No reasonable person would say otherwise. What I think you are getting at though, is when people judge others based on a lack of information that lead up to some marginal action. Rape and murder is objectively bad-at least most would agree-stealing a loaf of bread is simply something that can be forgiven depending on what caused a person to steal."
t3_1y8e6p,cfidj9k,"So do Mark Rothko's works. Even though many people (including myself) dislike this genre of art (personally I find it to be low effort), it's not like you can say that it doesn't fit the definition of art. Now as for all of this style of art being terrible, I think that's a very close-minded generalization."
t3_1y5jpe,cfhjc63,"How about someone who, say, brutally raped a dozen prepubescent girls, causing massive irreparable internal damage, and left them beaten and broken? Gotta say that even though I oppose the death penalty, I'd be a lot quicker to pull the switch on scum like that than someone who, say, planned the murder of his wife's lover. "
t3_1y0z80,cfggmp9,"We tried this out here in Montana a while back, where the speed limit on Interstate Highways was set to ""Reasonable and Prudent."" This changed a few years later, and we now have very specific speed limits, though it still took a few years before we had a state-wide prohibition on driving with an open container of alcohol. The problem is that people tend to over-estimate the capabilities of their vehicles, as well as their driving skills."
t3_1xwomv,cffjyds,"Instead, they draw you in by talking about general sociological theory without really going into detail about how it's applied or what it accomplishes. Remember also that every scientific field begins with personal opinion and conjecture; it's only upon performing the boring studies and such that it become Science with a capital S. Our understanding of gravity started when Newton (anecdotally, though not actually) had an apple fall on his head and thought ""something made that apple fall"", leading to ""I wonder if there is a force that attracts things to each other"", leading to scientific research to verify this conjecture, and now several hundred years later, we have a very refined understanding of the gravitational force. To draw a parallel to your original example, I don't think it's hard to argue that it's common sense that if you drop something it will fall."
t3_1xwb0k,cff8cw7,"You don't drag your nice desk chair to every class room you need to sit in, you use what is already in that room. I though it wasn't worth your time to spend hours learning the commands? If you are willing to learn the commands then vi is that tool (for some servers)."
t3_1xti2t,cfepy2q,"Yes, I think it is more about viewership and interest. A few years ago though there was a MLB player who did rant about the treatment of Black-Americans compared to Black-Hispanics, so I can't speak about what's going on within the organization itself and how Black-American players feel or are being treated. But as a young Black-American I don't hear young Blacks complaining about baseball--- they don't watch it to complain about it."
t3_1xrors,cfe2r8p,"There is nothing wishy-washy about it. Unfortunately though, decimal numbers are not unique, since the infinite sum 9/10+9/100+9/1000...=1. That means 0.9999... = 1."
t3_1xqnjx,cfdsxp9,"The other thing you have to remember about teaching in college is that college students are supposed to be more independent in their studies than in grade school, meaning that if they want to use their laptops/tablets and distract themselves by going on the internet instead of listening during class then they will ultimately face the consequences with a worse grade. Also, you might have noticed that I excluded the use of cellphones in this because in my experience students don't necessarily use cellphones for educational purposes in class but rather to distract themselves (even though they can be used for almost anything a tablet can be used for). "
t3_1xqloo,cfduxm3,"Down your line of thinking insanity lies where you can never really be sure of anything and you are constantly clouded with doubt. I've gotta say though I think I've just achieved a wall of text here, I totally agree in pretty much every way with your statement beyond the absolutist position of NEVER hold a belief so firm that your mind cannot be changed. I think maybe it's true of roles, a judge or doctor or politician should never rules something out completely or hold any opinions with 100% conviction, but us as simple individuals, we probably need at our core a few unshakable facts about reality that we never question because possibly that way madness lies?"
t3_1xqbkw,cfdnoww,"You feel like a normal, two-armed person in every way, but you have this third arm flopping around constantly reminding you that you're different. This might naturally cause you a lot of distress since people are going to treat you differently, even though you're just like them on the inside. You talk to someone about getting it removed, and they laugh and explain that it's just how you were born and you're silly for thinking you should only have two arms."
t3_1xny71,cfd4qsf,"No openly gay characters, episodes like the one where they introduce the Trill or where they had the gender neutral people (both TNG) were supposed to be allegories for gay people but the episodes were neutered (for instance by casting all the neutral people with women so Riker wouldn't kiss a man). Even the first lesbian kiss they overtly insisted that it was really a former man and a former woman kissing and not two women even though physically it was two women. Why do I bring this all up?"
t3_1x44be,cf7y65l,"If anyone knows of a superior alternative I will gladly jump ship eventually. It's actually true though. Factually speaking, you have the ability to do that stuff - if you have a device like a smartphone, that is."
t3_1x3quk,cf82a08,"They're placed on reddit, and upvoted by redditors, specifically because the posters and voters thought, in their heart of hearts, despite what polite society would have us think, that they could bring joy to a whole lot of people by sharing a simple photo with others. Thus, that picture of a girl's ass filling up most of your front page as you scroll down the page is representative of what makes reddit a beautiful, magical place: that things are shared out of kindness and upvoted with goodwill, and even though we may not agree with everyone on the site, even though we might despise a lot of the content, we know that we're mostly just decent people who are looking to enjoy ourselves for a little while on the internet, and we're not going to spoil some arbitrary rules about what is acceptable in polite company ruin our good time. If the unfortunate side-effect is that you have to occasionally see some naked pictures because you don't want to stick to your front page rather than /r/all AND you don't want to turn of NSFW posts then, well, maybe its something you should just let go."
t3_1wvouv,cf5t6kg,"You don't need the Windows key to use your computer, but these shortcuts are very convenient and a lot faster than the several mouse clicks needed for each of those operations. I have yet to find a use for the Menu key, though. Also, I believe you can disable the Windows key for full-screen applications so it doesn't interfere with your gaming."
t3_1wu9bx,cf5ghfv,"Sounds a bit sensational, doesn't it? It may not be that far fetched, though, with all the potential ludology has. "
t3_1wqdpz,cf4fnk7,There's really nothing substantive here to argue for or against. I don't think this is what redditors actually believe though. I'm going to start by saying I dislike CMVs in this format.
t3_1wjggc,cf2k4m9,"So either pedophiles ARE acting out on their urges (which is basically rape in our society, since children can't give consent), or they are NOT, in which case I would imagine they would be feeling distress and would like help. To my understanding, that's enough to classify it as a disorder (though I dislike the negative connotations that disorder has). "
t3_1wi4dg,cf3apv9,"Usually those types of people don't get much attention, at least compared to groups like the Westboro Baptist Church, but I believe that many people are like that. Paula Deen was plenty nice to African-Americans even though she was secretly a massive racist the entire time. If a gay couple's car broke down, I'm sure some Boy Scouts would help them just the same as they would anyone else."
t3_1we3gg,cf15san,"The condition's heritability is 50%. It doesn't present the same in everyone, though everyone has the same mutation. Some people are mildly hindered, but it can also be fatal on it own, and it increases risk for cancer."
t3_1we3gg,cf15san,"I used to think my parents were at best thoughtless, and at worst selfish to have children. Even though I am one of those children. None of us have it, luckily."
t3_1we3gg,cf15n2w,"This in turn can have an effect on cell replication and eventually cancer risk. The issue though, is that this is a many layered process, which first starts with, what is the rate of transmission of the gene. The first argument I would have again people having kids with an increased risk of cancer, is that fire and foremost it is at this point only a risk of passing on said genetic condition."
t3_1we3gg,cf14k7c,"On the other hand, other genes increase the chance of heart attacks, or strokes, or skin cancer. Even though I have been fortunate enough to never have had cancer, you might have a statistically better genetic profile than I do. Unless you know that your child would have a demonstrably and significant risk of getting bone cancer, your history shouldn't keep you from reproducing."
t3_1wd6jq,cf0vo2d,"This property is called ""Heavy dependance on initial conditions"". Now, one could say that even though we don't know the initial conditions, there have been set in stone and that's what they are. It is here that quantum mechanics come into play."
t3_1w99ax,cf08bgj,"For me, it would show a lack of trust in my character. For me, I wouldn't protest though. For me, I would do the paternity test in a HEARTBEAT, if the father of my child asked."
t3_1w91jl,cezwkl3,"Other aspects are more ambiguous, such as the politeness as weakness. This could be a derivative of the self-defense required when being tread upon by every other segment of society, though I'm not certain when it comes to this. However, what I can say at the end of all this is that a culture and every feature therein can only be judged in light of the trials its people must conquer to survive."
t3_1w6uhl,cezy174,"But your CMV wasn't talking about the average - you said "" I simply have not come across a compelling argument for IVF that makes reasonable sense to me."" When you think about the specific situations in which many couples find themselves, though, those arguments become clear. The cost issue brings up a very simple situation: many good health insurance plans cover IVF the same as any other medical issue."
t3_1vrpkb,cev6nad,"For some people insurance is a bad decision at any price. But I believe the fact that most people buy insurance means that they have though about it, measured their risk, expected value, and aversion to that risk and decided that it makes sense to pay for that kind of insurance. If I started deciding what's best for other people I'd end up screwing them over, because I don't know them or their situations as well as they do."
t3_1vil80,cet0nf1,"I just wanted to point out that your idea of this ""outside area of land"" is itself essentially predicated on the existence of society, as you seem to want the society in question to essentially cordon off this land as protected and stateless. This is still relying on society though if you want this land to have protected status. If you do not want any sort of protection of this status, however, then in what way will this land remain free and stateless?"
t3_1vg6qn,cerydvt,"So from what I can gather from your OP, the only reason you actually think this is a good idea is because it will increase the total GDP. There's a big problem with this though, ignoring ""muh freedoms"" which is a fairly obvious argument: You can't assume that every business will actually benefit from this, because you are not properly comparing profits in the current system vs. profits under your new one. For instance, suppose we set up the no-painting rule to prohibit do-it-yourself people from painting their own property - how do you know they're all going to hire painters instead?"
t3_1vd61r,cer51fm,"As in, GID's dysphoria can be cured by transitioning, whereas for others if they alter whatever they are fixating on, they will not be happy and will just find something else to despise. Edit: URL is that comment about the difference between GID and Body Dysmorphic Disorder and why they are treated differently, though both deserve sympathy. "
t3_1vbp78,ceqpcqv,"If your view was, ""people who want to play pool shouldn't stab people with sticks and should nicely ask them for space"", then I wouldn't be trying to change it...that's more than sensible. Your view though was that they shouldn't expect you to move in the first place, polite or not. As in your example here, the problem is that one of the activities is not location specific."
t3_1v8hly,ceps6kq,"So basically, weed improves my ability to contribute to society, to write things that make the world a better place and to help me deal in a productive way with anger towards people (some of whom I love) who express hurtful opinions towards others. It's fine if you don't want to smoke weed - I am SUPER against peer pressure and am not going to try to convince you to smoke yourself (though I would encourage you to try it if you want to educate yourself on what it actually feels like to be high. But you will find no pressure from me on that front)."
t3_1v6x7z,cepcqsx,We can't force veterans to call the crisis hotline when they're feeling stressed. We can't deny veterans their right to purchase weapons at their leisure even though those who own a weapon are more likely to commit suicide. I don't have a solution to the problem.
t3_1v6sc1,cep8u6j,"Any large slab of meat like a beef or a steak, etc., or things like potatoes, are all too big to eat with chopsticks. Asian food was made to be eaten with chopsticks though, which means there isn't really a negative side to using them beyond ""I'm not as comfortable using them"" (which goes away after you've used them a lot). "
t3_1v6sc1,cepbi6t,"I've taken my toddlers to a eat before, in a place that gave them to ""kids"" version of chopsticks (rubber-banded together) and they loved it. My main point here is that though there will always be douchebags out there, don't let them cloud your view of the world. You see what you want to see in people."
t3_1v2buu,ceo3y9o,"I haven't learnt 12 languages. What I have done, though, is travelled to places where I've spoken the language, and travelled to places where I didn't. And it wasn't necessarily ""useful"" to speak the language - nowhere was I unable to obtain food or shelter or something that I wanted."
t3_1uy91r,cemvbwz,"It shouldn't be the basis for gatekeeping anything , let alone gatekeeping a community of discriminated-against individuals with a lot in common. Gender Confirmation Surgery isn't a mandatory part of transitioning, though it can be very helpful for trans* individuals who experience dysphoria over their genitals. Reducing being trans* to ""wanting to invert your genitals"" is really hurtful and betrays a fundamental lack of understanding of what trans* people are actually experiencing and going through."
t3_1ut0dy,celg0sb,"Imagine how much more technology will advance in the next few? When the space shuttle was retired just a couple years back, its computer systems were all incredibly outdated, even though they were first constructed in the 1980's. The whole line of space shuttles had outlived its useful lifespan in only 20 or 30 years because it would have been prohibitively expensive to upgrade them to modern standards."
t3_1ul993,cej9725,"OK, now let's say you run your restaurant for a while, but then get bored and don't want to do it anymore. It's turning a nice profit though, so I tell you I'll buy it from you for 100,000 dollars. Good deal for you!"
t3_1uhj8f,cei5r73,"Yet many people in philosophy of mind still don't think it is likely to be true. Here is an illustration why: even though it seems too surprising, too incomprehensible that other hunks of meat in other human heads could give rise to conscious thought, that surprising-ness is just as real with regards to the hunks of meat in our own heads, and yet we have first-person direct acquaintance with our conscious experience nonetheless. Step back and don't think about your brain as ""yours"" but rather think about your brain as this physical object ""here"" and another person's brain as that physical object ""over there""."
t3_1ueayk,cehgs3r,"I don't think having kids is better than not having kids; people can be fulfilled either way. What I most strongly disagree with, though, is that non-child-related life goals are extrinsically motivated. I'd choose my career and life abroad."
t3_1u7llg,cefbw53,"Even if a person is partially responsible for being assaulted, does that not mean you can't have sympathy for them? Presumably you have sympathy for those who are victims of hurricanes or earthquakes or tornadoes, even though they are responsible for living in areas with an increased risk of natural disaster. If you got robbed while walking in a dangerous part of town, I'd still feel bad for you, even if you presumably could have taken steps to help reduce your risk."
t3_1txyfq,ceczo86,"But when faced with the question for real, few people will opt for the insecurity of dissolution. I've lived in Scotland as a foreigner for the past 6 and a half years, and though I've not followed the debate with eagle eyes, I have, of course, been aware of it. There are some difficulties with untying."
t3_1tx0tf,ceca72e,"Do you teach your kids your general views such as harming other people or stealing from them being wrong, or does that also qualify as a belief? I'm sure you see where I'm going here, so I'll leave it at that, though I'm sure I could come up with more examples. Secondly, if you honestly believe that if your children do NOT accept Jesus Christ as their lord and savior (to take a religious example, as I'm fairly certain that's the general problem you're having), they will be sent to an everlasting, painful, torturous hell... can you possibly say it is anything but evil for you NOT to teach them, even force them to accept Jesus Christ?"
t3_1tt75b,cebccgh,"I know there is a decent chance that the team down by 10 points will catch some form of momentum that will bring things back to even. It seems as though every qualm you have sited about the sport of basketball stems from the pace of the game. Every single possession in basketball must end with a missed basket, a turnover, or points all within a 24 second period; because of this fast-paced aspect of the game, the opportunities to score are greatly increased especially when taking into consideration the size of the playing field is 94' x 50', which, needless to say, doesn't even come close to the football field, baseball field, or soccer pitch."
t3_1tqttm,cealwzd,"You don't know where it will be or what the probability of that detonation are, but you know it's a possibility. I would argue that it's immoral to press the right button, because even though you'll be slightly convenienced, there is a chance that you'll act in a way that's very immoral. Eating meat, to me, is pressing the button on the right (I know it's hyperbolic, it's an example)."
t3_1tqlde,ceaj38t,"This is an extreme case of telling the Santa lie, where it starts to overlap with telling your child about a Deity, because when people do that, they do it in order to have them believe it wholeheartedly. In the majority of cases though, the Santa lie is supposed to be figured out by a child, while telling them about your favorite Deity is not. It's the difference between giving them a difficult puzzle which they don't know is a puzzle and giving them a difficult puzzle and telling them it's a painting, so they shouldn't even touch it."
t3_1t83kb,ce5bsdz,"The list goes on. - There are some testimonial URL that apply to married couples, though ideally this URL because I'd like to think you're not looking to do anything that will end with you in court. - Many of the above problems can be mitigated by executing separate legal documents."
t3_1t5izv,ce4jsh6,"If a local group is a threat then they can collect data on that group. If they don't feel as though a group is a threat, then how does having data they aren't even looking at going to let them prevent an attack? "
t3_1t2kp7,ce3sq3s,"and ethics. Even though this post was deleted, I'd just want to tell you that a lot of your day-to-day political and social life - your possibility to go to school, your possibility to elect your representative, the fact that the president cannot decide your death on his own, the fact that you can be an atheist if you want to, the fact that there are paved streets and road signs - are all products of political phil. and ethics."
t3_1t2kp7,ce3thab,"Every piece of structured knowledge you can acquire will help you somewhere and at some point. Philosophy and music have both helped me in my studies, though I was a ""scientific"" HS student, and now a law student. Not taking some of theses subjects because you assume there are not helping you in your career path is (1) Arbitrary: what do you really know about it?"
t3_1swzm7,ce22s9w,"Certainly the country has areas it could improve. As you mentioned, homelessness and poverty are serious problems, though not historically high. We are still deficit spending (though that is decreasing), and many still lack adequate health insurance (though the Affordable Care Act is helping that)."
t3_1swzm7,ce22s9w,"As you mentioned, homelessness and poverty are serious problems, though not historically high. We are still deficit spending (though that is decreasing), and many still lack adequate health insurance (though the Affordable Care Act is helping that). Overall though, the country is doing pretty well right now and does not require a massive and major reform."
t3_1swzm7,ce22s9w,"We are still deficit spending (though that is decreasing), and many still lack adequate health insurance (though the Affordable Care Act is helping that). Overall though, the country is doing pretty well right now and does not require a massive and major reform. In fact, the system was setup to prevent such major reforms because they tend to have a ton of unintended consequences."
t3_1swzm7,ce2h9nu,"Most people are simply paying less proportion of their income in taxes than they historically have. How do you reconcile this with being ""big government"" though? You said you thought the federal government should be shrunk and then called for it to be expanded."
t3_1sgl5a,cdy0hcv,"India did not exist except on British maps . We were not one nation in 1947, though we may be (sort of) today. We were a collection of many, many different peoples, across radically diverse geography."
t3_1sgl5a,cdy0hcv,"Look at how it worked out for them). He also ensured that post-Independence we did not tear each other apart on communal lines, though we've been trying hard since. To take no credit away from all the other freedom fighters, but they thought small."
