thread_id,comment_id,context
t3_2bffjw,cj4w7lb,"Amablue covered this well, but a few additional things I feel uniquely qualified to answer this because I'm working with a group building an autonomous car (its a small one though, I'm not a googler), and I just wrote a research paper on the ethical and legal implications of such vehicles. Amablue covered this well, but a few additional things"
t3_2begsn,cj4ixp5,"Most people don't have wealthy relatives to lend them money, and even if ""loan charities"" somehow became a thing, most people would not be poor enough to benefit from them. My main point is not that there are ways to make money without interest and without doing work yourself, though it is true. My main point is that you are giving people fewer options if you don't allow interest (and the loans that come with them)."
t3_2bbq91,cj3viu7,"Sexual readiness is a developmental milestone, too - or, rather, it's the culmination of several physical, emotional, mental and social milestones. There are still some major consent issues involving relationships between adults and middle/older teens, though. In a relationship with a large age difference where one partner is a minor, the adult partner generally has a very large power advantage - physical, psychological, financial, social status, etc."
t3_2bamw2,cj3fhb7,"The ""chicken industry"" for example is far less impactful than the beef industry, and fishing is mostly inconsequential as far as environmental impact if you don't accidentally fish something into extinction. From a suffering standpoint, though, this is where I try to remember that just because we're cognizant doesn't mean we aren't animals. We're not somehow separate from the rest of the animal kingdom."
t3_2ba26t,cj3fyrg,"Now we have to consider there might be about 20% of people who weren't completely satisfied, and rated lower. For many of the 'acceptable' system users, they might rate a 3 stars to show discontent (though also conceivably lower. But I think you'd argee that it seems anything less than 5 voices some dissatisfaction, whereas only a 1-2 star might do the same for a thoughtful reviewer.)."
t3_2b1rab,cj0ycid,"Now, I completely agree on the count, no restaurant should refuse you, or give you lower quality steak for this. However, you will find a deal of social stigma around ordering the steak like this, and I believe that to be somewhat warranted (though only in a mock-serious manner). Again, this is primarily because you could be paying a good amount of money, for a less flavorful steak."
t3_2aymhj,cj0yroe,"Not perfect by any means, but a fairly major difference from wild-type. Humans, though, have a generation time an order of magnitude longer- usually somewhere around 20-30 years, depending on culture. To achieve results similar to what was seen with the foxes, we're looking at something like 700 or a thousand years."
t3_2aymhj,cj161tw,"It's possible, in a similar way to how domesticated animals revert to something approaching wildtype when they go feral. Inserted or modified genes wouldn't be any more prone to loss or mutation than the rest of the genome, though- probably less so, since they'd been specifically designed to be advantageous. Besides, in that sort of collapse, the population in question would be very likely revert to the way they were before they acquired the characteristics you regard as dysgenic, too."
t3_2aymhj,cj161tw,"But these will be ameliorated as we develop the technology further. And it's not as though natural reproduction is without risks, from your point of view- that's where all these supposedly-dysgenic characters came from and how they were able to accumulate in the genome, after all. Even after you'd eliminated the current lot of them, you'd have to keep the eugenic program going indefinitely, in order to prevent new genetic problems from cropping up."
t3_2aymhj,cj161tw,"Gene therapy would allow the specifically deleterious alleles of these genes to be targeted and altered while allowing the rest of the genome to survive and contribute to the overall reproductive diversity of the population (and, incidentally, to the spread of the advantageous alleles it's been modified to possess). Governments (and other higher organizations) are made up of individuals, though. Laws and regulations are entirely abstract."
t3_2ay3kf,cizyl7b,"We're told to think differently, to spell differently, to use words differently. And it stops being our language and becomes someone else's language, imposed though unwanted. It's stops being the language we grew up with, the language of our grandparents and parents, and severs links with the past."
t3_2ay3kf,cj0s4zc,"As for people being touchy, well, they're always going to be touchy. I do somewhat agree with you though, if people weren't so quick to judge a persons abilities according to their grammar skills it could be positive. Because contrary to popular belief, the way a person uses grammar has little to do with their intelligence."
t3_2av5cs,cizd4ad,And even the couch surfers generally end up at Camp Toyota after a short period of time anyway. They're homeless though they often still have jobs. You might not even realize they're homeless.
t3_2av5cs,ciz37g5,"He grew up in the same city I did, played music, had a crappy apartment, traveled. There's a gap, though, after that, that he's never talked about. Other days he discusses how his week went."
t3_2ancgk,cizbef2,"When I was a toddler I had a few sets of colored foam letters that I played with, so perhaps corresponding colors were somehow wired into my brain as I was learning the alphabet and how to read. I hope I don't come across as someone who thinks they're superior to everyone because they have synesthesia; I recognize that it's a pretty inconsequential phenomenon and that it doesn't make me any better than anyone else (though you may meet synesthetes who do not share my view). But I really do believe that it is real, even if people misinterpret what it means."
t3_2a71ap,cis8nhw,"But, iheartaegislash, the name is coca-cola cake, why is it the buttermilk that's the real MVP? Don't fret though, the coca-cola adds flavor to the cake without overpowering it, but the buttermilk really brings out the flavor of the other ingredients. It still tastes like a delicious chocolate cake, and is incredibly rich, so you only need to have a small piece to really get the enjoyment out of it."
t3_2a71ap,cis8nhw,"I know, I know the sweets thing, but because of the mixture of spices included in the cake, it doesn't get overly sweet. I've downed about 1/3 of a full spice cake after eating a meal, and though I was full, I was the happiest guy in the room (mostly because everyone else only got to split 2/3's of this delightful concoction). I will close now with one final thought."
t3_29twg4,ciohbmn,Laws are about striking a balance between eliminating every potential harm and allowing people liberty (which is a good in and of itself). We allow cheese burgers even though obesity is a huge issue because the liberty of being able to eat them is worth more to society than the health benefits from banning them. Likewise listening to music when driving.
t3_29thke,ciod9wn,"If the government spends your whole life watching you but you never hear about it, it really isn't a problem for you in practical terms. In the real world though, there are some issues... 1. They are collecting huge amounts of data on everyone."
t3_29pjwk,cind88i,"well, you have to draw the line somewhere, it's not appeal to authority in the same sense or in anywhere near the same capacity that ""appeal to authority"" as a logical fallacy is meant to be understood ""appeal to authority"" is more along the lines of ""bob is a mechanic and he says I need new blinker fluid"" - wheras inductive reasoning is more along the lines of ""thousands of scientists, myself included, have attempted this well documented and replicable experiement procedure and most of us, but not all have observed the same results"" pick your side, pick your battles - just because 1% of people saw apples fall up, even if they really aren't lying, doesn't mean that really changes the fundamental fact that most of the time you and everyone else notice that apples generally fall down you can't completely eliminate cognitive bias, but with the scientific method we can get about as close as possible to doing so and about as close as possible to a present time understanding of the truth having beliefs, that are based on the best available current evidence, that are open to change when presented with compelling new evidence, is about as much as you can do if you want to call that appeal to authority, then ok, but you've gotta draw the line somewhere as to who to believe and when, and peer reviewed science, though not infallible, is about as close to the best option a person has well, you have to draw the line somewhere, it's not appeal to authority in the same sense or in anywhere near the same capacity that ""appeal to authority"" as a logical fallacy is meant to be understood ""appeal to authority"" is more along the lines of ""bob is a mechanic and he says I need new blinker fluid"" - wheras inductive reasoning is more along the lines of ""thousands of scientists, myself included, have attempted this well documented and replicable experiement procedure and most of us, but not all have observed the same results"" pick your side, pick your battles - just because 1% of people saw apples fall up, even if they really aren't lying, doesn't mean that really changes the fundamental fact that most of the time you and everyone else notice that apples generally fall down you can't completely eliminate cognitive bias, but with the scientific method we can get about as close as possible to doing so and about as close as possible to a present time understanding of the truth having beliefs, that are based on the best available current evidence, that are open to change when presented with compelling new evidence, is about as much as you can do if you want to call that appeal to authority, then ok, but you've gotta draw the line somewhere as to who to believe and when, and peer reviewed science, though not infallible, is about as close to the best option a person has "
t3_29n4wo,cio9nnh,"I think most of the points you gave are actually excellent general reasons for a given person to perhaps consider polyamory instead. It's still quite socially taboo, and though I'll probably take heat for this, I tend to notice most people are far more accepting of gays/lesbians/whatever than they are of polyamorous people. I don't know if any of the following directly addresses explicitly any of your numbered points but I think it at least implicitly addresses some of them."
t3_29koa9,ciluvuu,"Also, you put too much emphasis on the success of a scoring attempt. There are plenty of shots on goal, even though most of them are saved. What's more exciting than a goalie diving to make a last-minute deflection?"
t3_29koa9,ciludrx,"As for time management, that's a matter of preference. It really isn't random, though. There's a fourth official whose responsibility it is to make sure the right amount of time is added."
t3_28yh06,cig4wo1,"Maybe Vince pressured him to drop to Lesnar so that push could help generate interest in his limited appearances. Maybe Taker wanted to lose to a legit fighter (even though it was a WWE match). I mean, I'm sure someday Calaway( or someone else who knows what's gone on) will talk about it... most likely in one of those post-retirement retrospectives they make for us smarks."
t3_28xbw7,cifjy3z,"If said charities and organizations had transparency, for instance 20% of all donations going to administration and not to said purpose, I think people would have not right to complain about CEO of NGOs being paid high wages. As it stands though, there is little transparency in this sector, so when someone finds out something like: URL It's bound to leave a sour taste in the mouths of the donor. Seriously 4% of their take went to pay the CEO, that's kinda crazy."
t3_28k1k9,cibnrkr,"You're essentially describing states. The only things that keep the situation now from resembling what you describe (though I think we're as close a practically possible to what you describe with the current system) are the upswing of federal power, the general incompetence of present state governments and heavy gerrymandering of electoral districts. Splitting up into separate countries wouldn't solve the problem because contrary to the ""Red State-Blue State"" narrative, America isn't really divided by geographical lines."
t3_28at68,ci95fk4,"It is all too specific and boring for it to make sense in any non literal way. I'm not an expert though to be honest, so maybe there is an explanation. i just don't know it."
t3_281bde,ci6f2vp,"But it's not as simple as that because you want both the job and the relationship, so if he is unwilling to sacrifice his own job and move to your country, then you will have to make the decision as to which one of those you want more. It's not sacrificing your career though, it's only sacrificing this particular job and switching your career onto a new track. \*EDIT: Had a look at you previous posts, you said you only just started this relationship in the beginning of April ... chances are that if you go and live with him, the reality will not live up to the fantasy and it will soon be over ... but you might have to actually go through that to find out for sure otherwise you might always believe that it would have been wonderful if only you could have been together for ever."
t3_27r91j,ci469aj,"Because smoking affects your sense of smell, this goes largely un-noticed by smokers. Even though a friend of mine routinely told me ""you stink"" every time we hugged, I always thought he was referring to a small effect. No - it's a huge effect which drastically alters your social appearance."
t3_27hf7o,ci1a4gk,"A person working full time off of minimum wage would make about $15,000 a year. Should they all be compensated evenly, even though some of them obviously lost more than others? That hardly sounds fair."
t3_27hf7o,ci1a4gk,"That hardly sounds fair. If not though, then how do we decide? Even going off of past earning potential isn't enough."
t3_27gnxb,ci0ta3o,"Also, you have to keep in mind that the relation people have with the bible is fundamentally different than most books (save the Qur'an, Adi Garanth, Book of Mormon, etc.). Even though many have read the Hobbit, I doubt they are likely to pick it up on a regular basis. I doubt that most bother to memorize specific passages."
t3_27dypa,ci0bdgm,"Whether or not you put yourself at a disadvantage is completely irrelevant. If Jessie sees Jamie fall and hit their head on a rock - let's say for the sake of argument that Jessie knows Jamie has a concussion - then proceeds to have sex with Jamie even though they know Jamie would never consent to it otherwise, that's rape. It doesn't matter that Jessie did not personally hit Jamie with the rock, what does matter is that Jessie took advantage of Jamie when Jessie knew they were in a more coherent state of mind than Jamie was."
t3_277y4m,chydb1h,"This means they could donate money directly to political candidates and political action committees directly in support of candidates. I do think we should restrict their speech when it comes to ballot initiatives though. Churches are powerful, and giving them more power in the political process is likely not a good idea."
t3_2766rt,chxu2ly,"Christian philosophers have been trying to come up with a good answer for a long, long time. Like a lot of problems in Christian theology, though, it is usually dismissed by the faithful with some kind of appeal to faith - usually something like ""I believe in a good god, and part of my faith in God is the faith that what He does is Good and doing what he commands is therefore Good - to question his work would lack faith in his goodness."" Honestly, I think that is a kind of reasonable answer if you already have extreme faith, but is kind of a cop-out if you don't already have faith in God."
t3_274620,chxaxd7,"And it's not a democratic party circlejerk, it's much more of a liberal circlejerk. People there honestly aren't that in favor of Obama per se, just opposed to Obama-bashing, as though he were the source of all problems in the U.S. government. But that's just because reddit is mostly college students, and as the saying goes: ""if you aren't a liberal when you're twenty, you have no heart, and if you aren't a conservative when you're 40 you have no brain""."
t3_273kmd,chx2u1h,"Any mature group of adults will absolutely accept someone not drinking. None of this really changed my view though.. it was exposure to people within casual drug culture that did. You see, we should absolutely be treating alcohol and other drugs."
t3_26z994,ci473oh,"Which is much more clear. Now, though, I can keep a cool head when I'm terrified. I have practiced and learned that skill."
t3_26rjpu,chttc3y,"They'll go the way of the switchboard operator. You might have a few though for services like hotel shuttles, etc. but the average person won't use one."
t3_26nayb,chssa9d,"I've only glimpsed the a couple of the replies on here but clearly your experiences are telling you something about your actions are off-putting to others. I'm wondering, though, if you want us to change your view on what misogynistic behavior is or to change your view that your behavior is justifiably off-putting to women? It seems most people are addressing the former."
t3_26klj1,chs03g4,"A shitty government, a shitty school, shitty parents. All these causes though can be undone with effort and time. People can be rescued if there is the will."
t3_26klj1,chs03g4,"Unless their own lives go to hell they will never see the need to sacrifice time, energy, and resources to help others. These types of people can be worked around though. They are not a wall but a speed bump."
t3_26klj1,chs03g4,"The goal of ending it was there, but not reachable within anything but a ""one day in the future"" timeline. They did managed to achieve that goal though, and pretty quickly, because they kept working at it. No one is doomed."
t3_26klj1,chs24pt,"I do not substantially disagree with your main point (although your take on it seems a bit negative to me). I would like to address what you say here though: This part is often untrue, and seems a bit pessimistic. While it is well known in mental health circles that trauma affects the ability of caregivers to properly attune to their children, which often leads to interpersonal problems for them later in life (i.e., personality disorders, etc...) this is not set in stone."
t3_26klj1,chs24pt,"Perhaps your own struggles account for this negative flavor -- and rightly so. My point is fairly specific though; just because someone experienced truama in their family does not necessarily mean that it will be reflected in their own parenting style. According to attachment theory, people who have recovered from their own traumatic childhoods may exhibit what is known as ""earned"" secure attachment -- that is that their adult relationships do not resemble the traumatic and poorly-attuned relationship styles of their childhood."
t3_26chd9,chpu05i,"I know I do. More often than not though (at least in my experience, which is limited), the other party just doesn't listen. Doesn't care."
t3_26chd9,chpu05i,"It isn't my fault if other people don't want to hear about uncertainty. With regard to the media though, yes. Economic predictions are presented as being far more accurate than they actually are, especially when you consider the media most often reports on predictions (such as predictions of GDP growth) which are notoriously inaccurate."
t3_26chd9,chpu05i,"Economic predictions are presented as being far more accurate than they actually are, especially when you consider the media most often reports on predictions (such as predictions of GDP growth) which are notoriously inaccurate. I don't know whether this is the fault of the economists though, or of the media. What do you think?"
t3_26b1l1,chpkxvq,"Race is real like money, and national borders, and adoption, and the meaning of these squiggles I'm writing with--it's real because enough people collectively agreed that it was real and gave it importance. It isn't biologically or intrinsically real (even though we tried to find its 'location' so to speak) and it shouldn't matter, but thanks to the actions of the past (and present) it continues to be real. Racism makes no sense because these differences are based in our treatment of each other, our preference for one person or another, our limiting of people by their colour or nationality...not on something inherent."
t3_264xi6,chnu7dr,"5. It's the most time-consuming job (though there's an argument there). What they mean is that the combined mental, emotional, physical, and time on-call toll that it takes on someone is the greatest, and that we're physiologically wired to make it the top priority in our lives (oxytocin is a bitch of a chemical, let me tell you)."
t3_264iek,chnlkj6,"There's nothing dishonest about it. The word ""honorary"" basically means ""fake"", though with a very positive connotation. An organization gives an honorary title to a person who does not belong to the organization but whom it wishes to honor."
t3_26388i,chn9wjm,"The drugs they do get are unregulated and more likely to cause health problems. Finally, if caught they are sent though the legal system which wastes even more of their money and, if jailed, lessens their prospects as a productive member of society, putting them deeper into the hole. Drug money funds more damaging crimes, like terrorist, human trafficking, and gang wars."
t3_25x7qp,chlltit,"It is not immoral to mutually decide to participate in a natural function of the body with another individual in a non-physically harmful way. Even though you don't personally understand how people can feel that way about sex, the fact is that people DO feel that way, and you should not label their activities and feelings as immoral simply because you don't understand them. "
t3_25ttah,chknoam,"Sex can be good in non-committal relationships but we've had the benefit of being able to discuss what feels good, understand each other's respective turn-ons, and have had multiple bouts of differently toned sex ranging from playful to aggressive to slow and romantic. There are times we have sex and I feel as though it's more conversational in that I am relaying how my feelings in a way I could not with words. It is possible that this isn't what you're looking for at this point in your life."
t3_25k2ud,chi2ugu,"Take Macklemore's win over Kendrick Lamar at the Grammys and on the charts: Kendrick is more technically proficient, more innovative, and offers a more complex emotional and political message. Crash won an Oscar over Brokeback Mountain (though it grossed significantly less) despite (or perhaps because of) heavy-handed, saccharine moralizing. A ""big message"" doesn't necessarily lead to superior art, and the idea that the biggest or most award-winning of a genre are also the best examples of that genre is demonstrably false."
t3_25gqr3,chh8rrt,"As an aside, some consider the possibility of a cyclical universe that has periodic big bangs, then collapses in on itself and repeats. This would necessarily require a violation of the 2nd law of Thermodynamics (though admittedly the conditions of pre-big-bang universe have not been replicated in the lab). Furthermore, they don't line up with a universe that is accelerating outward."
t3_25e9jx,chh1vkr,"First, when Maurice (Belle's father) first shows up and says that there is a Beast that kidnapped his daughter, Gaston's only thought is to use it to have Maurice committed. Even though he is an avid hunter, he has no interest in killing the beast until he understands that he is a rival for Belle's affection (and until after the plot to have Maurice committed has begun to fail). Also, during the ""Kill the Beast"" son, Gaston says ""screw your courage to the sticking place""."
t3_255hmb,chdweq6,"That being said, adoption is a very admirable choice. I wouldn't do it because you are scared of your own genes though. Genes are like a hand in a card game-what works for poker might not work in bridge (or whatever card game would make this analogy work.)"
t3_254zub,chdse4g,"Besides, the government is also keeping the putative wannabe monopolist from shooting me because I want to be competing with them. The thing about burger shops is you'll actually find that most, though not all, localities do have rules regarding congestion and distance between buildings, not so much as to the purpose (though there are some contracts like with stores in Malls, or Universities where that has been negotiated), but to the existence? Yes, that can be regulated, when it does cause a problem, depending on the jurisdiction."
t3_24v4li,chaxo0c,"I eat meat and dairy products and so forth. But I do think it's possible, though difficult, to remove oneself (almost) entirely from the deaths of animals. And just because something is unavoidable does not mean we should do it endlessly and wantonly; if the death of one animal is necessary, that does not equate to a complete lack of respect for animal life, and a willingness to kill millions."
t3_24v147,chbavh7,"When the woman asked the teenagers (this happened more than one in more than one conversation with different teens) what they thought of these interruptions, the teenagers always answered ""what interruptions?"" They viewed their actions as normal (and not rude, though it was rude to do so). 2."
