thread_id,comment_id,context
t3_2rnr30,cni3o83,"Would this actually make a more heavily armed society a more polite one? I don't think it would, because though premeditated murders could well be less likely, accidental deaths, unplanned homicides, and suicides would like increase. "
t3_2rmy6e,cnhc8a5,"A lot of philosophy seems to be common sense just because it's been so thoroughly integrated into our culture. The place that we're currently at though is the result of a lot of work in ethics, epistemology and metaphysics. To assume we can arrive at the best answers just by thinking hard is ignoring the work that got us where we are, both in failing to understand how much labor was required to get us here, and failing to challenge some of our current baseline."
t3_2rmy6e,cnhjqws,"You get to read arguments against other arguments and see how expert thinkers think. Obviously not, you need to study science (though you would be surprised how many leading scientists actively study philosophy). Science is a set of methods and concepts that helps you explore the relationships between things in the world."
t3_2rkjr3,cngqb7p,"Say you're right, and most of the people who post here are incapable of actually changing their view on the subject they're bringing up (I don't believe this is the case most of the time, but just for the sake of argument). It would still be false to say that nobody ever changes their view, though. People have deltas awarded to them, and those signify that somewhere out there, somebodies mind was changed."
t3_2rexe3,cnf8xlt,"If business owners similarly extended military discounts too far, it could cut into their ability to be effective. On a personal level, though, I agree that ""military discount"" becoming ""public service discount"" wouldn't be a bad idea. It should be noted, however, that this would extend to even people like politicians, teachers, and government administrators"
t3_2r3fa4,cnc4l6o,"Essentially your argument is that our moral obligations stem entirely from our individual beliefs. Assuming you do not believe in hell (though maybe you do, I don't know) you are claiming that even though you don't believe this place exists, you think that someone who genuinely does believe such a place exists has the moral obligation to prevent people from being sent there - even though you would say that they are mistaken that there is such a place. So my response to that is this: if someone genuinely believed that a deity had told them to kill another person (or multiple people) in order for both they and he to achieve salvation, would you argue that it is moral for them to do so?"
t3_2r07cv,cnb8dy3,"Or in other words, it would be condemned as homosexuality, becuase you cannot change the gender that God gave you. (You can't really actually change it with science, either, but don't say that to loud, people get threatened) The single biggest reason though, is that changing your gender is in effect spitting in the face of God. If he is all knowing, and all loving, you were made the way you were for a purpose."
t3_2qtorn,cn9ejzb,"We should not cater to it. I do a little volunteer work with a women's shelter (though I'm a guy), and you will probably find that those shelters offer services for men as well. The shelter I work with has a dedicated facility for women, and partners with hotels for men."
t3_2qrbaf,cn9b6ar,"And I tried. I loved The Hobbit, even though it got slow, but I found Tolkien's prose to be far too slow-paced and filled with inane babbling about things too far removed from the plot. I loved the extended edition because I get more engaged in an audio-visual medium than I do into books, as a general rule (this gets suspended for pretty much anything that starts with ""Harry Potter and the..."" but that's an exception), and the extended trilogy let me really grasp the world of Middle Earth for the first time."
t3_2qqxoy,cn8oez8,"As people can engage in all kinds of delusional behavior and often still function in the world quite well, this is not sufficient evidence for whether or not something should or should not be constituted as evidence of a disorder. The belief that one has an animal spirit is not new and has been a component of many primitive animistic cultures throughout history, and certain Native American practices still have vestiges of this, though most of us wouldn't describe them as ""delusional"" simply because they follow the traditions of their ancestors as they've been practiced for centuries. While you may find the practice disingenuous or disgusting, this is not reason enough to hold the behavior as evidence of a specific disorder in and of itself, and in cases where there may be genuine mental illness involved, I believe that there's enough criteria already set forth in the DSM to diagnose these conditions accurately without directly addressing this particular cultural phenomenon as some kind of mental health outlier."
t3_2qqa7z,cn8hti0,Every exercise I can think of can be done at a variety of speeds over a variety of distances . Eventually though you'll stop making strength gains and simply be increasing your endurance. This is the fundamental problem with all body-weight exercises.
t3_2qmhw7,cn7hxwe,"The only ways I can think of are people trying to go back and find those pictures and use them against a person as some kind of ad-hominem attack in the public. This again, though, goes back to a culture which seems unreasonably biased towards sex. There's this mystique and taboos surrounding it's open discussion which involve shaming and peer pressure, bullying and non-sense."
t3_2qmhw7,cn7h4vg,"It's a thrill and a risk that gives people immense pleasure. They are not getting any attention though, since they usually remain anonymous. Also, when it is spread online you hardly ever find out who has seen it or what people think of it."
t3_2qia6o,cn6rxow,"I would also hope that a start up's first technical hire could be someone the founders have a reason to trust. And I see a line manager growing his team as a microcosm of a founder growing his company, though the company may have rules in place to help keep the line managers from going off the reservation. Do your rules only apply to big companies?"
t3_2qb4ra,cn4kqwf,"It's like playing poker with players who never bet: it's not fun, it's just a long, awful slog. That doesn't make Poker a bad game by design (even though it can be unfun in some scenarios); it just means that it's not a game that everyone will enjoy. I'd recommend pointing out to people that the point of the game is to make trades."
t3_2qaf6l,cn4h6d8,"Everyone has a mind that works in its own way. The problem isnt always bad parenting, though that can play a role, the problem is a black and white educational system. Treating everyone the same way, other than special classes for ""dumb"" kids is the problem."
t3_2pqfx4,cmzmqbt,"Hip Hop, however, is still evolving, changing, and being mass produced, by artists both good and bad. Still, though, Hip Hop today is still a very valid genre, and there's a huge difference between Classic Hip Hop and much of the mainstream ilk out there. There have been classic Hip Hop and Rap artists awarded that kind of recognition for example URL And, you have brought up Kayne's awards and critical fame URL , which I think essentially negates your own point --- Hip Hip is getting credit, just maybe not in the way you think it deserves."
t3_2pqfx4,cmzmqbt,"Critical recognition is very different from public recognition, and Hip Hop has had a tough road in that respect, with a lot of negative publicity due to past gang violence, and now celebrity antics. No one, though, is arguing the worth of Hip Hop being less than any other musical genre out there, though. "
t3_2ppxgu,cmz3fxo,"4)With any circle-jerk you can assume there is a sizable portion of trolls within it. Even though they may be making fun of the ""CIS, white-penis'd, STEM wielding hivemind,"" some of them are probably those exact things. 5) While I don't have solid evidence of their ""downvote-brigading"" you have to imagine that it happens to at least a certain degree."
t3_2pnm9s,cmytc0t,"A majority of them of them were able to find employment and friendship after release. Those aren't the ones you hear about though. Odds are, in the last year, you have interacted with somebody working a job, who had previously spent over a decade in prison."
t3_2pkvb6,cmxuwcy,"All of those things will happen. Why worry about it though? Why allow it to prevent having experiences like mine, or someone else, or something you dream up?"
t3_2pkvb6,cmxuwcy,We have total agency from an existential point of view although reality does assert itself early and often. We can still do things though. We can capture moments of experience.
t3_2pimzj,cmx2c61,"I was specifically looking for someone to shed light on a group that I have never been personally involved with, yet had strong opinions on, because I may want my daughter to get involved. CMV is a sub where there appears to be a more cordial attitude toward debate with less impassioned mud-slinging, derision, and name calling (though I admit I have only been viewing content for a couple of weeks). It seems that if someone really wanted to get on a soapbox, they could merely head to a sub that specifically handled their topic (politics, religion, etc.)"
t3_2p3z06,cmt7f8t,"For instance, per the CDC regarding Flu treatment: http://www.cdc.gov/flu/antivirals/whatyoushould.htm No, not everything can be treated, but going in and getting antibiotics may prevent you from getting pneumonia for instance. The two situations don't overlap completely, but, clearly employers think it's worth it, even though the more their health care is used, the greater their premiums. URL that's at least similar: Honestly, I can't think of a decent search term to pull up the appropriate study, but many cases of things like pneumonia patients think they might just have bronchitis or a cough, but if a doc listens to your lungs they can diagnose pneumonia."
t3_2ovqav,cmr1iii,"Everyone in the ground combat elements either knows or has seen someone like this. They buy pouches for their pouches, a dozen aftermarket accessories for their weapon that they don't even use properly and spray paint those accessories in earth tones even though they roll around in a giant fucking truck you can see from a mile away. They do their level best to look like a Call of Duty cover model and just end up looking like a douchebag."
t3_2ovqav,cmramno,"Think of it this way: you would think that rugby would be a much more dangerous sport than football because rugby players don't wear pads, but that isn't the case. The NFL is having problems with concussions and TBI even though they wear helmets and facemasks, rugby players the world over don't have the same problem wearing nothing more than a scrum cap. So what gives?"
t3_2okad4,cmo23yr,"I read TFiOS, Looking for Alaska and Paper Towns, and I thought that the hype was really unfounded because they were just more formulaic teen fiction. After revisiting the books later though to see why I had (briefly) originally liked them, I decided a lot of their appeal was because they deconstructed a lot of the tropes that they're made of. I'll concede that TFiOS is really overrated, but I think Looking for Alaska and Paper Towns in particular are really solid because they're a twist on the Manic Pixie Dream Girl thing that's really prolific in media right now."
t3_2okad4,cmo8ojn,"And it's not like Hazel ran around shouting it. She reminded herself that even though life seems unfair, she can still make the most of it. It might seem weird, but that little sentence from her favorite book helped her rationalize her cancer."
t3_2oihml,cmnhr07,"In the case where the person C is unaware of the relationship between A &amp; B I would agree. However, when person C is aware of a pre-existing relationship, even though he does not directly know person B and does not therefore have a meaningful connection to ""owe"" him anything, he is disrespecting person B by knowingly facilitating person A's breach of their social contract. Person C at that point has become an accessory to the infidelity, an accomplice if you will."
t3_2o6paa,cmkar1d,"OP, I'm going to make a bold jump here, but please bear with me. Based on your starting argument, It sounds as though you understand some of the basic principles of evolution, and that you have an idea of how the scientific method works, even if you aren't yet willing to accept the conclusion that all species on Earth descended from a common ancestor. My assumption here (and please, correct me if I'm wrong) is that you are not yet willing to accept common ancestry because it directly conflicts with a core belief that you hold, which is to say that you believe that all species on Earth came to exist exactly as they are, through creation."
t3_2nokg9,cmftzma,"The pacifist may have longer term goals than you. They may think that even though they can reduce next weeks major violence by committing minor violence today, they may be concerned about setting a precedent of violence that will last long into the future. They may believe that their example will pave the way for a dramatic and longer lasting reduction in violence years from now."
t3_2nokg9,cmfzhbk,"So I would think by your logic we would have to acknowledge that your framework is also immoral. I don't though, because I reject the notion that imperfection implies immorality. I don't think that adequately sums up either of my second two points."
t3_2nbeuf,cmc4ns0,"You exist for some of those moments, then you die. Even though you die, your existence in those pages is untouchable. Nothing can erase that."
t3_2namx3,cmbzyjs,"If the police dash cam video shows you get out of the car, stumble around a bit, then puke all over the road, you're going to be convicted, no matter how good your lawyer is or how bad the prosecutor is. I can think of one example though where the issue you raise is very important. Basically anyone at the IRS or SEC who demonstrates substantial competence is immediately hired by some Wall Street law firm at 5 times their old salary."
t3_2n900k,cmbi11m,"I think the concept of going to start one's own nation is not analogous to changing jobs due to the amount of work required. Instead, the best option would be to change the system, since that is part of the ""contract"" I'm in with the government even though I never consented to it. A problem I have with your argument here is that it seems to assume that the policies of a government or company are stagnant."
t3_2n8psp,cmbnpay,"I have no problem sitting down discussing retirement plans together. Nor am I thinking about replacing any of them with a better model, as though women were all on some scale and I'm looking for the one with the highest number of girlfriend points. I just enjoy being with them, and hope to be with them for a very long time."
t3_2mv3n4,cm83yv8,"I still can't bring myself to say that word without remembering those times. It went on for a while, I remember the last time though. Threatening to scream when his mum was downstairs, we were in his room and he'd locked the door."
t3_2mv3n4,cm83yv8,"I took money from him not to tell my parents, or to let him do other things to me. It was great though, I could buy toys my parents didn't have the money to buy for me. I didn't know what prostitution was."
t3_2mv3n4,cm83yv8,"After my second relationship I was older and more confident. I'd get drunk at any opportunity and have sex with pretty much any girl I could, paid for sex several times, it didn't really help though. I still felt dirty and feeling that way made me feel more like a woman than a man."
t3_2muo4y,cm8kfip,"As far as piracy vs. theft, I do think that the ease of getting away with it really does have a significant impact on the frequency of piracy. My main point though is that being part of society means putting up with a lot of legislation that you don't like and that, sometimes, upholding rule of law is more important than doing what you think you should be able to, for the sake of preventing people from breaking the laws you do agree with. Civil disobedience is what you do when you are so opposed to a law that you're willing to accept the penalty for breaking it, and risk others following your example of disregard for law, rather than follow it."
t3_2mesct,cm3nquu,"Yes, but the experience is personal and to what extent it is enjoyed subjective. Some people (even though they are a visibly smaller group) really just enjoy this initial buildup. - Trap, on the other hand, employs an almost identical build, and then the contrasted lack of sound at the drop serves as a different kind of experience."
t3_2m9le3,cm28iwd,"- ok, those parts were easy, they basically just say: follow a planner. They do not help with everything, though. Trying to manage several assignments at the same time, trying to make sure one is on time for meetings, etc."
t3_2lxha7,clz4fjz,"As the article says, I agree that it's difficult for parents to make decisions about their infant's future sex life. My parents had my brother circumcised even though their doctor told them it was medically unnecessary because they were worried that my brother would feel weird in later locker room and/or sexual situations when most of his peers would also be cut, statistically speaking. I think that in matters that will have an enormous effect on a person's self-esteem, social life, emotional life, etc., it is best to wait as long as possible to allow the child to have some say in their own future."
t3_2lwrsv,clzj8j6,"Discipline, initiative, physical fitness, and self-confidence are all pretty universal traits to success, and indeed, things that TRP/PUA advocate. So the military didn't strictly tell you to go talk to girls, what was so hard about figuring that out though? If you had asked your peers instead of going to the TRP, do you think you would have ever changed?"
t3_2lrnbm,clxhtmt,"After that if they chose not to make their work a bit legible then I wouldn't feel bad docking points off since you can't read anything. I can see the professor's point though, this is Engineering and not an English class. So he wants to grade on content rather than how pretty it looks which makes complete sense."
t3_2lqcby,clx99dx,"Speech is constitutionally protected no matter whether it's called public health or public safety or something else. The reason is that the first amendment protects the behavior, even though it's repulsive. Most cases of street harassment could not possibly be made criminal in accordance with current first amendment law."
t3_2lclza,clus7m4,"I'd argue none at all, but I don't expect to convince you if you disagree, and I don't expect you to convince me. Either way, though, the reality is that right now the overwhelming majority of meat (and other animal products, but let's focus on meat) is produced using obviously inhumane methods. To me, the only two surefire ways to ensure I don't consume any inhumane meat are 1."
t3_2kk7pc,clm4luc,"Financial exploitation has a vague definition, but if actual fraud has been committed, that's a more serious type of harm. Revenge porn with identifying information, though, could easily lead to life-threatening harm. Laws already exist to protect against this kind of stuff (and against similar activities like doxing) but the laws are scattered across many civil and criminal codes, which makes them unclear."
t3_2kgrtb,cll6vkk,"You have to think about what you're eating to make sure it passes the diet's rules, and if you consciously think about every single meal, you'll probably eat less. The actual rules don't really matter, though - you could make snacking harder by sticking to a ""diet"" in which you only eat foods that start with letters A-H. Counting calories and weighing everything you eat also requires that you think before you eat, but the burden is much higher than sticking to a few simple rules."
t3_2kfldi,clkve20,"The thing is that powerful followers of radical islam take great efforts to keep education away from people, so the two go hand-in-hand. Never said it wasn't, my point was that if you are going to go after the Bible for promoting violence, but give the Quran a pass, even though it has hundreds of verses promoting religious intolerance, then you are not being very philosophically consistent(not saying you are specifically, but there are plenty that do.). Many people who cry islamophobia have no issues with criticizing christians for their misdeeds, even though their actions towards people are lesser by comparison."
t3_2kfldi,clkve20,"Never said it wasn't, my point was that if you are going to go after the Bible for promoting violence, but give the Quran a pass, even though it has hundreds of verses promoting religious intolerance, then you are not being very philosophically consistent(not saying you are specifically, but there are plenty that do.). Many people who cry islamophobia have no issues with criticizing christians for their misdeeds, even though their actions towards people are lesser by comparison. Female genital mutilation isn't a part of the Bible, though."
t3_2kfldi,clkve20,"Many people who cry islamophobia have no issues with criticizing christians for their misdeeds, even though their actions towards people are lesser by comparison. Female genital mutilation isn't a part of the Bible, though. That has more to do with local practices than it does with religion."
t3_2k19cr,clgz8mq,"I can in fact get all the nutrition required for healthy living without consuming products that cause animals to suffer, so I feel it is most moral for me to do so. In fact I still feel that what I wrote above holds even though I eat meat now (we're all flawed I guess). My first girlfriend was horribly allergic to soy, and lots of other things including chocolate."
t3_2k19cr,clgz8mq,She would be hard pressed to get enough protein in her diet without meat due to her dietary restrictions. I never considered it immoral for her to eat meat even though I felt it was immoral for me to do so. If I were to try to enforce my beliefs about moral dieting on others (something I wouldn't do btw) it would have to be very conditional.
t3_2k16fy,clh464b,"Can you explain how do you have sexual orientation without gender? Is a couple with a m-f transgender and male partner gay, even though the man feels he is dating a women (but biologically male). Personally I feel as a society we put too much stock in this stuff (love whoever i don't care)."
t3_2jp9x4,cldt2z1,"Unfortunately for the back office, their work is never as highly valued as front office work. A front office can get by without a back office, though they will be less efficient. A back office has no purpose without a front office."
t3_2jp9x4,clekeze,"If a wife was a lawyer and the husband stayed at home and raised the kids you could easily imagine the wife saying ""I could simply hire a nanny for $X a month to do what you do - that is the free market value of your work and I bring 10 times as much value to our family through my work."" One of the interesting things though is that, generally, lawyers do not marry fork lift operators. Doctors do not marry call center reps, etc."
t3_2jkgzi,cld1es7,"But you know what? I discovered several new genes, one of which is important to the parasite's motility (and therefore infectivity), and discovered a key missing link in understanding the function of an already very well studied protein... didn't do any science though, according to you. Neither did Rosalind Franklin, James Watson and Francis Crick do any science when they got the structure of DNA."
t3_2jd1e2,clal24g,"Characters in ads now have cult followings like Mayhem, Flo, the old spice guy, and the most interesting man in the world. So even though you still have to sit through a bunch of ads during commercial breaks, the chances of one of those ads appealing to you are much higher because that sort of evolution was actually needed for advertisement to continue on TV. This brings me back to the original point."
t3_2jaiv1,cl9wvir,"Personally, I love the smell of marijuana, but that is probably due in some part to my previous use of it. One thing to note though is that as marijuana use becomes more socially acceptable and legally acceptable it will bring more innovative ways to ingest it that don't have the same smell of unburnt or burnt marijuana. Edibles and concentrates have been gaining popularity recently that don't have the typical marijuana smell, and vaporization has become a more popular way to smoke which doesn't carry the same smell either."
t3_2jaiv1,cl9wvir,Many legal growers and marijuana shop owners have essentially made marijuana their lifestyle. Do you what these people have done even though they make up the medical marijuana industry that you support? 
t3_2j28la,cl7ri4n,"So, I have nothing to say regarding your opinions - I agree that the U.S. military budget is way too high, and we could do well to implement a better health care system. One thing that's worth noting, though, is that having a military is not just as socialist as universal healthcare. Military necessarily needs to be provided for by the government, since everyone in a society benefits from having national defense yet nobody has an incentive to pay for it, so no private organization would ever be able to fill that niche."
t3_2j28la,cl81bji,"So while it'd be great if we had unlimited resources, we don't, and therefore it is a capitalistic good, and can be divided accordingly. Military defense is a fundamentally different type of public good though... "
