thread_id,comment_id,context
t3_2qc1rl,t3_2qc1rl,"With this in mind, we are forced to acknowledge that we are probably making errors in other places, and may even have been led astray in one of the areas we have already changed."
t3_2pjmrj,t3_2pjmrj,This is important b/c constitutions inevitably change over time and when there are no textual limits on that change you arrive at a situation like what exists in teh US where the Constitution enforced by the courts bears little resemblance to the Constitution as written (it's really interesting to note the universally acknowledged importance of intent-based interpretation of the Constitution in Canada.
t3_2oo3qw,t3_2oo3qw,"Ever since 2010 we've seen this kind of political posturing against the Obama administration, and while that campaign has been intellectually dishonest and very damaging in some ways, it's important to acknowledge and respect this persistent proportion of Americans who are genuinely not okay with the direction that the country is going."
t3_2nokg9,t3_2nokg9,"Whilst I agree that making a mistake is not in and of itself immoral, I would argue that having an absolute and uncompromising world view that we acknowledge is not always right is immoral Emphasis mine."
t3_2nokg9,t3_2nokg9,So I would think by your logic we would have to acknowledge that your framework is also immoral.
t3_2mo4fl,t3_2mo4fl,"However, if we acknowledge that everyone is purely self-motivated, I do not believe that I am or should be responsible for the functioning of society."
t3_2kose9,t3_2kose9,"Since it's unlikely that we'll just reform these laws piecemeal, each individual law can still dictate what kind of relationships it chooses to acknowledges for the purpose of that statute, i.e., still discriminate against 'peculiar' kinds of relationships."
t3_2k1puo,t3_2k1puo,I think most anti-death penalty advocates would acknowledge that rehabilitation would be impossible if society collapsed.
t3_2j7gwy,t3_2j7gwy,"Looking at your first link, OP didn't necessarily participate a lot, but every time they did participate it was to acknowledge a good point, and overall they thanked the group for providing a lot of useful ideas for clarifying what he thought (and indeed, he agreed eventually that giving to charities that supported the homeless was a better idea than giving to the homeless themselves, which is a significant change in viewpoint)."
t3_2isiv7,t3_2isiv7,"Democracy is a shared acknowledgement that we are all in the same boat together and we should, together, determine the path it takes."
t3_2gmkz2,t3_2gmkz2,"And to your second point, I don't know about the other states, but here in AR you have to publicly acknowledge your belief in God to hold a liquor license at your place of business."
t3_2g8jj7,t3_2g8jj7,"It's a small change, but an important one because it acknowledges the (not yet proven) assumption you're making."
t3_2fgw85,t3_2fgw85,"Like -- why other people, who acknowledge that their lives are a blip on the cosmic timeline (if even that), keep going on in life?"
t3_2faq4i,t3_2faq4i,"For me a fistbump is a physical shorthand for ""I acknowledge/departure your arrival and I'm glad to see you."""
t3_2eqf4w,t3_2eqf4w,"If those ferrets got out, there would've been a mass pandemic; in fact the paper that acknowledged this wasn't published due to fear of bioterrorism, but I digress."
t3_2eez7x,t3_2eez7x,"That said, the literature available acknowledges that teenagers who date seriously are at higher risk for negative relationships and pregnancy, as well as divorce."
t3_2d9qj2,t3_2d9qj2,"How many times do you turn on your phone's screen to archive a dumb email or read a one-line message (or acknowledge an event, etc.)?"
t3_2cflx0,t3_2cflx0,"As you have acknowledged, the Aldmeri Dominion is the true threat (not just to Skyrim, but to the world), but your belief in the Empire's ability to meet that threat (as it currently stands) seems unsupported."
t3_2btxhq,t3_2btxhq,"Even the big time warners about global warming like James Hansen acknowledge we are uncertain about how negative and positive feedback loops will interact, and therefore exactly how quickly warming can be expected to occur."
t3_2bffjw,t3_2bffjw,"Also, not to be untoward, but, rule 4: >""If you have acknowledged/hinted that your view has changed in some way, please award a delta."
t3_2auttr,t3_2auttr,"I acknowledge that the question you provided is a little strange, but trust me, as a retail manager you don't just want people who can do a job."
t3_26oc4p,t3_26oc4p,"But it migh also be useful to acknowledge what kind of other people it is associated with , who tend to approach the issue from this angle as yourself."
t3_26i4op,t3_26i4op,"You can acknowledge things that genuinely prove you wrong, but lacking those you assume that nothing will."
t3_25gqr3,t3_25gqr3,Even Christians acknowledge that.
t3_25fjdx,t3_25fjdx,"So if you acknowledge that it's okay for libraries to treat movies differently from books, then it's logically inconsistent to then get worked up about having yet another unique standard for another unique medium."
t3_22xij5,t3_22xij5,"It is an attempt to acknowledge that there are structural advantages that some groups have, and that these advantages in and of themselves can end up shielding them from the plight that others face."
t3_21tdqe,t3_21tdqe,It acknowledges the URL and consequently the lack of consensus over a necessary decision.
t3_2067hy,t3_2067hy,"* Just going to acknowledge the weird word similarity between Wax Fang, Wax Simulacra, and CavityFang..."
t3_1ycqp3,t3_1ycqp3,"The phrase ""reverse racism"" implicitly acknowledges that there is a difference between that and ""real racism""."
t3_1v8vbr,t3_1v8vbr,"You acknowledge that effects are never really clear, but you never really define what these effects are, then you say that without these effects it's okay to do X action."
t3_1um2og,t3_1um2og,"The method to determine exactly what strain to create a vaccine for has some pretty complicated math invovled (which I admit I don't fully understand), URL Because you acknowledge the advantage of herd immunity for malaria and polio, I am going to assume you know how it works."
t3_1rw7vg,t3_1rw7vg,"Late to the party so not sure if anyone will see this: I think the real reason why we use the word ""Feminism"" is because we acknowledge that, although this is at heart an equality movement, many women are suffering to a much greater degree than men - and thus it is women that need to find a rallying ground in order to tackle their problems."
t3_1qz653,t3_1qz653,"He's not interested in telling people the meaning of something, he's interested in forcing the spirit to acknowledge nothingness and fill in the gaps with its own being."
t3_1qz653,t3_1qz653,"This is because silence forces us to acknowledge that silence, and that can be a really uncomfortable, but enlightening, experience."
t3_1qz653,t3_1qz653,"I think this is similar- it's forcing us to acknowledge the silence of the painting, which makes us uncomfortable the same way silence does."
t3_1qxn8r,t3_1qxn8r,The scientific consensus in favor of anthropogenic climate change is overwhelming and should be acknowledged as such.
t3_1q370k,t3_1q370k,"Any legitimate, academic discussion of men's rights acknowledges that gender constructs affect women to a great degree, and I've yet to meet a single educated men's rights activist who would disagree."
t3_1ptfoy,t3_1ptfoy,"While I acknowledge the great success of women's suffrage, both men and women ended up voting for the oligarchy and what it decided."
t3_1ptfoy,t3_1ptfoy,I acknowledge its a personal qualm.)
t3_1orrrs,t3_1orrrs,"While comforting, it is important to acknowledge that what is ""fair"" is arbitrary and largely meaningless."
t3_1noi07,t3_1noi07,You acknowledge this yourself.
t3_1lkrjx,t3_1lkrjx,"By taking these professions it simply means that you acknowledge that these consequences must some times be used, it doesn't mean you WANT to."
t3_1lbmj6,t3_1lbmj6,"(If the sequel's any good, it will make this a plot point, or at least acknowledge it.)"
t3_1lbmj6,t3_1lbmj6,That's why a good Superman story acknowledges this but demonstrates that none of that ultimately matters.
t3_1kjxxx,t3_1kjxxx,Nobody has to respect that or even acknowledge it for me to be happy.
t3_1ka1tu,t3_1ka1tu,"I agree that buying products you like is effective, and you yourself acknowledge yourself that activism is effective, so if I care about an issue, why not do both?"
t3_1jiw0b,t3_1jiw0b,"Obviously to say ""I am absolutely certain I can't be certain of anything"" is also a contradiction, like the first one you acknowledged."
t3_1iuasi,t3_1iuasi,"Given that you believe strong unions are necessary and that you also acknowledge the dismal state of labor unions, can you not conclude that, at the very least, eliminating the minimum wage in our current economic climate would not yield the results proposed in your OP?"
t3_1h5k81,t3_1h5k81,"By contrast, most smart teachers within an individual secular discipline acknowledge the limited explanatory power of what they teach (though they'll also argue that their discipline has more explanatory power than it's usually given credit for--gotta be defending one's turf, right?)."
t3_1gzgyi,t3_1gzgyi,"And that's OK, it's good to acknowledge when you're scared of something."
t3_1fj2qs,t3_1fj2qs,"We acknowledge that if a trend emerges where the best humans choose not to procreate then we will weaken or even die as a species, but we now have the intelligence to decide we're apathetic to the fate of our species past our own short meaningless lives."
t3_1fh3pe,t3_1fh3pe,"You don't have to feel bad about it, and I don't know where you got the impression that you should - just acknowledge the problem and do what you can, when you can, to fix it."
t3_1fh3pe,t3_1fh3pe,"I don't have to feel bad about American imperialism, despite the fact that it's responsible for many thousands of deaths and I've directly benefited from it, but I should acknowledge it and take measures to fix it."
t3_1fh3pe,t3_1fh3pe,"Now, if you don't want to acknowledge the problem and/or want to do anything to fix it... then I would argue that you should feel bad."
t3_1d3iw3,t3_1d3iw3,"They acknowledge this and are taking great strides in reducing birth rates, but with this comes a host of other problems."
t3_1ajjfw,t3_1ajjfw,"In practice, the more important step is what you are taking right now, figuring out what to do once you acknowledge that privilege."
t3_341qpv,t3_341qpv,"So while having to give her an extra layer of respect based on gender, even though it is acknowledged she is being crazy, the husband is still in the wrong in every case."
t3_341qpv,t3_341qpv,"Now read that paragraph again with a gender swap: So while having to give him an extra layer of respect based on gender, even though it is acknowledged he is being crazy, the wife is still in the wrong in every case."
t3_33txti,t3_33txti,"Anti-racism should not be contingent on believing it will help you if you are not part of a marginalized group, and someone premising their support for it on that is refusing to acknowledge extant inequality, which is not really support for eliminating it at all."
t3_33d5wv,t3_33d5wv,"I obviously can't give you a source, but if you can acknowledge that this is a possibility, can you also acknowledge that this might not be inconsequential?"
t3_31p2g2,t3_31p2g2,"But white people get to ignore black culture because, unless you get your occasional fix from hip hop or other commodified black pop culture, you likely don't even have to acknowledge it exists."
t3_30rc1i,t3_30rc1i,"It would be like being called the wrong name, like if I was calling you ""BiffordRawford"" or something, and refused to acknowledge your username on grounds that doings so was ""unnecessary""."
t3_30plxu,t3_30plxu,"You might think that society pressuring them does that, and I'm sure at least for some people more pressure could be what they need, but you have to acknowledge how it affects others as well and weigh that against other options."
t3_30addl,t3_30addl,The BBC appeared to do very little to acknowledge these in its 'sentencing'
t3_304ub4,t3_304ub4,"While I acknowledge that we already do this in many places (healthcare included, for example), this does NOT mean that those laws are just or right, or that these similar situations are completely the same."
t3_2zgan1,t3_2zgan1,Since it's fairly clear that Jews tend to get it worse in terms of rudeness and assault it's important to acknowledge this.
t3_2zejsa,t3_2zejsa,"How do you think people should solve a problem if nobody (or at least, nobody in a position to do anything about it) will even acknowledge that it's a problem?"
t3_2z350q,t3_2z350q,"These people are also proponents of ""planned parenthood"" in a sense, but by their definition the very act of sex constitutes planning to be a parent, so abortion, sex ed, and contraception are all to be opposed by these people on roughly the same grounds: that they all acknowledge (or even encourage/incentivize) the use of sex for a purpose other than planned parenthood."
t3_2z350q,t3_2z350q,"In fact, the shaming of non-reproductive sex in these people's ideal society would also preclude (or at least discourage/disincentivize) the ""give birth -> give child up for adoption"" route, since this would require potential abortion seekers to publicly acknowledge the unwanted pregnancy and accept the attendant shame."
t3_2x4uzw,t3_2x4uzw,He acknowledges that he can't beat her up sufficiently in the moment (even with blood all over the place) so he decides that he'll wait until he can give it his full attention.
t3_2wc5yt,t3_2wc5yt,"If you are willing to acknowledge that there is ever a ""meaningful"" reason to climb any difficult mountain aside from ""because it is there,"" then I think you would have to allow for the possibility that someone could have a meaningful reason to do so on Everest, as it is simply another very high and difficult climb (and significantly less difficult and dangerous than many other peaks)."
t3_2vmfvq,t3_2vmfvq,"I acknowledge there are some problems with such conflicts of interest Well, first think that the purpose of the institution is that people obey the law."
t3_2vks7u,t3_2vks7u,"I submit that if you acknowledge this, I have changed your view."
t3_2ucr50,t3_2ucr50,"If you can't afford jewelry, that's fine; but saying jewelry is dumb or you don't see the point of it because you can't afford it fails to acknowledge that it's simply a matter of taste, which flows to fashion, which flows to art."
