thread_id,comment_id,context
t3_1oee4l,ccrfxpy,"I think a lot of it is just that people don't like having their sexuality, something that only they can know and has played a large portion in their life, openly questioned. For instance, I've had bisexual friends who have both been told ""Oh you're just fully gay, admit it"" or ""You're not actually gay, you're just straight and pretending"" (or something along those lines). They obviously had no problem with gay or straight people, but it's just straight up incorrect and it bugs them when people say it."
t3_1mq464,ccbkgg8,I believe that racism is fundamentally a product of ignorance. I'm gonna borrow /u/nope_nic_tesla example from here:http://www.reddit.com/r/changemyview/comments/1mq464/people_who_wont_admit_to_their_racism_are_the/ccbk1g7 We need to carefully deconstruct this hypothetical. The hypothetical fact here is rates of violence in black populated areas is higher than white populated areas.
t3_1mq464,ccbkgg8,It is complex and easily conflated with all sorts of other things. The fundamental point that combats racism is that there are no inherent superiorities or inferiorities due to race and that any admittedly factual discrepancies in rates of violence or what have you are not inherent and are actually due to external factors like socio-economic forces. People who conceive of a post-racial society are not wrong at the level of their idealism.
t3_1mjw31,ccafvbq,"However everyone will have their own preferences. You also do admit a bias based on what you deem to be ""good scifi"" is hard to find; are you sure that your bias is a solid foundation on which to condemn all prequel-writing authors as ""not serious"" regardless of the merit of their other work? Does this help change your view?"
t3_1mdfzf,cc8qlw3,"There's been some very exciting work in the last decade or so that shows that the actual structure (size, density) brain regions can change due to experience. For example, there was the (admittedly correlational) study of URL . Fortunately, further studies came along and showed structural change with experimentally induced new activities, like URL , or URL ."
t3_1lacd7,cbx94i4,"Back in the early 2000s, when the dot-com bubble was very thin indeed. I'd managed to sock away enough of my income (which, I don't mind admitting, was considerable for a while there) that I basically could've retired in my mid-30s. So I did, essentially."
t3_1l3hck,cbvusd3,"Right, but we can choose how to deal with those offenses. I'll admit that I'm a big advocate for free speech because I think it's been instrumental in the very best ideas that humanity has come up with, so I might be a little biased. But I also steadfastly believe that rights, equality, and acceptance are things that are fought for tooth and nail."
t3_1klpoz,cbqe15e,"Off the top of my head, I cannot think of a single artist that progressed as quick and as vast as they did in as little time, while still holding onto what made their music uniquely theirs. There are very few artists that can reach a point where they can create both URL and URL (two very different songs, I admit, and perhaps not perfectly exemplary of their body of work at large) in a way that is...natural. They progressed as opposed to mutated."
t3_1kj8ll,cbpjmas,"That they can ""know best"" despite the clear statements of that person about their own sexual identity? You telling me, ""No, you're not really straight, you do like members of the same sex, you just don't want to admit it"" is like conservative parents telling their gay son, ""No, you're not really gay, this is just a phase, you really do like girls."" Both are predicated upon the speaker knowing how the person really feels, despite that person's years of self-discovery."
t3_1kj8ll,cbpj892,"If that was the case, I'd expect much more than 10% of the population (the highest figure I've heard) of people to be bi/homosexual, just due to random variations pushing them far enough to the other end. I don't think that it is so much a matter of refusing to admit, as the feelings literally not existing, or at least not consciously. I believe that if society (etc) fully accepted homosexuality, there would be more men who would be attracted to men (and women to women) as they would then think about it."
t3_1jiw0b,cbf50ig,"I don't care what that something is, or in what manner it exists, or wether it's an illusion or not, just that: There is something - as opposed to not something. Even to deny this is to admit it! For a denial is itself something as opposed to not something!"
t3_1j44fb,cbawgr0,"When you listen to a song on a streaming service, they're monetizing you somehow, like with ads, and some of that is going back to the artist, such that you're really not ""getting it for free"". Therefore, every song that you download without paying for, rather than listening to on a streaming service as you admit you otherwise would, you actually are denying the artists a bit of money. "
t3_1i0zds,cazx7qm,"This behavior characterized people who were out there militating for the right for your assimilationist friends to even consider their sexual orientation as something uneventful; it used to be something that made them criminals and moral deviants. As someone who admittedly is pretty assimilationist, I have to say that I disagree with your married friends. Flamboyant people don't bring shame to the gay community any more than they do to the straight community."
t3_1hajga,cass9ux,"Please give me something to work with with regards to what you're disagreeing with my comment, mach11, and simply dismissing things without giving any reason isn't productive to an exchange of views regardless the topic, and it shuts down any chance of changing one's view, which is the point of this subreddit if I'm not mistaken. :/ I attempted to be as exhaustive as my admittedly layman perspective allows me to be, addressing the various specific concerns one might have. You only listed a few things in your initial post, stating Your only data to proof you provided was that of the APFT which I addressed and did not dispute."
t3_1hajga,cass9ux,"To argue otherwise seems to take such a negative view of both men's and women's fundamental characters that it would stand to argue men and women should be totally segregated because it's toxic for them to have interaction in any sort of professional setting. On this topic I admit there wasn't a lot of hand to hand combat in my service branch, especially in the rate I was a member of. If you have experience in this area I must yield to your presumed superior first hand knowledge on the subject."
t3_1ghg9u,cakhjuz,"The Koran, like many religious texts (including the bible), often appears contradictory. I admit I don't know as much about the history of the Koran as I should, but for the bible, it is fairly easy to explain why - all the books were written by different people, and though divinely inspired, they simply didn't cross-check everything to make sure the points were the same. For 8.065 specifically, it seems like that verse is the Koran equivalent of Luke 1:37 - ""Nothing is impossible with god""."
t3_1fzbuj,cafam2z,"Music is the exact same way, and what you consider unmusical noise is exactly the thing someone else gets a rush of adrenaline from. The ""everything can be done properly or badly"" approach: Vocals in death metal are, admittedly, not used the same way vocals are used in most other kinds of music. They provide a more rhythmic component and tie the instruments together."
t3_1f5j5p,ca7188z,"(which will be transferred into attention whore and snowflake stats, I'm sure.) Whether or not gender queer is recognized (and I'm friends with many people who'd sooner die than admit I'm not an ordinary straight male, even though I've experiences in life that make it easier for me to talk to women and the LGBT community, than to other straight men), it exists, as itself. There is nothing else quite like it...for now, anyways."
t3_1ehvba,ca0getj,"More often than not, it isn't. If you divorce war from the reality of the massive death and suffering caused I admit it doesn't seem as bad. That's a trivial statement, however; death and suffering are the primary cost of war."
t3_1dy3sl,c9uym99,"Or the outdated and offensive traditional gender roles that feminists are trying to get rid of? Now, I'm definitely going to admit that feminism hasn't really done a good job of addressing these issues, but hell, earlier this year, 80% of congress and the senate were men, and even that was considered a breakthrough in the amount of women present in the US government. I don't know why you think that feminists are the ones creating these toxic ideas when we're still fighting for rudimentary things like birth control and abortion rights."
t3_1cjeto,c9h2lgb,"Well first of all you'd have to accept that many people do actually like the taste, even though you personally don't. I'll admit it was an acquired taste where i didnt like most alcoholic beverages at first, but over time those flavors built up positive associations in my mind and i found myself enjoying them. Despite not particularly.liking them at first, nowadays i'll have some whiskey just for the pleasre of drinking it (flavor, feel, and buzz)."
t3_1cc8uk,c9f82sn,"Also what if some company decides to market a synthetic drug that is thousands of times more addictive than anything we've ever seen but it can't be regulated because its for personal enjoyment. Prostitution: I agree, but regulating would be expensive and no married man will ever be able to publicly admit he's for it. Public nudity/sex: How would this be illegal if there is no one to stand as witness to it?"
t3_1c8ym3,c9e9zzx,"That is the sort of ""safe space"" /r/MR is: it allows people, of all genders, to go and say ""hey, I don't like this aspect of society"" and not be immediately accused of being driven by hatred. I'll admit that occasionally, MR sickens me, but as much as the occasional instances of clear misogyny revolt me, I cannot help but go back on occasion, because without them to tell me that no, I'm not mad and evil and hateful to point out the hypocrisy of gender politics, I would go mad, and drift into actual misogyny out of bitter resentment at the double standard. "
t3_1c8ym3,c9e9ga5,"Those trolls all need to die in a housefire. tl;dr- Neither subreddit understands (or, at the very least, is willing to admit) that there are shitty people who are men and shitty people who are women but in general, men are not shitty and are not the root of the world's problems, and women are not shitty and are not the root of the worlds problems. "
t3_1bk94x,c97fll5,"I don't like to eat the same thing every day - why should I have to dress or look the same way every day? I do admit it's unwise to sacrifice comfort for pleasing others, but you also please yourself. When I see someone fit on television and admire their dedication to a fitness routine and I achieve a comparable level of fitness - it's something I can feel happy about."
t3_1ayifp,c91z4wm,"Ending the relationship opened my eyes to a lot of things I had been lying to myself for so long, like I liked the idea of the relationship more than him as a person, and that was selfish and wrong. So yeah, without the failure of the relationship, I wouldn't be able to know so much about myself and admit my own social faults/strengths. Knowing this, we both come out of having a better understanding of who we are as people in relationships and who we would best get along with in relationships."
t3_1assos,c90ewks,"Pretty sure I read that somewhere, don't remember where. ""If you are sick or injured and admitted to the hospital, you will receive the same level of care regardless of whether or not you have indicated your wish to be an organ and tissue donor. The doctors treating you are not involved with transplant programs or possible recipients."
t3_18dj9h,c8go2f3,"While I would agree that it is just as possible for a vegetarian diet to be healthy for most people, there are some that are physically required to eat meat. I have a friend that has an admittedly rare issue with anemia. While most anemics are able to take iron pills or consume plants that are rich in iron, her body doesn't process either of those sources correctly."
t3_34dp1h,cqtp0m2,"So, in summary, UKIP are bad news. However, I have to admit that I'm with them on hospital parking fees. ~~Edit: Well, it looks like OP has hit and and run."
t3_344wiz,cqras5q,"It does take more than a conversation to make a person realize another person's situation, but it is a starting point. Firstly: I'd be interested in hearing how it is you would suggest ""marketing"" this problem that you admit exists. Secondly: > a reality almost no one disputes when you get down to it: That white people have it better off in everyday social interactions Perhaps this is your experience, however there are many people who do deny this very fact."
t3_341qpv,cqqfavj,She the withholds sex as a control mechanism. On top of that she is gas-lighting him to admit he is wrong and should take the blame. She tells him there is no point in disagreeing because she has the control.
t3_341qpv,cqqfavj,He the withholds sex as a control mechanism. On top of that he is gas-lighting her to admit she is wrong and should take the blame. He tells her there is no point in disagreeing because he has the control.
t3_33ltmy,cqm6ae9,"Imagine what they would do if they didn't have some type of oversight. If you're there making sure they're obeying the admittedly poor environmental standards, you'll be doing some good. You might feel that you could be doing more somewhere else, but at least you'll be providing for your family and yourself with the construction job."
t3_32ml8o,cqcp6fe,"Even if we both agree that the standard in place isn't the best way to determine the quality of the teacher, the fact remains that these teachers subverted the primary means of overseeing teachers. Rather than admit they were incapable or put the effort in to avoid failure, they lied. That gets you forcibly ejected from any workplace I've ever heard of."
t3_2yx7xp,cpdtd1o,"I also find it incredibly uncomfortable to use the word (or any slurs) even if I'm trying to discuss how terrible they are. And I don't mind admitting that I avoid usage just to avoid my own discomfort. I think I see your point, but there's a big difference between these situations."
t3_2ymgjr,cpb1gj1,"First your basis of ""all things being reasonably equal"" is basically impossible, since two different businesses will always have different operating methods and costs. It seems to me that the one willing to admit that their pricing might not be as fair as they thought, and takes steps to remedy that is the better option. It's not that they're willing to be ""more reasonable,"" they're willing to admit they're wrong."
t3_2ymgjr,cpb1gj1,"It seems to me that the one willing to admit that their pricing might not be as fair as they thought, and takes steps to remedy that is the better option. It's not that they're willing to be ""more reasonable,"" they're willing to admit they're wrong. "
t3_2yd5o8,cp8vpwz,"Maybe they know their native country is shitty, but they don't take seriously any possibility that it's anything more than bad luck. Or maybe they know their native country is shitty, and admit the culture plays a role, but don't see why they shouldn't simply reap the benefits of their hosts' culture while despising it. You can make any of these five excuses, or maybe a lot more, but you can't say it's unreasonable for the hosts to think they should integrate, because it's not unreasonable to assume that immigrants have some serious reason for preferring the host country, that overall a large net influx of immigrants suggests the host country is systematically more successful in a way that the immigrants themselves appreciate, and that cultural differences do explain some differences between some countries."
t3_2yd5o8,cp8vpwz,"You can make any of these five excuses, or maybe a lot more, but you can't say it's unreasonable for the hosts to think they should integrate, because it's not unreasonable to assume that immigrants have some serious reason for preferring the host country, that overall a large net influx of immigrants suggests the host country is systematically more successful in a way that the immigrants themselves appreciate, and that cultural differences do explain some differences between some countries. And if those are reasonable things to think, then even though you don't have to agree with them, you certainly have to admit that there's nothing wrong with expecting immigrants to integrate, and that that expectation can be motivated by something other than racism. Even if it a native actually believed that all of the cultural differences between him and the potential immigrants were trivial and purely cosmetic , there is nothing wrong with having preferences between cultures."
t3_2y2tk3,cp5w6ub,"It's something that has been being discussed for a long time. Ferguson may have brought that into sharper focus, particularly the admittedly very strong images of police demonstrating very, very poor weapon control while attempting to deal with the protesters. (Compare URL with military police, who issue instructions URL and even while marching across Afghanistan URL .)"
t3_2x854p,coxtndh,"In ""All Falls Down"" he talks about how, even though he realizes the futility of consumerism, he is completely addicted to it. He readily admits that his entire persona is a front for his own fragile ego. Nowadays, rappers like Kendrick Lamar do self conscious rap all the time, but in a world of 50 Cents and Lil Jons, it was very rare."
t3_2x854p,coxtndh,"(""Runaway."") Tl;dr: In the macho world of rap, Kanye West talks about issues in a personal and self conscious way, examines topics from a variety of perspectives, and admits to personal foibles that most people would rather hide. "
t3_2wwm6s,cousnad,"Even if diseases evolve in such a way that our vaccines and antibiotics aren't effective anymore, why would we be worse-off in that case than we were before we had those tools in the first place? This is an appeal to present political circumstances, and I admit that those circumstances could change a lot over half a millennium. But I put it to you that they aren't likely to change in a way that challenges the point."
t3_2uj4yv,co9ncgk,"Petty inter-state power squabbles happen all the time, and healthcare is not something I'm comfortable with them dragging into that muck. Education: This definitely meets the constitutional challenge for federal control, though it does admittedly rely on SCOTUS principles. Having an educated populace is a compelling government interest."
