thread_id,comment_id,context
t3_2qmhw7,cn7hxwe,Why? Even you've admitted you can't really articulate it you just feel this way because you just do . Which is no basis for a logical or reasonable way to think about the world.
t3_2qb4ra,cn4kqwf,"If you can't sell auctions, this should still help. It does admittedly depend a lot on the people you play it with. If your fellow players absolutely refuse to negotiate, even when it would benefit them in the long run, then the game is not going to be fun."
t3_2pimzj,cmx2c61,"I was specifically looking for someone to shed light on a group that I have never been personally involved with, yet had strong opinions on, because I may want my daughter to get involved. CMV is a sub where there appears to be a more cordial attitude toward debate with less impassioned mud-slinging, derision, and name calling (though I admit I have only been viewing content for a couple of weeks). It seems that if someone really wanted to get on a soapbox, they could merely head to a sub that specifically handled their topic (politics, religion, etc.)"
t3_2p13uo,cmsek7e,"To use the minimum penalty for the actual crime as the penalty for the attempted crime would be to imply that these actions are in fact equivalent and not within the same ""order of magnitude"". You have admitted that the accusation is the lesser offense, therefore, the theoretical maximum punishment for an accusation should be the minimum punishment for the crime. To use the minimum penalty for the actual crime as the penalty for the attempted crime would be to imply that these actions are in fact equivalent and not within the same ""order of magnitude""."
t3_2mm2dl,cm5j6hr,"Good luck. he's been working under the table, so you don't know where he worked (wife says it's burger king, but no burger king admits to hiring him, 'cause you know ... illegal), you can't figure out which shifts even if you can find people who knew him at one location. So how do you warn the perhaps hundreds of people who he served over the course of the incubation period of the disease?"
t3_2m9le3,cm28iwd,"If you want to start a project try to see if you can keep it up on your own at a certain time per day without your planner. If not, feel free to admit. :) --- TLDR: go to bed and get up at regular times every day."
t3_2llfy2,clvxvqf,"If this was the condition for  not* having unisex bathrooms, then everywhere would have unisex bathrooms and thus there would be an increase in harassment. Also you yourself admit that high schools should maybe be included, well a shit-ton of harassment happens in the workplace - so what's the threshold here? "
t3_2j7d65,cl91nh6,"I'm not sure I understand you. What's wrong with using racism to mean discrimination based on race, which you admit is still a present problem? We have other words for other types of discrimination, you used a lot of them."
t3_2j3b5u,cl82avy,This is obviously wrong. Way wrong as you yourself have admitted. We don't need to bring up every scrap of evidence for us to both know that is true.
t3_2izt1m,cl7sekd,"One can claim they were moderates, but that was a sham the whole time. Obama even admitted it this summer when he called that a ""fantasy."" Again, he should have just let Assad (the moderate secular one) kill all the little Osamas."
t3_2iu5ia,cl8r5p5,"Dissent on the majority opinion is needed to make sure that the ideas are continually re evaluated to make sure they are as self evident as they are claimed to be. finally I hope that makes sense, because Ive been up since 12am yesterday, Ive had a rough day so I'll admit im half coherent. so if shits all misspelled or theres words out of place, or even rants that go off topic I apologize."
t3_2h8nzm,ckqdzys,"Sure, you could say some of those are just made up, but what about the ones that arent? A few them being my own, admittingly. Anonymity in this case gives me a platform to get some of these weights of my chest."
t3_2giql7,ckm2t5e,"BUT, we now live in the world where women are not reliant upon men, and they are not defined purely based on their 'intrinsic value' of having a womb. Most men, whether they admit it or not, would hate being in a relationship with a beautiful but personality-less girl. Yes, they are going to get some beautiful offsprings, but other things do matter(for most of us, whether we admit it or not)."
t3_2giql7,ckm2t5e,"Most men, whether they admit it or not, would hate being in a relationship with a beautiful but personality-less girl. Yes, they are going to get some beautiful offsprings, but other things do matter(for most of us, whether we admit it or not). IF you are smart, make a decent living, you enjoy fucking, you like dick, have a healthy lifestyle and body, can make a man happy, then men will find you a worthy mate(there are other factors too btw)."
t3_2gdd35,ckhzino,"Also, with how rampant STDs course through younger generations, I don't think we have a ""good"" means of preventing them, just a means. So, specifically in a religious context, to admit that was the reason would mean to admit God didn't say this on a moral or ethical level, but that the church just meant to control the population. Which would be to say The Bible is a lie."
t3_2fm9q9,ckazwr8,"If there is something I'm missing here, please correct me. It's not just every practical purpose, it's that you literally cannot use those pixels unless you are doing something that you just admitted you don't do ; beyond 1920x1080, movies don't render any sharper on a better display. Also, if you aren't an artist, I'm at a loss for why the idea of art and music programs for mac are a plus?"
t3_2f48co,ck5siun,"This is a very unusual conspiracy theory to hold (and despite your proclamation to the contrary, it is most definitely a conspiracy theory) because Hollywood has traditionally been accused of being full of hard-left communists, something that generally runs counter to your claims. I must admit I don't see any easy way to convince you that you're wrong, because it's not really clear why you believe this stuff. I know we're supposed to be changing your view, not vice versa, but where's your evidence?"
t3_2f1tka,ck53vic,"If you accept a different definition of rape--one that stems from a deep-rooted power imbalance between men and women--I think it's easier to imagine that being removed from the culture (slowly, yes) without demonizing a large group of innocent people. Well, first let me admit that I'm about to describe a really unpopular view, but at least hear me out. I think your definition of rape is definitely a fair legal definition, not least of all for evidentiary reasons."
t3_2d8gej,cjo8yiz,"I guess I have deontological intuitions, but I haven't studied the subject near enough to be able to say that one theory is probably right. At any rate, I really think that this exchange should be enough to change your view, inasmuch as you have admitted you have quite literally no reason to hold the view you hold. This is irrelevant."
t3_2cixjs,cjfyd92,"It has no motive to do so. I'm trying to put myself in the programs shoes and must admit humanity seems like a rather abstract and far removed concept. They lived in a world separate from mine, a string of data I know but can't understand."
t3_2ch2je,cjfeou6,"Except in Pokemon, those pets breath fire, shoot streams of pressurized water, and hurl bolts of lightning at each other, all at your command. So I would just say that it isn't valid to say Pokemon has no appeal because it is lacking in what are admittedly its weakest aspects. Every game is lacking in some way or another, but what makes it fun is how well its strong points make up for this."
t3_2c6m3v,cjd67az,"After 4-6 years of Critical thinking instruction, you could reasonably assume that these kids would be in what is currently the top 10 percentile in terms of critical thinking ability, and so what benefit would you expect to gain from teaching them philosophy? In my mind, something like game theory would be a better extension, but I'll admit I haven't thought deeply on what one should do after they've achieved very high levels of critical thinking ability. I think you'll find the beginning of this paper interesting ([Pencil and Paper argument mapping improves Critical Thinking Skills](https://www.academia.edu/772329/No_Computer_Program_Required_Even_Pencil-and-Paper_Argument_Mapping_Improves_Critical_Thinking_Skills))."
t3_2c5zac,cjc9611,"ISIS may have captured some hardware we gave the Iraqi's but its not like they stormed Ft Bragg and took it. The US Military, admittedly strung out from over a decade of bullshit wars, remains unquestionably the strongest fighting force in the world. This makes the US #1 by the most important military metric."
t3_2bqdam,cj828mm,"In just 10 years, because of compound interest, it can be worth $1,049.15. I'll admit I'm getting a little bit beyond just paying off the debt now. However, I assume the long-term goal here is financial independence."
t3_2bk0qs,cj64zeg,"Without getting bogged down in the messy logistics involved, what would you think of that solution? Well the issue of the victim's family is a little different, and I do have to admit its less clear cut. I have a hard time accepting that idea as real, meaning I have no reason to believe that solution would actually help the family at all, but I can't unilaterally declare that it would not."
t3_2b3qli,cj1lpfi,"The law already makes allowances for an affirmative defense in criminal proceedings. In an affirmative defense, the accused admits to committing the criminal act but provides a justification or excuse for their actions--duress, necessity, insanity, self-defense, etc. In such cases, a successful affirmative defense reduces or even entirely removes culpability for a criminal act."
t3_2apfnp,cixj7ex,"He WANTS to stop, but can't, he RECOGNIZES that what he is doing is self-harmful, but does it anyway. A person like that is engaged in an altruism (giving), yet he also (admittedly) acting against his interests (not self serving). "
t3_2ah6lr,civ3itz,"Whereas doing so on SRS is a banworthy offense. I'll admit the thread you linked about Islamaphobia is depressing, but I've also seen a lot of instances of people on TiA jumping all over people expressing bigoted views. "
t3_2a7f52,cisazcd,The show isn't for everyone but The show is so much fun if you don't look so closely at its flaws and just take it for what it is. I will admit some episodes are just dreadful but being a show on possibilities the next episode can be anything and when they knock it out of the park they really do a fantastic job. 
t3_29t2lw,cio8m2f,Of course. You admit the cards are stacked against you. Why not fight so other's don't have to face the same roadblock?
t3_298qie,ciinvgt,"But your starting position was more akin to ""not queuing is always rude."" The ""small pass"" you gave to bars was admittedly ""sarcastic,"" because you view bars as ""places where politeness goes to die."" In fact you stated that ""This [not queuing] is a big problem in two places, bars"" Now you agree that non-queuing in certain types of bar may not be a ""big problem."""
t3_287cab,ci86zv4,"The editors asked him informally to change the form of the article and cut down on the end-matter, and Sokal refused. The only reason the (admittedly bad) editors didn't scrap the article entirely was because they were so excited that he was a leading scientist attempting (in bad faith, as it turns out) to bridge the gap. They sat on the article for a while until an issue on Science came out."
t3_27poi8,ci35etu,Because of this I think that it would be best to give students to option to either do a project or a test. First off I have to admit that I have a huge bias. I am far better at tests than I am at projects.
t3_26ua0u,chujiwj,"The Penis In Vagina article is so utterly bizarre and absurd I honestly thought it was a joke. But if it is serious, then it's obviously not the best example of feminism since, as the author admits, she has an unpopular point of view. So I am going to ignore the more ""radical"" feminists for the purposes of the discussion."
t3_26nxhn,chsvwxu,"The difference between your plan of overusing the words, and the current plan of suffocating them until they die out, is who gets hurt by the plan. In your plan, gay people would suffer a deluge of insults from every direction that they couldn't even admit to being offended by. In the alternative, straight people have to avoid using one word."
t3_25im4s,chhkumz,"Instead, he says that God is merciful. The Eastern Orthodox tradition, while still admitting a state of being called ""hell"", don't consider that experience as punishment AND allow for that experience to be temporal. Unlike the Protestant tradition, the Eastern Orthodox believe that you can pray for your loved ones to find salvation, even after their death."
t3_25gqr3,chh8rrt,"As an aside, some consider the possibility of a cyclical universe that has periodic big bangs, then collapses in on itself and repeats. This would necessarily require a violation of the 2nd law of Thermodynamics (though admittedly the conditions of pre-big-bang universe have not been replicated in the lab). Furthermore, they don't line up with a universe that is accelerating outward."
t3_255qch,chdyl7n,"That, and I don't like supporting either culture or law in scenarios where it makes no sense. That said, I'll admit it's a personal choice and there's nothing ethically or morally wrong about preferring to always wait. What would you do if the crosswalk light never changed?"
t3_24xu2q,chc4ef4,"It all comes down to how the author uses it. As you've admitted, a prologue can be used well. To get past your prejudice against prologues, all you really have to do is figure out exactly what sets the good ones apart, and suddenly, the device itself no longer can carry an inherent negativity."
t3_24v147,chbavh7,"They certainly were drama queens. But you've got to admit that people, especially students, rely far too much on the internet for answers. They're used to having information at their fingertips."
t3_23xw5n,ch1nret,"I should've clarified in my original response that I didn't mean things offensive. (Okay, admittedly the first world problems thing was a bit sardonic. :)); I consider myself fortunate, reasonably, though not wealthy by American standards (I have a car made in a post-2010 year, albeit a Fiesta.)"
t3_23o885,cgzb7st,"Then, in Iraq, as we all know, we decided that kindness and negotiation wouldn't work, so we went to war. Even though some right-wingers still say that war wasn't about oil, members of the U.S. government all the way up to Secretary of Defense Chuck Hagel have admitted that gaining U.S. oil companies access to Iraq's oil was mostly why we went in. Sorry if this is poorly written, but basically, those a three examples of countries where the government decided whether friendship, intervention, or war would be better for the country, and while the war in Iraq was a giant clusterfuck, I don't think they were wrong in believing that the most efficient way to get at their oil was to beat their government in a war."
t3_2360o1,cgu0cre,"http://www.apa.org/pi/ses/resources/publications/factsheet-erm.aspx This site gives a very basic glimpse into the relation between SES and race that you can examine more fully on your own. You openly admit that you have no experience of the ""oppression"" and problems that those of lower SES face, which is the basis of your view. Since you are not poor and faced little discrimination it must mean that poverty is the true source of their problems."
t3_21g6jy,cgcq2pw,"Instigating and supporting coups of elected governments from Iran to half of South and Central America, we are not exactly remembered kindly through much of the world, and for good reason. TL;DR: partly, it's bad history and the U.S. rarely admits that nations we don't agree with can also be democracies, and partly it's not the particular ideology of communism that produces authoritarian regimes, but rather the nature of violent revolution attracting strongmen types who become leaders and seize power. "
t3_216l8g,cga7sga,"Going up to them and leering at them while taking pictures is objectification. But you have to admit, if it were just men marching around without their tops, they would receive zero attention. I don't think these women were surprised that it happened."
t3_20ndjd,cg50ewo,"The fact that it seems obvious to you isn't worth very much in practical terms. URL is admittedly not a very convincing source, but it does suggest that atheists are underrepresented in the prison system. If Christians are more likely to wind up in jail than atheists are, then it doesn't seem likely that religious faith consistently has the effect that you're ascribing to it."
t3_20er8m,cg2ldgv,"It could benefit you if your empathy for animals/other present and future people is a strong enough force to counteract the desire to eat meat. I know that Rand isn't the biggest fan of empathy as a rational motivation, but I am admittedly not sure how far she would take it. If there are limits to it, I don't see how not eating animals couldn't fit under her worldview for certain people and their desires."
t3_1y9b1n,cfim0mc,"Your view was that it's not possible to enjoy those bars, and it sounds like talking to a living counterexample to that view has changed that view. But stepping aside from the (admittedly narrow) scope of just trying to change your view, I don't mind expanding on why I like those bars. I'm not interested in determining whether or not it could be labeled as a social interaction."
t3_1xti2t,cfepy2q,So what should MLB do? Well first they should admit to themselves (not necessarily to the public) that they need to save their sport in order for it survive (if my theory is correct). IT IS PURELY a business model problem.
t3_1xti2t,cfepy2q,"Not a ""social rights/integration problem."" And YES they should admit that the sport is dying amongst Black-Americans. But their approach shouldn't be ""Oh Black people we have a great Black History"" in other words don't try to guilt Blacks into playing it."
t3_1xhrpt,cfbkr47,"The key difference, however, is that Christianity was born through nonviolence, whereas Islam was born through war. Both went to war of course, but the Muslims admit it. However, all of this being said, when Muhammad was alive Islam was barely even a thing."
t3_1x7uoa,cf8wl9o,"The justice system did exactly what it's designed to do. However, if it were to come out that she was actually guilty of the crime accused, either because new evidence comes to light or she admits it, then the Justice system certainly failed to protect against a domestic threat, and certainly did not ensure fair and impartial administration of justice. As far as George Zimmerman goes, I suppose the issue there was the interpretation of the ""Stand your Ground"" laws that he hid behind."
t3_1wvths,cf614t8,"But if the answer is no (as it would be for likely 95% of people) then you simply couldn't substantiate your viewpoint in an intellectually honest way. With no further assumptions, and without speaking towards the interpretation portion of dream analysis- one would have to admit that if, ever, one's dream(s) do, in fact, have some fidelity with or representation of a real-life concern, scenario, worry, etc., that there is simply no way to say that there could be no benefit in their analysis, once identified as having that fidelity. Speaking of an entirely self-contained system here- working with what it has, both in terms of conscious and subconscious areas, processing massive amounts of information; if some/any portion of that information 'resurfaces' in whatever format (dreams would certainly count) then I believe we would be remiss to say that on some level, the psychological machinery has deemed it important and a good use of limited resources, time, energy etc."
t3_1we3gg,cf14aw0,"I think similar things could be said for pain and suffering of many kinds. Now, if I happen to pass on my condition, (which, admittedly, I would think differently of, if it were known to be fully genetic and not a combination of environmental and genetic influences) I won't be happy about it. I'm sure I'll feel horrible when I see them in pain the way I am."
t3_1v37km,ceof5q0,"We went back and forth, she deconstructed my argument, made a strong argument for her side, and I gained the perspective I needed to come to a more informed conclusion. I admitted I was wrong, conceded my points, and thanked that person for their insight. I'm quite an open minded person, I'm willing to change my opinion on just about anything when presented with a strong enough argument, and I learn best through back and forth discussion."
t3_1um2og,cejgnup,"The amount of thimerosal in the vaccines that have it (not all do and you can easily request one that does not have it) have only a trace amount text , so you will need to get a massive volume of the vaccine in your system for it to even have an affect on you, let alone be dangerous. The method to determine exactly what strain to create a vaccine for has some pretty complicated math invovled (which I admit I don't fully understand), URL Because you acknowledge the advantage of herd immunity for malaria and polio, I am going to assume you know how it works. Let me know if you want me to explain it."
t3_1sqkke,ce09y0e,"In the study linked below, it was shown that athletic success for a school translated into a direct increase in the quality and quantity of students applying to the school in the following academic year. This allows universities to either a) admit more students while keeping the quality the same or b) increase standards. Both pay huge dividends for a college in the long run."
t3_1sgl5a,cdy2o2r,So just to make my point clear. Yes I admit that Gandhi has become a propaganda tool for the state. But that does not mean that he did not accomplish stuff which has a lot for us to learn.
t3_1sgl5a,cdy2o2r,"These stupid stories do not discount what Einstein did. Maybe at least you admit that Gandhi the man and Gandhi the propaganda are two different things, and Gandhi is great for different reasons. I would recommend reading him more."
t3_1qwdul,cdhd52x,"Which, for you, in your eyes may seem to be the PUA approach. I admittedly used a few PUA methods when I whored around, because some of them are actually common sense. The problem is the desired end goal."
t3_1qwdul,cdj5vts,"I have yet to see a testimonial where a bro is like ""yeah, I negged the shit out of this girl and took her home within the hour and now we are celebrating our fifth wedding anniversary at a B&amp;B in Vermont!"" I don't doubt that it happens, just that, uh I have to admit I'm kind of getting mixed signals here. If women really DO fall for you when they get to know you, I can tell you with absolute confidence that you are already better off than basically every man who can spit mad game but has very little going for him beyond it."
t3_1qw6q4,cdh5dka,"They lie to meet societal expectations. There are quite a few people that engage in actions and don't admit to them as well. Here's an example: the URL According to this theory, most people experience at least a little bit of homosexual attraction some time in their lives."
t3_1qfo09,cdcconr,"As long as those attitudes exist, they can't be equal. Your argument could be rephrased as ""I get that they want to be equal, and I'm find with them having equal rights, I just don't want to admit that they're equal"" You can say two halves or three thirds, but either way it still comes out to the same thing, and there's no valid reason to deny that. People don't want to give up the word marriage because they think it's special, and reserved just for them, and that by letting gays marry they'd be tarnishing the word."
t3_1pet4o,cd1li1o,"Your argument only makes sense if your hours are cut but the hours of other services that you want to use (DMV, car shops) are not cut which goes against the spirit of your view. So you are admitting that you have no empirical evidence to back this up and it is based purely on intuition. Unless you can provide evidence, this is not a claim that you can support."
t3_1pcykr,cd16k0g,"Sort of like how some people still believe we only use 10% of our brains at any given time. To address your two points, your recollection is admittedly hazy. Is it possible a flu shot caused muscular degeneration?"
t3_1ozdmq,ccx6cho,No society can survive without that sense of self-interest and by my moral code my society will always come above others. It is not hypocrisy because I do admit I act in self-interest and find no shame in doing so. The people who do spout moral justifications and the endless rationalizations do so because that is what makes them more comfortable to act in their self-interest.
t3_1oyj63,ccxncje,"It's about believing that you're worth the job. Every time you choose to expect things to go badly for yourself in order to prevent some pain down the road, what you're actually doing is admitting to yourself that you're not worth it. That on some level you don't deserve to be happy or have things go right for you, because they generally haven't before, so why should they now?"
t3_1oyj63,ccxncje,"You deserve more than merely not being miserable. It starts with you admitting to yourself that you deserve to be happy. Then, you make the leap."
