thread_id,comment_id,context
t3_2rawgb,t3_2rawgb,"In real life you don't know if your emotional troubles are going to annoy or be a burden to whoever is kind enough to listen, you don't know if they're just being kind and don't truly care, but on 4chan style board, if no one cares they're not going to respond and if they feel your problems are stupid they grant you the right to start over immediately and don't force anyone to carry their past with them."
t3_2jug85,t3_2jug85,"The other compromise to consider is something like Kiva, where you grant micro loans with a 99% payback rate."
t3_2j28la,t3_2j28la,And it does specifically deny the government the right to work on things that it doesn't specifically grant it the right to.
t3_2gdd35,t3_2gdd35,"But once you grant ""Well ok, pre-marital sex is actually fine"", you undermine the authority that religious texts hold."
t3_2fu5da,t3_2fu5da,Courts require a higher bar to grant legal privileges and arguing that this characteristic is immutable is the best way to secure those rights.
t3_2f48co,t3_2f48co,"Even if I grant any of the above, how can we say that the government is involved?"
t3_2d8gej,t3_2d8gej,"Okay, that's not something that most of the experts in the field of ethics believe, but grant that it's true."
t3_2bbyzd,t3_2bbyzd,The next most important thing Jar Jar does is make a speech imploring the Senate to grant emergency powers to the Emperor.
t3_27dypa,t3_27dypa,In any other legal situation being high or drunk does not grant you any kind of immunity from your actions.
t3_24bof3,t3_24bof3,"Are you aware that should 5% of the population vote 3rd party, that candidate qualifies for the Presidential Election Campaign Fund's grant?"
t3_20ndjd,t3_20ndjd,I'll grant you that.
t3_20madh,t3_20madh,"Building ten LHC's instead of the ISS would not have discovered 10 particles, and nor would building another ISS instead of the LHC (and other similar projects) grant us much more."
t3_1zrq6d,t3_1zrq6d,"Unfortunately, the researchers are getting hit anyway under the traditional model as they either have to get their institutions to shell out several thousands of dollars a year for each site's journal subscription, or else buy several private subscriptions out of one's grant money."
t3_1y3vw7,t3_1y3vw7,"Further, you have a grant."
t3_1s3pxw,t3_1s3pxw,"Also, lets say we grant that you truly never met someone who came to their beliefs with logic."
t3_1i3z9w,t3_1i3z9w,"You make a hypothesis, spend tons of effort fighting for grant money, then spend hundreds or thousands of hours in the lab testing it before you have a result."
t3_1i3z9w,t3_1i3z9w,In mathematics there is not the same need to fight for grant money because the research is much cheaper.
t3_1gjdzq,t3_1gjdzq,"The ability to do violence and the monopoly on violence, the ability to kill civilians, to create law and grant exception from it, can all be seen as violence and all contribute to the ""rule of law."""
t3_1e30x9,t3_1e30x9,"So for someone who graduates with a degree in philosophy and complains that there are no academic jobs available, they could justifiably be claiming that our society has poor values in what they fund just as a scientist who can't get an NIH grant due to cut backs can rightfully complain that society is being short sighted."
t3_1cbyg8,t3_1cbyg8,I will grant you that there are a lot of religious people that make the rest of us religious people look bad.
t3_2ug2wi,t3_2ug2wi,"Therefore, given infinite time and finite matter or energy, one's consciousness is infinite I will grant you that there are prevailing theories about the infinite nature of the universe and how that can lead to exact duplicates of structures in the universe, and therefore exact copies of yourself."
t3_2t6ote,t3_2t6ote,"If no ""crime"" took place, why would the courts grant CPS custody?"
