thread_id,comment_id,context
t3_1vhh7b,ceso4j1,"There would also have to be an entirely new authority system for working on local roads, though I suppose that is a bit easier. You could either incorporate them into the military (however, not all of them would want to be soldiers), retrain them, or put them on other construction jobs. It would probably cause some unemployment, though."
t3_1umi67,ceju0k7,"It was locked through the spokes, with URL of lock, not linked to some place else. It's pretty hard to get the bike to work without seriously damaging it, however it looks like its not even locked to people unfamiliar with that type of lock. Good chance people just threw it in the back of their pickup and only noticed at home that they were in for half an hour of angle grinding."
t3_1ty0ux,ceckou4,"Lastly, concentrating on overweight/obese is important. One thing that really surprised me however is that using the BMI definitions, being overweight did not correlate to a higher incidence of heart disease or cardiac problems when compared to normal weight. So really ""overweight"" in terms of BMI anyway isn't that bad."
t3_1tqttm,ceakm2y,"The next problem is pretty much exactly what you said: animals are generally not moral agents because they don't have a conception of morality. We do however, so pointing to an amoral agent can do nothing to inform us, as moral agents, how we should act. That's the equivalent of pointing to a sociopath and going ""Well he doesn't have a problem with serial killing, so I shouldn't either!"""
t3_1rw7vg,cdrq6vt,"&lt;That being said, would it not be better, if you have an overarching egalitarian viewpoint, to operate under egalitarianism so that you don't get caught up in your bias? You'll primarily, still want females to get their rights moreso than anything else, however you would end up helping other groups while dealing with your issues rather than walking overtop of them in pursuit of your own needs and desires. Also under no-bias framework would the solutions you come up with end up being a lot more beneficial in the sense of long-term solutions?"
t3_1rgch2,cdn0d35,"If you believe that justice is only served if the perpetrator suffers as much as the victim, then I suppose your view might make sense. Many people, however, believe that the punishment is related to how dangerous the criminal is, rather than how much the victim is damaged. If you believe that the purpose of prison is to rehabilitate a criminal, serve as a deterrent to others, and to keep the criminal away from society for a time so they can't commit another crime, then ""intent"" absolutely has to be considered."
t3_1r452i,cdjfd1i,"There are certain sectors where free-market is necessary and I fully support, but healthcare, especially for a developed nation with the available funds and infrastructure, should be a basic human right. That, however, has very little to do with equality. "
t3_1qfqj6,cdcgve9,"Good for them/us. Native Americans have good reason not to see it that way, however. Before the arrival of Europeans, there were a great variety of complex societies throughout the Americas, with their own cities, trade structures, technologies, and cultures, many of which were more advanced than their European counterparts."
t3_1ptwcr,cd63zq4,"The aftermath of this incident would produce lasting tensions with China and potential instability in the region if North Korea's nuclear program was not properly contained after the country's defeat. The North Korean dictatorship would likely fall in the event of any potential invasion by an international coalition; however, this victory would only be achieved after the partial destruction of Seoul and after heavy wartime casualties. The aftermath of this incident would produce lasting tensions with China and potential instability in the region if North Korea's nuclear program was not properly contained after the country's defeat."
t3_1ppyu1,cd4u21e,"The story is told from his perspective, each episode we see his struggles, we uncover mysteries with him, and we grow to like him, this is by definition a protagonist. Cersei however, is the main antagonist. We never see much of anything from her perspective, so her actions are not really justified (there are some moments when we see things from her side, and even sympathise with her, but that's brief)."
t3_1ppyu1,cd5an9q,"I wouldn't necessarily say that's true. The complexity or plot of a story is independent of however we define the constituent characters. No matter how you define antagonist and protagonist, you can still write a story from the protagonist's POV."
t3_1pdul1,cd1d692,"They can both pick to co-operate or defect. Co-operative play gives both players 3 points (the ""Reward"", R), however, if one defects and the other co-operates, the defector gets 5 points (the ""Temptation"", T) and the co-operator 0 (the ""Sucker"", S). If both defect, both get 1 (the ""Punishment"", P)."
t3_1pdul1,cd1jphb,"You have no way to know you will never interact with someone again unless you intend on killing them after the conversation is complete. The chance, however slim, to reencounter such a person is why humans have a system of trust. You also ignore the aspect of communication, which is key in more advanced game theory."
t3_1ni9rr,ccitwf4,"If people care about the integrity of their news, why can't the public be trusted to self select what they should and shouldn't consume? I don't disagree with you in theory, however I am not particularly comfortable with giving the power to any particular group of people to decide what is and what isn't news. I'm sure the lines are quite blurry when you really dig deep, if they miss one correction do they get their title stripped?"
t3_1mcs7s,cc7zm90,"""forest"" rather than ""trees"". That's a good thing, however. You can't let education become too focused when you ideally want people to keep their labor as liquid as possible."
t3_1lklmg,cc070hz,"The entire currency can be destroyed. However , and this is a very important however, the more widely used bitcoins become, the more expensive it is to destroy the currency. This is because the only real way to hack bitcoins is to execute a ""51%"" attack, which is where a single entity controls over 50% of the mining done of bitcoins."
t3_1l8kmg,cbwubws,"it's also possible that a culture exists that wine tasters are typically indoctrinated into, where they all develop similar tastes, and so the majority of wine tasters might all agree that some wines actually taste better than others. however, that is clearly not a random sample, and so the results are almost guaranteed to be biased. so you're right and you're wrong, depending on how you define quality."
t3_1l3hck,cbvffz9,"Why focus on the word? Using the word shows a lack of empathy on their part; however to them, you're ""just nagging"" about a ""bad word""; once you can make people stop using the word the important battle has already been won (people having empathy for a group of people they once considered sub-human) To be effective you should get in peoples face and ask them ""is being gay that big an insult?"" and embarrass those who would dare say yes by backing them into some sort corner."
t3_1kwoib,cbtlv0w,"Our things can easily be destroyed, but our genes are essentially immortal. I do personally believe in an afterlife, however, I cannot prove it so I am not going to try to argue it. But the reason why we are so driven to have sex is because our genes, our animal instinct wants to reproduce."
t3_1kpmvy,cbrg01p,It will probably take another generation for this to degenerate into a romantic fantasy. I can't see it being connected to rape alarmism however. 3.
t3_1kmwmn,cbqlofq,"As things change, there will always be many things which are referred to as conservative which seem to be outdated. That does not mean that whatever changes are happening are automatically good, however. Nor that everything anyone labeled as a conservative has lumped in with them is automatically bad."
t3_1kkl0k,cbpwrwm,"In all honestly, my father would probably count as a member of that elite. His parents, however, worked in a car factory for generations and discouraged him from going to college because it would hinder his chances at getting a job with the rest of his family. Of the 10 richest people in America, seven made their wealth themselves, and the three who inherited it are first generation rich (the children of the Walton family, Wall-Mart)."
t3_1ki1zh,cbp5nt9,"I agree it's a bit silly when we cheer people on for violence, even if it is self defense, for giving us that cathartic self righteous feeling but that doesn't seem to have anything to do with gender roles. It seems to me however that you think this is ridiculous because you may still be attached to the perception that for some reason women are weaker or more fragile than men, which is a sexist assumption to make. Don't worry, I do it myself, but just like every other gender stereotype we would probably benefit from moving on."
t3_1ke0w4,cbo5iau,"My mother barely knows how to use a TV or VCR (yeah, VCR), a programmable house phone except for using it like any old fashioned phone, hell, I mean, even on her cellphone, she inputs the numbers every time instead of using the contacts, even though my sister input every contact for her! :) I gave my mom my old laptop and it was sufficient for her needs, she learned it really, really quickly too, however a tablet is still much better for her. She likes her laptop a lot, she says she prefers it to the tablet, but she still uses the tablet more as it's more convenient."
t3_1k3fd5,cblb6qd,"I'm an international student, I can have not the absolute best grades but if I apply internationally to the US I am much more likely to be noticed than if I was your 'average' white american male with the same grades. I agree with you on religious intolerance in the US, however it is sadly worse in a lot of other first world countries. Religion is sadly one of those things that is still in the grey area, many times because people are ignorant about it, not necessarily because they are prejudiced to it."
t3_1jmadm,cbg3yyk,"I guess my phrasing is poor. The mother should always have a right to right to remove the fetus from her body, however, if it is possible to remove it without killing the fetus, then abortion shouldn't be allowed. "
t3_1j9xnf,cbcvqxh,"URL Make no mistake about it, the ROKR was made by the same engineers who worked on the iphone. When they made the iphone however, Steve had a different mindset. >*Jobs was unhappy with the ROKR, feeling that having to compromise with a non-Apple designer (Motorola) prevented Apple from designing the phone they wanted to make."
t3_1ia3zd,cb2h5ll,"Personally, I would prefer if the usage of ""more"" and ""as many as"" was clarified. ""Four time more apples"" should not be the same number as ""four times as many apples"" however it's pointless to argue against how the phrase is commonly used. I do not think that grammar nazism has had a significant effect on cultural phrasing or spelling in general, which is what you seem to suggest."
t3_1ia3zd,cb2h5ll,"Personally, I would prefer if the usage of ""more"" and ""as many as"" was clarified. ""Four time more apples"" should not be the same number as ""four times as many apples"" however it's pointless to argue against how the phrase is commonly used. I do not think that grammar nazism has had a significant effect on cultural phrasing or spelling in general, which is what you seem to suggest."
t3_1hmzrg,cavylue,"Moving on to your crime-free requirement. This would require a background check of all parties in the home, however we will use the same standard as above. The existing cost of a background check adminstered by the OPM URL as of 2011."
t3_1h9sqe,cas8g4g,"If you haven't already, I urge you to read over URL This is true, but like I was just saying, vim is not a tool designed for user-friendliness, it's designed for raw efficiency. There is however extremely comprehensive help files, so if you want to know something you can usually type `:h &lt;topic>` and get some useful information. Edit: I forgot to mention, if you're using stock gVim, it does come with menus by default, if you want to use them to get used to the keybinds."
t3_1h2wxx,caqen9z,"Of Course the insurance companies are able to price premiums in a way they always stay profitable. You however get the benefit of piece of mind, knowing if the worst happens you are covered. Auto insurance is important because most people couldn't afford to pay a huge claim out of pocket and they also cover uninsured drivers hitting you."
t3_1h2wxx,caqen9z,"Auto insurance is important because most people couldn't afford to pay a huge claim out of pocket and they also cover uninsured drivers hitting you. All insurance is probably considered negative lifetime equity, however they are important in helping people avoid financial disasters. One massive car accident, home fire or medical claim could bankrupt you and your family."
t3_1gtewi,cannxmk,"So your argument is that misogynistic dating advice for men is okay in light of the fact that there is a major deficit in dating advice for men, and that ""nice guys"" can find help there? Yes there is a deficit in dating advice for men and for now the seduction community is the only resource of decent size available (although there are other less misogynistic sources available), however, this does not justify nor atone for the misogynistic attitudes of the community. The advice is still misogynistic, even if it is helping people like you, because the possibility is always there that it could be non-misogynistic."
t3_1gndd7,cam0we6,"So this creates an awkward dynamic where everybody takes certain things as assumptions, but then claims that these assumptions are the result of scientific progress and doubting what is accepted. These assumptions, however, basically follow from the premises that lots of people accept, so they aren't the result of self-reflection and deep philosophical discourse. But I don't think that you are unreflective or haven't studied philosophy."
t3_1fthzm,cadpyxu,"The cause isn't because a person is black or white though. Being young ,however, does have a direct impact on how good a driver you are likely to be though, due to the way the brain develops. "
t3_1fafn1,ca8c6l7,"By saying the ends justify the means, you are saying that a person may ignore what society has decided is right based solely on what they perceive to be right . You are, in effect, saying that each person is welcome to define morality however suits them, since the ""ends"" are valued according to them. Even if you (somehow) construct a situation where society at large has equal participation in both means and ends, there is still a temporal argument to be made; i.e."
t3_1ekme5,ca1ende,"On the other hand, perhaps a pragmatist viewpoint will win out; just use what appears to work and is useful in practice. I agree that the inspiration to work on foundations of mathematics could be said to come from philosophy, however this gets into the issue of where mathematics starts and philosophy ends. This is not necessarily an accurate complete picture in my view."
t3_1e30x9,c9x7bnj,"No one should have their prospects in life depend on the whims of the market and placing middle class youth in that position has the potential of putting the reality of our economy in perspective. The perspective you seem to be advocating, however, places them in the position of simply having failed to adapt to the market. People should take responsibility for themselves, but the market, as a social entity, should be held responsible as well."
t3_1e30x9,c9wbvj3,"Another reason that people major in the humanities and social sciences is NOT because of a natural disability in physical sciences, or possibly even a natural dislike for the subjects. Post-Cold War America's trend of increasing demand for technological skills and better equipment has not changed, however, the government sponsored push for quality educational tactics and funding most definitely did. You see, the arms race with the Soviets included not only nuclear warheads, but a struggle to produce the biggest bunch of smartest technical minds that the superpowers could extract from their populations."
t3_1dr38j,c9t3tv5,"The only thing that sways people's mind is the enjoyment they get from the product which is similar to a lot of things we do that are bad for the environment. I would, however, question the economic effects of losing the beef industry. It is one that supports a lot of communities globally from farming to the service industry."
t3_1dmdji,c9rvfop,Ignorance indeed has no place in a proper discussion. Basics however are often the best things to start reasoning from since they open up pathways for logical reasoning and thinking. 
t3_1dahpy,c9ohbfe,"If your argument were only that drinking is a bad activity when pursued to the extent that one's judgment becomes irresponsibly impaired and harm to others becomes a strong possibility, I think you'd have a very strong case. The choice of others to drink because it makes them happy, however, even if they are capable of doing it responsibly and their choice to drink does not harm anyone else, is much more difficult to justify. Can you assert that drinking socially does not make others happy, or provide them with enjoyable experiences?"
t3_1dahpy,c9ohbfe,"If your argument were only that drinking is a bad activity when pursued to the extent that one's judgment becomes irresponsibly impaired and harm to others becomes a strong possibility, I think you'd have a very strong case. The choice of others to drink because it makes them happy, however, even if they are capable of doing it responsibly and their choice to drink does not harm anyone else, is much more difficult to justify. Can you assert that drinking socially does not make others happy, or provide them with enjoyable experiences?"
t3_1cxteo,c9l1cnw,"One of the things I think you have wrong is that I don't think fixing any one problem is the answer--on a global scale, problems like climate change come from a hundred thousand smaller problems, of which polluting is just one. | however not so for most other pollutants. Again, my point is that these things have effects that we don't know or understand."
t3_1cskpb,c9jlje5,"I disagree on account that, before the age of 18 you are not considered an adult yet. Children in highschool think that they're mature and that who they vote for now, will be the same way they think in 4 years however that's probably not the case. I don't feel they're intelligent enough yet, or have the experience necessary."
t3_1ayifp,c91y4yc,"Some can handle keeping in touch, others can't. That doesn't mean, however, that you shouldn't pursue a relationship because you can't answer ""what's the point?"" Third point: Caring for the social sphere's worries is unsubstantiated if you are thinking superficially."
t3_1arnlm,c90957k,"Continuing the discussion here would probably require you to just pick the arguments that you find most compelling to bring them up. If they are empirical claims, however, be prepared for replies from actual scientists. EDIT: I accidentally a word."
t3_1am1gg,c8yrmeo,etc. however when ur looking at state funded education; these skills like engineering are very fact checked; a communist bridge builder and and anarchist bridge builder; kinda would both agree on the basic ideas of gravity and the shape of a bridge when u have a history major u dont know if they thought fdr helped or harmed the great depression 
t3_1ajjfw,c8xzohj,I would consider financial inequality a subset of privilege. This just has to do with my definitions however. 
t3_34dp1h,cqtpbha,"You only start paying income tax when you cross the £10k boundary. You do, however, IIRC pay NI contributions even when you are under the £10k mark. This is a game British politicians love to play, they make all sorts of promises about income tax while conveniently forgetting that people also pay NI contributions which, in a way, act as a second income tax."
t3_340hb6,cqq447g,"because it would be very creepy. fat women, however, get a lot of comments, opinions, and advice they never asked for. women in general get this more than men, but fat women in particular."
t3_32rqew,cqedg0y,"Also, I own my computers . The law can specify what I'm not allowed to download (pirated content, or any data that belongs to someone else), but to dictate that I have to download and view ad content, however temporarily? That's infringing on my ownership rights."
t3_317c4q,cq08xc2,"The reason for the Allied defeat in the Battle of France was, infamously, the passage through the Ardennes of a German army and its breakthrough at Sedan, trapping the Belgian army, the BEF, and the best part of the French army near the coast. The Maginot Line, however, resisted all attacks, and actually many of the garrisons stubbornly refused to surrender even after the armistice. When the Italians invaded the French border, even the much less adequately defended Alpine line of forts held them at bay."
t3_316pae,cpyu50o,"Everyone might be more economically equal today, but if everyone is getting poorer together, especially relative to the world, it is inevitably going to bring those rankings down in the long-term because worldwide development doesn't stop. Stop growing, however, and your development will stop as well. "
t3_309bvo,cpqbaln,"As a PS4 owner of over a year now, literally the only game exclusive to that console that I enjoy is InFamous: Second Son, and even that got boring fairly quickly. It was a step in the right direction however, as developers are getting used to new hardware. When they use that hardware for remasters instead, it just proves to me that upgrading my console was completely pointless, as I have nothing new to play."
t3_309bvo,cpqbaln,"Example: I bought Last of Us in 2013 at launch. A year later, they release a superior version (however little) of the game. So, now I can't play the better version, because I bought their game at launch?"
t3_306b19,cpqv22p,"I think it's both very informative and interesting. If we stopped all of the actions that were contributing to global climate change right now, the current processes heating the planet wouldn't immediately stop; however they would peak and slow down. The idea I've had explained to me is that if we stop things that are outputting CO2 such as using our oil fuelled vehicles, which produce 19 pounds of CO2 per liter of gas used while driving according to URL we have a chance of stopping the increase in temperatures before the positive feedback loops become uncontrollable."
t3_304nx9,cppcie7,"You can believe in God without accepting scripture. If, however, you want to believe in scripture as well, I can't help you here. Well, there's an interesting way to look at it."
t3_2zejsa,cpi71b4,"There may be a neurological or psychological term or something, but IDk. I do know from reading about Buddhism, Yoga and meditation, however, that this split second moment between feeling an emotion and acting on it is referred to as ""bait"" and ""the hook,"" and part of practicing Yoga is about focusing on slowing down your mind so that you can control yourself during that split second and learn to control your reaction to your emotions and not ""get hooked"" into anger or violence. "
t3_2xsw3v,cp32kfg,"And all in one place. If you devoted the same area to wind power, you could put a few square kilometres here, a few there, allocate however you want. You could also put the wind farms closer to cities so less energy is lost in transit."
t3_2vayhb,cog18c4,"They absolutely were not the most technically sound, and the recordings sound (for the most part) very rough. This, however, was the point - punk culture at the time was about going against the grain, doing something different from the mainstream. Think about how back in those days there was no internet, cable, satellite, cell phones.. All music was generally consumed over the radio and nearly all stations were playing the same glossy tunes (disco, soft rock, weak pop)."
t3_2v0u7q,codo2ac,"I'm not saying that his behavior has any bearing on his claim. Pointing out the irony is however, valid criticism to his continuing behavior of binge-drinking. The criticism is effectively a new argument (against his binge-drinking), and distinct from the claim he made."
t3_2tquws,co1iyez,"They key is to educate children when they are young that no race is above any other. Two main problems with that, however, is how do you determine where AA is 'needed' and this approach takes time, like generations of time, before you can see results. In a way, this is exactly what different races have always done since globalization began."
t3_2s8qu4,cnn8yko,"It's a stubborn place, but it's lost much of its unique character, and is fighting to hold onto what is left. That said, however, change is the only thing that's certain, and what you think of as quintessentially ""Seattle"" or ""London"" or ""Berlin"" may not jive with what someone who lived there in the seventies thinks of as quintessential. Things fall out of fashion because they don't work, or no longer work."
