thread_id,comment_id,context
t3_1f9oa8,ca8tgxy,"If we have no qualms about pulling the plug on someone that is braindead because we agree that there is no life in this although the body is technically alive, then why does a fetus in that stage give issues?"
t3_1f93x1,ca84o94,"I wasn't referring to the Higgs, though."
t3_1f5j5p,ca7p4d4,"I actually consider myself genderqueer at the moment, so I'll try to explain my thought process to you."
t3_1f5j5p,ca7p4d4,"But I don't like the idea of being a woman and hate that everyone sees me as such, even though I understand why they do."
t3_1f5j5p,ca7p4d4,"I don't use gender-neutral pronouns like ""ze,"" though I know people who do and I respect their decisions."
t3_1f5j5p,ca8fo7j,"I'm lucky, though, not all trans people have access to such things."
t3_1et89u,ca3nnuy,The intervention during the first Gulf War to to get Saddam out of Kuwait; Once his troops retreated; this should have been the end of the War; [sanctions are ok as 'punishment' though].
t3_1ekr96,ca1bmet,"Some people even say that our sentience is the only thing that gives meaning to anything, though I do not fully agree with this view."
t3_1ekme5,ca1ende,"What you can say is that formal logic is useful in (the rest of) mathematics (though it is easy to overestimate this, centuries of mathematical discoveries were made just fine without any formal foundation, and even nowadays most mathematicians consider set theorists to be mostly irrelevant)."
t3_1ekme5,ca1ende,"So even though they are not completely solved, for the part that has been solved, the solution often comes from mathematics or physics or another science."
t3_1ekme5,ca1ende,The next philosopher thinking about them can only be so much smarter than the previous philosophers who have thought about them.
t3_1ejwsi,ca124sd,"I know that it is only an anecdotal evidence story, but I thought I'd share."
t3_1eeqwi,c9zlxhm,"If you ever travel to Kuwait, you will find Muslims there who pray 5 times a day and wear hijabs and drink at night (though it's illegal) and look at their newspaper headlines scratching their heads about how backwards and stupid their politicians are (much like we do in developed countries)."
t3_1edx91,c9zdm7n,Although I'm not saying racism isn't a problem.
t3_1edx91,c9zfzzm,Although I would argue even subtle racism is being frowned upon much more often.
t3_1edr56,c9z9qmk,"If you read the thread, there are some well thought-out arguments for why an animated show about children can be interesting and beautiful for adults, and personally I liked reading about it!"
t3_1edqbg,c9zdwam,"not ever cripplingly injuring oneself) and skill at football, just as you could accurately characterize a society that incentivises being good at managing money (Which you could argue is the chief meritocratic constraint of our current society, although that's a gross oversimplification) as also being a meritocracy."
t3_1edqbg,c9zdwam,"not ever cripplingly injuring oneself) and skill at football, just as you could accurately characterize a society that incentivises being good at managing money (Which you could argue is the chief meritocratic constraint of our current society, although that's a gross oversimplification) as also being a meritocracy."
t3_1edggu,c9z8w9e,"I'm not really sure where you draw the line for extreme cases - I don't need a scooter at the store or a walking stick to get around, I can walk across campus to my classes (although this is Florida and it's hot as hell, so I take the bus often, at least to the classes that are more than a mile away - we have a big campus)."
t3_1e71tp,c9xez56,When he gets Eve to eat the apples (though Satan isn't even mentioned in Genesis but as we are going to speak from an area that you are mostly ignorant except for the selective areas that support your opinion and yet have formed a decisive opinion) it is not because he wishes her to receive greater knowledge of science and logic or whatever.
t3_1e71tp,c9xg0eh,"I thought I did (the fact that Satan doesn't appear in Genesis for one), at least to the same extent you have as in point out of the events of the bible."
t3_1e71tp,c9xg0eh,I thought we were talking about their representation in the bible not what other people impose onto it.
t3_1e4v4u,c9ww06i,I hear people complaining about ads on Hulu after paying though.
t3_1e30x9,c9x7bnj,"No one owes me a job, but some collective effort and thought toward supporting the sort of productivity that I and people like me are capable of to use goes a lot further toward building a better society, which is what I went to college to learn how to do, than encouraging us to chase the market around, which is basically what you are suggesting."
t3_1e30x9,c9wbvj3,"Everything they thought they could do, that made them special, all seems untrue now, and they have to blame it on themselves."
t3_1e0dd7,c9vqt7l,"Although we didn't commit any actual crimes during the holocaust, we did basically refuse to help the Jews a few times."
t3_1dx9dj,c9uvnj6,"What you say actually makes sense, and i agree that those who can't choose, shouldn't be forced to they're free to do what they want; although I still think it's a lot more of a wasted vote not to do anything than to vote for insert random party here ."
t3_1dx9dj,c9uvnj6,"I think others have put it more eloquently than i could though, sorry for the confusion!"
t3_1duzzk,c9u8yoe,"In other words, your tax would punish one taxpayer and not anothers, even though both taxpayers have the same assets, simply because one taxpayer engaged in planning or predicted his or her death better."
t3_1dqocq,c9t1per,"But I don't consider myself a Democrat, though I'm registered as one."
t3_1dpa0j,c9sjq6e,"It requires concentration, creative thought, and a logical mind."
t3_1dj741,c9rbifa,The time issue of languages diverging and cultural importance is the main concern though.
t3_1dj741,c9r7xy8,"This is exactly what the British empire thought, too, so they had kids in Malaysia and India and all over the place forced to read novels about streets they'd never seen with trees that didn't grow in their country and foods they'd never even heard of."
t3_1dj741,c9r7xy8,"As a trilingual I can tell you that I have a different personality in my languages due to my respective place on the social chain in the respective societies, I can have certain thoughts in, say, Japanese that would not occur to me in English or make sense in the same way in English, and my life would ultimately be much less rich if I did not have access to such different ways of thinking."
t3_1di0zr,c9qvody,"Allan Watts puts it best here: http://www.youtube.com/watch?v=C9xQeejKSM0 And the more I thought about it, the more I realized, the group of all groups (or the universe as we know it), as Allan Watts puts it, itself is what people originally thought of as god."
t3_1di0zr,c9qvody,"He suggested to me something that I just wrote off as incorrect wishful thinking as a know-it-all teenager, that I know see as a logical line of thought."
t3_1dfy2a,c9pzk15,"Although I agree partially with you, I'm going to play devil's advocate."
t3_1dfnx1,c9pydqv,Whether the question is considered stupid / thoughtful may vary.
t3_1d93tu,c9o48f1,Do you have any more thoughts you have about what the performance evaluations you suggest would look like for the students?
t3_1d7g4o,c9nwpbl,"Even though they were far more racist, sexist, prejudiced in all sorts of ways and felt OK with slavery?"
t3_1d7g4o,c9nxhbi,"You are basically reduced to saying that even though there's absolutely zero reason to think it and plenty to not think it, it might possibly be true that XYZ."
t3_1d44p3,c9mrjf5,"So i probably speak more from experience rather than knowledge :/ As for the addiction thing, i have heard that being weaned off them is completely feasible although admittedly not a lot of fun, but neither is year upon year of deep depression."
t3_1d3iw3,c9mpy7b,Although I did 'contradict' some of your points I'm inclined to agree with your overall statement.
t3_1cymw8,c9l931u,"I wouldn't really say heaven/hell is a second chance, though, that would be more in the lines of reincarnation."
t3_1cyjeb,c9l7796,"So unless there comes a different species that is equally as smart as us and makes similar thought and behavior processes as us, sex with animals will never be moral."
t3_1crpmd,c9jkwqp,"Hope my opinion helps, even though this is kinda late."
t3_1cfa2w,c9g116t,"When these things go bad (and they have kept going bad, even though we know WHY they can go bad) it costs billions and billions and billions of dollars to fix it."
t3_1cfa2w,c9g116t,"Even though the risk of failure is low, the cost of failure is high."
t3_1cdk1m,c9fnhsl,"Something like 60% of students enrolled in post-education are females, and apparently the average amount of income for men has declined dramatically since 2000 where it has risen like 25% for women or something like that (although, women, on average, still make less)."
t3_1cbyg8,c9f2f7z,One thing people from the South have going for them though that you don't see in the North as much is a more pragmatic worldview and a better understanding of the connection between human nature/human behavior.
t3_1cbyg8,c9f2f7z,One thing people from the South have going for them though that you don't see in the North as much is a more pragmatic worldview and a better understanding of the connection between human nature/human behavior.
t3_1cbyg8,c9f2f7z,One thing people from the South have going for them though that you don't see in the North as much is a more pragmatic worldview and a better understanding of the connection between human nature/human behavior.
t3_1c11cx,c9cjvuj,"Ultimately, though (and I recognise that I've written a lot tonight) my objection to your plan lies in the fact that you're taking a positive freedom (the health benefit and disability benefit), and holding it hostage in exchange for the weight loss program."
t3_1c11cx,c9cjvuj,"Either way, your post is very thought provoking."
t3_1bjd8m,c97aro1,"In terms of hiring, a 3.9 gpa is the same as a 3.8 even though the difference between the two might be huge academically."
t3_1bitj0,c978xo7,It was something I never thought I would do.
t3_1bc8lk,c95k5tq,"I spent years trying to man up and deal with it because I thought that medicine was what weak people did - that depression was just in my head, and a strong person would overcome it without help, since it was just a matter of deciding to be happy."
t3_1b4ngo,c93juyb,"Even though you might make foolish decisions while drunk, it is ultimately your responsibility to control and moderate what enters your body and how that affects your decision making."
t3_1b4ngo,c93juyb,"This is because though you might not have been in the right state to make a proper decision in that moment, you could have easily prevented it."
t3_1ayifp,c91y4yc,"I love reminiscing about the fun I had with my previous girlfriends, and even though I don't talk to them, I know our thoughts will sometimes cross."
t3_1ayifp,c91y4yc,"I went through a stage where I thought constantly showering one in cute gifts is awesome, and I did end up stressed."
t3_1arnlm,c90957k,"I get that that's not really what the topic is about, though."
t3_1arnlm,c90957k,"If your belief is based on faith in God and the Bible, though, what exactly could you find out that would change your view?"
t3_1am1gg,c8yp91p,Here's a thought for you.
t3_1am1gg,c8yrmeo,however when ur looking at state funded education; these skills like engineering are very fact checked; a communist bridge builder and and anarchist bridge builder; kinda would both agree on the basic ideas of gravity and the shape of a bridge when u have a history major u dont know if they thought fdr helped or harmed the great depression
t3_1ahaci,c8y9ehd,"Something that would make them want to fight back, though it doesn't matter what exactly it is."
t3_1aah63,c8w7eb9,I thought St. Augustine addressed this pretty well.
t3_18hfbb,c8f4pon,And eventhough the restaurant you go to won't stop buying meat because your friend ordered a sallad it will change it's menu if they see a change in what people order and if enough restaurants change their menus then the food industry will change their production.
t3_18fnmc,c8efsxa,"If so, you understand exactly what is going on in your gf's head - appreciation without necessarily wanting to act on that thought/feeling; the only difference is that when she actually comments on it you get upset."
t3_181jmd,c8b80s2,"However, as with cars, if you fail to properly transfer ownership of a gun and that gun is used in a crime, there should probably be some consequences for you, though obviously not as severe as for the person who actually perpetrated the crime."
t3_34nm86,cqwdlqs,"Labels are important, though, as you have shown in your post - the feminist label used by the activists for these things you take issue with seems to be at the root of your attitude towards feminism."
t3_34ew6y,cqu66qp,"I once thought like this - but a girl that I had a relationship with previously had parents that definitely disproved this, though."
t3_34dp1h,cqtpbha,"In practice though, it's a very different story, you just have to look at the last few governments record of subtle privatisation and reduced service."
t3_34dp1h,cqtpbha,"I also don't think all of the UKIP supporters are right wing nut jobs, although sometimes they do look like parodies of Pub Landlord Al Murray."
t3_33xvlb,cqpfr89,"The problem arises, though, that if you treat ""best"" strictly as a subjective term in that way, it is by definition impossible to create a best game, and therefore a best game will never be created, either in the past, present, or future."
t3_33x4zd,cqph109,"Cancer is thought to be due to a combination of genetics and environmental factors, so even rare forms of cancer have to do with you participating in modern society with its associated carcinogens in the air we breathe, the foods we eat and the liquids we drink."
t3_33txti,cqooew0,"I would argue that at least in the western world, although we have had terms like ""racism"" vs ""institutional racism"", the overwhelming usage of the word ""racism"" in public discourse has referred to institutional racism."
t3_33ntp6,cqmwkk2,"It leaves blacks in a place of, ""wait I thought big lips were funny?"
t3_33ltmy,cqmkixu,"That said, I'm patiently waiting for the conservatives to get out, even though I finally reached the age of majority and still can't vote (I'm only a permanent resident)."
t3_33ltmy,cqmkixu,I can't say I'm particularly optimistic about the political future of Canada though.
t3_33ltmy,cqmkixu,"That said, I'm patiently waiting for the conservatives to get out, even though I finally reached the age of majority and still can't vote (I'm only a permanent resident)."
t3_33ltmy,cqmkixu,I can't say I'm particularly optimistic about the political future of Canada though.
t3_33ltmy,cqmlryg,"Even over the past 15 years though there has been a lot of thinking, and I think part of that is due to the work of people like you."
t3_33ltmy,cqmopca,"I am somewhat hopeful about the environment because even though it is being destroyed, we also have people in professions like yours dedicated to trying to save it."
t3_33ltmy,cqmlryg,"Even over the past 15 years though there has been a lot of thinking, and I think part of that is due to the work of people like you."
t3_33ltmy,cqmopca,"I am somewhat hopeful about the environment because even though it is being destroyed, we also have people in professions like yours dedicated to trying to save it."
t3_33ltmy,cqm92o8,"Everyone laughed about the 20 year study that would require and the millions in litigation, and it was effectively not pursued, even though it was a much better alternative."
t3_33ltmy,cqmkixu,"That said, I'm patiently waiting for the conservatives to get out, even though I finally reached the age of majority and still can't vote (I'm only a permanent resident)."
t3_33ltmy,cqmkixu,I can't say I'm particularly optimistic about the political future of Canada though.
t3_33jriw,cqlrxku,"Knowing that your family was exterminated because people hated them that much for being Jewish is a pretty terrible thought to grow up with as a Jew, and trauma and stress about something actually can be passed from generation to generation."
t3_33jriw,cqlu5ff,"Hopefully I will, though."
t3_33jriw,cqlu5ff,"I do think that even though we may be aware that the whole world doesn't actually want us dead, many of us are certainly afraid that someday, that sentiment will become popular (again-ish), and personally, I can't fault anyone for fearing that."
t3_33jriw,cqlu5ff,"Sometimes people do stick things in where they don't belong, though."
t3_33jriw,cqlu5ff,"But we never learned in my classes, for example, that the US turned away many, many Jews trying to escape the Holocaust, even though the immigration quota was nowhere near filled for most of the war."
t3_33jriw,cqlu5ff,"So even though the Holocaust is pretty ingrained, there's still a lot of pieces missing from the full puzzle of shared blame."
t3_335312,cqhmvlk,"His first five solo albums are considered classics among hip hop heads everywhere and although his Yeezus got mixed responses, it is on its way to being a classic as well."
t3_335312,cqhmvlk,"His other collab album Cruel Summer, although not up to his normal standards had a few big hits, including Mercy, undoubtedly the biggest song of last summer."
t3_332jn0,cqhabg4,"Although it looks like Unger is a respected philosopher, I have a problem with the word ""psychology"" used to almost explain away the differences, at least the way it appears in Wikipedia and the way you use it."
t3_32x0t2,cqfgq9p,(some ati and some nvidia) I had to throw away a couple of notebooks though because of Nvidias bumpgate fiasco.
t3_32tuwr,cqev05z,"The person who doesn't talk much can come off as stand-offish, and the jokes or comments they do make can be harder to read because you don't have enough context for them (I know sometimes people thought my sarcasm was mean when I was trying to joke with them)."
t3_32qem9,cqdmrey,That doesn't really make sense though because many people are elected whose views are different than the majority of people they represent.
t3_32mxxb,cqcpdn2,"In truth though, this seldom happens, because when one spouse does chores s/he expects the other to be doing something useful in the same time period."
t3_32hhvc,cqbea27,Its irrelevant though.
t3_32cuug,cqamp4r,An unchallenged thought or belief can't be addressed.
t3_32cuug,cqamp4r,"You probably don't see that happen very often, though."
t3_32br6b,cq9xojx,"This isn't just about illicit drugs, though."
t3_3295fa,cqa4xn2,"Although at no point was their growth particularly impressive, it was sufficient to maintain at least the capacity to defend itself."
t3_328mdv,cq909zj,"In fact that's what I always thought the multiple difficulty settings were best for- play it on easy to appreciate the story, play it on hard to appreciate the gameplay."
t3_320cdd,cq6tjhk,"Furthermore, many people who hold positions on certain issues, do so not because they've rationally arrived at a thoughtful conclusion based on available evidence."
t3_320cdd,cq6tjhk,"Likewise, when trying to ""reason"" with a person who holds an unreasonable position, logic and thoughtful argument doesn't often work."
t3_320cdd,cq6tjhk,Do these things tend to polarize and exclude people from thoughtful debate and compromise?
t3_31kfkt,cq2q8ub,"Then realize that their pain, though it will lose its edge, will remain with them for their whole life."
t3_31kfkt,cq2q8ub,"Finally, though you didn't ask for my advice, I hope you stick around."
t3_31iyzr,cq241hx,Varies by state though.
t3_31iyzr,cq241hx,"It reverts to their control at 21 though, so make sure they understand that the money is for school and using anything left over to get settled in a job."
t3_31iyzr,cq241hx,"Evolution is still taught, birth control is widely available, and if someone in your family really needs an abortion you can get it, though you might have to jump through hoops but the protesters are generally prevented from harassing patrons of clinics and most are peaceful."
t3_31iyzr,cq241hx,"And I still truly believe it is still the land of opportunity and if your diligent and ambition, you can do things and rise to heights you never thought possible."
t3_31extq,cq0zj18,"Even though I don't currently use those services, I have met people who used to have to, I have met people who currently do, and I might have to at some time in the future."
t3_319lcf,cpzou3x,Never in CMV have I seen a title that I thought I would totally agree with and a body that I totally disagree with.
t3_316gw1,cpyrd9b,I agree about poems though.
t3_30oi71,cpuh9jr,"So there's a lot of good research on the ""welfare trap"" though not using that term."
t3_30oi71,cpubj6z,"I'm a libertarian who supports the NIT, but you obviously put a lot of thought into this post."
t3_30oi71,cpubj6z,I never thought of some of the points you brought up here.
t3_30dwuy,cpris3v,They thought it was bad timing and a bad move for Republicans politically.
t3_30bmbr,cpqwt64,"Either teaching them philosophy would focus on one philosopher or general philosophy and basically be indoctrination, or it would teach a bunch of different philosophies, which, again, kids wouldn't really be developed enough to differentiate between on a meaningful enough level to really have it shape their thought process, and therefore just be a weird social studies/history course, with a bit of science thrown in assuming you touched on the scientific method."
t3_309gc1,cpqcrp3,"The problem arises though because Guam, the US Virgin Islands, American Samoa, and the Marianas all have relatively low populations."
t3_309gc1,cpqcrp3,"So even though there was a referendum in 2012, it's still not clear exactly what the majority of Puerto Ricans want in regards to their status."
t3_306owt,cpq6ae3,Almost all of my friends today were met through swimming so even though I haven't swam in a couple years it still has a positive effect on my life.
t3_304nx9,cppcie7,Just the thoughts of one Pagan... My take on it is that God isn't as narrow as that.
t3_2znn1r,cpkoqed,Vegans risk getting too little protein (although there are plenty of vegan Cross-Fit types that get plenty.)
t3_2zkscb,cpjth0r,"Although I would like it if everyone was motivated enough to walk escalators, but it doesn't seem to be the case."
t3_2ziiud,cpjaz7c,"My point though, is that institutions are a tool, and like any tool, can be used properly or improperly."
t3_2zi3o2,cpj94l8,"Anyway, food for thought."
t3_2zhhcc,cpj173b,"Beyond that though, what's wrong with a company asking for lower prices from its suppliers?"
t3_2zgan1,cpinblo,Hatred for Romani Gypsies is so ingrained that it is nestled deeply in most peoples minds without so much as a second thought that it might be bad.
t3_2zgan1,cpimxfr,"I agree that muslims are very prejudiced against in the UK, although I believe there are a few obvious reasons for it."
t3_2zgan1,cpimxfr,"I agree that muslims are very prejudiced against in the UK, although I believe there are a few obvious reasons for it."
t3_2z2msj,cpf7g2a,"Although, of course, on a much smaller scale."
t3_2z2msj,cpf7g2a,"Here's the thing though... people are expecting it to revolutionize gaming, and on its own VR is not going to do that."
t3_2z2e9y,cpf8cro,I always thought that foot fetishes were hugely common.
t3_2yszp3,cpcuf7e,"Although your intentions are good, your priorities are morally perverse to the extreme."
t3_2yrv0y,cpck14d,"In some college dorms, they have many of these bathrooms (though each has a shower)."
t3_2yrog1,cpcpdf3,The police have excessively militarized (I'd stop short of saying they've quite declared martial law though) and I would like to oppose that.
t3_2yrgi3,cpcbda3,Inevitably the situation you describe would happen though.
t3_2y2x3h,cp5u0ky,"Well, it is an intrusion on freedoms though."
t3_2y2tk3,cp5x9us,I agree that it is reasonable to allow rhetorical wiggle room for people making this statement even though it misses a lot of nuances of the issue.
t3_2y1qef,cp5h19u,"Regarding the science, though, the evidence is crystal-clear."
t3_2y1qef,cp5hsqg,"Well, as I said, it's a purely personal stance, but I'm pretty libertarian, so I take the side of no, the government should not be forcing people to do anything to themselves against their will, even though it's very clearly beneficial for society as a whole."
t3_2xucsd,cp40o0d,These are important questions as getting these attitudes at young ages can lead to very unhealthy thoughts and behavior.
t3_2xrgw2,cp38m66,I like reading about statistics and probabilities - even though I'm bad at doing them.
t3_2xnzkl,cp1snca,"I'd ask you though, what about the costs of taking on those other ideologies."
t3_2xnzkl,cp1snca,This thought isn't all that wrong.
t3_2xnzkl,cp1snca,I'd ask you to defend that claim though.
t3_2xi4wd,cp0kyaf,"For me, family is not about being buddies (though not exclusive to it)."
t3_2xcu0u,coyyw2v,"There were certainly URL (though many of them were minor acts that were trumped up by the police), but their actions were largely ineffective."
t3_2x8z4g,coxyxff,"If a person has also thought long and hard in a rational and lucid state, then perhaps it may not be morally wrong to stop them either."
t3_2wt9ya,cotx5b0,"It is objectively wrong, even though you live in a time and place where it is morally acceptable."
t3_2wt9ya,cotytfh,"People are generally not evil, in the sense that they seek to do wrong, but they are often immoral, in the sense that they do wrong even though that is not their goal."
