thread_id,comment_id,context
t3_1vrpkb,t3_1vrpkb,"But I believe the fact that most people buy insurance means that they have though about it, measured their risk, expected value, and aversion to that risk and decided that it makes sense to pay for that kind of insurance."
t3_1vil80,t3_1vil80,This is still relying on society though if you want this land to have protected status.
t3_1vg6qn,t3_1vg6qn,"There's a big problem with this though, ignoring ""muh freedoms"" which is a fairly obvious argument: You can't assume that every business will actually benefit from this, because you are not properly comparing profits in the current system vs. profits under your new one."
t3_1vd61r,t3_1vd61r,"Edit: URL is that comment about the difference between GID and Body Dysmorphic Disorder and why they are treated differently, though both deserve sympathy."
t3_1vbp78,t3_1vbp78,"Your view though was that they shouldn't expect you to move in the first place, polite or not."
t3_1v8hly,t3_1v8hly,It's fine if you don't want to smoke weed - I am SUPER against peer pressure and am not going to try to convince you to smoke yourself (though I would encourage you to try it if you want to educate yourself on what it actually feels like to be high.
t3_1v6x7z,t3_1v6x7z,We can't deny veterans their right to purchase weapons at their leisure even though those who own a weapon are more likely to commit suicide.
t3_1v6sc1,t3_1v6sc1,"Asian food was made to be eaten with chopsticks though, which means there isn't really a negative side to using them beyond ""I'm not as comfortable using them"" (which goes away after you've used them a lot)."
t3_1v6sc1,t3_1v6sc1,"My main point here is that though there will always be douchebags out there, don't let them cloud your view of the world."
t3_1v2buu,t3_1v2buu,"What I have done, though, is travelled to places where I've spoken the language, and travelled to places where I didn't."
t3_1uy91r,t3_1uy91r,"Gender Confirmation Surgery isn't a mandatory part of transitioning, though it can be very helpful for trans* individuals who experience dysphoria over their genitals."
t3_1ut0dy,t3_1ut0dy,"When the space shuttle was retired just a couple years back, its computer systems were all incredibly outdated, even though they were first constructed in the 1980's."
t3_1ul993,t3_1ul993,"It's turning a nice profit though, so I tell you I'll buy it from you for 100,000 dollars."
t3_1uhj8f,t3_1uhj8f,"Here is an illustration why: even though it seems too surprising, too incomprehensible that other hunks of meat in other human heads could give rise to conscious thought, that surprising-ness is just as real with regards to the hunks of meat in our own heads, and yet we have first-person direct acquaintance with our conscious experience nonetheless."
t3_1ueayk,t3_1ueayk,"What I most strongly disagree with, though, is that non-child-related life goals are extrinsically motivated."
t3_1ueayk,t3_1ueayk,I don't know if you have one singular goal you're still chasing though.
t3_1u7llg,t3_1u7llg,"Presumably you have sympathy for those who are victims of hurricanes or earthquakes or tornadoes, even though they are responsible for living in areas with an increased risk of natural disaster."
t3_1txyfq,t3_1txyfq,"I've lived in Scotland as a foreigner for the past 6 and a half years, and though I've not followed the debate with eagle eyes, I have, of course, been aware of it."
t3_1tx0tf,t3_1tx0tf,"I'm sure you see where I'm going here, so I'll leave it at that, though I'm sure I could come up with more examples."
t3_1tt75b,t3_1tt75b,It seems as though every qualm you have sited about the sport of basketball stems from the pace of the game.
t3_1tqttm,t3_1tqttm,"I would argue that it's immoral to press the right button, because even though you'll be slightly convenienced, there is a chance that you'll act in a way that's very immoral."
t3_1tqlde,t3_1tqlde,"In the majority of cases though, the Santa lie is supposed to be figured out by a child, while telling them about your favorite Deity is not."
t3_1t83kb,t3_1t83kb,"- There are some testimonial URL that apply to married couples, though ideally this URL because I'd like to think you're not looking to do anything that will end with you in court."
t3_1t5izv,t3_1t5izv,"If they don't feel as though a group is a threat, then how does having data they aren't even looking at going to let them prevent an attack?"
t3_1t2kp7,t3_1t2kp7,"Even though this post was deleted, I'd just want to tell you that a lot of your day-to-day political and social life - your possibility to go to school, your possibility to elect your representative, the fact that the president cannot decide your death on his own, the fact that you can be an atheist if you want to, the fact that there are paved streets and road signs - are all products of political phil."
t3_1t2kp7,t3_1t2kp7,"Philosophy and music have both helped me in my studies, though I was a ""scientific"" HS student, and now a law student."
t3_1swzm7,t3_1swzm7,"As you mentioned, homelessness and poverty are serious problems, though not historically high."
t3_1swzm7,t3_1swzm7,"We are still deficit spending (though that is decreasing), and many still lack adequate health insurance (though the Affordable Care Act is helping that)."
t3_1swzm7,t3_1swzm7,"Overall though, the country is doing pretty well right now and does not require a massive and major reform."
t3_1swzm7,t3_1swzm7,"Thanks for showing those statistics, though I do have a question : does the income tax chart account for inflation?"
t3_1swzm7,t3_1swzm7,"How do you reconcile this with being ""big government"" though?"
t3_1sgl5a,t3_1sgl5a,"We were not one nation in 1947, though we may be (sort of) today."
t3_1sgl5a,t3_1sgl5a,"He also ensured that post-Independence we did not tear each other apart on communal lines, though we've been trying hard since."
t3_1sgl5a,t3_1sgl5a,"I realise now that you believe in the inevitability of the formation of India as a country, which is fine, though I disagree with it."
t3_1s1j8s,t3_1s1j8s,"That's why politics contains such a high degree of rhetoric and ""good looks"" (though really most politicians haven't been that physically attractive... it's much more about liking the way they present themselves)."
t3_1rlna3,t3_1rlna3,"Many people will, though, and it is never likely to be a universally recognized right because most people feel that money is worth more than people."
t3_1rb6qj,t3_1rb6qj,"This is because it can share many characteristics with common real sandwiches that are known as such, and it can be treated like a sandwich even though it technically isn't one."
t3_1rb6qj,t3_1rb6qj,"A pita sandwich is still stuff inside two slices, though."
t3_1ra9u4,t3_1ra9u4,"Since you ask, though, here's a sample of the contents of one file: &lt;?xml version=""1.0"" encoding=""utf-8"" standalone=""yes""?> &lt;Title> &lt;Added>9/24/2013 1:37:15 PM&lt;/Added> &lt;LockData>false&lt;/LockData> &lt;Type>Movie&lt;/Type> &lt;Overview>&lt;![CDATA[Dr."
t3_1qwg8s,t3_1qwg8s,"Up until that point, they never counted me as a vegan, and there are plenty of people I know who don't count me as a vegan, so even though they've met a vegan who does not meet your stereotype, they don't make the association between my behavior and veganism."
t3_1qwdul,t3_1qwdul,"I had a friend who was pretty similar to how you describe, and when he tried the PUA route he got even more frustrated because he was feeling less connected to the people he was meeting, even though he felt more confident about meeting people."
t3_1qwdul,t3_1qwdul,"Because even though I'm a man, if I were a woman, we went out on a date, and (assuming you're as great as you claim) I got this laundry list of accomplishments out of you, my first thought would be ""what is wrong with this guy that he's made it to 29 without anybody locking him down?"""
t3_1qwdul,t3_1qwdul,"I will say two things, though: 1) Narcissists are, in this day and age, EXTREMELY common, and have huge blind spots to their own narcissism."
t3_1qwdul,t3_1qwdul,"PUA won't either, though, unless your strategy ends up being ""fuck this, I'm going to dehumanize the shit out them as much as they dehumanize me,"" which would be understandable, but holy shit is that a lonely way to live."
t3_1qw6q4,t3_1qw6q4,"It would have to be: ""It is typical for dates to split the check or take turns paying because it is a common practice, even though culturally we assume that the guy is going to pay and that may still be the most common."""
t3_1qw6q4,t3_1qw6q4,Because it's accepted even though it's not the most common?
t3_1qo0aj,t3_1qo0aj,That doesn't mean you can't ever make jokes involving gay people though!
t3_1qj032,t3_1qj032,"Let's talk about the long run though, as you state: In the long run, a country that can't make intelligent decisions will never be able to compete with a country that does."
t3_1qfy2y,t3_1qfy2y,"I think it's also possible (speaking as someone whose ex-wife loved knitting even though knitting is literally the most boring thing in the world) (no offense) that what he actually likes about knitting isn't knitting itself but feeling closer to you by sharing these things you love, and that when you refuse to share back, it feels like the thing he liked about knitting basically evaporates."
t3_1qfy2y,t3_1qfy2y,"There is definitely a general asymmetry in the way the powerful use power over women, versus the way the powerful use power over men (though you will find exceptions in both directions if you keep reading), but to me this seems to be in keeping with the feminist understanding that rape is about power, and ultimately almost everybody just treats other people as objects to be used, and the exceptions (like Syrio's sacrifice for Arya) are noteworthy for being rare."
t3_1qe6d9,t3_1qe6d9,"That letter got a bad rep, though, because he spent so much time talking about how homosexuality is a strong inclination towards sin."
t3_1qe6d9,t3_1qe6d9,"Here's the thing, though: to a Catholic theologian, [everyone is strongly inclined towards sin."
t3_1qe6d9,t3_1qe6d9,"](http://en.wikipedia.org/wiki/Concupiscence) So, while Francis said it better, both Popes have said that the Church should fight homophobia, even though homosexual sex isn't something the Church endorses."
t3_1qe6d9,t3_1qe6d9,"Also, while he wasn't the most effective at dealing with the child abuse scandal, URL Back to Benny 16's nerdiness, though; he really wasn't good at seeing how outsiders perceive the Church."
t3_1qdlln,t3_1qdlln,"""Respects being paid"" is a highly subjective approach to the issue though."
t3_1qa50u,t3_1qa50u,I ought to be able to consent to that form of government even though it may be imperfect and sometimes I do not always get what I want.
t3_1q0fp2,t3_1q0fp2,"I can't convince you that that particular world view will run contrary to your interest, though, because perhaps it won't."
t3_1q01e8,t3_1q01e8,"Even though there is a difference between Worker A and Worker B because B will make more hinges because they continue to work instead of smoking, that difference would be even greater if A was unhappy and couldn't get their smoke break, leading to even less door hinges because they weren't motivated."
t3_1pux5t,t3_1pux5t,"(ok, this is an extreme, but you see where I'm going) The very bottom line is though, even IF each abortion is individually questionable or even wrong, collectively they are an absolute necessity for the impact they have on society."
t3_1pp78v,t3_1pp78v,Advocating for these people to kill themselves may result in them doing it even though their situation may have improved.
t3_1pet4o,t3_1pet4o,"I'd summarize the post here, but its probably easier to just read for yourself (even though it has some jargon in it.)"
t3_1pet4o,t3_1pet4o,"3) from personal experience, even though half my weekends are 3 days long, I still feel they are much longer and am much happier knowing the coming weekend will be 3 days long than 2 days."
t3_1pdul1,t3_1pdul1,"more human), who may not care about others and may have learned enough to simulate empathy, but who is imperfect and sometimes, though not necessarily by mistake, reveals his true disinterest?"
t3_1pdul1,t3_1pdul1,"I don't think a great enough performance artist exists to indefinitely maintain a facade in his/her personal as well as public life, though I suppose that's open to debate."
t3_1p6fts,t3_1p6fts,"""Everybody should treat digital information as though it could be made public."""
t3_1oyj63,t3_1oyj63,"You deserve more than that, though."
t3_1otx5t,t3_1otx5t,"I hope you can see though that there are many factors involved in creating that sound, and that when a show is too loud, a lot of people can be to blame."
t3_1on8j3,t3_1on8j3,"Concealed carry is now legal in all 50 states (though some still severely restrict it), and the courts have established that carrying a gun in public for self defense is a constitutionally protected right."
t3_1ohh43,t3_1ohh43,"In general though, they want healthy, disciplined, physically fit people to be in the military, and the requirements are meant to exclude people who are not those things."
t3_1ob3rz,t3_1ob3rz,I think that eternity being inherently bad is hard to grasp though.
t3_1o3jlp,t3_1o3jlp,"That's not where the money goes though; equipment and training facilities are expensive, of course, but for the most part they're one-off expenses, and the profits more than cover that."
t3_1o24hh,t3_1o24hh,"Both valid options, though many men would tell you (due to some ridiculous idea about 'masculinity' or something) that it's standing only as a guy."
t3_1nqb9q,t3_1nqb9q,"The Catholic Church strongly opposes supporting contraception in any fashion, which it considers a grave moral ill (I don't share their view, though I can explain why they do if you care)."
t3_1nqb9q,t3_1nqb9q,Could that not be a bias you have though given your profession?
t3_1nh939,t3_1nh939,"Although I feel as though you and I have very similar thoughts about this whole thing, I have one point of contention I want to talk about."
t3_1ncxna,t3_1ncxna,Groups like that tend to be around in lots of areas though.
t3_1n8wzy,t3_1n8wzy,"I'm not being annoyed constantly though, so I still get stuff done."
t3_1n6bmg,t3_1n6bmg,"Having a government start banning annoying things can quickly get out of hand, though."
t3_1n6b29,t3_1n6b29,"Maybe, though I think that's a somewhat limited view."
t3_1n6b29,t3_1n6b29,"Or can it be perfect, or even just artistically valuable, though in a limited scope?"
t3_1n4obz,t3_1n4obz,"And, in the same way, I had my kindness abused when my new friend stepped over the line and started going though my things."
t3_1n4obz,t3_1n4obz,"Your analogy is also flawed though; unless someone accepts your friend request and then immediately messages you ""Feel Free to look through my pictures!"
t3_1n3wo2,t3_1n3wo2,"While it is unfair that people receive protection from others who get vaccinated even though they don't contribute to protecting others by getting vaccinated themselves, it seems far more unfair to force those who don't wish to protect others by getting vaccinated to leave their homes to another country."
t3_1n1zu0,t3_1n1zu0,This doesn't mean that the works themselves are not worth teaching by better teachers though.
t3_1mqfmi,t3_1mqfmi,Old uncle money-bags does though.
t3_1mq464,t3_1mq464,"I totally see your point of view though, but hopefully some of this helps change your view!"
t3_1mjw31,t3_1mjw31,"It's a good argument, though it doesn't change my mind."
t3_1mjw31,t3_1mjw31,I don't think that this should be blamed on the author though or that one individual critic's views (such as yours or mine) should extend to encompass everyone else's and also overshadow the decision that the original author made regarding their own work.
t3_1micrr,t3_1micrr,That's a choice though you'll have to make at the end of the book.
t3_1mdwb3,t3_1mdwb3,"The criminal court requires there be evidence beyond reasonable doubt whereas the civil court only requires it's more likely than not that the crime was committed, so here even though the US justice system decided there was a >50% chance he did it he was still found not guilty."
t3_1mdfzf,t3_1mdfzf,"There are differences in brain structures as you pointed out - though it's important to keep in mind that the more we learn, the more we find that the structure of the brain itself changes depending on how its used (as you were pointing out with the plasticity reference)."
t3_1mdfzf,t3_1mdfzf,"So if testosterone makes someone agressive, for example, a man and a woman could both have a spike to become equally aggressive with a testosterone boost, even though the absolute levels could be very different."
t3_1mcyw7,t3_1mcyw7,"""The issue with cell phones is a concept called attention,"" [..] ""When you're on the cell phone, it appears as though the process of talking with the cell phone may have an impact on one's attention and ability to visualize what's going on in the environment, because you are focused in on an abstract concept called the telephone."""
t3_1ma1o7,t3_1ma1o7,"Humour plays a large part of the person's receptability to these criticisms, though the poo-pooing of things by someone can oftentimes be humorousness."
t3_1m5nls,t3_1m5nls,"That doesn't make it a good idea, though."
t3_1ly6qz,t3_1ly6qz,"So, though overall cyclist injuries decreased, injuries per number of cyclists actually went up."
t3_1lt0gt,t3_1lt0gt,I think you're looking at the complaints (though not all of them) from the wrong approach.
t3_1lt0gt,t3_1lt0gt,"Now to address specific complaints toward Obama and the desire to remove him, this goes back to the idea that even though he was elected, he's not living up to the expectations of those who elected him."
t3_1lp8a5,t3_1lp8a5,"So, let's say that now you come along wanting to use blackface in your movie because you couldn't find any black people for the part (though I imagine that you probably had binders full of black people to choose from)."
t3_1ln6cd,t3_1ln6cd,"I'm a bit concerned, though, that we're talking past each other."
t3_1ln6cd,t3_1ln6cd,"What it also does, though, is mean that people will be offended as long as we don't have an orwellian, newspeak style language in common usage, and I for one think that's a good thing."
t3_1lilfq,t3_1lilfq,"By and large though, and I'm certain this is what OP is talking about, style is a proxy for class."
t3_1lilfq,t3_1lilfq,"Here's my point though: if you look at the history of fashion, the non-functional changes appear to be random (colors, textures, buttons, etc)."
t3_1lcywy,t3_1lcywy,"I can not think of any other subject that works this way and feel that even though I am good in this subject it seems rather useless unless you want to be a teacher, which I would only do if I had no other employment options."
t3_1lbwhm,t3_1lbwhm,"As such, people will still have to work for a living, and wages will still be different for each position (though profits will be split evenly as all workers have an equal share in ownership)."
t3_1lbmj6,t3_1lbmj6,This is actually one of the character's most interesting (though depressing) implications.
t3_1la7rw,t3_1la7rw,"Not to mention it's unlikely the US government would allow such a thing to begin with, though I don't know what the NSA will do."
t3_1la7rw,t3_1la7rw,"They knew the risks and joined him, even though he discouraged them all from doing so."
t3_1l6jx5,t3_1l6jx5,"If it's 5 or 10% healthier, would you feel vindicated, even though the difference is almost negligible?"
t3_1l6jx5,t3_1l6jx5,"That's the problem, though."
t3_1l4zh1,t3_1l4zh1,Realistically no one would ever pay me for it even though it is kind of snazzy.
t3_1l4s6s,t3_1l4s6s,"Many with mental retardation are able to function, though at various levels, including holding jobs, having families, and other things we consider normal."
t3_1l3r2u,t3_1l3r2u,"I am also thankful for the elective requirements, even though they are considered ""useless"" by many."
t3_1l3hck,t3_1l3hck,"And that's why PC language, though admirable and well-intentioned, is really losing the social battle right now."
t3_1l3hck,t3_1l3hck,Are they though?
t3_1l3hck,t3_1l3hck,"Is it more important to try to strike the word from our vocabulary because it will help some people not be hurt now, even though it may prolong the process?"
t3_1l09gg,t3_1l09gg,"From what I've heard, castrated child molesters sadly don't always respond very well to castration (though some do)."
t3_1kvk1r,t3_1kvk1r,"Sure, they may have been lying, and we don't ""know for sure"" whether it was really their intentions or not, but it's not plausible that they aren't, even though it's possible that it isn't ."
t3_1kmwmn,t3_1kmwmn,Even though it was trying to reform itself to incorporate the strengths of the ideologies that ended up beating it and now remain at the top of the heap.
t3_1klm9f,t3_1klm9f,"I find that to be unfair, though."
t3_1kkzei,t3_1kkzei,"I don't see what it has to do with one person's power though, as it would have to be done by a community of scientists working together."
t3_1kj8ll,t3_1kj8ll,"I could conceivably be pleasured by someone to whom I am not attracted, though I personally feel the knowledge that they were not attractive would put me off sexually."
t3_1kj8ll,t3_1kj8ll,I suspect that a person can learn (though perhaps not be taught ) to be one way or the other (or the other or the other or the other ... etc) but at any one time people belong at a single place along the spectrum.
t3_1khlm7,t3_1khlm7,"Since I can't find a figure online, let's say the electric motor components (which are the major components for regenerative braking) add another 100 onto that even though that's almost certainly highballing."
t3_1kag5w,t3_1kag5w,"So in conclusion, I would say that since the universe doesn't work on a strict A to B progression, and everything is built and seems exactly as though humans have free will, there are only two logical conclusions to come to: Either we have free will, or we have a perfectly functioning impression of free will that completes the same result."
t3_1k5c52,t3_1k5c52,"It sucks, though the Pacific NW is far from the worst."
t3_1k3fd5,t3_1k3fd5,"In general though, men are expected to work longer hours, do more dangerous labor, travel further from home, take less breaks."
t3_1k3fd5,t3_1k3fd5,"While it's true that most men aren't objectified sexually (they are for money, though that's another story) if a man is fashionable and attractive he can expect to get objectified."
t3_1k3fd5,t3_1k3fd5,"But, though this isn't true for every woman or man, it's incredibly common."
t3_1k2ucr,t3_1k2ucr,"So that you understand where I'm coming from, I was raised Catholic, though that's not my personal faith."
t3_1jzymk,t3_1jzymk,What if she wants to do something on her own though?
t3_1jxenp,t3_1jxenp,Now it seems like the GOP is on the verge of falling apart... even though they won back the House in three years ago (2010) and have a good chance at winning influence in the Senate in the next cycle.
t3_1jx75l,t3_1jx75l,"(They liked two different teams, though.)"
t3_1jx75l,t3_1jx75l,"Nowadays, I live pretty far from most of my family, though I get to visit more than I used to."
t3_1jx75l,t3_1jx75l,"As you might have guessed from my first two items, I'm not the most extroverted person, and it makes it easier for me to have reasons to interact with people, even though the interactions are often their own reward."
t3_1jwep9,t3_1jwep9,"Anyway, I'm going to give my opinion as someone who knows quite a bit about the Civil War and likes the history of the era (though I'm by no means a professional; the closest I've come is when I worked as a Park Ranger for a Summer)."
t3_1jwep9,t3_1jwep9,"Yet, even though, when all is said and done, it can be agreed that the Civil War was started because of slavery, not everyone who fought for the CSA agreed with slavery."
t3_1jaqjx,t3_1jaqjx,"This started out as a reply to your reply to u/A_Mirror, so apologies if I make some references that don't make sense in context, though I've tried to clear them up."
t3_1j00y5,t3_1j00y5,"This makes the situation sound as though the amount of money being spent by businesses is the same no matter what the minimum wage may be, and therefore we're hiring fewer people for the same amount of money, for no reason."
t3_1iw2um,t3_1iw2um,"Each ""style"" of education would be pointless on its own though, we really need to implement both if we want to see a decrease in violent crime."
t3_1iw2um,t3_1iw2um,"It is not for anyone else to ask if the victim could have done something different though, I like to assume they were doing everything in their power to not get attacked."
t3_1iw2um,t3_1iw2um,"We should also agree though that she is probably unaware of this fact, if she did realize she was vulnerable she would obviously change locations and stay alert."
t3_1it8ez,t3_1it8ez,"I can't find direct statistics, only correlations between crime and poverty and poverty and racial minorities(though I know that there are statistiscs, I just can't find them at the moment)."
t3_1ii9vi,t3_1ii9vi,"But yeah, I was grabbing that out of my ass, it would be interesting to be able to find that stat though."
t3_1ii9vi,t3_1ii9vi,"It's one of the main reasons that I have turned more pro-gun control, even though I was raised in AK with guns."
t3_1igbwh,t3_1igbwh,"The girls know they aren't pretty enough for regular gonewild but still want to objectify themselves (though we know only men can objectify women, ammirite?)."
