thread_id,comment_id,context
t3_2rnr30,cni3o83,"I don't think it would, because though premeditated murders could well be less likely, accidental deaths, unplanned homicides, and suicides would like increase."
t3_2rmy6e,cnhc8a5,"The place that we're currently at though is the result of a lot of work in ethics, epistemology and metaphysics."
t3_2rmy6e,cnhc8a5,All our philosophical questions then may as well be answered by /r/showerthoughts or /r/trees.
t3_2rmy6e,cnhjqws,The problem with thoughtful introspection is that you're vulnerable to your own bias.
t3_2rmy6e,cnhjqws,"Obviously not, you need to study science (though you would be surprised how many leading scientists actively study philosophy)."
t3_2rmy6e,cnhjqws,"Likewise, most people's lives are sufficiently common and boring that thoughtful introspection will do them just fine; but, for example, cutting edge businesses (e.g."
t3_2rmy6e,cnhjqws,"tech or service start-ups) rely on previously untested reasoning, and it can be very useful to have a capable, trained set of eyes on your thought process before you pull the trigger."
t3_2rkjr3,cngqb7p,"It would still be false to say that nobody ever changes their view, though."
t3_2rexe3,cnf8xlt,"On a personal level, though, I agree that ""military discount"" becoming ""public service discount"" wouldn't be a bad idea."
t3_2rawgb,cneyhn7,Every thought stands of its own individual merits.
t3_2r4b8f,cnch3ur,"While our initial thought might be that the ball costs ten cents, this is actually incorrect."
t3_2r3fa4,cnc4l6o,"Assuming you do not believe in hell (though maybe you do, I don't know) you are claiming that even though you don't believe this place exists, you think that someone who genuinely does believe such a place exists has the moral obligation to prevent people from being sent there - even though you would say that they are mistaken that there is such a place."
t3_2r07cv,cnb8dy3,"(You can't really actually change it with science, either, but don't say that to loud, people get threatened) The single biggest reason though, is that changing your gender is in effect spitting in the face of God."
t3_2qtorn,cn9ejzb,"I do a little volunteer work with a women's shelter (though I'm a guy), and you will probably find that those shelters offer services for men as well."
t3_2qslmz,cn96gyu,"I had a closeted gay paragon Shepard because I thought it was hilarious and he eventually shacked up with Kaidan, saved the world, let no one die, then picked destroy ending because why not."
t3_2qslmz,cn96gyu,"I was pissed as hell at the URL (and I don't think, as another fan, you'll need me to elaborate on why - I loved those characters and I hated how little involvement they had in how things went, and the ending was a total slap in the face to the player and all their work until that point) so I thought you know what, I want a Shepard where this kind of ending makes sense."
t3_2qrbaf,cn9b6ar,"I loved The Hobbit, even though it got slow, but I found Tolkien's prose to be far too slow-paced and filled with inane babbling about things too far removed from the plot."
t3_2qqxoy,cn8oez8,"The belief that one has an animal spirit is not new and has been a component of many primitive animistic cultures throughout history, and certain Native American practices still have vestiges of this, though most of us wouldn't describe them as ""delusional"" simply because they follow the traditions of their ancestors as they've been practiced for centuries."
t3_2qqa7z,cn8hti0,Eventually though you'll stop making strength gains and simply be increasing your endurance.
t3_2qmhw7,cn7hxwe,"This again, though, goes back to a culture which seems unreasonably biased towards sex."
t3_2qmhw7,cn7h4vg,"They are not getting any attention though, since they usually remain anonymous."
t3_2qia6o,cn6rxow,"And I see a line manager growing his team as a microcosm of a founder growing his company, though the company may have rules in place to help keep the line managers from going off the reservation."
t3_2qc1rl,cn4rijs,"Stalin thought non-stalinists were dangerous, and probably a lot of Russians did too who most would consider reasonable."
t3_2qc1rl,cn4sadr,People thought the exact same thing before WWI.
t3_2qc1rl,cn4sadr,They thought they were too civilized for what would happen in the next 50 years.
t3_2qc1rl,cn4sadr,"J. S. Mill would have been considered an extreme feminist back when he wrote, but today he's very much in the center of mainline liberal thought."
t3_2qb4ra,cn4kqwf,That doesn't make Poker a bad game by design (even though it can be unfun in some scenarios); it just means that it's not a game that everyone will enjoy.
t3_2qaf6l,cn4h6d8,"The problem isnt always bad parenting, though that can play a role, the problem is a black and white educational system."
t3_2q5zwb,cn37lx6,Korra was a very headstrong Avatar and thought that the best way out of any situation was to punch it to death.
t3_2q388d,cn2re9b,Let's have a little thought experiment: You are dragged in for 'questioning' and after you've been softened up a bit (ie.
t3_2q0mlm,cn2s796,"Being compared with a character voiced by Kumail is a fitting reward for typing all that on my phone, but I'm also interested to know how convincing you thought my examples were."
t3_2pxql9,cn1q51v,There has to be perhaps further thought given to the principles behind why and why not that action should be taken.
t3_2pqfx4,cmzmqbt,"Still, though, Hip Hop today is still a very valid genre, and there's a huge difference between Classic Hip Hop and much of the mainstream ilk out there."
t3_2pqfx4,cmzmqbt,"No one, though, is arguing the worth of Hip Hop being less than any other musical genre out there, though."
t3_2ppxgu,cmz3fxo,"Even though they may be making fun of the ""CIS, white-penis'd, STEM wielding hivemind,"" some of them are probably those exact things."
t3_2pnm9s,cmytc0t,Those aren't the ones you hear about though.
t3_2pkvb6,cmxr4yg,Pain is a physical and mental response to trauma although when you're feeling it pain takes on nuance.
t3_2pkvb6,cmxuwcy,Thank you although I think the argument accomplishes both.
t3_2pkvb6,cmxuwcy,Yes although I can only answer based on my personal experience.
t3_2pkvb6,cmxuwcy,Why worry about it though?
t3_2pkvb6,cmxuwcy,We have total agency from an existential point of view although reality does assert itself early and often.
t3_2pkvb6,cmxuwcy,We can still do things though.
t3_2pimzj,cmx2c61,"CMV is a sub where there appears to be a more cordial attitude toward debate with less impassioned mud-slinging, derision, and name calling (though I admit I have only been viewing content for a couple of weeks)."
t3_2pf19b,cmw30ng,We want to encourage kids to have an expansive vocabulary so that they can adequately express themselves and convey their thoughts and feelings.
t3_2p82u7,cmudm5u,A more appropriate example would be if I were a rich businessman and wanted to help the environment because I thought it was the morally right thing to do.
t3_2p82u7,cmudm5u,It turns out that I never deeply thought about if helping the environment really was morally right.
t3_2p3z06,cmt7f8t,"The two situations don't overlap completely, but, clearly employers think it's worth it, even though the more their health care is used, the greater their premiums."
t3_2p3d0h,cmszlym,Betrayed by someone he thought he could trust.
t3_2p3d0h,cmszlym,The rug has been ripped out from under him and what he thought he knew about friendship and trust has been shattered.
t3_2p19c2,cmsmj84,"Without going into it comprehensively, although it is very difficult to get complete numbers, here is a reasonable article about the number of people who are wrongfully killed by police in a year: http://fivethirtyeight.com/datalab/another-much-higher-count-of-police-homicides/ So, because there isn't great evidence, unless you have better evidence, I think it is safe to assume that this is accurate info."
t3_2p0lop,cmsehsp,"do you honestly trust every single person to take the considerable time and effort to receive a proper understanding of the intricacies of monetary legislation, and then cast a well informed and welly thought out vote on it?"
t3_2p04r0,cms66ua,"People thought he was born in Kenya, turned out he wasn't."
t3_2ovqav,cmr1iii,"They buy pouches for their pouches, a dozen aftermarket accessories for their weapon that they don't even use properly and spray paint those accessories in earth tones even though they roll around in a giant fucking truck you can see from a mile away."
t3_2ovqav,cmramno,"The NFL is having problems with concussions and TBI even though they wear helmets and facemasks, rugby players the world over don't have the same problem wearing nothing more than a scrum cap."
t3_2ovqav,cmramno,"I conducted that training a few times at various places around the country, and what I consistently noticed was that the more access these people had to military-style gear, the more they thought that their job (being a cop) and my old job (Marine) were similar."
t3_2okad4,cmo23yr,"I read TFiOS, Looking for Alaska and Paper Towns, and I thought that the hype was really unfounded because they were just more formulaic teen fiction."
t3_2okad4,cmo23yr,"After revisiting the books later though to see why I had (briefly) originally liked them, I decided a lot of their appeal was because they deconstructed a lot of the tropes that they're made of."
t3_2okad4,cmo8ojn,"She reminded herself that even though life seems unfair, she can still make the most of it."
t3_2oihml,cmnhr07,"However, when person C is aware of a pre-existing relationship, even though he does not directly know person B and does not therefore have a meaningful connection to ""owe"" him anything, he is disrespecting person B by knowingly facilitating person A's breach of their social contract."
t3_2o6paa,cmkar1d,"Based on your starting argument, It sounds as though you understand some of the basic principles of evolution, and that you have an idea of how the scientific method works, even if you aren't yet willing to accept the conclusion that all species on Earth descended from a common ancestor."
t3_2o66aa,cmktxrs,"Although the situation might seem simple, there's actually quite a few factors involved that influence the response."
t3_2o66aa,cmktxrs,"Although many people don't realize it, the purpose of this subreddit is to change a person's view, not necessarily reverse it."
t3_2nvj2v,cmhc9js,"Although, I still wouldn't find it practical on a large scale."
t3_2np4sw,cmfoh41,"I thought we were both firm, while being respectful (wish I had been a bit more so myself)."
t3_2np4sw,cmfoh41,"I'm not even sure what the best case scenario would be here, in terms of your child's thoughts of you."
t3_2nokg9,cmftzma,"They may think that even though they can reduce next weeks major violence by committing minor violence today, they may be concerned about setting a precedent of violence that will last long into the future."
t3_2nokg9,cmfzhbk,"I don't though, because I reject the notion that imperfection implies immorality."
t3_2nbeuf,cmc4ns0,"Even though you die, your existence in those pages is untouchable."
t3_2namx3,cmbzyjs,I can think of one example though where the issue you raise is very important.
t3_2n9vx2,cmbxdsx,"If you didn't have people who thought ""oui"" was right and other people who thought ""si"" was right, you wouldn't have French and Spanish."
t3_2n900k,cmbi11m,"Instead, the best option would be to change the system, since that is part of the ""contract"" I'm in with the government even though I never consented to it."
t3_2n8psp,cmbnpay,"Nor am I thinking about replacing any of them with a better model, as though women were all on some scale and I'm looking for the one with the highest number of girlfriend points."
t3_2n6s5w,cmav500,"if they really are at the cutting edge of human thought, then you (and all of us) are most likely poorly equipped to evaluate their positions on their merits."
t3_2n6s5w,cmav500,"Among the major philosophies of our time (or times just before ours -- I'm not sure how old you are, but I'm 25 and don't feel comfortable claiming stuff from the 60's-80's as 'mine') are: Feminism, which is an inherently postmodern field of critical theory
 Subatomic physics, which is arguably an example of science moving beyond strict empiricism and into new epistemological territory (I say arguable because I wouldn't agree with it but the fact that the argument even makes sense to have is relevant and important) * Democratic socialism, which is an area of political thought that meaningfully approaches the criticisms of strict capitalism that Marx raised, without falling into the serious shortcomings that come with a modernist interpretation of socialism Furthermore, achievements like the internet -- or, to get more specific, Wikipedia -- represent accomplishments in the human organization of knowledge that were literally unthinkable during the enlightenment."
t3_2mv3n4,cm83yv8,"It went on for a while, I remember the last time though."
t3_2mv3n4,cm83yv8,"It was great though, I could buy toys my parents didn't have the money to buy for me."
t3_2mv3n4,cm83yv8,I thought I'd be told that I had chosen to do it and for money no less.
t3_2mv3n4,cm83yv8,"I'd get drunk at any opportunity and have sex with pretty much any girl I could, paid for sex several times, it didn't really help though."
t3_2mv3n4,cm83yv8,I always thought URL was a good explanation regarding the ability to move on after something like sexual assault earlier in life.
t3_2muo4y,cm8hqzb,"Sorry, that was way longer than I thought it would be."
t3_2muo4y,cm8kfip,"My main point though is that being part of society means putting up with a lot of legislation that you don't like and that, sometimes, upholding rule of law is more important than doing what you think you should be able to, for the sake of preventing people from breaking the laws you do agree with."
t3_2mikc0,cm4o1vc,Teach teens and young adults what is or isn't healthy behavior/thought and how to get help.
t3_2mesct,cm3nquu,Some people (even though they are a visibly smaller group) really just enjoy this initial buildup.
t3_2m9le3,cm28iwd,"They do not help with everything, though."
t3_2m9le3,cm2e6er,"In college, you have professors to help you get started and guide you through your thought processes, peers to share your misery with, and deadlines to make sure that you actually do the work."
t3_2lxha7,clz4fjz,"My parents had my brother circumcised even though their doctor told them it was medically unnecessary because they were worried that my brother would feel weird in later locker room and/or sexual situations when most of his peers would also be cut, statistically speaking."
t3_2lwrsv,clzj8j6,"So the military didn't strictly tell you to go talk to girls, what was so hard about figuring that out though?"
t3_2lrnbm,clxhtmt,"I can see the professor's point though, this is Engineering and not an English class."
t3_2lqcby,clx99dx,"The reason is that the first amendment protects the behavior, even though it's repulsive."
t3_2lclza,clus7m4,"Either way, though, the reality is that right now the overwhelming majority of meat (and other animal products, but let's focus on meat) is produced using obviously inhumane methods."
t3_2l6s0m,cls56tt,"My interest, although not yet my career, is marine biology, so I will look at this subject from an oceanographic point of view."
t3_2l6s0m,cls56tt,"The #1 concern for me is[ ocean acidification,](http://www.pmel.noaa.gov/co2/story/What+is+Ocean+Acidification%3F) which is happening now and everywhere, although most noticeably in my area of the world (Puget Sound, PNW)."
t3_2ko5tx,cln523m,"However, this turned out to be less than accurate, and now their is a social backlash against the very thing once thought to be the perfect supplement to your little kids' diet."
t3_2kkqbm,clmbeod,"If you don't think that today's kids (who are tomorrow's adults) will be of benefit to you, go read (or watch) Children of Men - it's not great literature or cinematography, but it sure is thought-provoking."
t3_2kk7pc,clm4luc,"Revenge porn with identifying information, though, could easily lead to life-threatening harm."
t3_2kgrtb,cll6vkk,"The actual rules don't really matter, though - you could make snacking harder by sticking to a ""diet"" in which you only eat foods that start with letters A-H."
t3_2kfldi,clkve20,"Never said it wasn't, my point was that if you are going to go after the Bible for promoting violence, but give the Quran a pass, even though it has hundreds of verses promoting religious intolerance, then you are not being very philosophically consistent(not saying you are specifically, but there are plenty that do.)."
t3_2kfldi,clkve20,"Many people who cry islamophobia have no issues with criticizing christians for their misdeeds, even though their actions towards people are lesser by comparison."
t3_2kfldi,clkve20,"Female genital mutilation isn't a part of the Bible, though."
t3_2k19cr,clgz8mq,In fact I still feel that what I wrote above holds even though I eat meat now (we're all flawed I guess).
t3_2k19cr,clgz8mq,I never considered it immoral for her to eat meat even though I felt it was immoral for me to do so.
t3_2k16fy,clh464b,"Is a couple with a m-f transgender and male partner gay, even though the man feels he is dating a women (but biologically male)."
t3_2jzn6v,clgmxcg,Researchers in the field thought it was dodgy and ran studies to confirm but in the meantime huge numbers of people wanted a dangerous and useless procedure.
t3_2jp9x4,cldt2z1,"A front office can get by without a back office, though they will be less efficient."
t3_2jp9x4,clekeze,"One of the interesting things though is that, generally, lawyers do not marry fork lift operators."
t3_2joctk,cldknl1,"There is also a school of thoughts that when you are experiencing mental health problems like depression your brain chemistry is already out of whack, so using drugs to correct that is just like medicating any other illness."
t3_2jkgzi,cld1es7,"I discovered several new genes, one of which is important to the parasite's motility (and therefore infectivity), and discovered a key missing link in understanding the function of an already very well studied protein... didn't do any science though, according to you."
t3_2jd1e2,clal24g,"So even though you still have to sit through a bunch of ads during commercial breaks, the chances of one of those ads appealing to you are much higher because that sort of evolution was actually needed for advertisement to continue on TV."
t3_2jaiv1,cl9wvir,One thing to note though is that as marijuana use becomes more socially acceptable and legally acceptable it will bring more innovative ways to ingest it that don't have the same smell of unburnt or burnt marijuana.
t3_2jaiv1,cl9wvir,Do you what these people have done even though they make up the medical marijuana industry that you support?
t3_2j7gwy,cl96wx9,"Looking at your first link, OP didn't necessarily participate a lot, but every time they did participate it was to acknowledge a good point, and overall they thanked the group for providing a lot of useful ideas for clarifying what he thought (and indeed, he agreed eventually that giving to charities that supported the homeless was a better idea than giving to the homeless themselves, which is a significant change in viewpoint)."
t3_2j3b5u,cl82avy,Therefore the problem partially lies with your thought patterns/behaviors/habits.
t3_2j3b5u,cl82avy,This is a common thought pattern/behavior for many conditions that people get stuck in.
t3_2j3b5u,cl82avy,"You want to change, but only in the most limited of fashion....which won't ever be enough to motivate you to breakthrough entrenched thought patterns and the apparent acceptance of your sickness on your part."
t3_2j3b5u,cl89ycu,"Have you ever thought that the by purging you are, indeed, further developing your tendency towards ""overeating""?"
t3_2j28la,cl7ri4n,"One thing that's worth noting, though, is that having a military is not just as socialist as universal healthcare."
t3_2j28la,cl81bji,Military defense is a fundamentally different type of public good though...
t3_2j196u,cl7nh5y,"It sounds to me as though you have a somewhat misinformed understanding about what feminists mean when they use the term ""rape culture""."
t3_2izt1m,cl7sekd,I thought the US liked that kind of thing.
t3_2iwveo,cl6b8u3,They will never have a conscious thought again.
t3_2iwveo,cl6b8u3,"I would be against destroying the machine keeping the artificial brain alive though, because that's a thinking, conscious being, and that's akin to murder."
t3_2iwveo,cl800qa,"It proposes that there exists a fuzzy line between ""non-human"" bundles of growing cells and ""human cells"" with the bare minimum capacity for thought on human levels."
t3_2iwveo,cl800qa,"He thought that perhaps the signs of being able to dream, or better yet brain activity in abstract thought processing areas of the fetal brain served as a good guideline."
t3_2iu5ia,cl5lqxl,What if all the people in the north thought the same as me?
t3_2iu5ia,cl8r2er,"""Good"" is man functioning as though he would in a state of nature, and ""bad"" is any sort of deviation from that point."
t3_2iu5ia,cl8r2er,"This is because we not only have the right to speak, but the right to be exposed to outside ideas we don't agree with, to challenge the ones we to ( kinda paraphrasing hitchens here, but i won't be saying it as well as he did) so the ""bad"" is not the holocaust denier which many feel is bad, but the restricting of that thought to exist."
t3_2iu5ia,cl8r5p5,"( i did support him, not because i believed 100% of what he said though, I had many disagreements with his platform, but it was the lesser of evils i suppose.)"
t3_2iu5ia,cl8r5p5,Certainly there is a social one though.
t3_2irrk7,cl4wdvv,"More importantly though, the idea won't have the effect you want."
t3_2irrk7,cl4y7m2,"You can't impose this with legal force (regulating the thoughts and beliefs of others isn't possible), so it is worthless as a legal proposition."
t3_2irrk7,cl4y7m2,"Isn't it nobler to treat them equally, even though you are different?"
t3_2inzpj,cl3wpb9,Although a tall person crammed into a driver's seat has limitations too.
t3_2ilnf9,cl4i0sr,"Yup, that's the delta, though I dunno if it works when you quote it as you did (maybe it does?)."
t3_2il5rb,cl3468o,"I don't blame Reddit for distracting me from my work, even though it's readily available."
t3_2il5rb,cl38jy7,"I don't expect you to be convinced though, so in the spirit of a CMV, I'll try to convince you now."
t3_2ia3iy,cl0pza8,"I know some people who got their jollies off of a huge courseload and multiple degrees, and never regretted it (though none went all the way to 4 degrees)."
t3_2ia3iy,cl0pza8,"But a certain subset of people thought they were going to feel fulfilled after getting multiple degrees, but a while after graduation, didn't feel fulfilled, especially among engineering/pure sciences students, who often go on into further education."
t3_2i6wcg,ckzjivu,This is not the real world though.
t3_2i6l9n,ckzcg4f,"Many people have covered the idea that you can't judge someone else's finances, so I'm not going to go into that even though it is key here."
t3_2i17u3,ckxvexx,"You let them go, even though you love them, because their happiness is more important than your happiness."
t3_2i0v1l,ckxu8a4,But it doesn't seem like you're treating time as a valuable resource that you have to allocate carefully: you're acting as though you have unlimited amounts of time to squander on your professional goals.
t3_2hxjbt,ckx4axr,"The Four Horsemen and Horsewoman generally defined atheism as being without belief, although Hitchens and HArris were particular fans of New Atheism, which wrapped rationalism and skepticism into the mix with atheism."
t3_2hiuav,ckt28ag,"Imagine using iOS or Android on your desktop, and tell me that Apple would benefit from switching from OSX to iOS for their operating system on a Mac Pro (even though you don't like Mac) Second EDIT: These two things are mutually inclusive; Windows 8 does not exist in a vacuum."
t3_2hcsbm,ckrirh7,"In terms of athleticism, everyone knows how exhausting it is to box (some professional boxers burn more calories than a professional footballer per hour (although this is more debatable))."
t3_2hcsbm,ckrm2w9,"As an aside though, it seems that Football coaches are URL While the game might be strategic, if the coaches play an orthodox style, and ignore the subtle strategy, what good is the game having strategic depth in the first place?"
t3_2hcri1,ckrjgy3,":p Because even though your edit is right, your initial view still makes a point."
t3_2hcri1,ckrjgy3,"Even though its morally wrong to deliberately and significantly fuck someone else up with your laziness, you could still be unproductive to society without that happening."
t3_2h86d3,ckqarz7,I never thought that I would stay in the house that I own for more than a couple of years.
t3_2h0jzj,ckoe0hf,"You're talking about thought policing, making it illegal to believe a certain thing."
t3_2h0jzj,ckoe0hf,You make outrageously bold claims you don't back up and suggest we should institute a thought police to control peoples beliefs.
t3_2gy3lp,cknkn44,"This is one of those things that I don't care what other peoples opinions are, if I get pregnant and the thought of going through a pregnancy and birth disgust me, and I absolutely do not want to do it, I wont."
t3_2gy3lp,cknolpq,"If I went out and had unprotected sex, though, that does not mean I consent to pregnancy."
t3_2gutfw,ckmsso5,"I've been mistaken for all sorts of things, though typically people think I'm latino or middle eastern (I'm neither)."
