thread_id,comment_id,context
t3_2a71ap,t3_2a71ap,"Don't fret though, the coca-cola adds flavor to the cake without overpowering it, but the buttermilk really brings out the flavor of the other ingredients."
t3_2a71ap,t3_2a71ap,"I've downed about 1/3 of a full spice cake after eating a meal, and though I was full, I was the happiest guy in the room (mostly because everyone else only got to split 2/3's of this delightful concoction)."
t3_29twg4,t3_29twg4,We allow cheese burgers even though obesity is a huge issue because the liberty of being able to eat them is worth more to society than the health benefits from banning them.
t3_29thke,t3_29thke,"In the real world though, there are some issues... 1."
t3_29pjwk,t3_29pjwk,"well, you have to draw the line somewhere, it's not appeal to authority in the same sense or in anywhere near the same capacity that ""appeal to authority"" as a logical fallacy is meant to be understood ""appeal to authority"" is more along the lines of ""bob is a mechanic and he says I need new blinker fluid"" - wheras inductive reasoning is more along the lines of ""thousands of scientists, myself included, have attempted this well documented and replicable experiement procedure and most of us, but not all have observed the same results"" pick your side, pick your battles - just because 1% of people saw apples fall up, even if they really aren't lying, doesn't mean that really changes the fundamental fact that most of the time you and everyone else notice that apples generally fall down you can't completely eliminate cognitive bias, but with the scientific method we can get about as close as possible to doing so and about as close as possible to a present time understanding of the truth having beliefs, that are based on the best available current evidence, that are open to change when presented with compelling new evidence, is about as much as you can do if you want to call that appeal to authority, then ok, but you've gotta draw the line somewhere as to who to believe and when, and peer reviewed science, though not infallible, is about as close to the best option a person has"
t3_29n4wo,t3_29n4wo,"It's still quite socially taboo, and though I'll probably take heat for this, I tend to notice most people are far more accepting of gays/lesbians/whatever than they are of polyamorous people."
t3_29koa9,t3_29koa9,"There are plenty of shots on goal, even though most of them are saved."
t3_29koa9,t3_29koa9,"It really isn't random, though."
t3_28yh06,t3_28yh06,Maybe Taker wanted to lose to a legit fighter (even though it was a WWE match).
t3_28xbw7,t3_28xbw7,"As it stands though, there is little transparency in this sector, so when someone finds out something like: Highest CEO Salary: Zarin Mehta, New York Philharmonic Compensation (2008): $2,649,540 At the top of the list is Zarin Mehta, president of the New York Philharmonic."
t3_28k1k9,t3_28k1k9,"The only things that keep the situation now from resembling what you describe (though I think we're as close a practically possible to what you describe with the current system) are the upswing of federal power, the general incompetence of present state governments and heavy gerrymandering of electoral districts."
t3_28at68,t3_28at68,"I'm not an expert though to be honest, so maybe there is an explanation."
t3_281bde,t3_281bde,"It's not sacrificing your career though, it's only sacrificing this particular job and switching your career onto a new track."
t3_27r91j,t3_27r91j,"Even though a friend of mine routinely told me ""you stink"" every time we hugged, I always thought he was referring to a small effect."
t3_27hf7o,t3_27hf7o,"Should they all be compensated evenly, even though some of them obviously lost more than others?"
t3_27hf7o,t3_27hf7o,"If not though, then how do we decide?"
t3_27gnxb,t3_27gnxb,"Even though many have read the Hobbit, I doubt they are likely to pick it up on a regular basis."
t3_27dypa,t3_27dypa,"If Jessie sees Jamie fall and hit their head on a rock - let's say for the sake of argument that Jessie knows Jamie has a concussion - then proceeds to have sex with Jamie even though they know Jamie would never consent to it otherwise, that's rape."
t3_277y4m,t3_277y4m,I do think we should restrict their speech when it comes to ballot initiatives though.
t3_2766rt,t3_2766rt,"Like a lot of problems in Christian theology, though, it is usually dismissed by the faithful with some kind of appeal to faith - usually something like ""I believe in a good god, and part of my faith in God is the faith that what He does is Good and doing what he commands is therefore Good - to question his work would lack faith in his goodness."""
t3_274620,t3_274620,"People there honestly aren't that in favor of Obama per se, just opposed to Obama-bashing, as though he were the source of all problems in the U.S. government."
t3_273kmd,t3_273kmd,None of this really changed my view though.. it was exposure to people within casual drug culture that did.
t3_26z994,t3_26z994,"Now, though, I can keep a cool head when I'm terrified."
t3_26rjpu,t3_26rjpu,"Wouldn't all cars, buses and trucks on the road have to be self driving cars for safety to be vastly improved though?"
t3_26rjpu,t3_26rjpu,"You might have a few though for services like hotel shuttles, etc."
t3_26nayb,t3_26nayb,"I'm wondering, though, if you want us to change your view on what misogynistic behavior is or to change your view that your behavior is justifiably off-putting to women?"
t3_26klj1,t3_26klj1,All these causes though can be undone with effort and time.
t3_26klj1,t3_26klj1,These types of people can be worked around though.
t3_26klj1,t3_26klj1,"They did managed to achieve that goal though, and pretty quickly, because they kept working at it."
t3_26klj1,t3_26klj1,"I would like to address what you say here though: Likewise, if you happen to be born into an abusive or toxic family, it's very likely that you will suffer psychological and personality disorders that will prevent you from ever being able to form healthy relationships."
t3_26klj1,t3_26klj1,My point is fairly specific though; just because someone experienced truama in their family does not necessarily mean that it will be reflected in their own parenting style.
t3_26chd9,t3_26chd9,"More often than not though (at least in my experience, which is limited), the other party just doesn't listen."
t3_26chd9,t3_26chd9,"With regard to the media though, yes."
t3_26chd9,t3_26chd9,"I don't know whether this is the fault of the economists though, or of the media."
t3_26b1l1,t3_26b1l1,"It isn't biologically or intrinsically real (even though we tried to find its 'location' so to speak) and it shouldn't matter, but thanks to the actions of the past (and present) it continues to be real."
t3_264xi6,t3_264xi6,It's the most time-consuming job (though there's an argument there).
t3_264iek,t3_264iek,"The word ""honorary"" basically means ""fake"", though with a very positive connotation."
t3_26388i,t3_26388i,"Finally, if caught they are sent though the legal system which wastes even more of their money and, if jailed, lessens their prospects as a productive member of society, putting them deeper into the hole."
t3_25x7qp,t3_25x7qp,"Even though you don't personally understand how people can feel that way about sex, the fact is that people DO feel that way, and you should not label their activities and feelings as immoral simply because you don't understand them."
t3_25ttah,t3_25ttah,There are times we have sex and I feel as though it's more conversational in that I am relaying how my feelings in a way I could not with words.
t3_25k2ud,t3_25k2ud,"Crash won an Oscar over Brokeback Mountain (though it grossed significantly less) despite (or perhaps because of) heavy-handed, saccharine moralizing."
t3_25gqr3,t3_25gqr3,This would necessarily require a violation of the 2nd law of Thermodynamics (though admittedly the conditions of pre-big-bang universe have not been replicated in the lab).
t3_25e9jx,t3_25e9jx,"Even though he is an avid hunter, he has no interest in killing the beast until he understands that he is a rival for Belle's affection (and until after the plot to have Maurice committed has begun to fail)."
t3_255qch,t3_255qch,"My reasoning is that the amount of time I'd save is less than 30 seconds, and the maximum penalty (either being hit by a car or getting a ticket), though rare, is too high to justify such a small amount of time saved."
t3_255hmb,t3_255hmb,I wouldn't do it because you are scared of your own genes though.
t3_254zub,t3_254zub,"The thing about burger shops is you'll actually find that most, though not all, localities do have rules regarding congestion and distance between buildings, not so much as to the purpose (though there are some contracts like with stores in Malls, or Universities where that has been negotiated), but to the existence?"
t3_24v4li,t3_24v4li,"But I do think it's possible, though difficult, to remove oneself (almost) entirely from the deaths of animals."
t3_24v147,t3_24v147,"They viewed their actions as normal (and not rude, though it was rude to do so)."
t3_24v147,t3_24v147,"Thank you for taking the time to read the post, though."
t3_24sel2,t3_24sel2,People do not generally get into the arts because they love money though.
t3_24sel2,t3_24sel2,"They often realize this mistake though, and supposedly dead forms sometimes re-emerge."
t3_24sb0f,t3_24sb0f,"Below this you can drive legally, even though you've been exposed to alcohol/have it in your system."
t3_24mzo8,t3_24mzo8,That's beside the point though.
t3_24dj00,t3_24dj00,"Now that word does carry a certain air of disgust, even though it's definition simply means ""unusual"" or ""uncommon""."
t3_24dj00,t3_24dj00,"To answer your main question, though, there's not really a need for cis in general conversation."
t3_2480nm,t3_2480nm,"People also love other Disney films and I wouldn't say for example that Alladin is overrated event though I prefer the Lion King myself (not by a great distance, but still)."
t3_245y6b,t3_245y6b,"I definitely agree mobile speeds will increase, though."
t3_245y6b,t3_245y6b,"Providing a lot of data like a mainstream ISP would, though, is very unlikely to happen."
t3_24509o,t3_24509o,"The United Nations, though sometimes ineffective, is yet another point preventing wars."
t3_23xw5n,t3_23xw5n,":)); I consider myself fortunate, reasonably, though not wealthy by American standards (I have a car made in a post-2010 year, albeit a Fiesta.)"
t3_23xw5n,t3_23xw5n,"That's not really hate, though."
t3_23r9b4,t3_23r9b4,"Coercion, though, that seems like something that shouldn't affect your viewpoint, even if it affects your actions."
t3_23o885,t3_23o885,"The only way the U.S. would ever have the political will to get rid of the military would be if every other country in the world did the same first, and even then, I doubt we would decide to do that, though we would probably make significant cuts to military funding."
t3_23o885,t3_23o885,"At least among the political scientists I've read, it's basically a universally accepted fact that U.S. military dominance is a stabilizing/pacifying influence in the Western Hemisphere, though to be fair all of them are American political scientists."
t3_23o885,t3_23o885,"We didn't go to all-out war, though; instead, we reinstalled the Shah through a coup d'etat, and used him for our own interests."
t3_23o885,t3_23o885,"Even though some right-wingers still say that war wasn't about oil, members of the U.S. government all the way up to Secretary of Defense Chuck Hagel have admitted that gaining U.S. oil companies access to Iraq's oil was mostly why we went in."
t3_23litg,t3_23litg,"Even though they're not the kind of people I'd call at every major life event, I've greatly enjoyed being able to see them again."
t3_23fvx5,t3_23fvx5,"Okay, even though Asian men may indeed have smaller penises, penis size is a trait carried on the Y-chromosome, meaning that only males have the genes for it."
t3_2360o1,t3_2360o1,"You can increase them even more with blood doping and steroids, though this also increases the risk of DQ."
t3_2360o1,t3_2360o1,"No matter what you do or don't do, though, 9 people are going to lose that race."
t3_22s6od,t3_22s6od,"I would never consider those games RPGs, though, because they fit better into the FPS category."
t3_22rciz,t3_22rciz,"This feedback system is often broken, though, because you won't always see the consequences."
t3_22rciz,t3_22rciz,Even though both speakers are referring to the exact same reality .
t3_22p8vc,t3_22p8vc,Further (though my knowledge of genetics is admittedly limited) I believe the scientific consensus is that genetics (nature) tend to have more bearing on individual behavior than social context or upbringing (nurture).
t3_22jhn2,t3_22jhn2,"It is ""fair"" in the sense that a lion chasing a gazelle is ""fair""; the gazelle is not liable to kill the lion (though it does happen occasionally), but the gazelle has more of a chance to outrun the lion than it would if the lion were using a 12 gauge."
t3_22itbs,t3_22itbs,"If we can't reject absentee ownership and we continue to accept ideas like rent as being legitimate, I think the conditions would exist for a state-like entity to come about again (though it might look radically different from previous conceptions of the state, and could look completely unique from a question of formation and execution of state-policies)."
t3_22blk8,t3_22blk8,That's not why governments exist in capitalist societies though.
t3_22akzj,t3_22akzj,"The main problem, though, is education in this country is getting less and less funding with more and more student debt -- I think we should adopt a European style, where college is free and taxpayers foot the bill."
t3_22akzj,t3_22akzj,"Even if we were to enact this magical solution tomorrow, though, there'd still be the massive number of people out there right now who can't get a highly-skilled job because they aren't educated."
t3_225qcm,t3_225qcm,UKIP (much though I disagree with their policies!)
t3_21w3iu,t3_21w3iu,"The quote seems to be pretty much in line with your thoughts, but mostly the argument underlying it shows that the two are intertwined in a way that neither can be though of as more or less important."
t3_21w3iu,t3_21w3iu,If you can stomach my delta-whoring one moment though...
t3_21rsdj,t3_21rsdj,"I'd argue that certain types of stimulus and enjoyment/escapism are only attainable through books, though- I wonder, do you agree with that, and that you're missing out on something due to the fact that you don't enjoy reading, or do you disagree?"
t3_21rsdj,t3_21rsdj,"Next- I focus mostly on fiction here, because that's what I get the most value from, though I'd imagine that my pleasure from reading fiction could be derived from any number of nonfiction books by other people."
t3_21pkk6,t3_21pkk6,"Progress though, that's a bit of a stickier question."
t3_21hpd2,t3_21hpd2,"In the experiments I mentioned, the dogs eventually resigned themselves to the situation; even though they still had energy they stopped trying to escape."
t3_21hpd2,t3_21hpd2,"As I said though, this is all my view, and it is clearly different from many others."
t3_21g6jy,t3_21g6jy,"The problem, though, isn't with communism or Marxist ideology necessarily, but with the idea of violent revolution and the men who usually end up leading such a revolution."
t3_21ea18,t3_21ea18,"I am still ltrying to find this fucking youtube video though, and it's bothering me."
t3_219hvy,t3_219hvy,I would like to say this though.
t3_219hvy,t3_219hvy,"That, I will agree, is for the most part really pretentious (unless their dad played it for them as a kid, and died, it the player reminds them or him or something...that's usually not the case though)."
t3_219hll,t3_219hll,"It's actually impressive that they've managed to grow into such a big country from where they started, and they've arguably managed to expand their empire less genocidally than the British (though that's not a high bar)."
t3_219hll,t3_219hll,"Overall, Russia's influence on literature and theatre has been massive, probably only second to England (though it's concentrated on a fewer key authors), and those authors have had a much wider influence beyond those spheres (Dostoevsky alone had a singnificant influence on people like Freud, Nietzsche, etc.)."
t3_218cay,t3_218cay,"This night, though, she was blackout drunk, as far as I could tell, and she wanted to hook up with me."
t3_218cay,t3_218cay,"I could tell the message and embarrassment of me saying that to her, though, got through to her."
t3_218cay,t3_218cay,"Here's a less clear cut case, though, in an incoming comment... ------------------- EDIT: --- Only edit I'm gonna make, and the only response I'm gonna give under this account name."
t3_217z08,t3_217z08,"We still haven't addressed the issue of the cost of maternity, though."
t3_2174z5,t3_2174z5,"People who participate voluntarily in gendering themselves will keep those associations alive, though i'm certain they'll evolve and eventually be unrecognizable."
t3_20ow06,t3_20ow06,"You're still mistaken, though."
t3_20o1bq,t3_20o1bq,Usually this is okay :-) You can ask the mods if you want though.
t3_20ndjd,t3_20ndjd,"Can you provide any actual evidence in support of that view, though?"
t3_20madh,t3_20madh,"Previously though, astronauts from Canada, Germany, France, Italy, Belgium, the Netherlands, Sweden, Brazil, Malaysia, South Africa, South Korea and Spain have been on board."
t3_20madh,t3_20madh,"More importantly though, the argument can always be made that ""Programme X"" should be cut so that we can spend more on Education or Healthcare."
t3_20madh,t3_20madh,"Why though, does the success of one impact the other?"
t3_20krmr,t3_20krmr,"The problem I have with the anti-smoking lobby is that they lumped all of it in together as one dangerous mess, and pure tobacco is a lot less dangerous than cigarettes (though there is still some tar, etc.)."
t3_20evic,t3_20evic,"I haven't seen any research on the price stability of cigarette butts, though I'd be willing to bet it fluctuates wildly."
t3_20er8m,t3_20er8m,"Not to mention the consequences of meat processing and transportation, though that may not be strictly relevant."
t3_20bc4h,t3_20bc4h,You think that they are good people even though they have issues.
t3_208uz9,t3_208uz9,It's about accountability though.
t3_2067hy,t3_2067hy,"I won't claim they're my all time favorite instrument (that honor goes to bagpipes, if you'd like to consider a real ""egomaniacal contrarian"" choice), but Philip Glass really changed how I hear saxes, even though they're alone here and not harmonizing with other instruments like you requested, but if you learn to like them by themselves maybe you can translate that to jazz."
t3_1zyxf5,t3_1zyxf5,"What they didn't know at the time (but found out after the Cold War) is that the Cubans, at least, were perfectly willing to use nuclear weapons even though the Soviets were not."
t3_1zs621,t3_1zs621,"You correctly noted points 1 and 3 (though I'd say closer to the 18th century than the 19th, with portions occurring even earlier), but didn't address points 2 and 4."
t3_1zs621,t3_1zs621,"Up until pretty recently, even though most people were literate they didn't do much writing."
t3_1zje7a,t3_1zje7a,"We don't have to have a background check to drink alcohol, even though we know some people shouldn't drink."
t3_1zj8am,t3_1zj8am,"I can say with absolute certainty, though to your original point: If I ever feel threatened enough to fire a gun at another person, I'm not worried about them."
t3_1zdgxp,t3_1zdgxp,There is not comparison even though they are technically the same product.
t3_1yzk2r,t3_1yzk2r,"Even though he was on suicide watch (he mentioned having suicidal thoughts), so long as he wasn't actually in the act, they weren't going to force medication."
t3_1yst0y,t3_1yst0y,"I don't really think that that, in particular, is a cause for he current problems in society, though."
t3_1ysjvs,t3_1ysjvs,"These are all things representative to his time period, though."
t3_1yoc2s,t3_1yoc2s,"(a), since there can be information reasonably inferred, though it isn't the most reliable of information."
t3_1yf0hw,t3_1yf0hw,"Sometimes though it takes a few pages to build up to those epic lines, dialog and scenes that we all remember In the book."
t3_1yc8z3,t3_1yc8z3,"It's my understanding that such a code exists, though I'm not aware of the extent to which this tenet is strictly adhered to."
t3_1yc8x2,t3_1yc8x2,"I think you should dismiss these views because they're arrived at though needs that have to do with emotion and identity and belonging, not function or experience or deliberate, focused study."
t3_1y8r7h,t3_1y8r7h,"What I think you are getting at though, is when people judge others based on a lack of information that lead up to some marginal action."
t3_1y8e6p,t3_1y8e6p,"Even though many people (including myself) dislike this genre of art (personally I find it to be low effort), it's not like you can say that it doesn't fit the definition of art."
t3_1y5jpe,t3_1y5jpe,"Gotta say that even though I oppose the death penalty, I'd be a lot quicker to pull the switch on scum like that than someone who, say, planned the murder of his wife's lover."
t3_1y0z80,t3_1y0z80,"This changed a few years later, and we now have very specific speed limits, though it still took a few years before we had a state-wide prohibition on driving with an open container of alcohol."
t3_1xwomv,t3_1xwomv,"Remember also that every scientific field begins with personal opinion and conjecture; it's only upon performing the boring studies and such that it become Science with a capital S. Our understanding of gravity started when Newton (anecdotally, though not actually) had an apple fall on his head and thought ""something made that apple fall"", leading to ""I wonder if there is a force that attracts things to each other"", leading to scientific research to verify this conjecture, and now several hundred years later, we have a very refined understanding of the gravitational force."
t3_1xwb0k,t3_1xwb0k,I though it wasn't worth your time to spend hours learning the commands?
t3_1xti2t,t3_1xti2t,"A few years ago though there was a MLB player who did rant about the treatment of Black-Americans compared to Black-Hispanics, so I can't speak about what's going on within the organization itself and how Black-American players feel or are being treated."
t3_1xrors,t3_1xrors,"Unfortunately though, decimal numbers are not unique, since the infinite sum 9/10+9/100+9/1000...=1."
t3_1xqnjx,t3_1xqnjx,"Also, you might have noticed that I excluded the use of cellphones in this because in my experience students don't necessarily use cellphones for educational purposes in class but rather to distract themselves (even though they can be used for almost anything a tablet can be used for)."
t3_1xqloo,t3_1xqloo,"I've gotta say though I think I've just achieved a wall of text here, I totally agree in pretty much every way with your statement beyond the absolutist position of NEVER hold a belief so firm that your mind cannot be changed."
t3_1xqbkw,t3_1xqbkw,"This might naturally cause you a lot of distress since people are going to treat you differently, even though you're just like them on the inside."
t3_1xny71,t3_1xny71,Even the first lesbian kiss they overtly insisted that it was really a former man and a former woman kissing and not two women even though physically it was two women.
t3_1x44be,t3_1x44be,It's actually true though.
t3_1x3quk,t3_1x3quk,"Thus, that picture of a girl's ass filling up most of your front page as you scroll down the page is representative of what makes reddit a beautiful, magical place: that things are shared out of kindness and upvoted with goodwill, and even though we may not agree with everyone on the site, even though we might despise a lot of the content, we know that we're mostly just decent people who are looking to enjoy ourselves for a little while on the internet, and we're not going to spoil some arbitrary rules about what is acceptable in polite company ruin our good time."
t3_1wvouv,t3_1wvouv,"I have yet to find a use for the Menu key, though."
t3_1wu9bx,t3_1wu9bx,"It may not be that far fetched, though, with all the potential ludology has."
t3_1wqdpz,t3_1wqdpz,I don't think this is what redditors actually believe though.
t3_1wjggc,t3_1wjggc,"To my understanding, that's enough to classify it as a disorder (though I dislike the negative connotations that disorder has)."
t3_1wi4dg,t3_1wi4dg,Paula Deen was plenty nice to African-Americans even though she was secretly a massive racist the entire time.
t3_1we3gg,t3_1we3gg,"It doesn't present the same in everyone, though everyone has the same mutation."
t3_1we3gg,t3_1we3gg,Even though I am one of those children.
t3_1we3gg,t3_1we3gg,"The issue though, is that this is a many layered process, which first starts with, what is the rate of transmission of the gene."
t3_1we3gg,t3_1we3gg,"Even though I have been fortunate enough to never have had cancer, you might have a statistically better genetic profile than I do."
t3_1wd6jq,t3_1wd6jq,"Now, one could say that even though we don't know the initial conditions, there have been set in stone and that's what they are."
t3_1w99ax,t3_1w99ax,"For me, I wouldn't protest though."
t3_1w91jl,t3_1w91jl,"This could be a derivative of the self-defense required when being tread upon by every other segment of society, though I'm not certain when it comes to this."
t3_1w6uhl,t3_1w6uhl,"When you think about the specific situations in which many couples find themselves, though, those arguments become clear."
