thread_id,comment_id,context
t3_2rnr30,cnhlmdo,URL was far more situational that would align with the OP's train of thought.
t3_2rmy6e,cnhmkxc,"Simply providing new modes of thought and analysis can alter the way you see everything else in the world, and in that sense, philosophy can actually be more transformative and helpful than any other subject."
t3_2rmy6e,cnhmkxc,"Simply providing new modes of thought and analysis can alter the way you see everything else in the world, and in that sense, philosophy can actually be more transformative and helpful than any other subject."
t3_2rk7my,cngpiso,"You have a strange definition of ""risky""; while it's true a mistake can cost you your life, they often don't (cars have been getting safer since the 1920s) and the fact is that because so many people spend so much time driving, we are better at it than a lot of other things and so are much more likely to not make those mistakes (though, sadly, they do happen)."
t3_2rawgb,cnerfm7,"After a night of drinking even on reddit, I check my comments and prune them accordingly even though I only have a handful of friends that know who I really am."
t3_2r0eyf,cnb8f1r,"When I make a choice, I perceive the thought process that leads to it, and I recognise it as my own."
t3_2qncj3,cn7wgim,"), although you might be moved around a bit during those 5 years too, there's no guarantee you'll actually be able to see the world."
t3_2qmhw7,cn7kwnd,"But it is weakness to post pictures, or weakness to decide that you are too ashamed or worried about consequences to post pictures, even though you want to?"
t3_2qia6o,cn6ot0g,"Even if ""networking"" is just the employer telling the applicant about the existence of a job opening that they think would be a good fit has huge effects, without any kind of ""short list"" stuff (although at this point if they stop there, the company is probably knowingly wasting a ton of time and money with their ""weed out"" process on a candidate that they already are pretty sure will at least get an interview)."
t3_2qia6o,cn6ot0g,"Although you talk about the cliche schmoozing at networking events style stuff, in my experience real world networking is one of the purest forms of meritocracies out there, as its based very directly on real world performance."
t3_2qia6o,cn7hii7,That wasn't what I meant though (although that sort of thing does happen and is blatant discrimination).
t3_2qc1rl,cn50cq3,"Which brings me to this point - as you eliminate extremist thoughts, more and more moderate thought begins to be extreme."
t3_2qc1rl,cn50cq3,"Which brings me to this point - as you eliminate extremist thoughts, more and more moderate thought begins to be extreme."
t3_2q9fkx,cn4ebjb,"They didn't need to change the fundamental way everybody had gotten used to reckoning the passage of time, though, in order to achieve this end."
t3_2q6k6o,cn3ddwl,"Your confirmation bias is that, although someone else here has gotten you to talk about your womanizer friend who is easily as shitty as these women, it hasn't begun the process of changing your view about shitty adult-children being a gendered problem (or maybe it has?)."
t3_2q5zwb,cn37hc6,"I'm puzzled why you consider her ""seemingly minor"" while you don't seem to have a problem considering Mako an important character, even though his season 4 arc was pretty much a glorified baby sitting job for Prince Wu."
t3_2q5zwb,cn3966e,"If there were more on this, I'd certainly watch it, but I thought I got more than enough closure in these areas."
t3_2q5zwb,cn3966e,"Specifically, they thought about it during season one, and then started seriously planning for it and laying the groundwork by the beginning of season 3."
t3_2q4trg,cn2x9e7,"I think this deserves some amount of ""heat of the moment"" consideration, even though for most people it would be completely unshocking or even hard to understand (""SO's an atheist, so?"
t3_2q388d,cn2pyft,But just for a thought experiment: What if torture did work?
t3_2q388d,cn2pyft,But just for a thought experiment: What if torture did work?
t3_2q388d,cn2pyft,But just for a thought experiment: What if torture did work?
t3_2q2cxc,cn2g775,"All of these, though (and, I believe, any other way that humans could survive heat death), rely on physics that we don't understand well enough today to say that we know it's possible."
t3_2pxql9,cn1a1iu,We'd have to accept that in your premise that it is okay to pirate because: Even though you may willfully believe that you are compensating the developers purely for a vaguely similar value of the product; that is not what is happening in reality.
t3_2pp7pp,cmyxcrc,"The spam filter can be switched off by mods at their own discretion, though, and even those posts/comments which are removed by the filter show up in the mod-queue or spam-trap where mods can manually approve them."
t3_2p82u7,cmufwkg,It seems you're saying the moral evaluation of a person or action is merely the degree to which they've thought about their actions and to which their actions align with their thinking.
t3_2p82u7,cmufwkg,It would almost excuse any action by the way a person 'thought' about it.
t3_2p0lop,cms9kt1,Put in office by people who thought he was the best available person for the position.
t3_2ottrr,cmqnqbl,----- There are some good arguments though.
t3_2ottrr,cmqonl1,it's a thought dear to my heart
t3_2ottrr,cmqnqbl,----- There are some good arguments though.
t3_2ottrr,cmqonl1,it's a thought dear to my heart
t3_2orvv0,cmq18ik,"The other aspect is that ancient Greece is considered to be an advanced society and a civilized culture, and the point there is to suggest that homosexuality isn't something that dooms a culture to fail, when it was accepted in one of the most powerful cultures in history (although I don't think this is a good argument)."
t3_2orfda,cmpxkl7,"It can get tricky, though."
t3_2okad4,cmoaise,Even though the parents spend little time on the page I felt they were spot on in every nuanced detail.
t3_2oihml,cmnioce,"though they may not morally in the wrong, it's quite ""shitty"" for C to ""backstab"" A. unless A may be potentially dangerous to B (e.g."
t3_2oihml,cmnj7aa,EDIT: i understand why you can't agree with it though.
t3_2o66aa,cmkb48q,"There are two flaws in this particular example, though I won't necessarily disagree with the basic concept."
t3_2nz6pz,cmicb4z,"Can't really TL;DR this, and i threw together a lot of thoughts without really editing my post well, but the point is, humans have been having kids since forever with uncertain futures, this isn't any different."
t3_2nxt7j,cmi1f55,"Again though, I want to reiterate that defense of property is not, legally, morally or otherwise, justification for ending a human life."
t3_2nvxqw,cmhezg8,"You don't know it would last, though."
t3_2nokg9,cmfgdsv,"Also your argument on other's 'rely' on anyone for safety, is a very one sided thought."
t3_2nid9k,cmdv5rc,In another time and place it might be good though because the audience's expectations changes.
t3_2nid9k,cmdv5rc,I'm no expert though.
t3_2nfgyu,cmdb9q0,I still don't think that's reason enough to not have body cams but it was a different cop's perspective that I had not thought of.
t3_2nccrb,cmcd35f,"We have since grown apart (although I do still talk with her and see her occasionally), but from my experience it is absolutely possible to be best friends with someone from the opposite sex."
t3_2n900k,cmld565,"https://en.wikipedia.org/wiki/Legal_fiction#Corporate_personhood Basically, the government treats corporations as people, even though that's not logical (but the government controls the court system, so legally they're people) I'd like to challenge your belief that a company can become a monopoly by cutting prices way below profit for an extended period of time and recover enough afterward to keep all other potential competitors out."
t3_2n8psp,cmbzbs2,"I committed to somebody because I thought I wouldn't do any better, and I was a bit afraid of being alone."
t3_2n8psp,cmbzbs2,And it came along even though I wasn't looking for it.
t3_2n4aay,cma6qfq,"It may be healthy to try to overcome triggers, and would probably help make for a more comfortable, productive life (although 'triggers' could be anything from mild annoyance at a smell that reminds you of your ex to suicidal thoughts), but there's still no obligation towards overcoming it."
t3_2mv3n4,cm82ay0,even though it really does not read like a rape account.
t3_2lzhcj,clzoxqm,"Even though I'm not obligated to wish them a happy birthday, I like to do it anyways."
t3_2lxha7,clz6u94,Have you thought about how bad that would actually feel?
t3_2lxha7,clz6u94,Have you thought about how bad that would actually feel?
t3_2lpxdl,clx2whc,"Technology is fixing problems once thought unfixable, and people are becoming more aware of how what we do can affect the world."
t3_2ldxdq,clutbcc,"Good for you in the long run cause most likely you two have reached that peak in the relationship and if she can't accept who you are, does that mean she didn't love you as much as you thought?"
t3_2la4jb,clsu6ks,By making every effort to vote you are getting a better representation of the thoughts and feelings of those who do vote (but would not have otherwise) and a better understanding of those who are actively staying home.
t3_2kypt8,clpzajn,I think though you're focused on the pricing model and missing the larger issue - that it's time for telecoms to be nationalized in the US.
t3_2kuu7n,clp3n3x,"If I want to purchase something for $10 even though it only costed 5 cents to produce, why not allow me?"
t3_2kuu7n,cloyjd8,More money = more better and we gotta look good in our fancy sports cars that can go 250 mph even though the highway speed limit is 55 mph.
t3_2kkqbm,clm9hyb,I'm glad to see you putting so much thought into this issue.
t3_2kkqbm,clm9hyb,"Please remember though, that all of my stated benefits to having children can be gained by helping to raise any children."
t3_2kko3q,clmew0k,They thought it'd be the reemergence of a monarchy style tyranny.
t3_2kko3q,clmew0k,"Think about it though, which do you consider a bigger influence on our system today, corporations and lobbyists and special interest groups, or monarchs?"
t3_2k3k0f,clhnpfj,They aren't mutually exclusive though.
t3_2k3k0f,clhsvqc,"These attitudes are still harmful, even if we have won the same legal rights as men (although paid maternity/paternity leave for both genders would be beneficial for all)."
t3_2k3k0f,clhnpfj,They aren't mutually exclusive though.
t3_2k3k0f,clhsvqc,"These attitudes are still harmful, even if we have won the same legal rights as men (although paid maternity/paternity leave for both genders would be beneficial for all)."
t3_2jpazx,cldtw4w,"Now, perhaps there may be credence to an individual committing these acts for the fame and noteriety (although since many mass shooters die in the attack I don't know how well we could scientifically test state of mind and whether reduced news coverage would actually serve as a catalyst for reduced mass shooting events) and perhaps we can say a media ban of coverage would be best for society as a whole."
t3_2jkgzi,clcw0hv,"The idea is that you are trying reactions you wouldn't have thought of before because, frankly, based on what we know they are kind of silly."
t3_2jk4dx,clclpzw,"It is not why everyone says ""I'm probably to get downvoted for this..."" I can tell you with confidence I've started a comment with this before, and I did it with very little conscious thought other than ""People are probably going to downvote me for this but I'm going to say it anyway."""
t3_2jhdaw,clbr1hn,"So, you're not actually stiffing them, though I'm sure management will question why they don't get tips and eventually discuss with them their poor behavior and habits."
t3_2jgtvo,clbm2rj,I think you're ignoring the other side of it though.
t3_2jaiv1,cl9x4n6,You can function normally (although you shouldn't drive) while on sativa or most other strains.
t3_2j7ldo,cl93ul2,:) My first thought: get off the internet.
t3_2j7ldo,cl93ul2,My second thought: use your new free time to go volunteer somewhere.
t3_2j7gwy,cl9fm82,"So even if the OP doesn't necessarily say, OK I was completely wrong and now I think the complete opposite of what I thought before, the learning/insight that everyone gets from seeing into other people's minds/thinking on various issues is often fun and valuable anyway."
t3_2j3b5u,cl95hhw,I also think your comment about 'failing' is interesting - as though food is a test or exam.
t3_2j3b5u,cl95hhw,I also think your comment about 'failing' is interesting - as though food is a test or exam.
t3_2j3aav,cl849y1,"There are enough protections in law to stop this from being abused to put innocent people in prison, although you would have a good argument that these aren't enforced properly."
t3_2ixatz,cl6g9da,"Okay, after having thought about this for a minor amount of time I believe it to be a complete and utter waste of time- and here are some reasons why."
t3_2ixatz,cl6g9da,"At this point let's bring back in my first reason- we haven't yet found any evidence that intelligent life exists anywhere but here on earth so the likely hood of any aliens coming from a nearby star is incredibly low, otherwise we would have seen evidence of their existence before now- though I do admit it's a bit like trying to find a needle in a haystack, the same odds are against the hopeful invaders."
t3_2irrk7,cl52znp,"Although technically I am Caucasian, on legal documents I always put down that I am Hispanic given the option."
t3_2ir1vh,cl4qfr4,"Even though feminists would describe themselves as egalitarian, if egalitarian is a blanket term that describes both feminists and MRA folks who they strongly disagree with, its not a useful term to distinguish feminists from others who are in practice hold very different views."
t3_2iq68t,cl4g6fr,You are assuming way too much about my thought-process here and putting words in my mouth that aren't supposed to be there.
t3_2i7gey,ckzmgwt,The reclining function wasn't designed with the thought that everyone would have an empty seat behind them.
t3_2i6sq2,ckzpzfm,I disagree that singling out feminists isn't warranted though.
t3_2i4ujn,ckyu5rm,"While Christians have done some pretty terrible things in the past, no Christian denomination has the concept of ""Jihad"" as is common in Islamic thought."
t3_2i0v1l,cky4z54,"The difference between working on your future career 90% of the time versus 100% is very small compared to 0% versus 10%, even though it is the same amount of time."
t3_2i0v1l,cky4z54,"The difference between working on your future career 90% of the time versus 100% is very small compared to 0% versus 10%, even though it is the same amount of time."
t3_2i0v1l,cky4z54,"The difference between working on your future career 90% of the time versus 100% is very small compared to 0% versus 10%, even though it is the same amount of time."
t3_2i0v1l,cky4z54,"The difference between working on your future career 90% of the time versus 100% is very small compared to 0% versus 10%, even though it is the same amount of time."
t3_2htvoe,ckw1v6x,"The younger you start thinking these thoughts, in my opinion, the better; I was in my 20s before a lot of this started to click, and even then I didn't think too hard about it."
t3_2htrl3,ckvy6x4,Not all schools of thought can be grouped under that of rational thinking.
t3_2htrl3,ckvy6x4,Ever watch a movie with a friend and talk about what you both thought of it?
t3_2hr75i,ckv9rr3,"In hiring though, you don't have to deal with hundreds of thousands of people."
t3_2ho91q,ckuhsxy,"If it's the woman's desire to cheat, then her actually cheating on him is irrelevant, since he would have already been hurt by her ""thought crime."""
t3_2ho91q,ckuip0j,"In a sense, though, you're right."
t3_2hfggr,cks5dxq,"Finally, I have an issue with just declaring it, although this is more an issue with men being socialized to pronounce who they want to fuck constantly."
t3_2hevmr,cks21ow,It's certainly not easy though.
t3_2hevmr,cks21ow,"This out of the way, though, I shall now address specific points in the above context."
t3_2hevmr,cks21ow,"If, though, you mean that ""you get exactly these resources, which are identical to those everyone else gets, no more and no less,"" that seems rather counterproductive; this removes the incentive to advance oneself."
t3_2hevmr,cks21ow,"However, what if one of the poorest people in the country was able to receive education, healthcare, and housing, but then lacked the capital to actually patent and start producing this one really brilliant product he thought of?"
t3_2hcsbm,ckrhavj,"It seems like there's still strategizing (though with less time to think about it), and there's still the kinds of skills you mention (except it doesn't sound to me like there's as much specialization in rugby, so these are skills that most of the players have the learn, not just a few of them)."
t3_2h0jzj,ckodwsx,You'd have to institute a thought police gestapo to even come close.
t3_2h0jzj,ckodwsx,You'd have to institute a thought police gestapo to even come close.
t3_2gzyj0,ckok1e7,"Terrorism affected everyone on the streets, even though only 3 people were killed."
t3_2gy3lp,cknzw2g,"I see abortion the same way I see cumming into a tissue, It could be human life if I allowed it too but i'd rather not Your thoughts, opinions, values, beliefs are what make you human."
t3_2gy3lp,cknzw2g,If something shares the same genetics as me but doesn't have any thoughts or feelings than ofc I wont see it as my equal
t3_2gly57,ckkjp8m,"Sometimes this rationale is directly influenced by the idea that it's against the U.S, therefore it's good, although that's not the majority of views."
t3_2gly57,ckkjp8m,"In short, I'll put it this way, if we did trade with them, I could see it being much like Laos, in that you don't see too many naive westerners defending Lao's current system of government, even though they're also socialist."
t3_2gliyk,ckk9cif,I do believe though that once it becomes a viable source of power that a lot of the nuclear scare crowd will disappear.
t3_2ggppl,ckiy8ui,The people who originally designed the data plan thought it was more than enough.
t3_2fwmff,ckdfg3r,"Before we get to that though, let's talk about the setting."
t3_2fwmff,ckdgg9w,"Beyond that though, the ""violation of the contract"" was that she abandoned the family for another man, which went against her wedding vows which makes the divorce her fault."
t3_2fwmff,ckdgg9w,"In hindsight though, maybe I should have left off any children in this scenario because it does make things a little more grey."
t3_2fwmff,ckdgg9w,"These days though, it's much harder to tell what class a person's background in, and even more difficult to tell their earning potential."
t3_2fwmff,ckdijfs,"Let's pretend the courts are fair though, and if the man abandons the house or is unfaithful, that usually does result in him being punished financially at minimum."
t3_2fwmff,ckdijfs,"Actually, I'm not even sure if this applies in law, even though it seems fair, so I can't say that I agree or disagree."
t3_2fw6dg,ckdekcr,"My thoughts and choices affect the world around me, because that's how the universe works."
t3_2fu5da,ckd5eaz,"I've heard it used many times as a shorthand for any sort of behavioral plasticity, even though the people using it obviously understand that it's not conscious."
t3_2fm9q9,ckb1reh,"Even though it may have cost a dollar to make 2AA batteries, how bout we sell it for $4.35 eh?"
t3_2fm9q9,ckb1reh,But lets pretend we don't know this though and put that aside.
t3_2fkhgs,ckahr81,I'm not going to default to wrong pronunciations though.
t3_2fkhgs,ckab7k5,"Even though trying his best to respect its original pronunciation, but maintaining his typical accent when saying it."
t3_2fjsjb,cka49p5,"Strats are seldom used for heavier, high gain metal sounds even though a lot of classic metal guitars seem to have strat like qualities (body design, neck thickness, etc.)"
t3_2fduqy,ck94f1t,Adultery is a property sin against a man who is thought to own his wife.
t3_2fdmwl,ck8io4p,"Being dropped on top of the Everest by a helicopter is not, even though the result is the same."
t3_2fdmwl,ck8aoqa,"His art work was mocked, people thought it was useless, who wants a painting that doesn't look exactly like what we have?"
t3_2fdmwl,ck8aoqa,"Today though, he is considered a genius among some."
t3_2fdmwl,ck8aoqa,"His art work was mocked, people thought it was useless, who wants a painting that doesn't look exactly like what we have?"
t3_2fdmwl,ck8aoqa,"Today though, he is considered a genius among some."
t3_2fdmwl,ck8aoqa,"His art work was mocked, people thought it was useless, who wants a painting that doesn't look exactly like what we have?"
t3_2fdmwl,ck8aoqa,"Today though, he is considered a genius among some."
t3_2fdmwl,ck8aoqa,"His art work was mocked, people thought it was useless, who wants a painting that doesn't look exactly like what we have?"
t3_2fdmwl,ck8aoqa,"Today though, he is considered a genius among some."
t3_2f8s0s,ck7aczu,"I won't go into all the reasons for and against (though I'll mention that poverty rates have stagnated after implementing our ""War on Poverty"", and they were drastically declining prior,) because they are all very complicated, and there are thoughtful voices on both sides of the debate."
t3_2f8s0s,ck7ja0r,Not necessarily (though I do oftentimes lean towards that view.)
t3_2f78ys,ck6wzql,"I too have thought about this same question / statement as you have and I would totally agree with you, except on one point."
t3_2f3w7f,ck68kw6,"The State does have a vested interest in Marriage though, and that is why it provides a legal shortcut for couples who want to register."
t3_2eufa6,ck31m49,"As for manipulation by media, while commercials and other forms of media do use sexuality to promote themselves or affect people's thoughts, asexual people are far from immune to media influence."
t3_2eez7x,cjzgw4v,"Furthermore, stumbling through a series of relationships is a way to gain breadth, though its efficacy can be debated."
t3_2eeedl,cjyy8zl,"That said, though, there a numerous handicaps that don't involve the kind of physical strength that affects prowess at getting in and out of cars, but rather some other limitation, such as ability to walk long distances without having an asthma attack, or arthritis that is exacerbated by lengthy walking."
t3_2eahyl,cjxtave,This is just yet another way though that a song can manage to end at the top of a song rather than the bottom of a song.
t3_2e9s6m,cjxl9tb,It could be a slow progressive change though to allow adaptation.
t3_2e2jug,cjvvj7z,"Fuck me for having my own thoughts, right?"
t3_2dzrhq,cjunss7,You literally wrote down dialog of what you thought he might have said or done.
t3_2dzqgj,cjuorfi,"As a result of our interactions, I will purposefully find someone in the organization who I either know or suspect disagrees with a thought I have or an action I want to take and use them as a backdrop to see if I am able to substantiate my position."
t3_2dw5ig,cjtn850,This is entirely reliant on what lane you were in though.
t3_2dqcyj,cjs2c78,"Even though employees are also often customers of the company they work for, businesses rely on additional customers that get their income from somewhere else."
t3_2dnntx,cjr97o9,Reddit specifically is anti-thought-out content and anti-originality.
t3_2dnntx,cjr97o9,"When I submit a long, good, thought provoking article to one of the defaults, I don't get downvoted."
t3_2dnntx,cjr97o9,"I'll get two or three upvotes, but it won't matter, because by the time someone's read through the article and thought about it and whether it was worth their time and voted on it, the thread has fallen off the first page of /new/ and there's no saving it, while in the same amount of time an image macro has received hundreds of votes""](http://www.reddit.com/r/circlebroke/comments/vqy9y/dear_circlebrokers_what_changes_would_you_make_to/c56x55f) That would be 0, because /r/AdviceAnimals is trash."
t3_2dn3f8,cjrqm60,"We would potentially need additional lighting (although significantly less of it) for certain applications, but it would also mitigate light pollution."
t3_2dn3f8,cjsrqrl,"Although your argument is essentially ""turn them down or off"" this could hypothetically eliminate or significantly reduce the need for street lights."
t3_2dn11e,cjr71xy,"I'm not going to go into the ""we're all different love yourself"" thing, even though I believe, it, because I don't think that's what you are asking."
t3_2dn11e,cjr71xy,Finally I leave you with he story of Takeru Kobayashi: He doubled the Nathan's hot dog eating record in a single year because he played the game in a way no one else even thought to: http://en.wikipedia.org/wiki/Takeru_Kobayashi
t3_2dlel3,cjqpe0h,"Although I am as outraged with spying as the next guy, I'm certainly in no position to give up my life or lifestyle to fight it."
t3_2d8gej,cjn905a,"Certainly kidnapping the world's top AIDS researcher wouldn't be justified, even though he would maximize his own happiness."
t3_2cotfm,cjhkm9q,"So, although it is possible to review situations labeled as ""evil"" under a critical eye and gain understanding about motivations and intentions, there is still a time when there is more intentional harm/bad done to people than good in any given situation."
t3_2cotfm,cjhkm9q,"You may be able to look at it from Hitler's point of view and, through some warped justification, argue that he was trying to do what he thought was best."
t3_2cn87o,cjh6odd,"Had a hell of a hangover the next day, though."
