thread_id,comment_id,context
t3_2cmtbr,cjh02im,"Making fan art can actually distinguish one's own artistic style and fame even though it's technically fan-art, like in these examples."
t3_2cm5jd,cjguy6j,"Civilization may in fact fall apart, thought I doubt it as nothing that exciting ever happens in real life."
t3_2cimfd,cjfu9rt,"Again, immortal people don't exist, though."
t3_2cimfd,cjfvrb2,"I'm just guessing, though."
t3_2cimfd,cjfu9rt,"Again, immortal people don't exist, though."
t3_2cimfd,cjfvrb2,"I'm just guessing, though."
t3_2ch5sf,cjg8kfv,"If a heterosexual woman calls a heterosexual man cute, then it has different connotations; it means the girl finds his physical appearance at least somewhat pleasing, though it is not as intense as the word ""hot."""
t3_2ch2je,cjff0g8,I still have a ton of nostalgia for Red and Blue though.
t3_2cazp3,cjdo7z2,"There are different motivations here, though, I think."
t3_2c7yah,cjcxj9f,"The Nazis didn't like anything they thought might corrupt their blood, so they obviously wanted to get rid of everyone who wasn't appropriately German and anybody who had anything they thought of as a weakness or infirmity (that second part wasn't so unique to the Nazis)."
t3_2c5p5y,cjc7uan,"Although Americans seem to portray their culture as the ultimate in classless societies, there is a clear delineation between those who have and those who serve, and this is manifested in this fetish to be able to reward good service and penalise bad service as if you are employing your waiter as your own employee."
t3_2c1q5v,cjb3cqn,I did have a similar feeling as a girl where I (very very briefly) thought about going into prostitution.
t3_2c1q5v,cjb3rd7,"So on occasions when I happened to be really horny there would sometimes be a thought ""hey, I bet I could solve this problem (horniness) at with prostitution."""
t3_2c1q5v,cjb3rd7,"It wasn't a common though, and I was mostly disgusted by it so it's not like anything would ever come of it."
t3_2c1mga,cjc4wg5,"Israel was founded after WWII in May of 1948, although Jews were already migrating towards it since the 1890's(?"
t3_2c1mga,cjc4wg5,"But in 1917 there was a British conquest on Palestine which had many Zionist (Jews) volunteering to help the Brits in their mission but of course this didn't come without opposition, riots broke out in 1920 against the British rule and Jewish migration (though at this time the Jewish population was only around 10 percent, give or take)."
t3_2c1mga,cjc4wg5,"It isn't even about the invasion (as some might call it, though I just see it as a sad displacement) from the Jews anymore, but a fanatical idea that God wants them to win and take their land (back), and we know these are pretty theocratic nations so this belief cannot be conquered by simple reason."
t3_2c0gpr,cjaq908,They most likely do drive on a daily basis though.
t3_2c0frm,cjause4,It was a topic in the community that r/atheism is at sometimes anti-atheistic and pseudo promoted Islam for a while (although I haven't seen this for a while) and there's little criticism and more so oddly protective of eastern religions.
t3_2c0frm,cjb85xf,"As the creator of /r/Freethought a superset of /r/atheism, let me first suggest you familiarize yourself with the basics of URL ."
t3_2c0frm,cjbay39,"Ironically, the second-biggest atheist subreddit, /r/freethought is known for having less of that kind of stuff, but being its creator, I don't have a problem with the so-called ""disrespect"" you claim /r/atheism if full of."
t3_2byn0m,cjabwg5,Kind of like in math class you study calculus even though the laws of physics are more important/relevant.
t3_2bt248,cj8m3h7,"Even when I thought I might be gay in high school, I never thought about how great it would to be special."
t3_2bt248,cj8m3h7,I thought about how great it would be to finally fit in somewhere and have a name for what I was feeling.
t3_2bt248,cj8mwsz,"Those are some of the most hurtful, awful things I've ever experienced--from the people I thought loved me the most."
t3_2brzwb,cj8p7wa,You could even argue that conscious though is in itself free will.
t3_2brzmq,cj8b7ms,Emotions are survival tools emerging from processing information of your surroundings and your thoughts.
t3_2bag31,cj3f08t,"And even though I think a poor person giving money is sacrificing more, nevertheless if the rich person donates a large enough amount, it can affect his or her lifestyle in a significant way; they're not giving up anything they need , but they can potentially give up something that they want and something that they'll miss ."
t3_2ba26t,cj3fcgi,"For example, some video game magazines and websites use 10 point reviewing schemes -- but very often they will not rate a game that is ""acceptable"" as any lower than a 7, even though the numbers suggest that a 5-6 would be ""acceptable."""
t3_2b6skg,cj2cg6m,"My life sucks where it is right now, and if I thought that in five years I'd be in the same place I am right now, I would probably kill myself."
t3_2az65z,cj0g6d8,"It deals with a African man, his family and his tribe and his thoughts on Christianity and the white man."
t3_2ax77f,cizq3i4,Masturbating to thoughts of a friend does reveal negative things about you.
t3_2ax1is,cizvzsb,I'm still not convinced that there's a problem that needs solving though.
t3_2av5cs,ciz33th,"At first glance, it seems as though it wouldn't be very effective, but it has actually had huge success in reducing homelessness in the state."
t3_2atya5,ciyug3x,"Although it is possible to remove body hair, it is constant maintenance for many, and it certainly can make you feel like crap."
t3_2atkq9,ciz0aqa,"That doesn't make it bad, in my opinion, though."
t3_2atkq9,cizde8p,Some examples are: Getting in a fight over a game of Rock 'em Sock 'em Robots (most random thing I've ever thought of).
t3_2atkq9,cizde8p,"It is pretty hard to come up with one line examples of irony that work in a song though, so it's not really Alanis' fault."
t3_2aotoi,cixbgnz,"This, according to Hobby Lobby, is an abortion, though I do argue with their reasoning behind that."
t3_2aotoi,cixdemv,"I used the Jehovahs witness scenario because that is what the Hobby Lobby case opened up, even though we think its stupid and asinine to think that a religion would deny coverage for something that is life saving (while I agree plan-b isn't) they still now have the OPTION to do it!"
t3_2ao6r9,cix3fsy,"When a thoughtful critic says he enjoyed a movie, he is not saying the same thing as when he calls it great."
t3_2ao6r9,cix8b7l,"Saying ""*Citizen Kane* is overrated because I like Star Wars more"" is a bad criticism though, you're right on that point."
t3_2am3iw,ciwtkzm,"It's not just the conflict in the west bank, though."
t3_2ah2al,civg8t9,"Yes, although in this case I don't agree with the methods Palestine has used to fight back all the time."
t3_2afrhx,ciuoedf,"For the most part, I agree with you, although when it comes to jobs that require in-person interactions with customers, companies have a right to have say in the image that they present."
t3_2a9dnv,cissjh9,"Seriously, though, you've given three reasons why a person won't know how to pronounce a word properly and none of them indicate ignorance or lack of intelligence in my opinion: If it's a word from a language that died before humanity invented reliable means of recording sounds, NO ONE can say for sure what it sounded like."
t3_2a2ccx,cir7jqm,Do you assume everyone is so weak-minded that a person talking to them on the phone will control their thoughts?
t3_29zmtz,ciq3149,"So, making it though the cycle represented real achievement, and then you get to start over again."
t3_29t2lw,ciorv42,"Your hypothetical is also flawed because it makes it seem as though the appropriate response from a woman confronted with a significantly lower salary (presumably for no other reason than that she is a woman, although your hypothetical doesn't specify if this is the case) than the minimum compensation of what this position should command is to shrug it off and try to find better pay elsewhere."
t3_29t2lw,ciorv42,"Your hypothetical is also flawed because it makes it seem as though the appropriate response from a woman confronted with a significantly lower salary (presumably for no other reason than that she is a woman, although your hypothetical doesn't specify if this is the case) than the minimum compensation of what this position should command is to shrug it off and try to find better pay elsewhere."
t3_29r85r,cinqid2,"Although it works in principle, what about towns with a very limited amount of jobs?"
t3_29pjwk,cin94yc,"For example, if I note that everyone born prior to, say, 1850 was human and died, and then infer from this that all humans will eventually die, I have not appealed to any authority even though I have made an inductive inference."
t3_29o0d3,cimx6xh,"If Christianity turns out to be wrong, and Islam is true, you're still going to Hell even though you chose religion."
t3_29o0d3,cimx6xh,"If Christianity turns out to be wrong, and Islam is true, you're still going to Hell even though you chose religion."
t3_29n4wo,cimrxy5,"Love means different things to different people but even though we try to make sacrifices for those we ""love"" they are still sacrifices that we would rather not make if not necessary."
t3_29n4wo,cimnztj,"Logically speaking, though, being in a relationship is in fact superior to being single if you are in a healthy relationship."
t3_29n4wo,cimqk8p,"She fits all of these expectations even I personally was beginning to think might be a bit too ridiculous, from a person who was ""Christian gone agnostic"" to ""at least a 6/10"" to ""doesn't want to live in the city, even though we currently live in the city."""
t3_29koa9,cimms71,Luckily that kind of incident is pretty rare though.
t3_29koa9,cimms71,Luckily that kind of incident is pretty rare though.
t3_29koa9,cimms71,Luckily that kind of incident is pretty rare though.
t3_29koa9,cimms71,Luckily that kind of incident is pretty rare though.
t3_29koa9,cim79ff,"Unfortunately you're out though, despite Tim Howard being absolutely world class."
t3_29fpzd,cikh4e8,You act as though the Atlantic Slave Trade was the only way black people could ever come to Americans.
t3_298jbk,ciijbdz,"Mcafee would be one, along with Norton (which for some reason got onto your list even though its clearly paid."
t3_28sivx,cie3rwm,So although thought of as socially unacceptable it is a stereotype and the idea of a boy seen in the same light playing the game is not outside the comprehension of most people.
t3_28rftj,cidq2o7,"When you got off that flight, maybe they didn't see your bags, maybe they thought you were on a spiritual Trip (which millions of people do)."
t3_28b3qa,ci9g3ic,Over time though all that time they spent talking might lead to behavior or actions which are harmful to others.
t3_28b3qa,ci9g3ic,"The planning is still dangerous, though."
t3_28b0tb,ci9lccd,Ignorance is probably a much bigger one though.
t3_28a4rk,ci90bbf,"As for the stereotypes, most groups get something similar, although they may range from silly to offensive (worth mentioning here that being silly doesn't make a stereotype acceptable)."
t3_27ywun,ci5rb2e,Maybe you feel differently though.
t3_27yn4n,ci5nwbp,Even though I'm completely uninterested in casual games if I see Nintendo return to it's roots and impress me with the new Zelda and a version of Smash Bros that worlds well competitively and they continue to get games like Bayonetta 2 then I might just be a customer once again.
t3_27r91j,ci4g5dm,"I'm a smoker, and I'd like to quit (although I haven't tried hard lately), though the loss of the social opportunities presented as the result of stepping outside the bar or party to have a cigarette are insane."
t3_27qqap,ci3fwt5,"That seems to be in tension with your claim that we should have universal healthcare, though, because universal healthcare requires taking huge sums of money from some people to give to others, which arguably violates the rights of the people who earned the money."
t3_27lmyu,ci292ni,/r/atheism is just like every other relatively large group on Reddit; you have a silent group of individuals that support the idea as the minority and as you go down the pyramid people become more vocal with less thought out arguments i.e.
t3_27jtsq,ci1ib47,"If I remember correctly there was allegations of corporate espionage, and Snowden leaked that the President was spied on (but that's to be expected though)."
t3_27jl8c,ci1ghse,"Winston ""loved Big Brother"" at the end of 1984 because he had been tortured and psychologically damaged to the point that he was no longer capable of forming rational thoughts."
t3_27jl8c,ci1ghse,"Winston is tragic because he was the only sane man left among the party, and one of the last few that appeared to be capable of reasoned thought."
t3_27ea43,chzyvc9,As many others have said: it is due to a chemical imbalance in the brain that causes irrational thoughts.
t3_27ea43,chzyvc9,"For me, it was always night time, when nobody else was around I was alone with my thoughts and insecurities and had nobody to sound these things off of to tell me ""That's absurd, you are wrong about how horrible you are because of [reason]"", and so that pessimism got to me on a pretty deep level."
t3_27ea43,chzyvc9,As many others have said: it is due to a chemical imbalance in the brain that causes irrational thoughts.
t3_27ea43,chzyvc9,"For me, it was always night time, when nobody else was around I was alone with my thoughts and insecurities and had nobody to sound these things off of to tell me ""That's absurd, you are wrong about how horrible you are because of [reason]"", and so that pessimism got to me on a pretty deep level."
t3_27ea43,ci005dx,"As someone who, although faced with many hardships, has still been afforded a great quality of life in comparison to people in many parts of the world, and who is depressed, let me explain."
t3_27ea43,ci005dx,"""Just get over it,"" ""it gets better,"" ""just think happier thoughts"".... these (and more polarizing comments like them) are oft-heard, and while they may seem like good platitudes to the speaker, are more isolating than they are comforting."
t3_27ea43,ci005dx,You can't think-happy-thoughts away clinical depression.
t3_27dypa,ci07fb6,legally they'd be responsible for your actions in some part if not all (again depending on various factors) You're in a compromised state and others that are in sound mind are taking deliberate advantage of that knowing you can't make clear thought out decisions.
t3_27aea6,chywfdl,"Because this is one aspect of one field of philosophy (metaphysics) and is a pretty bad representation of philosophy as a whole, though it does seem to be a good representation of an introduction to philosophy class."
t3_27aa6m,chyuott,What makes the thoughts of old people inherently flawed?
t3_276tlp,chy0rmg,"Everyone thought it was just some gadget toy that nobody would really use since it is not a real phone and neither a real computer, just a secondary device."
t3_276tlp,chy0rmg,"Now for most people the iPad might still be that shiny toy, but there were new ways invited and thought of on how to use this piece of technology."
t3_273kmd,chxabgz,"Raising the legal limit, requiring stricter rules for getting a liquor/beer license, limiting the places someone could drink legally, raising the penalties for abusing alcohol, increased awareness through educational campaigns, etc have not even been considered, let alone thought through completely before simply thrown out with the bathwater by placing it on the same level, as say meth."
t3_26zh5n,chvzqvi,"Yes it's a dumb example, that's how these things start though."
t3_26zh5n,chw0vw9,"Oh I agree with you 100%, my wife being naked is not a top priority to the government, what I'm saying though is every day activity, being monitored is an invasion of privacy."
t3_26zh5n,chw2k1z,"That's true, and that may be justifying snowden, the fact that remains though that people are upset that their privacy was invaded."
t3_26zh5n,chvzqvi,"Yes it's a dumb example, that's how these things start though."
t3_26zh5n,chw0vw9,"Oh I agree with you 100%, my wife being naked is not a top priority to the government, what I'm saying though is every day activity, being monitored is an invasion of privacy."
t3_26zh5n,chw2k1z,"That's true, and that may be justifying snowden, the fact that remains though that people are upset that their privacy was invaded."
t3_26zc51,chvxpww,"As for your other point though, the human brain isn't even done fully developing around age 25."
t3_26zc51,chvxpww,"If you wonder why many young girls are usually into males of an older age though, it's because URL"
t3_26wd6r,chv4tni,"You say that the logical thought would be that obviously these aren't realistic expectations, but keep in mind you are aware of the movement to point out how unrealistic these standards are and thus it might actually be doing what it was intended to do."
t3_26wd6r,chv4tni,"You say that the logical thought would be that obviously these aren't realistic expectations, but keep in mind you are aware of the movement to point out how unrealistic these standards are and thus it might actually be doing what it was intended to do."
t3_26u9dw,chukxnl,This is still very little evidence to go on though.
t3_26oc4p,chsxgnl,"I don't think current feminism provides an alternative or any profound thought to achieve gender equality, but that is not what the term of feminism is about."
t3_26nryd,chsrvxo,"Regardless of what your personal thoughts about religion are, there are somethings that they do that are positive."
t3_26nayb,chsv92t,"As a final though, keep in mind that EVERYBODY discriminates."
t3_26dl3h,chqb2dv,"Developing fetuses do not have these qualities, although they are biologically human."
t3_26b7qy,chpfdw6,"For your main point that there is no evidence, there is actually alot of evidence that reducing the corporate tax rate actually is revenue neutral for the government while increasing investment (though not doing anything for employment) (Mertens, Ravn."
t3_26avz4,chpens6,I do not believe anything I said entails this claim though.
t3_264xi6,chntgnu,They're the ones who thought parenting would be super-easy and they're annoyed because now they can only post on facebook fifty times a day.
t3_26388i,cho108e,Stated another way my point is that although drug use as a whole may harm society drug prohibition also harms society as you will end up prosecuting and thus harming many peaceful and otherwise law abiding citizens.
t3_25yudb,chm0yjp,He obviously thought it was of enough value to keep.
t3_25xl5s,chlqmz0,Morality is all about protecting and promoting life (though people have many different definitions of what that is).
t3_25nvz4,chj0yiz,"Here's another thing, though."
t3_25jy2j,chhxvwc,"As others have said, there is nothing in the bible about abortion, and in any case, Christians are in exactly the same position as atheists regarding where they get their moral instruction from ... basically, they both come to their conclusions by listening to trusted advisors and then considering their own thoughts on the subject."
t3_25itrj,chi69ds,"2. if you've ever done physical activity (which can be assumed since you say you are quick) you could probably kill it with a solid kick, or at least punt it hard enough to give it serious second thoughts."
t3_25gqr3,chhjcvi,"I'm going to disagree with your assertion that gods are just a product of our fear of death (although certain ones are, and I believe that the Christian god falls under that net)."
t3_25gqr3,chhjcvi,"It didn't have to be proven or demonstrated, it just had to fit with what we thought of the world."
t3_25gqr3,chhh81o,"The point of this argument is that many things are illogical under standard thought, but are true."
t3_25gqr3,chhh81o,"The point of this argument is that many things are illogical under standard thought, but are true."
t3_2544cj,chdklfz,"I thought this comment might still fit into your post though because it is an alternative to metric that is used in the USA, much like Imperial measurements."
t3_24v147,chbf3nm,It would be designed to make any coffee I thought of.
t3_24uvqn,chb7e9p,"That is because even though it can take 10-15 years to bring a drug to market, we still rarely have any idea of long-term side effects that can manifest."
t3_24u1tt,chap2b6,"(Although, it's also quite likely that humans will morally degenerate over time since moral relativism is so prevalent and attractive.)"
t3_24li4x,ch8on3p,He reacted as though she were taking pics with Waka Flocks Flame or something.
t3_24fjg2,ch6n7vo,"Even though animals may not fully grasp death, they all very clearly avoid it."
t3_24c1q3,ch5p4qj,"You'd have to admit though that asking a woman to trim instead of shave is just as much of an enforcement of prejudices on the woman as asking her to shave is, and maybe more so if she thinks you expect her to change her bathroom routine."
t3_24bof3,ch5phng,"Therefore, this 15% of voters probably almost exclusively came from people who would have voted B, meaning instead of the normal 50% for A and 50% for B election, it went 50% for A, 35% for B, and 15% for C, having A win demandingly even though the same 50% really didn't want A in office."
t3_24b8ko,ch66f4q,"3) The ""measurement"" problem with moral reasoning via utilitarianism isn't just about whether well-being can be measured itself (though it's an entirely subjective thing, so you're never going to be able to get better than a statistical measure, which may lead to immoral results in individual cases)."
t3_23k2q0,cgxturs,Without consciousness we would be slaves to instinct and nature with no prospect of free thought.
t3_23k2q0,cgxturs,I don't care to dwell on such thoughts for long periods of time.
t3_23gsm4,cgwtza2,"For the sake of discussion I'll assume all of your claims about adoption's effect on children are correct, even though they are not."
t3_2371el,cgu6rya,"That's simply not true, though; an accent or a dialect doesn't make you any more or less intelligent then anyone else, and to think that it does is classist and possibly racist, even if you don't realize it."
t3_22uku3,cgqivn8,"Tourism might lead to gentrification (although you have not shown evidence of this), but it itself is not at all gentrification."
t3_22uku3,cgqivn8,"Tourism might lead to gentrification (although you have not shown evidence of this), but it itself is not at all gentrification."
t3_22ujpc,cgqk4rp,"Legalized abortion actually increased numbers of unwanted pregnancies because it paradoxically led to more unprotected sex from people who thought ""oh, I can just get an abortion now"" but for whatever reason never did."
t3_22s540,cgq0y5h,"This oughta be a fun thought experiment, and I think I'll write it as a narrative even though I doubt I'll get much notice!"
t3_22s540,cgq0y5h,"Back in 2017, after the re-election of Hilary Clinton, right when we thought everything was safe, the country went to shit."
t3_22s540,cgq0y5h,But it turned out a lot worse than they thought.
t3_22s540,cgq0y5h,We thought we were immune from things like the Arab Spring uprisings.
t3_22s540,cgq0y5h,"Many thought that the military couldn't function without funding, and that requires taxes."
t3_226qii,cgjy42n,Can you honestly say that the thought of that doesn't bother you in the least?
t3_226qii,cgkpw8o,"People wouldn't stop lying because they thought it was the right thing to do, but because there is a stream that could put them in jail, it would be the threat of being caught."
t3_225n20,cgjto4c,"Were I to be coming form a male starting point, the fact that I love crocheting and collect hello kitty crap would be something for most people to mock, even though it's less obvious than anything I wear."
t3_222civ,cgj4jnh,"If you say ""no,"" then you're saying that the public's right to be shielded from his offensive conduct prohibits him from expressing his political opinions, which are a form of speech that historically has been thought to be one of the core types of speech the First Amendment protects."
t3_222civ,cgj4jnh,"Even though if they and people like them have that right, it arguably has a harmful effect on our society by coarsening public discourse?"
t3_222civ,cgir9ho,"It makes sense that the ones that fall into the ambiguous parts of the Constitution, though a small portion of all the cases, are a big portion of the ones that actually go to the Supreme Court."
t3_222civ,cgir9ho,"Even of the cases petitioned to SCOTUS, they only take 1% - the ones with interesting, hard legal questions Also, not everything the Supreme Court does is Constitutional law, they also do statutory interpretation, review regulations, etc (though this doesn't change your or my point really)."
t3_21w3iu,cgh3ukf,"When you get down to it though, there is no emotion in intelligence and understanding, but there is knowledge and happiness in imagination."
t3_21w3iu,cgh4efu,"Emotion without logic is easily manipulated and misled, it can lead to nonsensical thoughts and ideas, and may be inappropriate in many situations."
t3_21w3iu,cgh4efu,Purely emotional thought is easily manipulated: how often have you seen a charity ad that pulls on the heartstrings so that it can then pull on the purse-strings?
t3_21w3iu,cgh4efu,"Purely emotional thought is nonsensical: While it may be creative, sometimes it can be too creative."
t3_21w3iu,cgh4efu,Strange rituals and superstitions come from the same type of thought process.
t3_21w3iu,cgh4efu,"Purely emotional thought and behaviour can be inappropriate: if you get angry with someone, you probably shouldn't go with your gut instinct when deciding what to do next."
