thread_id,comment_id,context
t3_1ied1a,t3_1ied1a,"It can be really empowering and invigorating to know that one of the greatest things you can do to forward the cause is to simply listen and accept; and though it's painful to get those things tossed your way, it does wonders to build trust within yourself and between you and any safe space community you might be a part of."
t3_1i4vt4,t3_1i4vt4,I think this is a good thing - even though is may be frustrating when your issue is blocked by some other interest.
t3_1hz32h,t3_1hz32h,"The same gadget may also make the recognition of words and categories faster, even though the same tasks could be done without it."
t3_1hz32h,t3_1hz32h,"It's difficult to infer the primate equivalent of bipolar disorder from the fossil record, though, but scientists have been studying behavioral disorders in apes and other non-human primates."
t3_1hz32h,t3_1hz32h,"Rats have a better sense of smell, even though the human nose is physically larger."
t3_1hxzas,t3_1hxzas,"A middle-class white kid from the suburbs comes up to them, tells that he totally loves rap music, he's ""from the streets"" just like them, he definitely ""is down"" with the whole rap culture even though in his life he never actually experienced any of the topics that rap sings so often about and in fact only got into rap because several of his friends were listening to it at school."
t3_1hxjqk,t3_1hxjqk,"Great solution in my opinion (not really applicable for women, though)."
t3_1hv4rd,t3_1hv4rd,I think one thing that people talking about collapse do themselves a disservice with is their word choice though.
t3_1hv4rd,t3_1hv4rd,"I have no idea how likely it is that either of these things change though - not so much because of the strength of the dollar, but simply because every other currency seems to have the same problems."
t3_1hv4rd,t3_1hv4rd,"This will make things get steadily more expensive over time - which if you think about it you've probably seen in your lifetime (lately though the trend hasn't been to raise the amount on the price tag of basic goods, but to sell a smaller amount for the same price)."
t3_1ht05v,t3_1ht05v,Nothing remains of me after my death even though I leave a carcass.
t3_1hqd66,t3_1hqd66,"At some point, though, the major labels stopped caring about maintaining a balance and started only caring about efficiency in moving units."
t3_1hp8cm,t3_1hp8cm,"My central point remains, though."
t3_1hp8cm,t3_1hp8cm,Segregating the gym into time slots though saves on the budget as it prevents them from having to build two entirely separate male and female gyms like they do with restrooms.
t3_1hhxrp,t3_1hhxrp,"An identical population-based model can account for the propagation of memes, even though some individuals may ""decide"" not to propagate it."
t3_1hf3eh,t3_1hf3eh,Corporations will always wield less dangerous power (though sometimes only slightly less dangerous) and will always minimize distributed decision making as it is antithetical to the goal of maximal efficiency.
t3_1hajga,t3_1hajga,"Women can certainly still get pregnant, though even in the Navy it was more than a little bit recommended they choose to get an IUD to avoid this as it can, indeed, be a deep complication to their personal as well as their unit's readiness."
t3_1h9hye,t3_1h9hye,"If things were to progress to the point you fear though, where demand exceeds supply, then the market would push things back to the more efficient methods in order to cover this unmet demand."
t3_1h749v,t3_1h749v,Your inclusion of the first bullet made it seem as though you supported the legalization of assisted suicide for someone who was temporarily depressed because they were a recent amputee.
t3_1h6ah2,t3_1h6ah2,"I use vim as my editor, sure, but even there it's not ""just"" a text editor (though it's a damned fine editor)."
t3_1h6ah2,t3_1h6ah2,"Even though Ruby has these built in (and probably implemented in very efficient C), if they didn't exist, you could add them."
t3_1h5k81,t3_1h5k81,"Lastly, I'd argue that, though the Bible has long been the most important book, that it's influence at present has waned."
t3_1h5k81,t3_1h5k81,"And in fact, I think that most high schools should and often do touch on basic tenets of biology or capitalism, though without necessarily teaching those originary texts themselves."
t3_1h5k81,t3_1h5k81,"By contrast, most smart teachers within an individual secular discipline acknowledge the limited explanatory power of what they teach (though they'll also argue that their discipline has more explanatory power than it's usually given credit for--gotta be defending one's turf, right?)."
t3_1h5k81,t3_1h5k81,"It's hard, though, to present Christianity in such a limited fashion, and I think it's particularly hard for kids in high school to grasp it, since they're likely still living at home and are probably forced to conform their religious practices to those of the family in which they were raised."
t3_1h5bo4,t3_1h5bo4,"Gender, on the other hand, only warrants intermediate scrutiny, though it has gotten to the point in some cases where it's closer to strict than anything."
t3_1h5bo4,t3_1h5bo4,"Intermediate scrutiny came about during a spree of gender-based discrimination cases and has mostly been reserved for gender alone though, on some occasions, legitimacy (as in ""illegitimate"" children) as well."
t3_1h5bo4,t3_1h5bo4,"It is more fatal than deferential scrutiny, though not as fatal as strict scrutiny."
t3_1h4fc4,t3_1h4fc4,Specifically with regards to your points though: 1.
t3_1h3tmi,t3_1h3tmi,Your main point is really interesting though.
t3_1h3tmi,t3_1h3tmi,"If I want to know whether I am sad, even though there might be behavioral correlates I cannot collect evidence for whether I feel sad in my own mind."
t3_1gzggd,t3_1gzggd,One could make a perfectly valid point in text lingo and that makes it no less valid (though perhaps it would be harder to read).
t3_1gt2ny,t3_1gt2ny,"These are traditionally understood as more childish treats when the alcohol is not added, even though there is nothing about them that makes them age specific."
t3_1gqfyr,t3_1gqfyr,"As such, even though there is a never-ending onslaught of increasingly brazen terrorist attacks around the world, 9/11 by itself may only be a ""big deal"" for most Americans, but the consequences it has had are a big deal for everyone in the world."
t3_1go0nk,t3_1go0nk,"This view is called physicalism , and though you didn't explicitly endorse it in your post, it is quite likely similar to the opinion you seem to hold."
t3_1go0nk,t3_1go0nk,"I'd like to return, though, to qualia."
t3_1gndd7,t3_1gndd7,"There are no other premises which allow for any ""therefore"" to be drawn from that categorization though, which is a lot of the problem here."
t3_1gndd7,t3_1gndd7,"It looks like you're defending the question about creating AI or something, even though that wasn't the one I quoted and responded to."
t3_1gndd7,t3_1gndd7,"Again though, you haven't done anything to show that your categorizations being accurate demonstrates triviality."
t3_1glkkw,t3_1glkkw,"This is kind of the case in Israel, though it isn't so strict legally in many areas."
t3_1gk7i3,t3_1gk7i3,"- URL (though if you look in that article you'll find that often simply brandishing a weapon is enough to stop an attacker, I'll discuss why that's important in more detail later) They serve only one purpose - Hunting, self-defense, being a guard against tyranny, and coldblooded murder are not the same thing."
t3_1gjtcs,t3_1gjtcs,"You didn't hear it from me, though.)"
t3_1ghuhk,t3_1ghuhk,"In my opinion though, once you pass baby-stage it's all the same."
t3_1ghg9u,t3_1ghg9u,"I admit I don't know as much about the history of the Koran as I should, but for the bible, it is fairly easy to explain why - all the books were written by different people, and though divinely inspired, they simply didn't cross-check everything to make sure the points were the same."
t3_1g8ye7,t3_1g8ye7,What about senatorial elections though?
t3_1g8dms,t3_1g8dms,"What Dickens did well that others didn't, though, was write for mass appeal."
t3_1fm8eb,t3_1fm8eb,A homosexual relationship is purely consensual and carries none of the problems of reproduction via incest (though personally I hold no problem against purely consensual relationships between relatives).
t3_1fm8eb,t3_1fm8eb,I totally agree though.
t3_1fl90i,t3_1fl90i,"Second, the United States is famously a secular state but it is rife with religious justification for laws (though, not regarding the right to worship)."
t3_1fl90i,t3_1fl90i,"So far we see that while a given state may be officially or unofficially secular, this has no bearing on a) it's capacity or willingness to accept religious argument as a basis for legislation and b) just because a state legislates in line with a particular religion's belief's doesn't mean that it will begin to encroach on the right to worship - though the rights of non worshipers suffer, discussed below."
t3_1fkqyp,t3_1fkqyp,It's not abusive in any way shape or form though.
t3_1f5j5p,t3_1f5j5p,"Whether or not gender queer is recognized (and I'm friends with many people who'd sooner die than admit I'm not an ordinary straight male, even though I've experiences in life that make it easier for me to talk to women and the LGBT community, than to other straight men), it exists, as itself."
t3_1f3esr,t3_1f3esr,"That's not going to get many people involved, though."
t3_1evztt,t3_1evztt,"Do you allow him to continue coordinating terrorist attacks against you because you can't capture and try him, even though you could kill him?"
t3_1er14x,t3_1er14x,"By the time a fetus is 8 months in, it's perfectly viable and ending the pregnancy seems to many people to be equivalent to murder (though some religions hold that ensoulment occurs at the moment of birth, and not before, so maybe a view from that quarter would be different)."
t3_1er14x,t3_1er14x,"The idea of jailing a rape victim for an abortion is abhorrent to many people, though, so the pro-life movement mostly does not seem to demand ideological consistency on this point (which is fine with me, since I'm pro-choice anyway)."
t3_1enop4,t3_1enop4,"For example, to put it simplistically if you are analyzing states from a realist perspective you would primarily be looking at conflict/war and, (though feminist literature shows how women have participated and been affected by war) as historically men have done the fighting this theory really only analyses men's behavior in conflict completely ignoring women's behavior and perspective."
t3_1ejwsi,t3_1ejwsi,"The desirability of the latter thing is a whole other debate, though, and I don't want to get into it here -- I'm just offering it up as a further example."
t3_1ejwsi,t3_1ejwsi,"I'll note as well that this point is a totally neutral one, even though you're offering it up as though it's negative."
t3_1ejwsi,t3_1ejwsi,"I won't get in your way, though I also won't agree."
t3_1ejwsi,t3_1ejwsi,"If you have any follow-up questions or challenges to offer, though, I'll be glad to do what I can."
t3_1ejwsi,t3_1ejwsi,"My post is a little late, but I want to address 3D being used to bring depth and meaning to a film, since I don't think it was as well addressed in this thread (though I haven't read through all of it so I apologize if it has)."
t3_1eeqwi,t3_1eeqwi,The majority of my country prefers secular system rather than Sharia law even though some fundamentalists want Sharia.
t3_1edqbg,t3_1edqbg,"I own a violin that belonged to my great grandfather at the time he immigrated from Europe to the US, and though it isn't worth much, you can bet that I want to pass it on to my own kids someday."
t3_1e74qq,t3_1e74qq,"Even though you're entirely physically capable of stabbing yourself, every part of your brain will fight you."
t3_1e30x9,t3_1e30x9,"If you just want to make money, then become an engineer or pick another STEM field (even though science isn't necessarily the best way to make money)."
t3_1e0dd7,t3_1e0dd7,I wouldn't expect us to do it outside of a time we are in war though for the reasons you mentioned... we would be extremely alarmed if anything of that sort started again.
t3_1dyb7o,t3_1dyb7o,"On the other hand there are singers that could bring you to tears with Amazing Grace, even though the melody is fairly boring."
t3_1dj741,t3_1dj741,"In actuality, you need a freezer first, so the ice cream does not provide that benefit (though is still delicious)."
t3_1di0zr,t3_1di0zr,"Love probably developed as part of procreation, that doesn't help in understanding it though as you yourself are a product of the same process that caused love to exist."
t3_1dgj00,t3_1dgj00,"It's an interesting thought, though."
t3_1dgj00,t3_1dgj00,"I've already stated, though, that my argument is not ideological, it's practical."
t3_1dfy2a,t3_1dfy2a,"You're basically asking humans (read, not men or women, but both) to just control some very powerful urges as though it's as easy as flipping a light switch."
t3_1dfy2a,t3_1dfy2a,"Is he somehow prevented from insisting upon a condom, though?"
t3_1dfnx1,t3_1dfnx1,"So, musical tastes are disputable, though I would recommend going elsewhere if you want to discuss it."
t3_1dahpy,t3_1dahpy,"I largely misunderstood what it would be like when you got drunk, even though I had the descriptions right, the reality of it wasn't the same."
t3_1d44p3,t3_1d44p3,"- Alcohol always makes you drunk in a relatively predictable way, right (even though some people act different when drunk than others)?"
t3_1d44p3,t3_1d44p3,"If an antidepressant works though, that is pretty great."
t3_1d44p3,t3_1d44p3,"The alternative, though, even if they're completely out of her system, not just cold turkey withdrawal, is serious mental anguish."
t3_1d44p3,t3_1d44p3,"I'd advise giving it as fair a shake as you can stand and seeing if it's worth it for you; at no point did I find them any of them psychologically addictive so if you're not happy with your treatment I think you should be able to get back to good old 'depressed but not medicated' without too much trouble (though coming off some of them was a fucking pain from just the physical effects, lookin' at you Effexor)"
t3_1d3iw3,t3_1d3iw3,"The Russians, as the Chinese today, were always in competition with the Americans (though the Chinese rely on the Americans in reality)."
t3_1cymw8,t3_1cymw8,"More than even that, though, is that a belief in hell gives you the comfort of knowing that even if someone who does great evil in this life gets away without corporeal punishment, God will not let them get away without any punishment."
t3_1ctkhw,t3_1ctkhw,"I would like to see a panel of scientific experts for candidate's debates or speeches though, just to see the BS in their arguments."
t3_1cocdc,t3_1cocdc,"One reason we might not want people doing that for routine surgery, though, is that it directly impacts a hospital's competence at the harder stuff."
t3_1cocdc,t3_1cocdc,"That's a personal judgement though; some people think individual rights always trump obligations to society, some people think the exact opposite and most people lie somewhere in the middle."
t3_1cocdc,t3_1cocdc,"Just on the specific point of using Yelp reviews though, the actual system would have to be enormously more complicated in order that it wasn't distortionary."
t3_1cjeto,t3_1cjeto,"Well first of all you'd have to accept that many people do actually like the taste, even though you personally don't."
t3_1cfa2w,t3_1cfa2w,"All these countries manage to make a significant chunk of their energy renewable, and that's even though were not even close to reaching max effiecancy for all forms of renewable energy."
t3_1cfa2w,t3_1cfa2w,"Finally, even though I'm not a fanof nuclear energy, I understand that you might not want to give it up, but then again, you don't have to."
t3_1cbyg8,t3_1cbyg8,"Additionally, though you may not mean it, I think there might be some sort of political undertones to your question."
t3_1c9rnm,t3_1c9rnm,"Even though she's causing the death of another being, that being does not have a right to her body."
t3_1c9rnm,t3_1c9rnm,"Not everything that is alive can suffer, a plant for example cannot suffer as it is not sentient, even though it is alive."
t3_1c5xlc,t3_1c5xlc,"I think too though that on the spectrum of the sportiness of a sport, if falls on the lower side of the scale, though still a sport."
t3_1c5s2j,t3_1c5s2j,"Would it have been more difficult for them to stand in line, though?"
t3_1bk94x,t3_1bk94x,It's not necessarily to attract the opposite sex (though sometimes it is!).
t3_1b757j,t3_1b757j,"It's not just personal safety, though."
t3_1b5h4r,t3_1b5h4r,"After all, most members of safe space groups live in societies which are not as receptive/encouraging of their views every day, so it isn't as though they are hiding from the world entirely."
t3_1am1gg,t3_1am1gg,"The original point though, was that we tend to give too much credit to how science and engineering help humanity and not enough to other branches of knowledge and I still hold that belief (maybe through stubbornness, although to be honest I don't think anyone gave a very convincing argument)."
t3_1am1gg,t3_1am1gg,"Even though i got a science education in college, I'm actually going back now and reading URL in order to get a more liberal education."
t3_18n2uc,t3_18n2uc,"The most I could say right now is that not wanting power (or at least not feeling entitled toward a particular position of power) often helps one be a better leader, but it definitely does not make you a good leader in and of itself, and I think it is possible to have leaders who are good leaders even though they want the power at some level."
t3_18hfbb,t3_18hfbb,"As one in a similar situation morally I feel similarly, though my concerns are purely hedonistic!"
t3_341qpv,t3_341qpv,"So while having to give her an extra layer of respect based on gender, even though it is acknowledged she is being crazy, the husband is still in the wrong in every case."
t3_341qpv,t3_341qpv,"Now read that paragraph again with a gender swap: So while having to give him an extra layer of respect based on gender, even though it is acknowledged he is being crazy, the wife is still in the wrong in every case."
t3_33x4zd,t3_33x4zd,"With regards to your final point about employment, I agree wholeheartedly, and in UK case law the principle of 'volenti non fit injuria' is often not applicable in these cases, as even though the person knows that the risk is part of the job, they often cannot fully consent to the level, and certainly do not consent to harm as part of a breach or failure."
t3_33ltmy,t3_33ltmy,"First let me just say that the answer I suggest is the better paying job, though i also do not have every detail as you do."
t3_33ltmy,t3_33ltmy,Your job will be to make sure they at least consider it though.
t3_33fzqf,t3_33fzqf,"As things stand though, they're an important oil producer, and trying to topple them or sanction them could result in another 70's style oil embargo, and worldwide economic depression."
t3_33f4nn,t3_33f4nn,"At this point, the proponent of this ethos can do no better than spin ad hoc explanations why somebody ""really isn't harmed"" even though he sincerely feels that he is, or to explain that when you hurt only feelings, it is not really ""harming"" at all."
t3_33c9pv,t3_33c9pv,I eagerly await a different form of governance - perhaps something resembling technocracy/The Venus Project - though i'm not optimistic about seeing it happen in my lifetime.
t3_335imf,t3_335imf,"The reason he SHOULD be worshipped, according to Christians, is that he provided a way, even though the sins of humanity, for humans to go to heaven."
t3_335312,t3_335312,"His outbursts, though not classy, are not unfounded."
t3_334q3e,t3_334q3e,"Then in the 17th century, when royals began to confiscate the weapons of regular citizenry, they felt as though they had been wronged somehow and made slaves to an oppressive king."
t3_333cqy,t3_333cqy,"Even though I still think it's killing the baby, sometimes killing is permissible."
t3_32x0t2,t3_32x0t2,I have had both a GTX 560 ti and a 780 overheat on me though.
t3_32x0t2,t3_32x0t2,"According to this group, AMD desktop processors had lower failure rates than Intel (though it's pretty negligible), while AMD graphics cards had a higher failure rate than their NVidia counterparts, in a non-negligible number."
t3_32lp3g,t3_32lp3g,That's hardly the most important part of my argument though.
t3_32hhvc,t3_32hhvc,There's a middle ground there though.
t3_32cnkw,t3_32cnkw,"Oh he definitely would, at a rate proportional to cover the kids, though I don't think it would really make an impact on how much he gets to spend on food for himself."
t3_32cnkw,t3_32cnkw,"Even though it seems small, it isn't negligible."
t3_32cire,t3_32cire,"URL showing that even though men across all demographics have a lower opinion of Hillary compared to women, 59% of nonwhite men find her favorable compared to 37% of non-Hispanic white men."
t3_32ag2g,t3_32ag2g,"Their brains are still developing, and even though it seems like they have their full mental faculties at work making a decision, quite simply they don't."
t3_321v5o,t3_321v5o,The workers do not have a claim on the future tax receipts of the Federal government though.
t3_320ncw,t3_320ncw,"Some people are more fun when you can argue with them; but even if your mom isn't one of them, that doesn't mean that working silently to push back against her prejudices will make your relationship weaker, or that buckling under and letting her pressure you into acting as though you think her worldview is acceptable will make her company more enjoyable."
t3_320ncw,t3_320ncw,I guess that's pretty secular though.
t3_320ncw,t3_320ncw,"If you have firm beliefs, your mother might pressure you into conformity in a way that is merely hypocritical; but if you are still figuring lots of things out, then by pushing you to act as though her crazy beliefs are reasonable and respectable, that conformity will slowly lead you to accept that they are ""somewhat"", then ""more-or-less"", then ""completely"" reasonable."
t3_320ncw,t3_320ncw,"I would want to put it more strongly than a ""false front"", or ""placation"", though."
t3_320ncw,t3_320ncw,"But she's more like a schoolyard bully who tries to make things true (""you don't have any friends"", ""everyone hates the way you dress"") by saying them and getting everyone else to act as though they're true."
t3_31z0jc,t3_31z0jc,"Each system gives birth to the next, almost organically, though obviously those changes have required a great deal of sacrifice."
t3_31cggh,t3_31cggh,"Practical and moral aren't the same, though, and rarely have been."
t3_31cggh,t3_31cggh,"I've played plenty of RTS games, though I'm more of a Civ or AoE man myself."
t3_31cggh,t3_31cggh,"I think you're confusing pragmatism for morality (though some codes of morality rely heavily on pragmatism, such as utilitarianism) and ignoring that individuals, sometimes influential individuals, have bucked societal norms and understandings of what is and isn't moral, and that over the course of history many of them agree with each other in terms of basic understandings of right and wrong."
t3_316gw1,t3_316gw1,"EDIT: I should add though, that's probably not a book you want to be reading in public in Israel."
t3_3143ne,t3_3143ne,"More importantly though, you said yourself that these people pick out the recyclables from the trash bins to sell."
t3_30rc1i,t3_30rc1i,"The lack of respect and courtesy hurt my feelings at the time, though."
t3_30dwuy,t3_30dwuy,"Private donors arent giving money to Cruz just to support a publicity stunt, they do it because they genuinely believe in him, like lots of (though a small minority) believes in him."
t3_30bmbr,t3_30bmbr,"But 100 years later, society is doing just fine even though 99% of the population cannot quote Maxwell's equations."
t3_30bmbr,t3_30bmbr,"Similarly, we don't need everyone to learn how to program in assembly language, even though everyone is an IT user."
t3_30a5zk,t3_30a5zk,"I would still feel like a man in my mind, even though I am missing the instrument which our society (largely focused on binaries) says is necessary to be a man."
t3_306jm9,t3_306jm9,"Coming to terms with this guilt and accepting that this is just the luck of the draw that is life and you aren't anything special even though you get to do this special thing is ""humbling."""
t3_305ejo,t3_305ejo,"Overall, even though I don't like it at all, this reaction from society seems pretty logical, I'd say give it time, the novelty will fade eventually and it will get better."
t3_304ub4,t3_304ub4,"For instance, I feel much better about contributing to the health insurance of someone who's mother drank while pregnant - even though as a community we are paying for someone else's mistake, the stakes are higher, and I would prefer that the person be able to live a healthy life."
t3_302atl,t3_302atl,Hank's tolerance of lifestyle that 100% goes against his values is contrasted with Peggy's constant attempts at trying to meddle into other people's affairs even though she is ostentatiously tolerant of other people's lifestyles.
t3_301n6h,t3_301n6h,"This varies tribe to tribe, but for a lot of Indians^2 community involvement matters way more than blood quantum (though blood quantum still matters, again, depending on the tribe.)"
t3_300pmw,t3_300pmw,I can only think of one occasion where a man has propositioned me and he was definitely persistent; though that may have been because I was not clear enough or he was too drunk to realize.
t3_300pmw,t3_300pmw,"I understand what you mean though, most people don't notice it or are willfully ignorant."
