thread_id,comment_id,context
t3_21w3iu,cgh4efu,"It may have thought of them, but not in any reasonable or implementable way."
t3_21w3iu,cgh4efu,"Putting two and two together though: ...if I hear ""Straw Man"" one more time...
 ...college kids flexing their new found argument skills... * ...it merely comes across as condescending, arrogant, and dismissive..."
t3_21rsdj,cgfyezv,"Sorry, you lost me with ""although important and beneficial, reading books is not necessary for life enrichment and fulfillment."""
t3_21rsdj,cgga8cv,"It becomes more a part of your thought processes, and something you're more able to draw from."
t3_21rsdj,cgga8cv,"You think about it for a while after it's finished, let the thoughts set before moving onto the next thing."
t3_21ppzf,cgfeu4n,"And though you can research a lot now days, salesmen generally have an inside track to information from the companies they sale and deal with many customers and get their feed back on what is quality and not."
t3_21hpd2,cgd5p1v,"You don't have to buy into Dr. Tononi's theory to change your view, though."
t3_21h3ct,cgcysnd,It's not as though lowering the burden of proof actually captures more criminals so much as it makes easier to label them as such whether it's true or not.
t3_219hvy,cgbl2ej,There's a lot more to collecting records though than quality.
t3_219hvy,cgbqj7y,And even though there are shitty people on the vinyl community (I've met plenty) a lot of us are just people who love records and music.
t3_2108o3,cg8vacp,I thought I'd take a stab at addressing some of your concerns.
t3_2108o3,cg8vacp,"Some universities aren't there yet, though, leaving individual faculty to find what works best for their courses."
t3_2100tm,cg8cadv,Many politicians during the 90's thought Sierra Leone was a lost cause.
t3_2100tm,cg8cadv,"Today they are a democracy, and although still very underdeveloped, they are starting to see foreign investment come in, and a slow transition from subsistence agriculture to cash crops."
t3_21006g,cg8jacm,"One very good friend, let's call her Ashley, told me, knowing that I was a Christian, that she liked that her parents encouraged her to choose her own faith even though they didn't hold any formal religious beliefs."
t3_21006g,cg8jacm,"He could tell her that, although the Western tradition is not the only musical system in the world, he believes it is the most beautiful and that, because she will have exposure and training in this tradition from a young age, she can be free later in life to combine that training with any number of other influences, and that, even if she decides that Oriental or African music is better, despite being jarring to her father's Western sensibility, at least she was able to make an informed choice."
t3_21006g,cg8jacm,"Even though it was the Egyptians that they were fleeing, Augustine says that the gold was still useful; just because it was their enemies' gold doesn't mean it doesn't have any utility."
t3_21006g,cg8jacm,"Instead, one should, with a thoughtful and critical eye, use what can be used."
t3_20w0tt,cg7r3mc,Here's the thing though.
t3_20smoi,cg6ejad,"I honestly thought players just ran around doing whatever until someone passed the ball to them, at which point they'd shoot."
t3_20s5x9,cg68rlg,while gamers who've been playing from childhood would know that without a second thought.
t3_20mxh2,cg5k6xt,"Also a different line of thought, if you make fines proportional to income, wouldn't it be easier for rich people to higher a driver for minimum wage and offer to pay all of their tickets and tell him to speed rather than pay 10% of their income?"
t3_20madh,cg4rj03,"Although there is no single major discovery, these are literally hundreds of experiments and research projects that can ONLY be made on the ISS or an equivalent space station."
t3_20iv9v,cg44wwu,"That way, you'd have a much fairer referendum, although ideally it should still be held in, say, 2016, providing a greater amount of time for debate."
t3_20iv9v,cg44wwu,"Although, the vote in Scotland will not include a devo."
t3_20iv9v,cg44wwu,"That way, you'd have a much fairer referendum, although ideally it should still be held in, say, 2016, providing a greater amount of time for debate."
t3_20iv9v,cg44wwu,"Although, the vote in Scotland will not include a devo."
t3_20i4lp,cg3j6v8,"Lightweight though it is, this could be argued to be an ideology."
t3_20er8m,cg2orrj,Jeremy Bentham said it well I hope you feel compassion for the suffering of animals and recoil at the thought of being the cause of their suffering.
t3_20er8m,cg2qfx4,"AKA subjective, though I suspect you will make an argument about how they are different."
t3_20c7cz,cg1tdlz,I suppose I might have heard incorrectly though.
t3_20bc4h,cg1q9b0,"Most of them have parents who are involved with them, even though the clients live at houses that we maintain."
t3_20ad2g,cg1bd5n,"It costs more than your average federally approved childcare facility, but she thought it was worth it."
t3_2067hy,cg0fxc1,URL Just some thoughts.
t3_2067hy,cg0fxc1,URL Just some thoughts.
t3_2055ga,cfzvkk2,"Even though I can't speak for all ""Republicans"" I do agree (generally) more with their political platform than the Democrats, so let me do what I can to briefly clarify my views."
t3_1zje7a,cfu72o5,I think the problem is with your thought process.
t3_1z75tg,cfr6098,"I've never thought of a muffin as being healthier than a cupcake; muffins are generally much bigger, so they're way more calorific, and don't necessarily have healthy ingredients."
t3_1z607l,cfr2k30,"It doesn't seem like you are being prejudiced though, because as you say, you ""have absolutely no prejudice with Indians"" and the only issue you have with them is when you are bowling next to them."
t3_1z0efm,cfpdbjr,"Even though, like many other issues, it is interpreted differently today than it was twelve-score years ago, that doesn't mean that today's interpretation is useless."
t3_1yqbtv,cfnjhfp,"To say that one is arguing semantics is to say that we don't agree on what certain words mean, which is a bit like aiming each others' thought processes at the wrong targets."
t3_1yoc2s,cfmyafl,It makes the stereotypes not very useful even though males do share traits.
t3_1yf0hw,cfk3g6w,"Sometimes though it takes a few pages to build up to those epic lines, dialog and scenes that we all remember In the book."
t3_1y8r7h,cfibir3,"The full thought is that you might not know the whole story, so don't let your biases keep you from thinking things through."
t3_1y7dly,cfi99ou,"Although, if this is the case then these competitions would no longer be inter-subjective since changing judges to those of a different country would yield different results."
t3_1y6r6n,cfhzeok,It can still be comforting though.
t3_1y0z80,cfgd9sg,"Even though it sometimes doesn't seem like it, the roads are a complex system that must be managed as such; letting everyone do what they want is only inviting accidents."
t3_1y0q8w,cfidch8,Also - I thought you haven't really argued that early transfer to hospices is murder :P
t3_1xzf7d,cffzjhg,"On an individual level, though, my duty is to myself and my family, not anyone else."
t3_1xzeag,cffzfv6,"I agree with your principle, though, that there are plenty of 8 year olds who are just as capable of making decisions like that as many adults that we grant the right to."
t3_1xx4hd,cffe6q8,"It gains visual richness, but at the cost of loss of plot, character introspection/development (it's almost impossible to portray a character's thoughts in a movie), and complexity."
t3_1xowzb,cfdbx3c,"Different neurotransmitters and other completely biological molecules change your mood, thought process, alertness, etc."
t3_1xowzb,cfdbx3c,"So, * Your mind is constantly being tampered with and being changed by completely natural things and processes * This means that the effects of recreational drugs are just similar (although often more intense) processes that occur in the brain as a result of drug use * Since the line between drug and natural substance is so blurry, there is nothing inherently wrong with drugs or using them (they're not evil or unnatural) So by these definitions, caffeine and sugar could be considered recreational drugs, considering we often use them to achieve a specific state of mind (alertness)."
t3_1xowzb,cfdbx3c,"Different neurotransmitters and other completely biological molecules change your mood, thought process, alertness, etc."
t3_1xowzb,cfdbx3c,"So, * Your mind is constantly being tampered with and being changed by completely natural things and processes * This means that the effects of recreational drugs are just similar (although often more intense) processes that occur in the brain as a result of drug use * Since the line between drug and natural substance is so blurry, there is nothing inherently wrong with drugs or using them (they're not evil or unnatural) So by these definitions, caffeine and sugar could be considered recreational drugs, considering we often use them to achieve a specific state of mind (alertness)."
t3_1xml8r,cfcvgy3,"The consequence of that, though, is that the life expectancy of someone at retirement can't possibly go much higher than 1/5 of one's working life."
t3_1xml8r,cfcvgy3,"The consequence of that, though, is that the life expectancy of someone at retirement can't possibly go much higher than 1/5 of one's working life."
t3_1xj5t3,cfbsvrz,"Even though 99.9% of businesses wouldn't have an issue with that, the fact that one group is treated special over another is the problem."
t3_1xhrpt,cfby4iv,"I guess the long top at the top is very comprehensive and although there are certain sections of it which I disagree with, most of it is true."
t3_1xhrpt,cfby4iv,"Women were treated waaayyy differently for centuries and Islam did a lot to raise their status, although I would not say they are equal, I would say they have a different set of responsibilities."
t3_1xg9o8,cfb8rco,"The accidents will have trials, you can't just give teachers immunity for prosecution if the gun they are responsible for kills an innocent student due to their neglect, that would never be upheld by a court (sorry little johnny was killed because Mr. Suckswithguns thought it would be fun to play with what he thought was an unloaded gun while the students were testing, but because he's a teacher he can't be sued and you'll just have to carry the burden of knowing that Johnny's sacrafice made the world safer... seriously not going to fly for public opinion)."
t3_1xg9o8,cfb8rco,"News stories about settlements being handed out, and teachers going to jail for shooting their students (even though it was negligent), would make people go ""Wait you mean the people I trust with my kids suck with guns..."
t3_1xg9o8,cfb8rco,"I'm not saying it wouldn't save more lives then it would end, I'm saying all you need is a few accidents (which will happen) and suddenly all you will hear about is the armed teachers who shot students on accident, and with the drop in school shootings, the only thing people will remember is the presence of guns in these schools is killing kids, not saving them, even though the exact opposite may be true."
t3_1x9drc,cf9drsg,"I don't think what's going on here is really that you are realizing women can it be trusted, although that's what it may seem like."
t3_1x9drc,cf9drsg,"Instead, what I see is an individual who is experiencing a crisis between two contrasting thoughts: 1."
t3_1x5wrj,cf8h4zs,"That said though, while such studies like the one cited provide interesting information about general differences between the sexes, how can such information really be applied anywhere?"
t3_1x44be,cffje6e,"With my new phone I think it'd be easier to turn off GPS myself, though I haven't tried."
t3_1x44be,cf7ynno,"Really though, it should be because you have a need for that constant connection."
t3_1x3quk,cf811b2,"Although what exactly constitutes over sexualization and if women are more sexualized on reddit than elsewhere is up for up debate, that's your opinion and you're entitled to it."
t3_1wvths,cf5zw0f,"Although I am convinced none of those tests: graphology, psychometric, projective or other profiling, give the expected results, they have indirect benefits so can't be 100% ditched."
t3_1wmoca,cf3fxbx,I will say though that I'm not of the mind that university should be solely about 'getting a job.'
t3_1wjljf,cf2l6xd,Also to address your second point: When do you think humans thought more critically than we do now?
t3_1wi4dg,cf26fvv,"Can't argue with you on homosexuals, though."
t3_1we5ye,cf1drrq,"Falling over is much more dangerous than staying upright, so even though it is unlikely for me to fall, it is better to keep moving."
t3_1we3gg,cf1mnjk,"You have a lot of good points, though, I'll give you that."
t3_1we3gg,cf1mnjk,"You have a lot of good points, though, I'll give you that."
t3_1wdil8,cf1etgp,"Nothingness is not better, though."
t3_1wdil8,cf1etgp,(I was going for the argument I thought would be most common.)
t3_1w91jl,cf0javl,"It should also be noted that the music of mainstream America could also be seen as frequently demeaning to women, though perhaps less blatantly."
t3_1w84rh,cezjtaz,"i usually hear queer in the term ""gender queer"" which is (as far as i understand it) not identifying with your gender, though not really identifying with the opposite gender either."
t3_1w6uhl,cezh5ah,"Chinese adoptions, even though they're overseas, are often more affordable and ""safe"" to the adoptive parents than American adoption."
t3_1vpp6t,ceuld78,"I can understand wanting scholarships for people with conservative principles (which already exist), but I don't think we should award any kind of affirmative action (though I'm against affirmative action of any kind except for low socio-economic status)."
t3_1vougq,ceudmfn,"[And I have to pause to ask, if you really think that it's a good idea to take an 18 year old with no training who is there under duress getting paid minimum wage (even though if they had been working through school they might be making more) and put them with vulnerable people needing a social worker? ]"
t3_1vhh7b,ceso4j1,"There would also have to be an entirely new authority system for working on local roads, though I suppose that is a bit easier."
t3_1vhh7b,ceso4j1,"It would probably cause some unemployment, though."
t3_1vhh7b,ceso4j1,"The whole process can't be instant and total, though."
t3_1vhh7b,ceso4j1,"What about the state and local levels, though?"
t3_1vbtut,ceqwdz5,"If the minute hand is still at the 59 minute point, but at a glance it looks like it's pointing straight up then my reading of the time would be 2:00, even though the actual time is 2:59."
t3_1v8vbr,cepzl4s,"The point is though, the person has the right to not have their life taken away, specifically without a justifiable reason."
t3_1v5dnm,ceovlgt,"Even though they might help weed out bad teachers, other problems may arise."
t3_1v37km,ceoakgs,"A downvote brigade doesn't thoughtfully engage or attempt to change an underlying idea or prejudice, it just tries to yell really loud and drown out the speaker."
t3_1uy8ez,cemun5t,The thing about science though is that the fields cross over.
t3_1uw88g,cematy2,I am sure many people had the same thought about the revolutions in Libya and Egypt... and yet...
t3_1uhnsm,cei83kz,"In my experience though, I just keep finding little areas where that knowledge did make a huge difference and was certainly worth the effort."
t3_1uhj8f,ceim6kr,"For example, it's thought that one of the functions of having a conscious mind is the ability to picture in advance how other people see you, and how they will see you if you do certain things (""how will people respond if I say X?"")."
t3_1uhj8f,ceim6kr,"We can create all kinds of very complicated thoughts, but then to communicate them to someone else we have to resort to very low-information density mediums, like text or speech."
t3_1ueayk,cehtd0e,"Perhaps if I fell in love with a woman who was gung ho and I thought she would make a good mother, I would have a kid."
t3_1twxa7,cecflca,"Although there is deliberation involved, it's not an effect of the media itself."
t3_1twxa7,cecflca,"It influences, even when it's as simple as a food advert, or a thought of opinion upon an event."
t3_1tt75b,cebecvh,"I'm not against physical contact in sports though, all my favourite sports have it."
t3_1tqttm,ceakm2y,"It is is an effect nonetheless though, and if you'd ever looked up the statistics on how many entire animals the average human eats in their lifetime, you'd realize that it is much larger than you probably think."
t3_1tqttm,ceak6vp,"I am not one of the ones who think that consumer power is an effective tool though, I believe in direct action."
t3_1tqttm,ceak6vp,"A lot of ethical vegans are also anti-capitalism though, and oppose the treatment of the workers you mentioned."
t3_1tqlde,ceahwfu,"This creates a conflict for the child because just as they are learning to distinguish fantasy from reality, adults throw a curveball and tell them ""well, even though this LOOKS like fantasy, it's actually real and some day you'll get to see Grandma in heaven."
t3_1tqlde,ceahwfu,"In the end, you'll make them a better thinker and you won't have to stifle creative imaginative thought to do it."
t3_1tqlde,ceahwfu,"They are not interchangeable concepts, even though they are related psychologically."
t3_1tpqhr,ceaei9g,"We'd need alternatives to road transport figured out first, though, throughout large parts of the United States, and we'd need to already have other incentives pushing large numbers of people to denser areas where public transit is viable."
t3_1to7tw,ce9wfe0,"It may be more correct to say that the societal worth of a person is equivalent of the total wealth produce, though even then this wouldn't be totally accurate."
t3_1tns6s,ce9s0mv,"Obviously, though, you can't spend ALL your time off."
t3_1te39z,ce71ql3,"This is why I would call myself an atheist, and not an agnostic, even though I technically am."
t3_1t9irv,ce5r69v,That's why Catholics have all these holidays celebrating saints and why Catholics venerate saints even though saints aren't referenced in the Bible at all.
t3_1t8yrt,ce5jxeb,The reason why execs haven't just gone to that type of model though is it reduces their profit margin.
t3_1t5izv,ce4oagv,Is it really though?
t3_1t1i45,ce3g5h1,"Most of the complaints are about the 2-3 minutes un-skippable ads on YouTube though which is a extreme annoyance for most people, as well as ads which play during a video."
t3_1t1i45,ce40luw,I'm at the opposite end of the spectrum though advertising is such a small part of my income its basically non-existent and is too inconsistent for me to bother with compared to the much more substantial income from subscribers / Record companies
t3_1t0eax,ce36rhk,"And although you may consider it to be unimportant whether two people who love each other are allowed to marry or not, a large number of other rights (as has been mentioned in several other replies) are conferred by marriage, including insurance, pension, visitation in hospitals, etc."
t3_1sv960,ce1punh,"These people, whoever they are, a classmate, a former friend, a colleague, whatever, they put conscious thought into seeing bad things about you."
t3_1suyq6,ce1i6wn,"- I have to say I am puzzled when people love fan fiction where the main canon characters are majorly OOC, though, because, honestly, I read Fan Fiction about those characters because I liked their canon selves, so why would I a WANT them to be different?"
t3_1suyq6,ce1i6wn,"- I have to say I am puzzled when people love fan fiction where the main canon characters are majorly OOC, though, because, honestly, I read Fan Fiction about those characters because I liked their canon selves, so why would I a WANT them to be different?"
t3_1sgr9m,cdxioq6,How big is big enough though?
t3_1scv1e,cdw9st7,"true dat, its not alcohol's fault though, its the idiot who doesn't know their limits or the asshole that's pushing a newbie to drink too much."
t3_1sclwf,cdw6eku,I know there's something a little deeper that comes with biological maternity (and paternity to a slightly lesser although definitely legitimate extent).
t3_1s94cq,cdv5luo,Finding philosophies and such that are consistent but on the surface surprising hardly seems like a problem though.
t3_1s6w43,cduuorr,"Well, I haven't devoted a whole lot of thought to the Native American thing, but I've heard the argument that there should not be scholarships for black people because it's unjustly giving black people something because we feel bad about slavery."
t3_1s3pxw,cdtmrcr,"First, you need to qualify it with ""The religious people I work with ..."" Second, do you honestly think they are incapable of logical thought?"
t3_1s3pxw,cdtmrcr,So at the most you can say the don't understand some logical thought.
t3_1s3pxw,cdtmrcr,"First, you need to qualify it with ""The religious people I work with ..."" Second, do you honestly think they are incapable of logical thought?"
t3_1s3pxw,cdtmrcr,So at the most you can say the don't understand some logical thought.
t3_1rkrbs,cdoe2j3,Being a stay at home mom wasn't something I ever thought would be me because it's not something I'm used to.
t3_1re89d,cdme68p,What are your thoughts on replacing social welfare programs with something like a form of Basic Income?
t3_1re89d,cdme68p,"I'd like your thoughts (and others), and there's /r/BasicIncome if you're interested in more information."
t3_1re89d,cdmhgib,"As time goes on though, salaries for desirable jobs would lower and the salaries for undesirable jobs would go up, as they should now, but with more dramatic effect when 'noone' needs to work."
t3_1qz653,cdiiqug,"For example, Rothkos works have a pretty high dollar value, they've motivated a lot of useful thought and discussion, and from what I understand (I don't have the skill to judge myself) his later work actually is obviously executed with clear professional skill and experience."
t3_1qz653,cdiiqug,"For me, Rothko's works helped open up these avenues of thought, basically for the same basic reasons you've started this discussion."
t3_1qz653,cdiiqug,I've found this line of thought to be very useful to my perception of the world.
t3_1qy1k7,cdhqdd4,Say I decided to learn Konkani because I find it interesting even though it will NEVER have a practical use in my life.
t3_1qwdul,cdhesw0,"I saw URL on /r/bestof a month ago, and I thought it was a really good read... it shows how much confidence is something that just naturally radiates in a way that is at the same time subtle, intangible, difficult-to-describe, and yet totally real and noticeable."
t3_1qw6q4,cdhrw21,"If you replaced 'heteronormative' with 'typical' in that sentence, although it would remain true, it would lose its specific meaning."
t3_1qo0aj,cdepoj6,"The main thing is though, it just feels like cheap storytelling."
t3_1qj48o,cddkk2y,The thought crossed my mind that maybe everyone would be better off if we offered to painlessly euthanize any of these individuals who voluntarily decided they no longer wanted to live but didn't want to go through the pain of actually harming themselves.
t3_1qj48o,cddkk2y,"The more I thought about it though, the more it seemed to not be that crazy after all...sadly."
t3_1qhv03,cdcy1h9,You are definitely not alone in this thought.
t3_1qgtma,cdcq77q,"Clearly the internet gives us mental stimulation that is unheard of in previous generations, and although I can't quote the exact study, it's true that pleasure chemicals are released in your brain every time you get a 'Like' on Facebook or a new follower on Tumblr, which can lead to the addiction you talked about."
t3_1qfy2y,cdcikj0,Also I don't think Martin directly calls Brienne ugly or homely although he may describe her with features we think of as ugly or homely.
t3_1qdzt5,cdbwdog,"Although most social groups are composed of average intellectual people, there are groups that are highly (or at least more ) selective for intellectualism: it could be argued that this subreddit (/r/changemyview) is slightly more selective for intellectual behavior than Reddit as a whole."
t3_1qdzt5,cdbwdog,"Thus, you are right, even though the bulk of Reddit is much closer to the baseline, there are subreddits that are farther deviations toward intellectualism than the baseline."
t3_1qdzt5,cdbwdog,"Although the Dunning-Kruger effect is real, it has opposite effects as well: http://en.wikipedia.org/wiki/Impostor_syndrome In fact, many of my friends in doctoral programs face the opposite of Dunning-Kruger; since they are intellectual, they are much more aware of all the things they don't know: they're aware that the knowledge space is far bigger than someone who doesn't know anything at all and thinks the knowledge space is small because they only have a small glimpse of it."
t3_1prkvt,cd5tpwq,"I personally think that this doesn't solve the real underlying problem at all, though."
t3_1pp78v,cd4kcgh,Because there's a good chance they haven't tried anything (even though they think they did) or things will look better soon (even though they think they won't).
t3_1pgfdi,cd34jgz,"As an attractive woman, though, I will tell you I get just as much of this in jeans as a tshirt as otherwise."
t3_1pfnlc,cd1u8uf,"I have several thoughts 1) I think the biggest problem in America is we think we are inherently amazing, but the truth is, we were the only large industrialized nation that didn't get all our factories blow up in ww2."
t3_1pet7o,cd1m5vz,I still disagree though that making things explicit makes it harder to understand the law for anyone - the only thing outlawing specific things does is clarify and codify what courts may have already ruled anyway.
