thread_id,comment_id,context
t3_29pjwk,cincqfj,"the problem here is a simple one of equivocation the primary issue is that ""authority"" in the common sense consists of people who have the capability to lie induction is based on independently confirmed observations over the course of as many trials as possible so far, we pretty much know that gravity is gravity because so far, while on the ground on planet earth, we have not observed an apple falling up a person who is considered an ""authority"" can say he's seen an apple falling up, and that's quite a different matter than whether or not apples actually fall up on a regular basis and that this fact could be independently observed and confirmed by multiple parties in multiple trials across the planet while it's entirely possible that one person may lie about apples falling up, it becomes (usually) increasingly more and more unlikely that people are lying when multiple independent sources attempt and observe the same phenomena when subject to a panel of people (peer review) who usually by and large would like nothing more than to prove someone else wrong science is self correcting... when ""I tried it a thousand times at a hundred spots across the globe and so far apples don't fall up, so I think you're full of shit"" is the response that comes from dozens or hundreds of different people, you can be fairly (although of course not 100%) assured that apples do not fall up and that gravity behaves as we more or less expect of course you are free to believe that apples fall up based on the evidence that there is a logical fallacy known as the appeal to authority and that you are effectively taking these people's word on the situation and so hundreds of people may be involved in a mass conspiracy to delude you - but I'd pretty much say that's at the very least counter productive, and at the worst kind of stupid in fact you are welcome to try your own experiments to let go of apples and see how many of them fall upwards (pending approval of funding of course), but my guess is that you will observe that they do not fall up and that if you do observe that they fall up there is one of several explanations, either you may have indeed found an anomaly (the least likely) or you are on drugs, or you simply have confirmation bias - and confirmation bias is a primary reason that things like peer review exist, because a person like yourself might not believe the status quo and may wish to try for themselves, and you are welcome to do so, and if you can provide a way for other people to also challenge the theory as you did, and also do the thing, and also see the same results, then maybe you've found an anomaly otherwise you're just crazy - of course you may simply be narcissistic and think that other people are not real or some such other oddity and so their challenges and retesting of the experiments don't count because they're all out to pull the wool over your eyes, but that would basically be psychosis if I've got my terms correct, and you would in that case be suffering from an equally problematic situation in which you think you are, but you are not, an authority"
t3_29pjwk,cind88i,"well, you have to draw the line somewhere, it's not appeal to authority in the same sense or in anywhere near the same capacity that ""appeal to authority"" as a logical fallacy is meant to be understood ""appeal to authority"" is more along the lines of ""bob is a mechanic and he says I need new blinker fluid"" - wheras inductive reasoning is more along the lines of ""thousands of scientists, myself included, have attempted this well documented and replicable experiement procedure and most of us, but not all have observed the same results"" pick your side, pick your battles - just because 1% of people saw apples fall up, even if they really aren't lying, doesn't mean that really changes the fundamental fact that most of the time you and everyone else notice that apples generally fall down you can't completely eliminate cognitive bias, but with the scientific method we can get about as close as possible to doing so and about as close as possible to a present time understanding of the truth having beliefs, that are based on the best available current evidence, that are open to change when presented with compelling new evidence, is about as much as you can do if you want to call that appeal to authority, then ok, but you've gotta draw the line somewhere as to who to believe and when, and peer reviewed science, though not infallible, is about as close to the best option a person has"
t3_29o0d3,cip76q7,http://freethoughtblogs.com/entequilaesverdad/files/2013/07/carl-sagan-wonder-of-universe.jpg Or this has often been seen on /r/atheism I don't really care enough to dig deep and find examples.
t3_29o0d3,cip76q7,http://freethoughtblogs.com/entequilaesverdad/files/2013/07/carl-sagan-wonder-of-universe.jpg Or this has often been seen on /r/atheism I don't really care enough to dig deep and find examples.
t3_29n4wo,cimjv32,"Like I said, there are misunderstandings - what if you just thought that someone was eating peas one by one?"
t3_29n4wo,cio9nnh,"It's still quite socially taboo, and though I'll probably take heat for this, I tend to notice most people are far more accepting of gays/lesbians/whatever than they are of polyamorous people."
t3_29koa9,ciluvuu,"There are plenty of shots on goal, even though most of them are saved."
t3_29koa9,ciludrx,"It really isn't random, though."
t3_29koa9,cilut8k,"Sorry, I thought I'd take a separate comment to reply to the things that bug you (I was already writing too much) Just like in football, accidental contact can still get punished the same way that it can in soccer."
t3_29d178,cijpsrq,We _cannot_ be thought of as the gatekeepers for valid people.
t3_28yh06,cig4wo1,Maybe Taker wanted to lose to a legit fighter (even though it was a WWE match).
t3_28xbw7,cifjy3z,"As it stands though, there is little transparency in this sector, so when someone finds out something like: URL It's bound to leave a sour taste in the mouths of the donor."
t3_28k1k9,cibnrkr,"The only things that keep the situation now from resembling what you describe (though I think we're as close a practically possible to what you describe with the current system) are the upswing of federal power, the general incompetence of present state governments and heavy gerrymandering of electoral districts."
t3_28k1k9,cibtpvd,"We live in an era when the thought of a war between major powers is nigh-on unthinkable, why would creating a situation where it was likely be a good thing?"
t3_28if5j,cib9fxp,"Although that kind of supports changing the name, I just want to point that out."
t3_28if5j,cibarlj,I thought it took effect immediately.
t3_28b3qa,ci9axta,"If you don't have answers to these questions it will be difficult to discuss your views very thoroughly, so hopefully it provides some food for thought."
t3_28at68,ci95fk4,"I'm not an expert though to be honest, so maybe there is an explanation."
t3_28a5fu,ci9bvft,"(But the type of jealousy that comes from wanting what you don't already have or thought you had is usually called ""envy"")."
t3_28a5fu,ci9bvft,"Actions are proof of what you believe, thought are not."
t3_286wmt,ci817z2,"It can work, it's just that it requires a lot of forethought, which is hard to do when you're basically a mob of people instead of a unified order."
t3_281bde,ci6f2vp,"It's not sacrificing your career though, it's only sacrificing this particular job and switching your career onto a new track."
t3_27w5po,ci4zmff,"My thought is that the closing of Beer Stores and allowing convenience stores to sell alcohol, we'll end up with a better overall experience."
t3_27r91j,ci3qcct,Although many places allow you to smoke ecigs inside where I live people often go outside to curb confusion and also just out of habit.
t3_27r91j,ci469aj,"Even though a friend of mine routinely told me ""you stink"" every time we hugged, I always thought he was referring to a small effect."
t3_27r91j,ci3s6fn,And here I thought this stuff was just the plot of that friends episode.
t3_27lmyu,ci25ehz,"I think what you see instead and call ""hatred"" is an extreme frustration with people and an institution that is fundamentally based on the willing suspension of rational thought in favor of feel-good thinking."
t3_27lmyu,ci25ehz,How can you trust someone who's basic thought process is so drastically different from your own?
t3_27lmyu,ci25ehz,How can you trust someone who doesn't have logic and reason as the core of their thought process?
t3_27lmyu,ci25ehz,EDIT: I thought about this a little more while in the shower (where I always do my best thinking!)
t3_27jl8c,ci1ybru,"History is being rewritten to make sure the Party was right all of the time, you don't have any privacy, and to have your innermost thoughts dragged out of you."
t3_27hf7o,ci1a4gk,"Should they all be compensated evenly, even though some of them obviously lost more than others?"
t3_27hf7o,ci1a4gk,"If not though, then how do we decide?"
t3_27gnxb,ci0ta3o,"Even though many have read the Hobbit, I doubt they are likely to pick it up on a regular basis."
t3_27dypa,ci0bdgm,"If Jessie sees Jamie fall and hit their head on a rock - let's say for the sake of argument that Jessie knows Jamie has a concussion - then proceeds to have sex with Jamie even though they know Jamie would never consent to it otherwise, that's rape."
t3_277y4m,chydb1h,I do think we should restrict their speech when it comes to ballot initiatives though.
t3_277x8k,chyttqk,"At this point the extra money, although nice, I would rather focus increasing my earnings at a company and job I enjoy."
t3_276tlp,chy7sh3,"So I've had a Google Glass for a few months now, so I'm going to try to address some of your thoughts the best I can."
t3_2766rt,chxu2ly,"Like a lot of problems in Christian theology, though, it is usually dismissed by the faithful with some kind of appeal to faith - usually something like ""I believe in a good god, and part of my faith in God is the faith that what He does is Good and doing what he commands is therefore Good - to question his work would lack faith in his goodness."""
t3_274620,chxaxd7,"People there honestly aren't that in favor of Obama per se, just opposed to Obama-bashing, as though he were the source of all problems in the U.S. government."
t3_273kmd,chx2j8z,It could be that we have more different societies than I thought; typically here it is rather looked down upon to be noticeably drunk and not functioning properly.
t3_273kmd,chx2u1h,None of this really changed my view though.. it was exposure to people within casual drug culture that did.
t3_26zc51,chwc4g5,"Although this disparity exists among adults as well, it is not nearly as universal."
t3_26z994,ci473oh,"The reason I 'encourage this fear' is that, although the sense that I was/am small 'prey' starting developing in my late teens, it didn't actually hit home until after I was sexually assaulted."
t3_26z994,ci473oh,"I genuinely believe they thought I was, they actually didn't realize my 'no' meant: 'I don't want you take my clothes off."
t3_26z994,ci473oh,"Now, though, I can keep a cool head when I'm terrified."
t3_26wd6r,chv5dr8,"As these girls grow up this message is constantly reinforced, so by the time they are old enough to analyse it as you have, it is too late for many of them and they already have the negative thoughts formed."
t3_26vy78,chv29xs,"Although neither the leather jacket on a warm day nor the glasses have practical uses, they serve as forms of self expression."
t3_26ua0u,chujiwj,The Penis In Vagina article is so utterly bizarre and absurd I honestly thought it was a joke.
t3_26rjpu,chttc3y,"You might have a few though for services like hotel shuttles, etc."
t3_26nhjw,cht4pkp,"There once was a fellow whose thinking Was somewhere near ""poetry's stinking"" They thought that it covered Just hardship and lovers But I'd love to know what they were drinking."
t3_26nayb,chssa9d,"I'm wondering, though, if you want us to change your view on what misogynistic behavior is or to change your view that your behavior is justifiably off-putting to women?"
t3_26nayb,chssa9d,"If I don't like a black person and I call him a ""stupid nigger"" around strangers, I'm sure it would sounds absolutely racist even if the reason I hated him is because he did something unrelated to his race; like he hit me or I thought him a bad person."
t3_26klj1,chs03g4,All these causes though can be undone with effort and time.
t3_26klj1,chs03g4,These types of people can be worked around though.
t3_26klj1,chs03g4,"They did managed to achieve that goal though, and pretty quickly, because they kept working at it."
t3_26klj1,chs24pt,I do not substantially disagree with your main point (although your take on it seems a bit negative to me).
t3_26klj1,chs24pt,"I would like to address what you say here though: This part is often untrue, and seems a bit pessimistic."
t3_26klj1,chs24pt,My point is fairly specific though; just because someone experienced truama in their family does not necessarily mean that it will be reflected in their own parenting style.
t3_26chd9,chpu05i,"More often than not though (at least in my experience, which is limited), the other party just doesn't listen."
t3_26chd9,chpu05i,"With regard to the media though, yes."
t3_26chd9,chpu05i,"I don't know whether this is the fault of the economists though, or of the media."
t3_26b7qy,chpe7k0,"It worked well for Reagan's years even with his enormous Cold War spending, although I'm ill-equipped to argue that it'd work for us now."
t3_26b1l1,chpkxvq,"It isn't biologically or intrinsically real (even though we tried to find its 'location' so to speak) and it shouldn't matter, but thanks to the actions of the past (and present) it continues to be real."
t3_26b1l1,chpkxvq,These erroneous thoughts have consequences.
t3_264xi6,chnu7dr,It's the most time-consuming job (though there's an argument there).
t3_264iek,chnlkj6,"The word ""honorary"" basically means ""fake"", though with a very positive connotation."
t3_26388i,chn9wjm,"Finally, if caught they are sent though the legal system which wastes even more of their money and, if jailed, lessens their prospects as a productive member of society, putting them deeper into the hole."
t3_25yudb,chm0wl0,Maybe Kafka thought his works weren't great.
t3_25x7qp,chlltit,"Even though you don't personally understand how people can feel that way about sex, the fact is that people DO feel that way, and you should not label their activities and feelings as immoral simply because you don't understand them."
t3_25ttah,chknoam,There are times we have sex and I feel as though it's more conversational in that I am relaying how my feelings in a way I could not with words.
t3_25pnxw,chjirvh,A popular school of thought is that people who are scared of clowns are scared of child molesters.
t3_25k2ud,chi2ugu,"Crash won an Oscar over Brokeback Mountain (though it grossed significantly less) despite (or perhaps because of) heavy-handed, saccharine moralizing."
t3_25gqr3,chh26by,"I myself am agnostic at best, but I can accept religious people now (and I remember when I had a phase when I would have thought that r/atheism was the best thing ever)."
t3_25gqr3,chh8rrt,This would necessarily require a violation of the 2nd law of Thermodynamics (though admittedly the conditions of pre-big-bang universe have not been replicated in the lab).
t3_25e9jx,chh1vkr,"First, when Maurice (Belle's father) first shows up and says that there is a Beast that kidnapped his daughter, Gaston's only thought is to use it to have Maurice committed."
t3_25e9jx,chh1vkr,"Even though he is an avid hunter, he has no interest in killing the beast until he understands that he is a rival for Belle's affection (and until after the plot to have Maurice committed has begun to fail)."
t3_255hmb,chdweq6,I wouldn't do it because you are scared of your own genes though.
t3_254zub,chdse4g,"The thing about burger shops is you'll actually find that most, though not all, localities do have rules regarding congestion and distance between buildings, not so much as to the purpose (though there are some contracts like with stores in Malls, or Universities where that has been negotiated), but to the existence?"
t3_24w84s,chb9ik2,"'Really, I think Z about Y issue' 'Well you should check your privilege' It assumes that the person hasn't thought about the issue from any side other than their own which is quite insulting for people who have."
t3_24w84s,chb9ik2,And by that same brush (assuming they haven't thought) sort of does discredit their opinion: because prior to being told to 'check their privilege' they'd clearly completely forgotten to think about this issue in any depth at all.
t3_24v4li,chaxo0c,"But I do think it's possible, though difficult, to remove oneself (almost) entirely from the deaths of animals."
t3_24v147,chbavh7,"When the woman asked the teenagers (this happened more than one in more than one conversation with different teens) what they thought of these interruptions, the teenagers always answered ""what interruptions?"""
t3_24v147,chbavh7,"They viewed their actions as normal (and not rude, though it was rude to do so)."
t3_24v147,chbavh7,"Everybody needs to hear my thoughts, see my face, and see my my my me me me."
t3_24v147,chbavh7,"Thank you for taking the time to read the post, though."
t3_24uvqn,chbpy2d,"Maybe instead of pushing for earlier human testing you should be thinking pharmaceutical companies should be made more aware that animal models aren't necessarily accurate so they shouldn't ditch drugs that cause non-fatal side effect, especially if the drug shows exceptional promise in treating the disease (although I wouldn't be surprised if this was already the case)"
t3_24sel2,cha7e4s,People do not generally get into the arts because they love money though.
t3_24sel2,cha7mba,"They often realize this mistake though, and supposedly dead forms sometimes re-emerge."
t3_24se6g,cha8lpp,"Property taxes are best thought of as a ""user fee""."
t3_24sb0f,cha6mi6,"Below this you can drive legally, even though you've been exposed to alcohol/have it in your system."
t3_24mzo8,ch8txh7,That's beside the point though.
t3_24mdbl,ch8og6w,"They actually need to use them thoughtfully, and with supporting discussion that clarifies why their comparison is not just intended to evoke an emotional reaction and shut down the conversation."
t3_24mdbl,ch8og6w,"Indeed, if I were discussing medical ethics, it would often be very useful to thoughtfully bring up the Mengele experiments as examples of reasons why we might not want to engage in certain types of experimentation."
t3_24io3e,ch7na38,"I think your thought is good, but the argument is poor."
t3_24dj00,ch62yhy,"To answer your main question, though, there's not really a need for cis in general conversation."
t3_24dj00,ch63o4o,"As do I, although usually silently and to, hopefully, no great effect on my behavior."
t3_248s83,ch4snfe,"Did you consider the vaccine a human right prior to its approval in males, or like so many in the debate, thought it opened the door to willy-nilly recreational sex as apparently these birth control pills do?"
t3_2480nm,ch5g781,"People also love other Disney films and I wouldn't say for example that Alladin is overrated event though I prefer the Lion King myself (not by a great distance, but still)."
t3_245y6b,ch3yug9,"I definitely agree mobile speeds will increase, though."
t3_245y6b,ch3yug9,"Providing a lot of data like a mainstream ISP would, though, is very unlikely to happen."
t3_24509o,ch3osvi,"The United Nations, though sometimes ineffective, is yet another point preventing wars."
t3_23xw5n,ch1nret,":)); I consider myself fortunate, reasonably, though not wealthy by American standards (I have a car made in a post-2010 year, albeit a Fiesta.)"
t3_23xw5n,ch20pmq,"That's not really hate, though."
t3_23wvv9,ch1dvsg,"Technically speaking this doesn't rebutt your argument since it applies only to the current state of things, I thought my perspective might be of interest."
t3_23r9b4,cgztw3a,"Coercion, though, that seems like something that shouldn't affect your viewpoint, even if it affects your actions."
t3_23o885,cgz4djl,"The only way the U.S. would ever have the political will to get rid of the military would be if every other country in the world did the same first, and even then, I doubt we would decide to do that, though we would probably make significant cuts to military funding."
t3_23o885,cgzb7st,"At least among the political scientists I've read, it's basically a universally accepted fact that U.S. military dominance is a stabilizing/pacifying influence in the Western Hemisphere, though to be fair all of them are American political scientists."
t3_23o885,cgzb7st,"We didn't go to all-out war, though; instead, we reinstalled the Shah through a coup d'etat, and used him for our own interests."
t3_23o885,cgzb7st,"Even though some right-wingers still say that war wasn't about oil, members of the U.S. government all the way up to Secretary of Defense Chuck Hagel have admitted that gaining U.S. oil companies access to Iraq's oil was mostly why we went in."
t3_23lqtl,cgybkki,"It needs to be defined in such a way that it does cause physical events, which means the zombie world thought experiment gets thrown out the window."
t3_23lqtl,cgybkki,"The inverted qualia thought experiment is much older than Chalmers, and Chalmers actually wrote URL that debunks it."
t3_23lqtl,cgy90vi,"Firstly, a mere thought is not witty, we might consider it a witty thought but ""witty"" is not adjective that can be given to the thought itself."
t3_23lqtl,cgy90vi,"A light wave has no mass either and probably no temperature (although I am not sure about that), but it is still ""physical""."
t3_23litg,cgy73k6,"Skype feels much more personal than a phone call, and What's app allows us to share thoughts and photos in our life as they happen, rather than waiting until the rare hours in which we're both free for long conversations."
t3_23litg,cgy73k6,"Even though they're not the kind of people I'd call at every major life event, I've greatly enjoyed being able to see them again."
t3_23fvx5,cgyony8,"Okay, even though Asian men may indeed have smaller penises, penis size is a trait carried on the Y-chromosome, meaning that only males have the genes for it."
t3_2371el,cguakwg,Although I agree it's not the most beneficial culture.
t3_2360o1,cgtz3wv,"You can increase them even more with blood doping and steroids, though this also increases the risk of DQ."
t3_2360o1,cgtz3wv,"No matter what you do or don't do, though, 9 people are going to lose that race."
t3_22xij5,cgrqv9h,"Although people can misuse the argument regarding privilege, the way it is discussed in an academic sense of the word is not an attempt to shame or belittle people."
t3_22wdaq,cgr4744,"Treat this as the important life lesson it is: the world isn't composed of the black and white morality you thought it was, and you can and did make a mistake that could come back to bite you on the ass."
t3_22s6od,cgpvjq6,"I would never consider those games RPGs, though, because they fit better into the FPS category."
t3_22rciz,cgq73lr,"This feedback system is often broken, though, because you won't always see the consequences."
t3_22rciz,cgq73lr,Even though both speakers are referring to the exact same reality .
t3_22p8vc,cgph660,"The South is thought about as an URL , URL ."
t3_22p8vc,cgph660,Only that the way culture is represented--even well meaningly!--is reductive in a way that often smothers critical thought and inflates the egos of the people that made the representation.
t3_22p8vc,cgph660,"After all, everyone else who came before us thought they had gotten it right too."
t3_22jhn2,cgneze9,"It is ""fair"" in the sense that a lion chasing a gazelle is ""fair""; the gazelle is not liable to kill the lion (though it does happen occasionally), but the gazelle has more of a chance to outrun the lion than it would if the lion were using a 12 gauge."
t3_22itbs,cgneaye,"If we can't reject absentee ownership and we continue to accept ideas like rent as being legitimate, I think the conditions would exist for a state-like entity to come about again (though it might look radically different from previous conceptions of the state, and could look completely unique from a question of formation and execution of state-policies)."
t3_22f1kj,cgm7mon,"Most discoveries aren't 'thinking the way no one has thought before', they're 'applying well known methods to something that no one has gotten around to doing this on yet'."
t3_22f1kj,cgm6vi2,"Considering that second strain of thought, increased profitability may in fact increase incentives to discover, and the free market would distinguish between good discoveries and bad discoveries, the useful and the useless."
t3_22blk8,cglshvs,That's not why governments exist in capitalist societies though.
t3_22akzj,cgl8lo1,"The main problem, though, is education in this country is getting less and less funding with more and more student debt -- I think we should adopt a European style, where college is free and taxpayers foot the bill."
t3_22akzj,cgl8lo1,"Even if we were to enact this magical solution tomorrow, though, there'd still be the massive number of people out there right now who can't get a highly-skilled job because they aren't educated."
t3_225qcm,cgjw5o8,UKIP (much though I disagree with their policies!)
t3_225n20,cgjsq8n,3 years ago I thought I was transgender mtf and I started HRT estrogen and androgen blockers.
t3_225n20,cgjsq8n,"I thought this would last but no, the opposite became true emotions were felt too deeply, a sense of loss in my sexual organs occured."
