thread_id,comment_id,context
t3_1uy91r,cemvbwz,"Gender Confirmation Surgery isn't a mandatory part of transitioning, though it can be very helpful for trans* individuals who experience dysphoria over their genitals."
t3_1uw88g,cema7rn,"Although revolution is highly unlikely, it is a much more real (potential) threat to politicians in America than in many other countries, because of the sheer volume of firearms available to the populace."
t3_1ut0dy,celg0sb,"When the space shuttle was retired just a couple years back, its computer systems were all incredibly outdated, even though they were first constructed in the 1980's."
t3_1ut0dy,celqez5,"Hydroponics continues to URL , and is thought to be a way to grow crops either in spacecraft or in colonies without suitable soil."
t3_1us404,celnjcf,Although I believe every human deserves equality in respect and dignity I don't believe everyone is equal.
t3_1us404,celnjcf,"Sure people can be generous and thoughtful but they are also greedy, envious and selfish whether we see it or not."
t3_1ul993,cej9725,"It's turning a nice profit though, so I tell you I'll buy it from you for 100,000 dollars."
t3_1uhj8f,cei563f,"The idea that this Earth is supposedly littered with billions of individual consciousnesses is, indeed, a mindblowing thought that's difficult to comprehend."
t3_1uhj8f,cei5r73,"Here is an illustration why: even though it seems too surprising, too incomprehensible that other hunks of meat in other human heads could give rise to conscious thought, that surprising-ness is just as real with regards to the hunks of meat in our own heads, and yet we have first-person direct acquaintance with our conscious experience nonetheless."
t3_1ugfg7,cehxooj,"It's not about your ""right to criticise"", which is obviously key to freedom of thought and information; it's about curtailing abuse of that right where it is used to unjustly gain a social edge."
t3_1ueayk,cehgs3r,"What I most strongly disagree with, though, is that non-child-related life goals are extrinsically motivated."
t3_1udzn5,cehk3xp,"URL is a link to a version from the labels page, although not the full version it does give you half the song without any MC."
t3_1ud8fv,cehjb3t,"First post on CMV, but US Constitutional Construction Theory is something I love, so thought I'd give it a try."
t3_1ud8fv,cehjb3t,"So using the ""privacy"" example from above, although the word ""privacy"" does not exist in the text of the Constitution or its Amendments, recent jurisprudence (of the last 50-75 years) has found a qualitative right of privacy protected by various provisions of the Constitution, most notably the Fourth and Fourteenth Amendments."
t3_1ud8fv,cehjb3t,"As a result, I believe we should definitely care what the authors thought."
t3_1ud8fv,cehjb3t,"Still, the Founding Fathers obviously couldn't foresee many events that have happened since 1789, and so I ultimately fall on the ""Living Constitution"" side of the debate: how could they possibly have written or thought anything about the internet?"
t3_1u8u5z,cefn691,"Although you could make the roads slightly more efficient by requiring everyone to be on auto, it's not necessary, and it hurts those that enjoy driving manually."
t3_1u87uu,cefgarg,"When you arrived in the morning, you were almost shaking from the excitement and you (perhaps naively) thought that you NEVER wanted to go home."
t3_1u87uu,cefgarg,"Come evening you have become tired and the thought of going home seems more and more appealing, and when the park closes you tiredly follow your parents to the car remembering an awesome day, having only a slight regret that it has ended, and perhaps even being glad for the opportunity to rest."
t3_1u7llg,cefbw53,"Presumably you have sympathy for those who are victims of hurricanes or earthquakes or tornadoes, even though they are responsible for living in areas with an increased risk of natural disaster."
t3_1u4wxq,ceeovmf,Although experienced with inexperienced is probably a contributing factor I don't think it's one of the larger reasons.
t3_1txyfq,ceczo86,"I've lived in Scotland as a foreigner for the past 6 and a half years, and though I've not followed the debate with eagle eyes, I have, of course, been aware of it."
t3_1txyfq,ceczo86,"Not saying it's very likely in the case of Scotland, but it's worth a thought."
t3_1tx0tf,ceca72e,"I'm sure you see where I'm going here, so I'll leave it at that, though I'm sure I could come up with more examples."
t3_1tt75b,cebccgh,It seems as though every qualm you have sited about the sport of basketball stems from the pace of the game.
t3_1tt75b,cebccgh,When a score is tied 90-90 with 2 minutes left it has to be thought of as this: Each team has been able to respond to each others offensive and defensive plays and stops.
t3_1tqttm,cealwzd,"I would argue that it's immoral to press the right button, because even though you'll be slightly convenienced, there is a chance that you'll act in a way that's very immoral."
t3_1tqlde,ceahpf0,"It's an outright lie, but it could be thought of as a lie of omission, but if the age appropriate answer is more suitable for the child, isn't that okay?"
t3_1tqlde,ceaj38t,"In the majority of cases though, the Santa lie is supposed to be figured out by a child, while telling them about your favorite Deity is not."
t3_1tk9tm,ce8td9v,"Although google glass can probably do so, and balance checkbooks in time."
t3_1t9irv,ce5spfk,"All the other things are rules, many of which I believe were made by men who thought they correctly interpreted God's intentions."
t3_1t83kb,ce5bsdz,"- There are some testimonial URL that apply to married couples, though ideally this URL because I'd like to think you're not looking to do anything that will end with you in court."
t3_1t5izv,ce4jsh6,"If they don't feel as though a group is a threat, then how does having data they aren't even looking at going to let them prevent an attack?"
t3_1t4vo2,ce4d03u,Another thought just occurred to me: What if her classmates ask the teacher to settle the argument?
t3_1t46ur,ce4aypp,"Finally, what makes you think that most women haven't already given the procedure a lot of thought?"
t3_1t2kp7,ce3sq3s,"Even though this post was deleted, I'd just want to tell you that a lot of your day-to-day political and social life - your possibility to go to school, your possibility to elect your representative, the fact that the president cannot decide your death on his own, the fact that you can be an atheist if you want to, the fact that there are paved streets and road signs - are all products of political phil."
t3_1t2kp7,ce3thab,"That being said , the fact is that we may have an interest in these particular things although we are not professionally implicated because - to sum it up - we like them."
t3_1t2kp7,ce3thab,"although I'm a law student, because I like it, and it allows me to have sort of a ""break"" in my week."
t3_1t2kp7,ce3thab,"Philosophy and music have both helped me in my studies, though I was a ""scientific"" HS student, and now a law student."
t3_1swzm7,ce22s9w,"As you mentioned, homelessness and poverty are serious problems, though not historically high."
t3_1swzm7,ce22s9w,"We are still deficit spending (though that is decreasing), and many still lack adequate health insurance (though the Affordable Care Act is helping that)."
t3_1swzm7,ce22s9w,"Overall though, the country is doing pretty well right now and does not require a massive and major reform."
t3_1swzm7,ce2h9nu,"How do you reconcile this with being ""big government"" though?"
t3_1swzm7,ce2h9nu,You said you thought the federal government should be shrunk and then called for it to be expanded.
t3_1suq0i,ce1gpo7,"Although the two are often fused, there are liberal / moderate Muslims, just as there are moderate Christians and Westboro Baptists."
t3_1sgl5a,cdy0hcv,"We were not one nation in 1947, though we may be (sort of) today."
t3_1sgl5a,cdy0hcv,"He also ensured that post-Independence we did not tear each other apart on communal lines, though we've been trying hard since."
t3_1sgl5a,cdy0hcv,"To take no credit away from all the other freedom fighters, but they thought small."
t3_1sgl5a,cdy0hcv,"The Rani of Jhansi just wanted the British out from Jhansi, Bose thought violence could achieve his ends (and allied with the Empire of Japan, who would have been far worse than the British), Tilak would eventually have gotten independence .. for Bombay province."
t3_1sgl5a,cdy3g93,"I realise now that you believe in the inevitability of the formation of India as a country, which is fine, though I disagree with it."
t3_1s3pxw,cdtokz7,"So, your argument is essentially that people whom you met in your line of work that deny climate change are all religious, and because of this observation, then all religious persons therefore are not capable of rational thought?"
t3_1s3pxw,cdv43gy,Does that necessarily mean that therefore all religious persons are therefore incapable of rational thought?
t3_1s1j8s,cdtfxvy,"That's why politics contains such a high degree of rhetoric and ""good looks"" (though really most politicians haven't been that physically attractive... it's much more about liking the way they present themselves)."
t3_1rw7vg,cdrov9y,"Late to the party so not sure if anyone will see this: I think the real reason why we use the word ""Feminism"" is because we acknowledge that, although this is at heart an equality movement, many women are suffering to a much greater degree than men - and thus it is women that need to find a rallying ground in order to tackle their problems."
t3_1rvnty,cdrgglu,I would be interested to hear your thoughts on this comparison.
t3_1rqcx7,cdpu3pe,"It also appears to be less compulsive and addictive in the short term than crack, although we don't have enough studies of either for this to be much more than general observation from users."
t3_1rlna3,cdokmar,"Many people will, though, and it is never likely to be a universally recognized right because most people feel that money is worth more than people."
t3_1rgch2,cdo0n79,"Only the actions that were taken, and the intent of the killer, specifically, did they cause the death willfully, knowingly, and will malice aforethought."
t3_1re89d,cdmem16,"That being said, my politics trend towards conservative and I generally oppose expansion of social welfare programs unless I can determine that they're well thought out and actually address a lack of resources."
t3_1rb6qj,cdlrdyo,"This is because it can share many characteristics with common real sandwiches that are known as such, and it can be treated like a sandwich even though it technically isn't one."
t3_1rb6qj,cdlrdyo,"A pita sandwich is still stuff inside two slices, though."
t3_1ra9u4,cdl68j9,"Since you ask, though, here's a sample of the contents of one file: &lt;?xml version=""1.0"" encoding=""utf-8"" standalone=""yes""?> &lt;Title> &lt;Added>9/24/2013 1:37:15 PM&lt;/Added> &lt;LockData>false&lt;/LockData> &lt;Type>Movie&lt;/Type> &lt;Overview>&lt;![CDATA[Dr."
t3_1qxn8r,cdhle85,"Edit - [here](http://www.reddit.com/r/changemyview/comments/1ib69q/i_believe_that_though_climate_change_exists_it_is/cb33h7c?context=7) is an earlier exchange on this topic, citing another part of that same website, in which another redditor had his view changed about anthropogenic climate change."
t3_1qwg8s,cdhe2ys,"Up until that point, they never counted me as a vegan, and there are plenty of people I know who don't count me as a vegan, so even though they've met a vegan who does not meet your stereotype, they don't make the association between my behavior and veganism."
t3_1qwdul,cdh6jv3,"I had a friend who was pretty similar to how you describe, and when he tried the PUA route he got even more frustrated because he was feeling less connected to the people he was meeting, even though he felt more confident about meeting people."
t3_1qwdul,cdigp3t,"Because even though I'm a man, if I were a woman, we went out on a date, and (assuming you're as great as you claim) I got this laundry list of accomplishments out of you, my first thought would be ""what is wrong with this guy that he's made it to 29 without anybody locking him down?"""
t3_1qwdul,cdj3osu,"I will say two things, though: 1) Narcissists are, in this day and age, EXTREMELY common, and have huge blind spots to their own narcissism."
t3_1qwdul,cdj3osu,"PUA won't either, though, unless your strategy ends up being ""fuck this, I'm going to dehumanize the shit out them as much as they dehumanize me,"" which would be understandable, but holy shit is that a lonely way to live."
t3_1qw6q4,cdh7j9w,"It would have to be: ""It is typical for dates to split the check or take turns paying because it is a common practice, even though culturally we assume that the guy is going to pay and that may still be the most common."""
t3_1qw6q4,cdh7j9w,Because it's accepted even though it's not the most common?
t3_1qvm1n,cdgyu8j,"Okay, so you're in 10th grade, and that makes this answer a little more optimistic than I thought going in."
t3_1qo0aj,cderzi3,That doesn't mean you can't ever make jokes involving gay people though!
t3_1qj032,cdda585,"Let's talk about the long run though, as you state: Firstly, I think the assumption that a country like the US doesn't make intelligent decisions is false, it wouldn't be where it is if it didn't."
t3_1qfy2y,cdcoftz,"I think it's also possible (speaking as someone whose ex-wife loved knitting even though knitting is literally the most boring thing in the world) (no offense) that what he actually likes about knitting isn't knitting itself but feeling closer to you by sharing these things you love, and that when you refuse to share back, it feels like the thing he liked about knitting basically evaporates."
t3_1qfy2y,cdcoftz,"There is definitely a general asymmetry in the way the powerful use power over women, versus the way the powerful use power over men (though you will find exceptions in both directions if you keep reading), but to me this seems to be in keeping with the feminist understanding that rape is about power, and ultimately almost everybody just treats other people as objects to be used, and the exceptions (like Syrio's sacrifice for Arya) are noteworthy for being rare."
t3_1qfqj6,cdcffak,"I can't argue against this point in relations to world history (although I don't neccesarily think you are correct), however in relation to the conquest of the Americas this view doesn't hold water."
t3_1qee3b,cdc0hlx,"Essentially the thought goes that we should respect the beliefs of all others, but when there is a conflict we will respect those who disrespect others less than those who don't."
t3_1qe6d9,cdbzgva,"That letter got a bad rep, though, because he spent so much time talking about how homosexuality is a strong inclination towards sin."
t3_1qe6d9,cdbzgva,"Here's the thing, though: to a Catholic theologian, [everyone is strongly inclined towards sin."
t3_1qe6d9,cdbzgva,"](http://en.wikipedia.org/wiki/Concupiscence) So, while Francis said it better, both Popes have said that the Church should fight homophobia, even though homosexual sex isn't something the Church endorses."
t3_1qe6d9,cdbzgva,"Also, while he wasn't the most effective at dealing with the child abuse scandal, URL Back to Benny 16's nerdiness, though; he really wasn't good at seeing how outsiders perceive the Church."
t3_1qe6d9,cdbzgva,"That doesn't sound to me like he will handle the sex abuse scandal in particular much better than his predecessors - although, he is pretty dedicated to getting rid of corruption in the Vatican in general."
t3_1qdlln,cdc66t9,"""Respects being paid"" is a highly subjective approach to the issue though."
t3_1qa50u,cdasnci,I ought to be able to consent to that form of government even though it may be imperfect and sometimes I do not always get what I want.
t3_1q5w5k,cd9l1k7,"It's also entirely possible to buy the premium items with in-game currency without ever donating anything, although this is obviously a much slower route to obtaining them."
t3_1q0fp2,cd8calk,"I can't convince you that that particular world view will run contrary to your interest, though, because perhaps it won't."
t3_1q01e8,cd7t14x,"Even though there is a difference between Worker A and Worker B because B will make more hinges because they continue to work instead of smoking, that difference would be even greater if A was unhappy and couldn't get their smoke break, leading to even less door hinges because they weren't motivated."
t3_1pyt0c,cd9eqz1,"Solar radiation induces nitric oxide release in tissue and immediate pigment darkening which certainly play important roles, although these are still unknown."
t3_1pux5t,cd6evv3,"(ok, this is an extreme, but you see where I'm going) The very bottom line is though, even IF each abortion is individually questionable or even wrong, collectively they are an absolute necessity for the impact they have on society."
t3_1pp78v,cd4jxtx,Advocating for these people to kill themselves may result in them doing it even though their situation may have improved.
t3_1pocaz,cd4bjgk,"There's something much more satisfying about a sexual experience when the phallus is attached to, you know, a person--someone with a pulse, thoughts, and needs."
t3_1pet4o,cd1sa3b,"I'd summarize the post here, but its probably easier to just read for yourself (even though it has some jargon in it.)"
t3_1pet4o,cd1sa3b,Hopefully you'll find some of this stuff thought provoking.
t3_1pdul1,cd2og2j,"more human), who may not care about others and may have learned enough to simulate empathy, but who is imperfect and sometimes, though not necessarily by mistake, reveals his true disinterest?"
t3_1pdul1,cd2og2j,"I don't think a great enough performance artist exists to indefinitely maintain a facade in his/her personal as well as public life, though I suppose that's open to debate."
t3_1p6fts,ccz983e,"""Everybody should treat digital information as though it could be made public."""
t3_1p0cwf,ccxh3kc,"Which means some people back then thought what you think now, that progress would subsequently consist of refinements &amp; that a grand unified field theory (of everything) was within grasp."
t3_1ozdmq,ccx6rg9,"First off, I don't agree with the ""war on terror,"" but this dichotomy doesn't accurately reflect the thought process that goes into it."
t3_1ozdmq,ccxciwa,I don't really see anything hypocritical about that thought process.
t3_1oyj63,ccxncje,"You deserve more than that, though."
t3_1otx5t,ccvntps,"I hope you can see though that there are many factors involved in creating that sound, and that when a show is too loud, a lot of people can be to blame."
t3_1ooyb1,ccu41n1,It was also the first time that I thought I could actually have sex with someone and not feel ashamed.
t3_1ooyb1,ccu41n1,"I thought everyone's life was like mine, and everyone wanted to kill themselves."
t3_1ooyb1,ccu41n1,"I honestly think that if I had never felt this ephemeral happiness, if I had honestly thought that life was just the misery I lived in, I would have killed myself."
t3_1on8j3,cctmaun,"Concealed carry is now legal in all 50 states (though some still severely restrict it), and the courts have established that carrying a gun in public for self defense is a constitutionally protected right."
t3_1okrb7,cct05wy,"I don't know if he does, and no one else does either although lots of people believe that he does."
t3_1oj3p9,ccsggop,Sometimes I just need to make it clear because I often don't trust people my age with holding a well-thought-out political conversation.
t3_1ohh43,ccs14vq,"In general though, they want healthy, disciplined, physically fit people to be in the military, and the requirements are meant to exclude people who are not those things."
t3_1oee4l,ccrfxpy,"Although I believe this can be true, I don't think it's always true."
t3_1ob3rz,ccqdu4k,I think that eternity being inherently bad is hard to grasp though.
t3_1o5321,ccp3x7x,I have thought a lot about this topic.
t3_1o3jlp,ccoi13b,"That's not where the money goes though; equipment and training facilities are expensive, of course, but for the most part they're one-off expenses, and the profits more than cover that."
t3_1o24hh,cco736j,"Both valid options, though many men would tell you (due to some ridiculous idea about 'masculinity' or something) that it's standing only as a guy."
t3_1nrv36,cclsxnj,Would you think nasty thoughts about yourself if you met him or her on the street?
t3_1nqms4,cclbk5y,"I have a slightly different perspective to offer, although I also work at a trading firm so it will be pretty similar."
t3_1nqb9q,ccl87ko,"The Catholic Church strongly opposes supporting contraception in any fashion, which it considers a grave moral ill (I don't share their view, though I can explain why they do if you care)."
t3_1nhxca,ccisqrm,"I do not remember the story line because I was obsessed with only with the Norton and Pitt, I missed all the little details, and the worst of all, I watched the entire film with the thought in my mind, ""When is he gonna find out?"""
t3_1nh939,ccikqy0,"Although I feel as though you and I have very similar thoughts about this whole thing, I have one point of contention I want to talk about."
t3_1ncxna,cchh67n,Groups like that tend to be around in lots of areas though.
t3_1n8wzy,ccgmnw0,"I'm not being annoyed constantly though, so I still get stuff done."
t3_1n8542,ccg95kd,I personally couldn't stand the thought of one of my family being forced to go to war and not coming back.
t3_1n6bmg,ccgdc5o,"Having a government start banning annoying things can quickly get out of hand, though."
t3_1n6b29,ccfxcou,"Maybe, though I think that's a somewhat limited view."
t3_1n6b29,ccfzhku,"Or can it be perfect, or even just artistically valuable, though in a limited scope?"
t3_1n4obz,ccferzk,"And, in the same way, I had my kindness abused when my new friend stepped over the line and started going though my things."
t3_1n4obz,ccff78k,"Your analogy is also flawed though; unless someone accepts your friend request and then immediately messages you ""Feel Free to look through my pictures!"
t3_1n3wo2,ccfmxhg,"While it is unfair that people receive protection from others who get vaccinated even though they don't contribute to protecting others by getting vaccinated themselves, it seems far more unfair to force those who don't wish to protect others by getting vaccinated to leave their homes to another country."
t3_1n1zu0,cceotqq,This doesn't mean that the works themselves are not worth teaching by better teachers though.
t3_1mxf26,ccdidvp,Breakfast is thought to play an important role in reducing the risk of type 2 diabetes and cardiovascular disease.
t3_1mv3g3,cccwow7,instead of being the naive and prejudiced person that chooses to think that all Muslims/Arabs are violent by nature because that requires less thought.
t3_1ms5h6,ccc8c0p,"However this is by no means impossible, although sometimes indeed is ""ridiculously hard""."
t3_1mqfmi,cccdkog,Old uncle money-bags does though.
t3_1mqfmi,cccdkog,"Even thought society might collectively have a decent amount of money, growth in our economy would choke without the capital markets."
t3_1mq464,ccbkgg8,Some ability for rational thought is better than no ability for rational thought upon which to fight racist cognitive structures.
t3_1mq464,ccbkgg8,"I totally see your point of view though, but hopefully some of this helps change your view!"
t3_1mjw31,ccafvbq,I don't think that this should be blamed on the author though or that one individual critic's views (such as yours or mine) should extend to encompass everyone else's and also overshadow the decision that the original author made regarding their own work.
t3_1mivxm,cc9njqd,"The more I think about, the more I think it fails even as a thought exercise."
t3_1micrr,cc9iise,That's a choice though you'll have to make at the end of the book.
t3_1mdwb3,cc8dkwo,"The criminal court requires there be evidence beyond reasonable doubt whereas the civil court only requires it's more likely than not that the crime was committed, so here even though the US justice system decided there was a >50% chance he did it he was still found not guilty."
t3_1mdfzf,cc86nl7,"There are differences in brain structures as you pointed out - though it's important to keep in mind that the more we learn, the more we find that the structure of the brain itself changes depending on how its used (as you were pointing out with the plasticity reference)."
t3_1mdfzf,cc86nl7,"So if testosterone makes someone agressive, for example, a man and a woman could both have a spike to become equally aggressive with a testosterone boost, even though the absolute levels could be very different."
t3_1mdfzf,cc8qlw3,"Thanks for sharing your thoughts on this, you have a very coherent viewpoint, that is well supported by the evidence you have available."
t3_1mcs7s,cc80xcj,"I'll be honest - I've met more atheist, progressive, think-outside-the-box types in the Air Force than I ever thought possible."
t3_1mc6y7,cc7uvd2,"Psychology is confined to identifying the towns and cities of thought but cannot yet see the streets - we cannot examine in sufficient detail the neurological activity of the brain that is behind specific actions, and that makes for slow going in this field."
t3_1ma1o7,cc779hk,"Humour plays a large part of the person's receptability to these criticisms, though the poo-pooing of things by someone can oftentimes be humorousness."
t3_1m5nls,cc65afh,"That doesn't make it a good idea, though."
