thread_id,comment_id,context
t3_1m3uw1,cc5jurv,"If you can't at least learn handle your SO's gas, how are you going to be able to clean up their puke when they are incapacitated with the flu, or feel comfortable enough with your SO to have them check out a weird lump that you can't get a good view of, or all sorts of things which, although not pleasant, are the types of things you should be able to rely on your SO to do, and should be willing to do in turn for your SO."
t3_1m2ol2,cc583n9,"I promise you, not all stoners are like what you see on /r/trees (although many of us are friendly to bits and pride ourselves upon that) or on movies like Harold and Kumar."
t3_1lykde,cc4218e,"Although I love politics, it is possible to imagine that I do not and I really do only care about healthcare."
t3_1ly6qz,cc3yqq3,"So, though overall cyclist injuries decreased, injuries per number of cyclists actually went up."
t3_1lt0gt,cc2od32,I think you're looking at the complaints (though not all of them) from the wrong approach.
t3_1lt0gt,cc2od32,"Now to address specific complaints toward Obama and the desire to remove him, this goes back to the idea that even though he was elected, he's not living up to the expectations of those who elected him."
t3_1lpsaf,cc1xji9,I thought I was studying my ass off until I realized that some people made me look downright lazy.
t3_1lp8a5,cc1fjpt,"So, let's say that now you come along wanting to use blackface in your movie because you couldn't find any black people for the part (though I imagine that you probably had binders full of black people to choose from)."
t3_1ln8b5,cc0ztv9,"I think you're right about how the concept of dignity is misused, but it's only misused when acts or persons are improperly thought of to be worthy of respect."
t3_1ln6cd,cc1zfyi,"I'm a bit concerned, though, that we're talking past each other."
t3_1ln6cd,cc0x9ao,"What it also does, though, is mean that people will be offended as long as we don't have an orwellian, newspeak style language in common usage, and I for one think that's a good thing."
t3_1lkz0j,cc0ekn0,Maybe they don't even HAVE anyone to share thoughts and feelings with.
t3_1lkrjx,cc0e6s0,"It's not crap writing, it can be hard to portray our thoughts through typing."
t3_1lbwhm,cbxpt3g,"As such, people will still have to work for a living, and wages will still be different for each position (though profits will be split evenly as all workers have an equal share in ownership)."
t3_1lbmj6,cbxpw34,He's better thought of as a concept.
t3_1lbmj6,cbya367,This is actually one of the character's most interesting (though depressing) implications.
t3_1l90aj,cbwzd68,What is your opinion on thoughtcrime?
t3_1l8kmg,cbwu6s4,"We pretty much already accept that certain wines are typically thought to be ""better"" by most people, but ""better"" is still subjective."
t3_1l6jx5,cbwinoh,"He thought that e-cigs were a healthier alternative, while I remained skeptical."
t3_1l6jx5,cbwinoh,"If it's 5 or 10% healthier, would you feel vindicated, even though the difference is almost negligible?"
t3_1l6jx5,cbwinoh,"That's the problem, though."
t3_1l4zh1,cbvtytr,Realistically no one would ever pay me for it even though it is kind of snazzy.
t3_1l4s6s,cbvtd9h,"Many with mental retardation are able to function, though at various levels, including holding jobs, having families, and other things we consider normal."
t3_1l3r2u,cbvieup,"I am also thankful for the elective requirements, even though they are considered ""useless"" by many."
t3_1l3hck,cbvgtot,"And that's why PC language, though admirable and well-intentioned, is really losing the social battle right now."
t3_1l3hck,cbvgtot,Are they though?
t3_1l3hck,cbvgtot,"Is it more important to try to strike the word from our vocabulary because it will help some people not be hurt now, even though it may prolong the process?"
t3_1l39f3,cbvj6st,and the person just stared at her utterly confused like that thought had never occurred to her before.
t3_1l09gg,cbuio96,"From what I've heard, castrated child molesters sadly don't always respond very well to castration (though some do)."
t3_1kwoib,cbteqkq,"What you have to do is decide whether you're ok with a) dying and vanishing into nothing, or b) after you die the thoughts, feelings and experiences that made you you will go on."
t3_1kvk1r,cbt3dfo,"Sure, they may have been lying, and we don't ""know for sure"" whether it was really their intentions or not, but it's not plausible that they aren't, even though it's possible that it isn't ."
t3_1kvk1r,cbt3dfo,"You're not charging people with thinking certain thoughts, you're charging people acting on them - like we would a serial killer who tortures their victims."
t3_1ks6p4,cbs6692,(not to mention the artistic skill to see and bring out something special like the Ancel Adams shot /u/fadingthought provided.)
t3_1kr8vj,cbrto4k,"She thought she was a mastermind because she looked at how well things had been going for her, without understanding just how much luck/daddy/LF/and so forth had actually been behind her survival."
t3_1knxq9,cbquflp,"Someone could write a long, well thought out answer and then the person will say ""But what about this other bad thing."""
t3_1kmwmn,cbqml03,Even though it was trying to reform itself to incorporate the strengths of the ideologies that ended up beating it and now remain at the top of the heap.
t3_1klm9f,cbq6o27,"I find that to be unfair, though."
t3_1kkzei,cbq6gfx,"I don't see what it has to do with one person's power though, as it would have to be done by a community of scientists working together."
t3_1kj8ll,cbpjmas,"I could conceivably be pleasured by someone to whom I am not attracted, though I personally feel the knowledge that they were not attractive would put me off sexually."
t3_1kj8ll,cbpl5sq,"The URL attempts to break along the spectrum of orientation and although it's criticised, for most purposes it's adequate enough and only requires further clarification when considering homo/ hetro-eroticism, transexualism, changing attitudes as people age, as well as other less common circumstance."
t3_1kj8ll,cbpl5sq,I suspect that a person can learn (though perhaps not be taught ) to be one way or the other (or the other or the other or the other ... etc) but at any one time people belong at a single place along the spectrum.
t3_1ki1zh,cbp9dea,"I ended up using the local domestic violence hotline, because people banging on my upstairs neighbors door made me curl up into a fetal position, because I thought he was back to hurt me."
t3_1ki1zh,cbp9dea,"when a woman is justifiably hit (although, I disagree that this is a ridiculous thing to do)."
t3_1khlm7,cbp1ln5,"Since I can't find a figure online, let's say the electric motor components (which are the major components for regenerative braking) add another 100 onto that even though that's almost certainly highballing."
t3_1ke0w4,cbo3zx9,"Need to jot down some information, remember something for later, make a list, or just record some thoughts?"
t3_1kdvro,cbnxpjy,"As a teacher, there were numerous incidents where I thought a student was bullying someone else only to find that the situation was more complicated."
t3_1kdvro,cbnxpjy,I even had a period of multiple months where we thought that a group of Mexican kids were tagging the halls with gang writing and harassing a bunch of black kids.
t3_1kag5w,cbn0mxn,"So in conclusion, I would say that since the universe doesn't work on a strict A to B progression, and everything is built and seems exactly as though humans have free will, there are only two logical conclusions to come to: Either we have free will, or we have a perfectly functioning impression of free will that completes the same result."
t3_1kabrs,cbmzr37,"What we really need is some sort of Lovecraftian villain that would allow Batman to escape the first fight, but which would nevertheless gradually take over and become insurmountable (maybe zombies, in general, although tbh I don't know if they count) That, or somebody who reincarnates as a more powerful being (Phoenix?)"
t3_1k5c52,cblu6s5,"It sucks, though the Pacific NW is far from the worst."
t3_1k3fd5,cbkz187,"In general though, men are expected to work longer hours, do more dangerous labor, travel further from home, take less breaks."
t3_1k3fd5,cbkz187,"While it's true that most men aren't objectified sexually (they are for money, though that's another story) if a man is fashionable and attractive he can expect to get objectified."
t3_1k3fd5,cbl0mqo,"But, though this isn't true for every woman or man, it's incredibly common."
t3_1k2ucr,cbl0joo,"So that you understand where I'm coming from, I was raised Catholic, though that's not my personal faith."
t3_1jzymk,cbjyany,What if she wants to do something on her own though?
t3_1jxenp,cbjhhbv,Now it seems like the GOP is on the verge of falling apart... even though they won back the House in three years ago (2010) and have a good chance at winning influence in the Senate in the next cycle.
t3_1jx75l,cbj8v5p,"(They liked two different teams, though.)"
t3_1jx75l,cbj8v5p,"Nowadays, I live pretty far from most of my family, though I get to visit more than I used to."
t3_1jx75l,cbj9dmd,"As you might have guessed from my first two items, I'm not the most extroverted person, and it makes it easier for me to have reasons to interact with people, even though the interactions are often their own reward."
t3_1jwep9,cbj95j9,"Anyway, I'm going to give my opinion as someone who knows quite a bit about the Civil War and likes the history of the era (though I'm by no means a professional; the closest I've come is when I worked as a Park Ranger for a Summer)."
t3_1jwep9,cbj95tk,"Yet, even though, when all is said and done, it can be agreed that the Civil War was started because of slavery, not everyone who fought for the CSA agreed with slavery."
t3_1jiw0b,cbf50ig,"(Although my argument, by extension, implies that there does exist moral superiority."
t3_1jaqjx,cbctgfc,"This started out as a reply to your reply to u/A_Mirror, so apologies if I make some references that don't make sense in context, though I've tried to clear them up."
t3_1j8dv1,cbc693d,"So you're saying IMDB does judge movies in the context of their time, and that led to IMDB having misleading ratings for films, so you wasted a lot of your time watching films that you thought were boring or just ok?"
t3_1j3vw4,cbau8kc,"Although I'm not a libertarian by any means I think government, and society in general, works best when the arrangements are voluntary."
t3_1j0ghg,cbag4fl,"As someone with a child, I am here to tell you that any and all thoughts one has about childbearing and childrearing - let alone the fate of Gaia - amount to zilch once this planet contains even one additional human being that you created."
t3_1j00y5,cb9tnv2,"This makes the situation sound as though the amount of money being spent by businesses is the same no matter what the minimum wage may be, and therefore we're hiring fewer people for the same amount of money, for no reason."
t3_1iw2um,cb8zrox,"Each ""style"" of education would be pointless on its own though, we really need to implement both if we want to see a decrease in violent crime."
t3_1iw2um,cb8zrox,"It is not for anyone else to ask if the victim could have done something different though, I like to assume they were doing everything in their power to not get attacked."
t3_1iw2um,cb9glw3,"We should also agree though that she is probably unaware of this fact, if she did realize she was vulnerable she would obviously change locations and stay alert."
t3_1it8ez,cb8ie7q,"I can't find direct statistics, only correlations between crime and poverty and poverty and racial minorities(though I know that there are statistiscs, I just can't find them at the moment)."
t3_1ioyfw,cb6negu,"I consulted the Oxford English Dictionary, and one of their definitions of the word 'they' is: I think it can sound perfectly fine in certain sentences, for example: ''If someone knocks on the door, ask them to wait'' or ''You can bring a friend and they can share our picnic'' So although it does sound awkward in some circumstances, it's actually grammatically correct"
t3_1in64c,cb6akju,"Although theories make prediction, they are also descriptive because they often formed after analysing evidence."
t3_1in64c,cb6akju,"They are not descriptive, scientific theories but aim to develop standards, Generally speaking, although religions may make some claims about the universe (and claims without evidence, usually), there is a lot more non-scientific, descriptive discourse."
t3_1in64c,cb6akju,Although Buddhism has scientific discourse on life - there is much more discourse and literature about rituals.
t3_1ii9vi,cb4uyp8,"Now when you apply that to criminals, although they are looking for easy marks, eventually they will know that they need to carry and use a gun."
t3_1ii9vi,cb59siw,"But yeah, I was grabbing that out of my ass, it would be interesting to be able to find that stat though."
t3_1ii9vi,cb5cg2b,"It's one of the main reasons that I have turned more pro-gun control, even though I was raised in AK with guns."
t3_1igbwh,cb4649p,"The girls know they aren't pretty enough for regular gonewild but still want to objectify themselves (though we know only men can objectify women, ammirite?)."
t3_1ied1a,cb3rv5u,"It can be really empowering and invigorating to know that one of the greatest things you can do to forward the cause is to simply listen and accept; and though it's painful to get those things tossed your way, it does wonders to build trust within yourself and between you and any safe space community you might be a part of."
t3_1ia9x8,cb2j72l,You need to understand that there are plenty of intelligent individuals who haven't thought much about religion that aren't well versed in a variety of fields.
t3_1i6m7q,cb1isj1,(not sure about this but I thought it was worth mentioning)
t3_1i6m7q,cb1jxlw,I know this is a special case but I thought it was worth mentioning.
t3_1i4vt4,cb1h533,I think this is a good thing - even though is may be frustrating when your issue is blocked by some other interest.
t3_1i2u57,cb0fo0o,"Now, granted, I have come across a few teenage dumbasses who thought suicide is ""cool"", but I doubt that those are the people who are the main suicidal demographic."
t3_1i00hp,cazmh6c,"Although, seriously, URL Today, the wild parts of gay pride parades exist, as a small minority paying tribute to the courage of those who have lived before, and because nobody should have the right to silence those who are different, whether or not you approve of all that evil sex they're having."
t3_1hz32h,cazg5yg,"Having a high IQ is not like having high testosterone, but more like having specific ""gadgets"" in your body (not just the brain, although that's certainly ground zero for most of them) that perform specific functions."
t3_1hz32h,cazg5yg,"The same gadget may also make the recognition of words and categories faster, even though the same tasks could be done without it."
t3_1hz32h,cazg5yg,"It's difficult to infer the primate equivalent of bipolar disorder from the fossil record, though, but scientists have been studying behavioral disorders in apes and other non-human primates."
t3_1hz32h,caznbpr,"Bipolar disorder, although I was in a hurry to talk about gadgets earlier, is chemical, and that's why we can treat it with drugs."
t3_1hz32h,caznbpr,"Rats have a better sense of smell, even though the human nose is physically larger."
t3_1hxzas,caz1kcn,"A middle-class white kid from the suburbs comes up to them, tells that he totally loves rap music, he's ""from the streets"" just like them, he definitely ""is down"" with the whole rap culture even though in his life he never actually experienced any of the topics that rap sings so often about and in fact only got into rap because several of his friends were listening to it at school."
t3_1hxjqk,cayxqwq,"Great solution in my opinion (not really applicable for women, though)."
t3_1hv4rd,caybwrp,There's no reason that these things can't happen again - the Romans and Soviets probably all thought that they were well-prepared enough to prevent a collapse.
t3_1hv4rd,caybwrp,I think one thing that people talking about collapse do themselves a disservice with is their word choice though.
t3_1hv4rd,cazpmxq,"I have no idea how likely it is that either of these things change though - not so much because of the strength of the dollar, but simply because every other currency seems to have the same problems."
t3_1hv4rd,cazsg9p,"This will make things get steadily more expensive over time - which if you think about it you've probably seen in your lifetime (lately though the trend hasn't been to raise the amount on the price tag of basic goods, but to sell a smaller amount for the same price)."
t3_1htq5j,cayipgd,"Although I'd rather live in a society where a father can come back into the life of a child without any other considerations than the child, so I would vote against it if there'd be any aspects of the law influencing such a decision."
t3_1hqd66,cax3idc,"At some point, though, the major labels stopped caring about maintaining a balance and started only caring about efficiency in moving units."
t3_1hp8cm,caws05i,"My central point remains, though."
t3_1hp8cm,cawibsn,Segregating the gym into time slots though saves on the budget as it prevents them from having to build two entirely separate male and female gyms like they do with restrooms.
t3_1hhxrp,caur7q6,"An identical population-based model can account for the propagation of memes, even though some individuals may ""decide"" not to propagate it."
t3_1hhxrp,cavbnw1,"Although individuals may suffer bad effects, as a population, having a more complex set of response-regulators tends to be beneficial."
t3_1hf3eh,catuwc7,Corporations will always wield less dangerous power (though sometimes only slightly less dangerous) and will always minimize distributed decision making as it is antithetical to the goal of maximal efficiency.
t3_1hf3eh,cau0x1e,"The answer to each of your concerns is nuanced and requires detailed thought, tracing out logical implications, game theory, metrics, alternative scenarios, testable hypotheses, and on and on and on."
t3_1hajga,casiuzy,"Women can certainly still get pregnant, though even in the Navy it was more than a little bit recommended they choose to get an IUD to avoid this as it can, indeed, be a deep complication to their personal as well as their unit's readiness."
t3_1h9hye,cas4sd4,"If things were to progress to the point you fear though, where demand exceeds supply, then the market would push things back to the more efficient methods in order to cover this unmet demand."
t3_1h749v,cariwgq,Your inclusion of the first bullet made it seem as though you supported the legalization of assisted suicide for someone who was temporarily depressed because they were a recent amputee.
t3_1h6ah2,caredw7,"I use vim as my editor, sure, but even there it's not ""just"" a text editor (though it's a damned fine editor)."
t3_1h6ah2,care65c,"Even though Ruby has these built in (and probably implemented in very efficient C), if they didn't exist, you could add them."
t3_1h5k81,carb58q,"Lastly, I'd argue that, though the Bible has long been the most important book, that it's influence at present has waned."
t3_1h5k81,carb58q,"And in fact, I think that most high schools should and often do touch on basic tenets of biology or capitalism, though without necessarily teaching those originary texts themselves."
t3_1h5k81,cargoo8,"By contrast, most smart teachers within an individual secular discipline acknowledge the limited explanatory power of what they teach (though they'll also argue that their discipline has more explanatory power than it's usually given credit for--gotta be defending one's turf, right?)."
t3_1h5k81,cargoo8,"It's hard, though, to present Christianity in such a limited fashion, and I think it's particularly hard for kids in high school to grasp it, since they're likely still living at home and are probably forced to conform their religious practices to those of the family in which they were raised."
t3_1h5bo4,car3t1w,"Gender, on the other hand, only warrants intermediate scrutiny, though it has gotten to the point in some cases where it's closer to strict than anything."
t3_1h5bo4,car3t1w,"Intermediate scrutiny came about during a spree of gender-based discrimination cases and has mostly been reserved for gender alone though, on some occasions, legitimacy (as in ""illegitimate"" children) as well."
t3_1h5bo4,car3t1w,"It is more fatal than deferential scrutiny, though not as fatal as strict scrutiny."
t3_1h4fc4,caquh1j,Specifically with regards to your points though: 1.
t3_1h3tmi,caqo3iu,Your main point is really interesting though.
t3_1h3tmi,caqo3iu,"If I want to know whether I am sad, even though there might be behavioral correlates I cannot collect evidence for whether I feel sad in my own mind."
t3_1gzggd,capcxm0,One could make a perfectly valid point in text lingo and that makes it no less valid (though perhaps it would be harder to read).
t3_1gt2ny,canlnes,"These are traditionally understood as more childish treats when the alcohol is not added, even though there is nothing about them that makes them age specific."
t3_1gqfyr,camsoga,"As such, even though there is a never-ending onslaught of increasingly brazen terrorist attacks around the world, 9/11 by itself may only be a ""big deal"" for most Americans, but the consequences it has had are a big deal for everyone in the world."
t3_1go0nk,cam94e3,"The philosopher David Chalmers has a thought-experiment that really highlights this, involving what he calls URL ."
t3_1go0nk,cam94e3,"This view is called physicalism , and though you didn't explicitly endorse it in your post, it is quite likely similar to the opinion you seem to hold."
t3_1go0nk,cam94e3,"I'd like to return, though, to qualia."
t3_1gndd7,calx3a2,"There are no other premises which allow for any ""therefore"" to be drawn from that categorization though, which is a lot of the problem here."
t3_1gndd7,calx3a2,"It looks like you're defending the question about creating AI or something, even though that wasn't the one I quoted and responded to."
t3_1gndd7,calx3a2,"Again though, you haven't done anything to show that your categorizations being accurate demonstrates triviality."
t3_1gndd7,calxx48,"Or does this still fall foul of the fact that although finding non-trivial solutions to the problems might be insightful, the problems themselves are still trivial?"
t3_1gndd7,calw2lu,Morality is an issue intrinsic to the human society and probably thought process.
t3_1gn5gq,caluwrn,I thought about where else I had seen and remembered drug addicts.
t3_1gn5gq,caluwct,How would you feel if someone ridiculed you for something they thought wasn't socially acceptable but is perfectly normal for you?
t3_1glkkw,caljuen,"This is kind of the case in Israel, though it isn't so strict legally in many areas."
t3_1gk7i3,cal9gz2,"- URL (though if you look in that article you'll find that often simply brandishing a weapon is enough to stop an attacker, I'll discuss why that's important in more detail later) They serve only one purpose - Hunting, self-defense, being a guard against tyranny, and coldblooded murder are not the same thing."
t3_1gjtcs,cal0tb3,"Star Trek's writers (or Roddenberry, specifically), thought that--out of the millions of rules we make exceptions to every day--there might be some which deal with such a huge risk that it's better to make the rule absolute rather than dabble with discretion."
t3_1gjtcs,cal0tb3,"The writers also want you to take ideas and test them back here on Terra Firma, in the form of thought experiments, so let's try it."
t3_1gjtcs,cal0tb3,"You didn't hear it from me, though.)"
t3_1ghuhk,cakst8b,"In my opinion though, once you pass baby-stage it's all the same."
t3_1ghg9u,cakhjuz,"I admit I don't know as much about the history of the Koran as I should, but for the bible, it is fairly easy to explain why - all the books were written by different people, and though divinely inspired, they simply didn't cross-check everything to make sure the points were the same."
t3_1g98dv,caicko1,"Because when it comes to issues of the US Constitution, their words and thoughts on the topic reveal the true intentions of that document and its associated Amendments."
t3_1g8ye7,caiqwaz,What about senatorial elections though?
t3_1g8dms,cahqtw0,"What Dickens did well that others didn't, though, was write for mass appeal."
t3_1g2qho,cag6n0x,"It doesn't really have to do with how boring the sport is to watch or anything like that, although we do call soccer boring, it's just a cultural thing in that we are supposed to enjoy x sport , y sport, and z sport, but we shouldn't enjoy w sport."
t3_1g0pzr,cafn0w2,"Speaking from my perspective, the tattoos that are constructed and done with only the thought of 'deep meaning"" tend to be the ones whose appeal wears off most quickly."
t3_1g05un,cafhm9s,Although I think you can definitely make art in some games.
t3_1fsg25,cadcq9r,"Once again, this sort of thing is commonly thought about gay people as well."
t3_1fm8eb,caboa00,A homosexual relationship is purely consensual and carries none of the problems of reproduction via incest (though personally I hold no problem against purely consensual relationships between relatives).
t3_1fm8eb,cabxdab,I totally agree though.
t3_1fl90i,cabjfyp,"Second, the United States is famously a secular state but it is rife with religious justification for laws (though, not regarding the right to worship)."
