thread_id,comment_id,context
t3_2rnr30,t3_2rnr30,"I don't think it would, because though premeditated murders could well be less likely, accidental deaths, unplanned homicides, and suicides would like increase."
t3_2rmy6e,t3_2rmy6e,"The place that we're currently at though is the result of a lot of work in ethics, epistemology and metaphysics."
t3_2rmy6e,t3_2rmy6e,"Obviously not, you need to study science (though you would be surprised how many leading scientists actively study philosophy)."
t3_2rkjr3,t3_2rkjr3,"It would still be false to say that nobody ever changes their view, though."
t3_2rexe3,t3_2rexe3,"On a personal level, though, I agree that ""military discount"" becoming ""public service discount"" wouldn't be a bad idea."
t3_2r3fa4,t3_2r3fa4,"Assuming you do not believe in hell (though maybe you do, I don't know) you are claiming that even though you don't believe this place exists, you think that someone who genuinely does believe such a place exists has the moral obligation to prevent people from being sent there - even though you would say that they are mistaken that there is such a place."
t3_2r39y4,t3_2r39y4,I still think it makes sense though.
t3_2r07cv,t3_2r07cv,"(You can't really actually change it with science, either, but don't say that to loud, people get threatened) The single biggest reason though, is that changing your gender is in effect spitting in the face of God."
t3_2qy21w,t3_2qy21w,"On average, women tend to find out around 4 to 6 weeks in that they are pregnant, though you can get a test that will tell you as early as two weeks, I believe."
t3_2qy21w,t3_2qy21w,"Most doctors won't do it before around the 15th week of pregnancy, though some do it as early as 11 weeks."
t3_2qy21w,t3_2qy21w,Does she have to go it alone even though not getting an abortion was not her fault?
t3_2qtorn,t3_2qtorn,"I do a little volunteer work with a women's shelter (though I'm a guy), and you will probably find that those shelters offer services for men as well."
t3_2qrbaf,t3_2qrbaf,"I loved The Hobbit, even though it got slow, but I found Tolkien's prose to be far too slow-paced and filled with inane babbling about things too far removed from the plot."
t3_2qqxoy,t3_2qqxoy,"The belief that one has an animal spirit is not new and has been a component of many primitive animistic cultures throughout history, and certain Native American practices still have vestiges of this, though most of us wouldn't describe them as ""delusional"" simply because they follow the traditions of their ancestors as they've been practiced for centuries."
t3_2qqa7z,t3_2qqa7z,resistance in many muscle groups Eventually though you'll stop making strength gains and simply be increasing your endurance.
t3_2qmhw7,t3_2qmhw7,"This again, though, goes back to a culture which seems unreasonably biased towards sex."
t3_2qmhw7,t3_2qmhw7,"They are not getting any attention though, since they usually remain anonymous."
t3_2qia6o,t3_2qia6o,"And I see a line manager growing his team as a microcosm of a founder growing his company, though the company may have rules in place to help keep the line managers from going off the reservation."
t3_2qb4ra,t3_2qb4ra,That doesn't make Poker a bad game by design (even though it can be unfun in some scenarios); it just means that it's not a game that everyone will enjoy.
t3_2qaf6l,t3_2qaf6l,"The problem isnt always bad parenting, though that can play a role, the problem is a black and white educational system."
t3_2pqfx4,t3_2pqfx4,"Still, though, Hip Hop today is still a very valid genre, and there's a huge difference between Classic Hip Hop and much of the mainstream ilk out there."
t3_2pqfx4,t3_2pqfx4,"No one, though, is arguing the worth of Hip Hop being less than any other musical genre out there, though."
t3_2ppxgu,t3_2ppxgu,"Even though they may be making fun of the ""CIS, white-penis'd, STEM wielding hivemind,"" some of them are probably those exact things."
t3_2pnm9s,t3_2pnm9s,Those aren't the ones you hear about though.
t3_2pkvb6,t3_2pkvb6,Why worry about it though?
t3_2pkvb6,t3_2pkvb6,We can still do things though.
t3_2pimzj,t3_2pimzj,"CMV is a sub where there appears to be a more cordial attitude toward debate with less impassioned mud-slinging, derision, and name calling (though I admit I have only been viewing content for a couple of weeks)."
t3_2p3z06,t3_2p3z06,"The two situations don't overlap completely, but, clearly employers think it's worth it, even though the more their health care is used, the greater their premiums."
t3_2ovqav,t3_2ovqav,"They buy pouches for their pouches, a dozen aftermarket accessories for their weapon that they don't even use properly and spray paint those accessories in earth tones even though they roll around in a giant fucking truck you can see from a mile away."
t3_2ovqav,t3_2ovqav,"The NFL is having problems with concussions and TBI even though they wear helmets and facemasks, rugby players the world over don't have the same problem wearing nothing more than a scrum cap."
t3_2okad4,t3_2okad4,"After revisiting the books later though to see why I had (briefly) originally liked them, I decided a lot of their appeal was because they deconstructed a lot of the tropes that they're made of."
t3_2okad4,t3_2okad4,"She reminded herself that even though life seems unfair, she can still make the most of it."
t3_2oihml,t3_2oihml,"However, when person C is aware of a pre-existing relationship, even though he does not directly know person B and does not therefore have a meaningful connection to ""owe"" him anything, he is disrespecting person B by knowingly facilitating person A's breach of their social contract."
t3_2o6paa,t3_2o6paa,"Based on your starting argument, It sounds as though you understand some of the basic principles of evolution, and that you have an idea of how the scientific method works, even if you aren't yet willing to accept the conclusion that all species on Earth descended from a common ancestor."
t3_2nokg9,t3_2nokg9,"They may think that even though they can reduce next weeks major violence by committing minor violence today, they may be concerned about setting a precedent of violence that will last long into the future."
t3_2nokg9,t3_2nokg9,"I don't though, because I reject the notion that imperfection implies immorality."
t3_2nbeuf,t3_2nbeuf,"Even though you die, your existence in those pages is untouchable."
t3_2namx3,t3_2namx3,I can think of one example though where the issue you raise is very important.
t3_2n900k,t3_2n900k,"Instead, the best option would be to change the system, since that is part of the ""contract"" I'm in with the government even though I never consented to it."
t3_2n8psp,t3_2n8psp,"Nor am I thinking about replacing any of them with a better model, as though women were all on some scale and I'm looking for the one with the highest number of girlfriend points."
t3_2mv3n4,t3_2mv3n4,"It went on for a while, I remember the last time though."
t3_2mv3n4,t3_2mv3n4,"It was great though, I could buy toys my parents didn't have the money to buy for me."
t3_2mv3n4,t3_2mv3n4,"I'd get drunk at any opportunity and have sex with pretty much any girl I could, paid for sex several times, it didn't really help though."
t3_2muo4y,t3_2muo4y,"My main point though is that being part of society means putting up with a lot of legislation that you don't like and that, sometimes, upholding rule of law is more important than doing what you think you should be able to, for the sake of preventing people from breaking the laws you do agree with."
t3_2mesct,t3_2mesct,Some people (even though they are a visibly smaller group) really just enjoy this initial buildup.
t3_2m9le3,t3_2m9le3,"They do not help with everything, though."
t3_2lxha7,t3_2lxha7,"My parents had my brother circumcised even though their doctor told them it was medically unnecessary because they were worried that my brother would feel weird in later locker room and/or sexual situations when most of his peers would also be cut, statistically speaking."
t3_2lwrsv,t3_2lwrsv,"So the military didn't strictly tell you to go talk to girls, what was so hard about figuring that out though?"
t3_2lrnbm,t3_2lrnbm,"I can see the professor's point though, this is Engineering and not an English class."
t3_2lqcby,t3_2lqcby,"The reason is that the first amendment protects the behavior, even though it's repulsive."
t3_2ldsgu,t3_2ldsgu,I could justify a trade or vocational school though.
t3_2lclza,t3_2lclza,"Either way, though, the reality is that right now the overwhelming majority of meat (and other animal products, but let's focus on meat) is produced using obviously inhumane methods."
t3_2kk7pc,t3_2kk7pc,"Revenge porn with identifying information, though, could easily lead to life-threatening harm."
t3_2kgrtb,t3_2kgrtb,"The actual rules don't really matter, though - you could make snacking harder by sticking to a ""diet"" in which you only eat foods that start with letters A-H."
t3_2kfldi,t3_2kfldi,"Never said it wasn't, my point was that if you are going to go after the Bible for promoting violence, but give the Quran a pass, even though it has hundreds of verses promoting religious intolerance, then you are not being very philosophically consistent(not saying you are specifically, but there are plenty that do.)."
t3_2kfldi,t3_2kfldi,"Many people who cry islamophobia have no issues with criticizing christians for their misdeeds, even though their actions towards people are lesser by comparison."
t3_2kfldi,t3_2kfldi,"Female genital mutilation isn't a part of the Bible, though."
t3_2k19cr,t3_2k19cr,In fact I still feel that what I wrote above holds even though I eat meat now (we're all flawed I guess).
t3_2k19cr,t3_2k19cr,I never considered it immoral for her to eat meat even though I felt it was immoral for me to do so.
t3_2k16fy,t3_2k16fy,"Is a couple with a m-f transgender and male partner gay, even though the man feels he is dating a women (but biologically male)."
t3_2jp9x4,t3_2jp9x4,"A front office can get by without a back office, though they will be less efficient."
t3_2jp9x4,t3_2jp9x4,"One of the interesting things though is that, generally, lawyers do not marry fork lift operators."
t3_2jkgzi,t3_2jkgzi,"I discovered several new genes, one of which is important to the parasite's motility (and therefore infectivity), and discovered a key missing link in understanding the function of an already very well studied protein... didn't do any science though, according to you."
t3_2jd1e2,t3_2jd1e2,"So even though you still have to sit through a bunch of ads during commercial breaks, the chances of one of those ads appealing to you are much higher because that sort of evolution was actually needed for advertisement to continue on TV."
t3_2jaiv1,t3_2jaiv1,One thing to note though is that as marijuana use becomes more socially acceptable and legally acceptable it will bring more innovative ways to ingest it that don't have the same smell of unburnt or burnt marijuana.
t3_2jaiv1,t3_2jaiv1,Do you what these people have done even though they make up the medical marijuana industry that you support?
t3_2j28la,t3_2j28la,"One thing that's worth noting, though, is that having a military is not just as socialist as universal healthcare."
t3_2j28la,t3_2j28la,Military defense is a fundamentally different type of public good though...
t3_2j196u,t3_2j196u,"It sounds to me as though you have a somewhat misinformed understanding about what feminists mean when they use the term ""rape culture""."
t3_2iwveo,t3_2iwveo,"I would be against destroying the machine keeping the artificial brain alive though, because that's a thinking, conscious being, and that's akin to murder."
t3_2iu5ia,t3_2iu5ia,"""Good"" is man functioning as though he would in a state of nature, and ""bad"" is any sort of deviation from that point."
t3_2iu5ia,t3_2iu5ia,"( i did support him, not because i believed 100% of what he said though, I had many disagreements with his platform, but it was the lesser of evils i suppose.)"
t3_2iu5ia,t3_2iu5ia,Certainly there is a social one though.
t3_2irrk7,t3_2irrk7,"More importantly though, the idea won't have the effect you want."
t3_2irrk7,t3_2irrk7,"Isn't it nobler to treat them equally, even though you are different?"
t3_2ilnf9,t3_2ilnf9,"Yup, that's the delta, though I dunno if it works when you quote it as you did (maybe it does?)."
t3_2il5rb,t3_2il5rb,"I don't blame Reddit for distracting me from my work, even though it's readily available."
t3_2il5rb,t3_2il5rb,"I don't expect you to be convinced though, so in the spirit of a CMV, I'll try to convince you now."
t3_2ia3iy,t3_2ia3iy,"I know some people who got their jollies off of a huge courseload and multiple degrees, and never regretted it (though none went all the way to 4 degrees)."
t3_2i6wcg,t3_2i6wcg,This is not the real world though.
t3_2i6l9n,t3_2i6l9n,"Many people have covered the idea that you can't judge someone else's finances, so I'm not going to go into that even though it is key here."
t3_2i17u3,t3_2i17u3,"You let them go, even though you love them, because their happiness is more important than your happiness."
t3_2i0v1l,t3_2i0v1l,But it doesn't seem like you're treating time as a valuable resource that you have to allocate carefully: you're acting as though you have unlimited amounts of time to squander on your professional goals.
t3_2hiuav,t3_2hiuav,"Imagine using iOS or Android on your desktop, and tell me that Apple would benefit from switching from OSX to iOS for their operating system on a Mac Pro (even though you don't like Mac) Second EDIT: I want to know why Windows 8 is bad, not why something else is better."
t3_2hcsbm,t3_2hcsbm,"As an aside though, it seems that Football coaches are URL While the game might be strategic, if the coaches play an orthodox style, and ignore the subtle strategy, what good is the game having strategic depth in the first place?"
t3_2hcri1,t3_2hcri1,":p Because even though your edit is right, your initial view still makes a point."
t3_2hcri1,t3_2hcri1,"Even though its morally wrong to deliberately and significantly fuck someone else up with your laziness, you could still be unproductive to society without that happening."
t3_2h6ar3,t3_2h6ar3,"To further increase manufacturing capability, potentially employing more people even though less are needed per car (I don't think this happened in the automotive case, but it does happen sometimes.)"
t3_2gy3lp,t3_2gy3lp,"If I went out and had unprotected sex, though, that does not mean I consent to pregnancy."
t3_2gutfw,t3_2gutfw,"I've been mistaken for all sorts of things, though typically people think I'm latino or middle eastern (I'm neither)."
t3_2gutfw,t3_2gutfw,"Pygmies are very different from Bantu, even though both are listed as black."
t3_2gutfw,t3_2gutfw,"My guess is that most people in North America would call them Asians, but they're all quite different from Chinese and Indians (though there are many Indians in Indonesia)."
t3_2gutfw,t3_2gutfw,"But the descendants of Charlie are just as closely related to the descendants of Christina, David, and Delilah... even though Charlie and Christina's descendants are predominantly race A and David and Delilah's descendants are predominantly race B."
t3_2gliyk,t3_2gliyk,"Remember thay even though there have only been 3 major nuclear disasters, there are only about 400 nuclear power plants worldwide."
t3_2ggppl,t3_2ggppl,"Really though, I feel the strongest argument is the future."
t3_2fwmff,t3_2fwmff,"It's more okay for them to be upset about losing stuff, though, so that's what they complain about."
t3_2fm9q9,t3_2fm9q9,"Even though it's a laptop, I could put up to 16gb of RAM into it, and the extra RAM sticks would likely cost me ~$100, which still keeps me just under half the price of the Mac for a superior machine."
t3_2fm9q9,t3_2fm9q9,"All in all, certainly if you'd rather have a mac, that's your prerogative, and if aesthetics, the mac's aluminum construction (though I'm not sure how this is different from ASUS's aluminum construction), and an SSD are worth >$1000 to you, then have at it."
t3_2fg916,t3_2fg916,"Fancy meals come and go, expensive electronics break or become obsolete with the passage of time, college is important, but not worth giving up a sibling for, family though, and the impression they leave on you lasts forever and is important in shaping the adult that a kid will grow up to be."
t3_2fduqy,t3_2fduqy,"Basically though the idea is that masturbation is observed in multiple species, not just humans."
t3_2f8s0s,t3_2f8s0s,"A mere comparison, though 100% different but follows the same logic, is that if police officers demand a raise and get it, then EMS workers may request one, then firefighters, etc."
t3_2f8s0s,t3_2f8s0s,"Moving on, though, I want to turn the discussion, based on my other reply, to point at that technological advancement has done wonders for removing issues from people's lives."
t3_2f5k1m,t3_2f5k1m,"I believe that now people can listen to their songs, even though the way they were obtained wasn't right."
t3_2f1tka,t3_2f1tka,"So I guess it depends on how you'd define ""rape"" -- if you include every time a woman submits to sex against her desire because of an imbalanced power dynamic in our male-centric culture, yeah, you can definitely teach that out of the culture, though granted it would be a long uphill battle."
t3_2efrf8,t3_2efrf8,"You have not explained that, though."
t3_2efrf8,t3_2efrf8,"Whether that's correct is what the whole debate tends to be about, though."
t3_2edzcv,t3_2edzcv,"Some states also believe that they should be URL , acting as though Creationism is a legitimate scientific view (which it obviously isn't)."
t3_2e98b1,t3_2e98b1,"To be honest though, this was a few years ago when taking photos was not something everyone always did."
t3_2e3f98,t3_2e3f98,"North Korea though, are they committing mass genocide in the name of Atheism?"
t3_2e3f98,t3_2e3f98,"The thing about religions changing their view over time though, is that they claim their books are gods law, so if god isn't changing the book, then technically their views should be the same and their laws the same as 3000 years ago."
t3_2e3f98,t3_2e3f98,"Religion though, my law is the only law, and my way is the only way because I have faith that my book is right."
t3_2e1fah,t3_2e1fah,"In both cases, though my neighborhoods might have resembled suburbs, there was a lot of undeveloped, unfenced land around."
t3_2dwo4u,t3_2dwo4u,"It gets circular after a while though, eventually you just have to accept some assumptions."
t3_2dtng7,t3_2dtng7,"the rebuttal I always hear is that ""you have this free will but even though you have so many choices God will still know what you are going to do,"" which I think is a weak argument because then I say well then there is no free will and the two can not coexist."
t3_2dn11e,t3_2dn11e,"It may now seem unfair and impossible to accomplish anything in life and the friendly competitive drive may turn to depression and despair, even though you yourself, really have not changed."
t3_2digbr,t3_2digbr,Are they really fine though?
t3_2dg4c1,t3_2dg4c1,The thing is though is that I loved her far more than what I thought was possible.
t3_2d9xj4,t3_2d9xj4,"I can guess to maybe within 30 seconds or so when 5 minutes pass (and again, not some bullshit ""consensual reality"" thing - we can count the vibrations of a quartz crystal under electric current and know objectively what 5 minutes is), whereas under mushrooms, I seriously watched the time go from 5:00 to 5:30 minute by minute, each minute lasting what felt like hours and hours (though the entire half-hour seemed to have gone by in a few minutes after the 30 minutes were up)."
t3_2d8gej,t3_2d8gej,"My point is though, that in the end, happiness derived from a machine-world is indistinguishable and just as good as happiness derived from the world around us."
t3_2d4iry,t3_2d4iry,"By and large, though, it sufficiently covers the average teenager."
t3_2ctoax,t3_2ctoax,"His role in the bible is as a parental figure, and is mostly associated with the creation of the Universe, and of Jesus, though he is ocassiobally mentor."
t3_2ctoax,t3_2ctoax,"The father himself though has no direct connection to the universe, and is neither omniscient nor omnipotent."
t3_2cflx0,t3_2cflx0,"The Empire is unlikely to give the kind of military support necessary though, preferring instead their own might, and likely viewing the LDB as a political threat."
t3_2cflx0,t3_2cflx0,"Perhaps, though I expect a whole lot of deeper changes than that to occur because of the Alduin/Second Great War situation."
t3_2cfco7,t3_2cfco7,"I think my point still stands though, that having a near-death experience immediately after birth is exceedingly rare for a galactosemic infant who is not fed lactose-containing food."
t3_2c6m3v,t3_2c6m3v,"The most promising method I've seen is the one adopted in a 1st year critical thinking course at the university of Melbourne, known as URL This URL analyzed the effectiveness of philosophy courses on teaching critical thinking and came to the conclusion: ""The meta-analysis results indicate that students do improve while studying philosophy, and apparently more so than general university students, though we cannot be very confidant that this difference is not just the result of random variation."
t3_2c454p,t3_2c454p,"I can't really contest it taking up less space though, that is a given."
t3_2c1r9q,t3_2c1r9q,"Most modern practicing Jews (modern meaning from Late Antiquity onwards, though some tribes have held this view for far longer) reject the concept of fallen angels or a real 'Hell,' and instead highlight the idea that Evil is an abstract concept that can be attached to certain actions."
t3_2c1r9q,t3_2c1r9q,"It is not the 'traditional' branch, though it is definitely similar to Wahabbism in fundamental thought."
t3_2c1r9q,t3_2c1r9q,"These are the theological teachers and elder scholars of the faith, though in some sects the Jews allow non-rabbi scholars to present their ideas on the holy word."
t3_2c1mga,t3_2c1mga,"This doesn't negate Palestinian claims of long-standing, though it does pre-date them."
t3_2btxhq,t3_2btxhq,"So I'm not particularly familiar with Guy McPherson, though I had heard the name once or twice in a similar context, looked into him, decided he was a hack and stopped reading."
t3_2boeux,t3_2boeux,Doesn't make my space ship a car though.
t3_2bkf5u,t3_2bkf5u,"Interactivity has it's own set of drawbacks though, that you don't seem to account for."
t3_2bkc6k,t3_2bkc6k,A quick follow-up though.
t3_2bk0qs,t3_2bk0qs,"What would be the point, though?"
t3_2bhy5s,t3_2bhy5s,Only two programs are really turning a profit though.
t3_2bhy5s,t3_2bhy5s,How are they being subjected though?
t3_2bhy5s,t3_2bhy5s,"Recognition that will go a long way towards them securing themselves a future, even though it may not come immediately in financial terms because their discovery belongs to the University."
t3_2bffjw,t3_2bffjw,"I feel uniquely qualified to answer this because I'm working with a group building an autonomous car (its a small one though, I'm not a googler), and I just wrote a research paper on the ethical and legal implications of such vehicles."
t3_2begsn,t3_2begsn,"The wealthy loan shark doesn't have to buy the house themself, organise and employ labourers (which gives people both a job and income) so even though he might not be doing real work he is still doing a social good."
t3_2begsn,t3_2begsn,"My main point is not that there are ways to make money without interest and without doing work yourself, though it is true."
t3_2bbq91,t3_2bbq91,"There are still some major consent issues involving relationships between adults and middle/older teens, though."
t3_2bamw2,t3_2bamw2,"From a suffering standpoint, though, this is where I try to remember that just because we're cognizant doesn't mean we aren't animals."
t3_2ba26t,t3_2ba26t,"For many of the 'acceptable' system users, they might rate a 3 stars to show discontent (though also conceivably lower."
t3_2b1rab,t3_2b1rab,"However, you will find a deal of social stigma around ordering the steak like this, and I believe that to be somewhat warranted (though only in a mock-serious manner)."
t3_2aymhj,t3_2aymhj,"Humans, though, have a generation time an order of magnitude longer- usually somewhere around 20-30 years, depending on culture."
t3_2aymhj,t3_2aymhj,"Inserted or modified genes wouldn't be any more prone to loss or mutation than the rest of the genome, though- probably less so, since they'd been specifically designed to be advantageous."
t3_2aymhj,t3_2aymhj,"And it's not as though natural reproduction is without risks, from your point of view- that's where all these supposedly-dysgenic characters came from and how they were able to accumulate in the genome, after all."
t3_2aymhj,t3_2aymhj,"Governments (and other higher organizations) are made up of individuals, though."
t3_2ay3kf,t3_2ay3kf,"And it stops being our language and becomes someone else's language, imposed though unwanted."
t3_2ay3kf,t3_2ay3kf,"I do somewhat agree with you though, if people weren't so quick to judge a persons abilities according to their grammar skills it could be positive."
t3_2av5cs,t3_2av5cs,They're homeless though they often still have jobs.
t3_2av5cs,t3_2av5cs,"There's a gap, though, after that, that he's never talked about."
t3_2ancgk,t3_2ancgk,I hope I don't come across as someone who thinks they're superior to everyone because they have synesthesia; I recognize that it's a pretty inconsequential phenomenon and that it doesn't make me any better than anyone else (though you may meet synesthetes who do not share my view).
