thread_id,comment_id,context
t3_1fze4z,cafajkn,"Dogs happily accept the collar and leash, but it would be a truly exceptional person that was willing to be led around in public that way. You would feel imprisoned by a cage, while a domesticated bird experiences it as a kind of security against predation. The third assumes there is no better way."
t3_1fzbuj,cafam2z,"But in reality, most people  do* enjoy some amount of spiciness, mostly because it makes food more interesting, or because it provides a greater range of ingredients to work with. I see heaviness in music as being roughly analogous to spiciness in food: some people simply find it painful to eat something and can't fathom why you would deliberately add food that makes eating painful, while others would have it no other way, and get hooked to spicier and spicier foods, each food providing a bigger thrill than the last. Everyone has a different spiciness threshold, like they do in music, before which spice is enjoyable and beyond which it simply becomes painful."
t3_1fzbuj,cafam2z,"You could play some Red Hot Chili Peppers on the same bass that you play Adele, but again, the ideal bass sound and playstyle are so different for both those artists that it almost isn't the same instrument. Instruments play different roles in different styles: to play Adele you barely want to hear the guitar, while if you're playing Jimi Hendrix the guitar provides a beautiful wall of fuzzy noise weaving in and out of the vocals. Similarly you wouldn't sing Aretha Franklin the same way you would sing Adele, even if they're both powerful female vocalists."
t3_1fzbuj,cafam2z,"If you heard just the drum track from the greatest hits of the last century (however you define them), you would probably recognize less than 5% of the songs. You would enjoy some of the drums, you'd recognize the songs where the drums lead the intro or chorus, but while listening to the full song you would almost never say ""I bet this drummer really knows his musical theory"". So are drums music?"
t3_1fzbuj,cafam2z,"So are drums music? If you say yes, you understand that melody is not essential for something to be music, while if you think not, then you see a role for non-music in almost every song recorded in the last 100 years. Similarly, in metal, the melody doesn't come from the same places that it does in a lot of other kinds of music."
t3_1fzbuj,cafam2z,"Between the 4 guitars, there was plenty enough melody to go around, and the role of the vocals was more to tie it all together than to add a 5th layer of music. Listen to URL or URL to see how when there's that much going on with the instruments, an extra layer of ""clean"" singing would just get lost in the mix, while the death metal vocals provide a layer of sound that isn't there. Another example of singing kicking you in the pants is URL : when the song starts, literally every instrument in the band is going balls to the wall, and things could not possibly get heavier, right?"
t3_1fz6yz,cafa0ej,"Did you ever consider that the news is biased but not in a left/right way? There's a ""sensationalism bias"" where news outlets try to find news that is exciting while ignoring important, yet mundane or complex stories. There's a ""pander to your audience"" bias, where news organizations try to please their audience rather than educate them."
t3_1fthzm,cads3uf,"When you take out an auto policy, you are basically wagering that you are going to get into an accident someday. Meanwhile, the ""house,"" or the insurance company, is wagering that you won't. In order to stay in business, then, the insurance company has to make sure that the odds aren't stacked against them."
t3_1fthzm,cads3uf,"Thus they aren't going to give big payouts unless the initial investment is high. Meanwhile, those demos with statistically lower risks wouldn't have to spend as much to ""play"" because the insurance company knows that the chances they'll have to pay out are slim. The alternative would be that all payouts would be of the ""red-black"" variety, because otherwise, the insurance company wouldn't be able to stay in business if it offered the low-investment/high-return bet for everyone."
t3_1fsg25,cadecc8,"Now I'm not saying that you fall into this category, what I'm saying is that the fakes have spoiled things for the genuine . In my personal experience (I used to go out to the bars in my younger days), I met a good portion of girls who would go out and say they're bi and drink and make out/fondle other girls all the while having men take phone pics and cheer them on. None of these girls would ever date another girl, or get intimate with another girl."
t3_1fl90i,cabjfyp,"In spite of this and it's overwhelmingly Christian population, the US has yet to bar worship of any religion. So far we see that while a given state may be officially or unofficially secular, this has no bearing on a) it's capacity or willingness to accept religious argument as a basis for legislation and b) just because a state legislates in line with a particular religion's belief's doesn't mean that it will begin to encroach on the right to worship - though the rights of non worshipers suffer, discussed below. The last point I want to make is the one you raise about being part of a minority."
t3_1fjy6l,cabcutd,"Solving these kinds of problems trains us in abstract problem solving that extends beyond the mathematics. Perhaps you will never use the Lagrange theorem, but you will use the ability to put together several logical building blocks together to reach a worthwhile conclusion. Mathematics will give tools to see and solve problems from a different perspective."
t3_1fi40v,caai66k,"My advice, if you care, is to go to the most questionable party you can find. Meet some people, smoke a joint (it won't kill you) and try your hardest to get your dick wet, all while seeing how much you can drink before you physically can't drink anymore (on a weekend or during the holidays preferably) and if you survive your one step closer to becoming everything you have ever wanted. OR (this is a stroke of genius btw) think of it as training your social skills: if you can get off with some random girl you just met, or one of the 'cool kids' says something along the lines of ""your alright actually mate"" you get an A+ and should reward yourself appropriately (with another party perhaps?)"
t3_1fdu9t,ca9jfv7,"There are, of course, other ways, such as buying local and others, which are also perfectly viable. So, while I am not advocating for everybody to become vegans, I can see why people choose the lifestyle. "
t3_1fafn1,ca8d7of,"I won't try to convince you that ""unsavoury"" actions are never justified. For instance, there is the argument that the Hiroshima and Nagasaki nuclear bombings, while ""unsavoury"", were justified, because it shortened the war and indirectly saved many lives. I don't agree with it, but the evaluation of these bombings - whether they were justified or not - is not so clear-cut."
t3_1f93x1,ca88try,"You cannot see this in macroscopic objects, because with a whole bunch of wave equations doing this, the system decoheres very quickly, and collapses into one state. This is why we cannot tunnel through walls by running into them with a high momentum, many times, while particles can (there is a finite probability that they are already on the other side of the wall)! But while we cannot apply this to macroscopic systems of atoms, we can apply it to time."
t3_1f93x1,ca88try,"This is why we cannot tunnel through walls by running into them with a high momentum, many times, while particles can (there is a finite probability that they are already on the other side of the wall)! But while we cannot apply this to macroscopic systems of atoms, we can apply it to time. Now we are entering back into string theory."
t3_1f93x1,ca88try,"The 5th dimension is a wave equation where each state represents the events that can possibly occur. The past is the part of the wave equation which has already collapsed, meaning that the probability of past events is 1 (or 100%), while all future events are superimposed and have a finite probability. Impossible events are still contained, but have a negative or 0 probability (depending on your coordinate system)."
t3_1f5j5p,ca7264l,"as they welcomed those who were also outcasts. And they helped a great deal, in raising visibility, while more conservative gay men turned on their own and denied everything. Hence, why there's an LGBTQ."
t3_1f5j5p,ca7fgce,"I identify with it, and I can guarantee the last thing anyone imagines is that I have a cutting tongue and that I've used my intuition to make dangerous men cry. Or that I once picked up threw a man, because someone is in danger, and while I won't lift a finger to defend myself, you hurt those I care about, and adrenaline does funny things. No, most will get that I cry too easily."
t3_1f5j5p,ca7fgce,"And so does slut shaming and sexual entitlement, if you breathe a hint of less than pure to the wrong person. My posts are frequently voted to the top of the threads, while other men struggle to grasp basic concepts. It's not because I'm special."
t3_1f5j5p,ca75otf,"It's reasonable to expect that gender is just as prone to blurred boundaries (if not more so), and there is a growing body of evidence that not only are these alternate genders you speak of real, they have measurable effects (or possibly causes) in neuro-anatomy. You are confusing ""sex"" with ""gender""; sex is about what you have between your legs while gender has more to do with what you have between your ears. Now, most people have a clearly defined sex, but there are a few out there born with physical attributes of both sexes and a few out there born with no discernible sex at all."
t3_1f5j5p,ca75otf,"Now, most people have a clearly defined sex, but there are a few out there born with physical attributes of both sexes and a few out there born with no discernible sex at all. There are also cases where one's expressed sex is the opposite of their genetic sex - people who are physically female, for instance, while carrying XY chromosomes. If physical sex isn't absolutely defined, how much more malleable is mental gender?"
t3_1f5j5p,ca7h7yg,"India, the Philippines, various Native American cultures... It's more likely that better communication coupled with a relaxation of Puritanical views regarding gender roles have rendered this near constant percentage of the populace to speak more openly about their mental states with less fear of reprisal while simultaneously giving their voices much greater reach than they've ever had before. It's less a spike in occurrence and more of a situational change making us more aware these people exist."
t3_1f3fkz,ca6ix69,"While the engineering student studied late into the night and worked on projects night after night, the History student spent his nights playing video games and watching Indiana Jones before slamming out a good 65% paper the night before it was due. He studied a few days before his exams and rocked out a solid 70% average, while his buddy slaved away night after night for a respectable 80%. I fully agree with this interpretation, and I think at this level, you're right."
t3_1f3fkz,ca6ix69,"The RANGE of grades in STEM and Non-STEM courses works differently. At the lower end of the grade scale, NON-STEM courses are quite forgiving, while STEM courses are brutal (hence the high drop out rate in fields like Comp Sci, Biology, or Engineering). But, at the top of the range, everything is pretty equal."
t3_1evztt,ca4bru8,"If he was revealed to be checking out a falafel restaurant in Nashville, Tennessee, and the Obama administration chose to drone strike him into oblivion when they could have easily apprehended him instead, that would be a regrettable decision. I think al-Awlaki raises an interesting question: what do you do about an American citizen who is actively committing treason against the country, but is doing so while on the run and who may be difficult or impossible to capture? Do you allow him to continue coordinating terrorist attacks against you because you can't capture and try him, even though you could kill him?"
t3_1et89u,ca3lwau,"There are lots of Iraqi exiles out there... No, you couldn't have a democratically elected government right off the bat, but you could have civilian control of the (heavily bribed) military while that transition happens, after the fall of Saddam's government. There are lots of Iraqi exiles out there... No, you couldn't have a democratically elected government right off the bat, but you could have civilian control of the (heavily bribed) military while that transition happens, after the fall of Saddam's government. "
t3_1er14x,ca2wyds,"There is no clear demarcation of ""this entity is now a full human being"", it's a gradual spectrum, and reasonable people can disagree with where to draw a line. The pro-choice position lets people draw the line in any place for themselves while acknowledging that they could be wrong. The pro-life position is willing to use the force of law to punish those that think it should be drawn later or in different circumstances than their own preferences."
t3_1en2w6,ca1xwfz,"In other words, your kids can help you become a better person too. Make your goal to become a better person while helping others become better too , and suddenly the number of people will become less important than the quality of those people. "
t3_1edx91,c9z9hpy,"The other problem with Reddit is that it's heavily slanted towards URL sort of people. They're super smart, but they don't often learn a lot about sociology, anthropology, etc., while getting their education, and most of their fields are severely segregated along several axes of privilege. So their impressive intellect never really gets applied to social justice."
t3_1edr56,c9z8p9f,"Quite simply, I think that the people who do not contribute to the subreddit will get bored and leave within a few weeks, and the repetitive posts and poor answers will stop. I think that while there has been a drop in quality of late, you are wrong about it ruining the subreddit (at least ruining it for good). There are 13 moderators here, who are good at enforcing the rules, and there is the whole community that were here before the /r/AdviceAnimals post."
t3_1edqbg,c9z8lj2,This would not change if the violin were instead worth $100k. Artworks could easily fall into this category while being worth much more. * Many people who grow up poor and struggle into the middle class do so in part out of a drive to leave their children with more than they had.
t3_1edggu,c9z6htb,"'Normal' people get send to jail, but if you are mentally ill you get send to a psychiatric institution. But some people argue that everybody who murders somebody is in some way mentally ill, while others say that everybody is responsible for their own actions. There isn't really a line here."
t3_1e897d,c9xr4w4,"Locking a gun up for home defense is like putting a safety on the brake pedal (a I'm bad at analogies right now but it still works). I can't ask the home invader(s) to wait while I go to the gun safe, unlock it, unlock the gun itself, load it, etc. It just doesn't make sense."
t3_1e74qq,c9xfppc,"The two are directly analogous to what your brain thinks when you tell it to stop using a drug. You may think rationally while not stressed by cravings ""oh sure I can quit whenever I want"", just as you can think ""oh I can ram a knife into my hand"", but in the moment the blade is against your skin, that rationality evaporates. You're left with a survival impulse and not much more."
t3_1e4w3h,c9x0hy8,"This is where you might bring in other concepts that are not directly determined by our biology or what we know of from evolutionary biology. it's a big leap to determine that how we behave is solely dependent on our evolutionary history, while we sit typing at keyboards, on a computer, over the internet, inside of a dwelling made mostly of artificial materials, that we in, most likely, no way shape or form built ourselves. so why is that we think that our lives are so concordant with such paradigms?"
t3_1e30x9,c9wfnbb,"This leads to the massive underfunding of many fields. For instance while philosophy has been directly responsible for the vast majority of changes in societal structure that have allowed us to succeed, this benefit is both long term and spread among the population making it unlikely that any specific philosopher will receive their due. This happens in the STEM fields too by the way."
t3_1e0dd7,c9vvh9i,"I wouldn't expect us to do it outside of a time we are in war though for the reasons you mentioned... But it seems that we take our most draconian measures in times of war and I, while thinking it is far fetched, could see this happening if the situation was set up perfectly. I don't think that you could say it would never happen, you would be better off saying it's highly unlikely."
t3_1duzzk,c9u8l52,"Instead of wealth redistribution from the empires to the masses, it will become from the slightly more fortunate to the slightly less fortunate. The income earners who worked out of low income status will see their children dropped back down in to it, while those who began with family wealth will see it preserved. I don't mean to soapbox, but this is precisely the weakness with the progressive tax system, which was introduced under the same logic."
t3_1dsz4r,c9tr6a5,"Here are additional studies that show a significant number of female rapists: 1) This academic study of university students shows similar rates of victimization between men and women: http://pubpages.unh.edu/~mas2/ID45-PR45.pdf Page 412 discusses the results for men and page 414 discusses the results for women. There's a nice table here that presents the results of this study in a clearer way: http://feck-blog.blogspot.com/2011/05/predictors-of-sexual-coercion-against.html 2) Here's another study regarding sexual coercion of university students: http://www.questia.com/library/1G1-20318535/sexual-coercion-men-victimized-by-women 3) Here's another study: http://www.ejhs.org/volume5/deviancetonormal.htm The conclusion states, ""the evidence presented here shows that as many as 7% of women self-report the use of physical force to obtain sex, 40% self-report sexual coercion, and over 50% self-report initiating sexual contact with a man while his judgment was impaired by drugs or alcohol"". "
t3_1dro9y,c9t7g6w,"Maybe lots of things are mattering all the time, presently, for a lot of people, and that's the only way mattering can occur. Maybe civilization, plumbing, electricity, and civil rights are all worthwhile goals and successes of humanity. Maybe it's entirely a function of your perspective."
t3_1dro9y,c9tar20,"It's not easy to challenge your view because that's a pretty mushy concept right there. Now when you talk about worthwhile goals, unless you mean something unique, I achieve goals that are literally worth my while constantly. For one such example, see this post."
t3_1dro9y,c9tar20,"For one such example, see this post. From my POV, living a happy life is worthwhile, even intrinsically so, based on my experience of pleasure as something to be done again and pain to be avoided. The experiences commend themselves to be repeated or avoided inherently in my experience."
t3_1dqyrn,c9t02yl,"Imagine the resources it would take to get mental care for every serious criminal, especially in the USA, which has more people incarcerated per capita than any other in the world. I don't think it's practical or even reasonable to a) assume that everyone who's committed a crime is mentally damaged and b) attempt to treat them while they're in prison. "
t3_1dpzzj,c9spiqj,"Also keep in mind that being smart in one area does not mean you are necessarily smart in another. One person might be a physics prodigy, but have little or no knowledge of economics, while another might be a mathematics genius who also speaks 7 languages fluently and has deep knowledge of philosphy but he has never left a university and has no real world experience. How do you determine if they have ""humanitarian prospects""?"
t3_1di0zr,c9qwjv9,"The church has done and is doing some very bad things, I won't try to dispute that, but that's not what we're discussing here. Churches in Africa and Latin America tend to view homosexuality as a sin, while the pastor in my neighbourhood accepts everyone the way they are, not because he's some sort of rebel but because he feels that is what his faith teaches him. Churches are representatives of faith, but they are not synonymous, we can only judge faith by the actions of the faithful, we cannot judge it based on their policy or their guiding document (Bible, Quran etc.)."
t3_1d93tu,c9o9bv4,"But, imagine this: you are looking for a job, and one of your options is somewhere that the work will be much harder, you're almost guaranteed to get paid less, and you'll be blamed for all of it. Meanwhile, you can go work at a so-called ""nicer"" school, work less, get paid more, and everyone will praise you for your hard work. This is sort of the current system anyway, but your suggestion exacerbates it."
t3_1d93tu,c9o9bv4,"This is sort of the current system anyway, but your suggestion exacerbates it. So-called ""bad"" areas already struggle to keep teachers around, so this just funnels more funds into ""good"" schools while choking out ""bad"" schools... which leads to ""bad"" areas being even less capable of receiving ""good"" education. 5."
t3_1d93tu,c9o9bv4,"However, everyone trying to ""fix"" the schools has never had any experience teaching! People are trying to fix something while only knowing the symptoms, and none of the problems. "
t3_1d7duu,c9nmoii,"In the U.S. the percentage of rape outdoors is ~3.6% (http://en.wikipedia.org/wiki/Rape_statistics#United_States taken from http://www.hawaii.edu/hivandaids/Similarities_And_Differences_In_Women_s_Sexual_Assault_Experiences_Based_On_Tactics.pdf). But, the Bureau of Justice reports that 29% of rapes occurred while traveling to or from work, school, other place/shopping or errands/leisure activity away from home. That seems rather significant (http://bjs.gov/content/pub/pdf/fvsv9410.pdf at 4)."
t3_1d7duu,c9nmv0u,"Since 29% of rapes occur when traveling, there is a very legitimate threat to women alone at night. If you use the 20% societal-wide figure for the likelihood of rape in a woman's lifetime as your baseline, about 6% of all women have been raped while traveling somewhere. Your odds are at about 1 in 20 during your lifetime if you are a woman."
t3_1d44p3,c9mq0ns,"Mood starts to improve slowly and you start to realize things you did not even take into account before anymore. Things that are just as valid an real as what you noticed while being depressed. Yes, your friends care for you and yes, you are worth it."
t3_1d44p3,c9mq0ns,"- They just want to help but have no idea how, they are not 'just annoyed"". - Sure, there might be no life after death, but what stops you from having one while you ARE alive? No, how you are feeling right now is not invalid and I know how frustrating it is when people just say to ""look on the bright side of life""."
t3_1d44p3,c9mxd9o,"There seem to be two main issues with antidepressants that both you: 1) Your friends don't take depression seriously, and 2) You don't want to be reliant on pills to feel better. I will try to address both of these points below, while providing a scientific background in order to try to help you understand the importance of antidepressants. Firstly, let's talk about what depression is."
t3_1d44p3,c9mw0w9,"As an aside, hopefully for psychotherapy you consider an evidence-based treatment like CBT, Interpersonal Psychotherapy, etc. Second, while depression feels like reality, in CBT, one major goal of the clinician is to help the client view situations more accurately and realistically (NOT ""look on the bright side of things""). This is helpful to clients because they are NOT viewing many situations realistically or accurately--their viewpoints are typically skewed by their focus on the negative side of things or a difficulty identifying/weighing positive or neutral elements or interpretations of a situation, so helping their thinking become more accurate, realistic, and balanced results in their thinking becoming more positive."
t3_1d44p3,c9mw0w9,"When clients have not been depressed for as long and can remember what it was like to not be depressed, they are better able to see how differently they are thinking and reacting to things than they used to. Fourth, and finally, while people who take antidepressants can react differently to them, many folks I know personally and have worked with professionally have described taking antidepressants in the following ways: ""I feel like myself again,"" ""I feel less overwhelmed by things, more optimistic like I used to,"" ""Sometimes I wonder if I need the medication because I feel so normal...but I know the medications are helping me achieve that."" (These are all basically direct quotes from folks, one of them from the last week)."
t3_1d44p3,c9mw0w9,"(These are all basically direct quotes from folks, one of them from the last week). So while I know some folks who have initially been concerned about being ""addicts"" or ""not being myself anymore,"" I personally haven't heard people continuing to feel that way if they are taking the medication and getting benefit. "
