thread_id,comment_id,context
t3_2glozx,ckkcrue,"Please. The body line is that people are guided by certain goals and principles when they make decisions, feel certain ways while they act and as a result of their actions, and then they either are satisfied or are dissatisfied/ have regrets about their decisions. ""Good"" is a term we apply to goals, principles, feelings, and retroactive self-evaluation, but that doesn't mean that all good things are good in the same say."
t3_2gliyk,ckk9cif,"To sort of answer that question, you can assume that we'll replace Fission reactors with Fusion reactors. And while it's still a possible solution to the waste problem it's still a long ways away from becoming commercially successful. I do believe though that once it becomes a viable source of power that a lot of the nuclear scare crowd will disappear."
t3_2gliyk,ckk9cif,"As far as the second point, well that's a bit trickier and I don't have an open solution to this. And while I understand there is a fundamental difference between weapons grade and power grade nuclear material you still can't ignore the fact that power grade material is a stepping stone to weapons grade (in most cases) and power grade material by itself can be weaponized in the form of a dirty bomb. So how do we control that material in countries that probably shouldn't have access to stuff that nasty?"
t3_2gkv97,ckk2eje,"This way we won't need everyone to ""watch out for each other"" with lethal force. What if the two burglars were actually two people who the homeowner asked to watch their house while they were away on vacation? That 61 year old man would have then killed two innocent people."
t3_2gea6k,ckicnlx,"My friend and I went hiking one weekend, so I wore some dirty old khaki cargo pants and a dirty old black t-shirt, and I had my hair pulled back in a weird half-ponytail. I'm a woman, and I have short hair, so that didn't look very flattering, but I didn't care because it kept the hair out of my eyes while we hiked. I didn't have any makeup on either, because, well hiking."
t3_2g1ea5,cket437,I guess I'm just skilled that way. But I have had a calzone blow a leak out the back end while I bit into the front. With calzones you always have to monitor your bread to topping ratio to make sure you have enough both bread and filling from beginning to end.
t3_2g0cy2,ckef8s5,"I would say the opposite, that subreddits need more rules now that reddit has millions of members, otherwise every subreddit ends up looking the same which is basically screenshots of facebook, and one-liner memes ... it can take a while to navigate your way to the kind of subreddit you are looking for, perhaps something like /r/trueaskreddit for general discussions? I would say the opposite, that subreddits need more rules now that reddit has millions of members, otherwise every subreddit ends up looking the same which is basically screenshots of facebook, and one-liner memes ... it can take a while to navigate your way to the kind of subreddit you are looking for, perhaps something like /r/trueaskreddit for general discussions? "
t3_2fwmff,ckdfg3r,"By this point, he's basically a single dad with a roommate who lives in his house for free and helps with nothing but causes a lot of trouble for him and his children. Eventually, his wife decides she's bored with her life, and starts meeting men online while her husband is at work and the kids are at school. She sleeps with them, and picks up STDs and eventually gets into drugs as result of the quality of people she associates with."
t3_2fou4r,ckbbbtr,"I work with a lot of kids, all of them happy, intelligent, and for the most part normal. Most of them are very easy to work with and sit in their seats while we do homework. The ADHD kids?"
t3_2fnlil,ckb9o9v,"neural activation/rest) in others by comparing it to humans. Meat is certainly not a necessity, while survival may be a preference to some (you are guessing it is not, and justifying it as educated based on your current knowledge). A curios question: what if no diagnostic equipment existed?"
t3_2fjsjb,cka49p5,You can change pickups with either right or left hand and without having to actually grasp it with your fingers. Good luck trying to hit the exact toggle position on the Strat blade toggle without stopping what you are doing and grabbing on to the thing while juggling a pick. Fixed bridge is superior for at least tuning purposes.
t3_2f8s0s,ck8c7fa,"At the very least, we must acknowledge there is less reasonable debate about whether we need a government based military/police at all than whether we need a welfare system at all. In some cases -- if one could maintain that there isn't really any reasonable debate about the military/police question, while maintaining there is reasonable debate about welfare systems -- people would be able to accept my argument against welfare systems while rejecting the mirror argument against police/military. I don't see this as splitting hairs."
t3_2f78ys,ck6wzql,"There are also people who choose to just have fun with their canvas without caring about how it looks like or functions in the end. Some people set a certain structure of how to paint their canvas to their children, while some people aren't satisfied with their canvas, so they tell others not to follow the same pattern. And sadly, some people choose to even destroy other people's canvasses."
t3_2f78ys,ck6wzql,"When we pass, our canvasses will be washed away. But while we were making our canvas, we also have been intentionally or unintentionally painting on other people's canvasses. It can a small dot, or even 80% of someone's canvas."
t3_2eufa6,ck31m49,"I don't know whether I would have wasted more or less time if I was actually attracted to people and experienced one or more failed relationships. As for manipulation by media, while commercials and other forms of media do use sexuality to promote themselves or affect people's thoughts, asexual people are far from immune to media influence. Sex is one of the biggest tools in their kit, but there are many, many others, and media has had a huge affect on my life and altered my way of thinking, often without my awareness or consent."
t3_2ervii,ck2ndkx,"Its not like business can just cut jobs without losing anything, if the job exists, he must be doing something, you cant just erase it without consequences and if you can, the job shouldn't have existed to begin with. The general problem with your argumentation is that its completly focused on business, while compeltly ignoring the needs of the people living in a country. The goverment should protect the interests of the overall population above any economic matters."
t3_2eqf4w,ck20baa,"It sounds all abhorrent that an animal had its eyes sewn shut, but I find it unlikely to the point of not being worth considering that scientists had no good reason for an experimental group of animals with forced sightlessness. Animal testing is just the least cruel we can be while trying to save the human race. The ALF might save the lives of hundreds of animals publically, but that research, uninterrupted, may save thousands or millions of human lives that will now be lost because of delays in research."
t3_2enyd1,ck1a9xo,"The technology to execute elections online just isn't there yet, and it won't come anytime soon. The requirements (both legal and technical) are incredibly strict and often contradictory; for instance, how do we perform voter authentication online while ensuring a secret ballot, all the while allowing for post-election audits and defending against voter coercion and vote-buying? "
t3_2emkns,ck13upr,"Sex is changed by taking hormones, in that secondary sexes changes with such medication. A trans man won't have a functioning uterus or experience menstruation while on testosterone and trans women won't produce sperm. They will grow beards and breasts, respectively."
t3_2emkns,ck19pfa,"Not true. Complete Androgen Insensitivity Syndrome is the name of the condition whereby someone who, without any medical intervention, develops into a biological female while still having the Y chromosome. Your question is malformed."
t3_2efrf8,cjz67ye,affect a.). This seems like a smokescreen that allows you to remain substantially against abortion while not explicitly pursuing the implications of your position. 
t3_2e98b1,cjxen7r,"I'm not saying that people should be glued to their cameras taking pictures constantly, but a few photos here and there are amazing memories Because my family takes a decent amount of pictures, I can look back at photo's of my Grandpa before he died, and a few silly moments we had with him. I consider a good catalogue of photos invaluable - they can lead me to laugh (like I do when I see the picture of my Grandad with a black eye, because he fell out the back door throwing his shoe at a squirrel) or cry (seeing pictures of my Grandpa, or our old cats etc etc) I'd be very curious to know how old you are, because my view has actually changed a lot on the matter since I was in my teens, compared to now, when I'm in my early/mid twenties Memories are important, and while you don't need to constantly post to facebook, 10 years down the line you might just enjoy looking at pictures from now "
t3_2e3t22,cjwos6i,"Fortunately we have checks, balances, and regulations in place to prevent this from getting out of hand and for the most part they work pretty well. This system essentially formalizes that increased control into the system, removing many of the checks and balances and pathing the way to remove most of the rest while further benefiting those that choose to exploit their control. "
t3_2e3t22,cjwos6i,"Fortunately we have checks, balances, and regulations in place to prevent this from getting out of hand and for the most part they work pretty well. This system essentially formalizes that increased control into the system, removing many of the checks and balances and pathing the way to remove most of the rest while further benefiting those that choose to exploit their control. "
t3_2e2rb6,cjvzfop,"For instance, you chose not to commit suicide today and have probably taken some efforts to remain alive (eating, drinking, etc. ), and while one may chalk this up to simple biological self-preservation, you as a sentient being could choose a different route entirely. I'm also guessing you haven't gone out of your way to murder someone else or inflict pain on anybody innocent."
t3_2e1fah,cjv5s7v,"Your rural experience isn't standard for everyone. I grew up in a rural location, and while I did some outdoor stuff I'd rather have lived within walking distance of a friend. I didn't have nearly the social interaction it sounds you did."
t3_2e1fah,cjvncqn,"I could play in the woods and build forts, take my dog for a walk or run around with him, go down the street to my neighborhood park, go for a bike ride, etc. It also wasn't a huge deal to be out past dark, while it is kind of dangerous to do so in most cities. Dependence:I could ride my bike to places I wanted to go."
t3_2e1fah,cjvncqn,"Not to mention that the schools are typically of a lesser quality in the city than in counties, and this holds true where I live. My county's schools are very highly rated, while my city's schools are not. So now the child either has to get a weaker education, or the parents have to spend more money enrolling them into (and getting them to) a private school or a school in a neighboring county."
t3_2e1fah,cjv5s7v,"Your rural experience isn't standard for everyone. I grew up in a rural location, and while I did some outdoor stuff I'd rather have lived within walking distance of a friend. I didn't have nearly the social interaction it sounds you did."
t3_2dwo4u,cjtt0a5,Rights are an excellent way to frame a discussion. There are a lot of policies that we can still fruitfully discuss while still respecting the rights involved. Take your abortion example.
t3_2dwo4u,cjtt0a5,"A policy that simply bans abortions of female fetuses isn't good, because it clearly tramples on the right to bodily autonomy. A solution that, for example, gives a monetary incentive for expectant mothers of girls to carry those pregnancies is better, because it attempts to solve the problem while maintaining the mother's choice. The bringing up of rights in this context doesn't end the discussion, it merely gives a good guide of what sort of policies should be discussed."
t3_2dw5ig,cjtn850,"Because of this, if you were both in the left-most lane, you are in the wrong if you aren't actively passing other cars (which it seems you weren't). Meanwhile, he was looking to actively pass other cars (in this case, you) but did not have a lane to the left of you to take and was asking you to move over. This is entirely reliant on what lane you were in though."
t3_2dsh9z,cjsp93m,"People donating should do so because they care about the cause, not because they get a baked good. If the goal was to do something productive while raising money, you might as well just tell them to get a part time job and donate to cure cancer. You wouldn't say you donated to cancer research if you hired a maid and she decided to donate her earnings to cancer research, would you?"
t3_2drox8,cjshzfo,"Then the next day you get a call from the principal, who is angry because HE got a call from the student's parent who says that the kid told them some preposterously distorted version of what really happened. This happens all the time, of course, but every once in a while, the kid in question also has parents who get to vote on issues like 'Which school gets more money?' and 'Should the principal's contract be renewed?'"
t3_2dnntx,cjr97o9,"I just don't get voted on at all. I'll get two or three upvotes, but it won't matter, because by the time someone's read through the article and thought about it and whether it was worth their time and voted on it, the thread has fallen off the first page of /new/ and there's no saving it, while in the same amount of time an image macro has received hundreds of votes""](http://www.reddit.com/r/circlebroke/comments/vqy9y/dear_circlebrokers_what_changes_would_you_make_to/c56x55f) That would be 0, because /r/AdviceAnimals is trash. "
t3_2djwly,cjq6x41,"Should this happen, the blending strategy may become more difficult to execute. Similarly, while powers such as the US ostensibly seek to avoid or minimize civilian casualties, recent experience in the region has shown that this is generally not a very serious objective. The calculus is further changed by the simple fact that civilian casualties are the natural result of unchecked ISIS growth, which might allow us to present civilian casualties on a theoretical ""net"" basis."
t3_2dgu6l,cjpe59d,"Just because it's easier to use it is ""dumbed down""? Is being difficult to use now a requirement in order to be a worthwhile computer? I wouldn't consider myself technologically illiterate, as I have built several computers and fix lots of problems for my friends and family (all windows by the way) yes I haven't had to use applecare (knock on wood), but from what I have heard, it is second to none with regards to warranty services."
t3_2d9qj2,cjnknol,"Having a phone bouncing around in my pocket throws me off my game. Leaving it in my bag and hauling it out occasionally isn't ideal either: it is distracting, it takes time, and I don't want people to notice I have an expensive phone just sitting there while I am out on the field. It is way easier to just check my wrist (my watch loses contact when I am playing on the field, but reconnects when I come back to the bench where my bag is)."
t3_2d9qj2,cjnknol,"It is way easier to just check my wrist (my watch loses contact when I am playing on the field, but reconnects when I come back to the bench where my bag is). Not only is it easier, but I find that taking 5 seconds to look at my wrist lets me stay focused on the game while taking 60 seconds to dig out the phone, check, put it away pulls me out more frequently. Finally, I sit in a lot of meetings."
t3_2d8gej,cjn905a,I'm not convinced as well that a life with more hedons is more valuable. You can maximize individual happiness while decreasing total happiness. 
t3_2d80rd,cjn0l56,"So maybe it's less that there's a double standard, and more that people actually chose to pay attention to what the song was saying for once I think it's the general tone and context of the whole song that puts Blurred Lines into a slightly different light The whole of the song Blurred Lines is objectifying women, saying things like ""Yeah, I had a bitch, but she ain't bad as you"" and so on and so forth Rihanna's song Skin, seems to be generally about consensual sex so the line you referred to is more in the context of - hey, we both want sex, get over here and we'll have sex The pussycat dolls song, while more aggressive, doesn't give off a vibe where they're attempting to assault someone, it's more a case of - I think you're hot and I bet you think I'm hot and you wish I was your girlfriend instead of that bitch The spice girls one is the example that actually falls in much closer to Blurred lines, with lines like ""He's resistant not persistant, it didn't stop me from homing in"" and the like, but I imagine the reason this song wasn't highlighted is because it just wasn't as... prominent as blurred lines, where you've got a deep ""I know you want it"" really clearly over the music To be honest, most people don't seem to listen to the sum total of the lyrics for a lot of songs - like Every Move You Make (or whatever it's called) where people think it's this lovely romantic song, when really it's really about stalking But I think with a song like Blurred Lines, the lyrics are begging to be listened to and when people paid attention, they realised it seemed sinister. So maybe it's less that there's a double standard, and more that people actually chose to pay attention to what the song was saying for once"
t3_2d80rd,cjn0l56,"So maybe it's less that there's a double standard, and more that people actually chose to pay attention to what the song was saying for once I think it's the general tone and context of the whole song that puts Blurred Lines into a slightly different light The whole of the song Blurred Lines is objectifying women, saying things like ""Yeah, I had a bitch, but she ain't bad as you"" and so on and so forth Rihanna's song Skin, seems to be generally about consensual sex so the line you referred to is more in the context of - hey, we both want sex, get over here and we'll have sex The pussycat dolls song, while more aggressive, doesn't give off a vibe where they're attempting to assault someone, it's more a case of - I think you're hot and I bet you think I'm hot and you wish I was your girlfriend instead of that bitch The spice girls one is the example that actually falls in much closer to Blurred lines, with lines like ""He's resistant not persistant, it didn't stop me from homing in"" and the like, but I imagine the reason this song wasn't highlighted is because it just wasn't as... prominent as blurred lines, where you've got a deep ""I know you want it"" really clearly over the music To be honest, most people don't seem to listen to the sum total of the lyrics for a lot of songs - like Every Move You Make (or whatever it's called) where people think it's this lovely romantic song, when really it's really about stalking But I think with a song like Blurred Lines, the lyrics are begging to be listened to and when people paid attention, they realised it seemed sinister. So maybe it's less that there's a double standard, and more that people actually chose to pay attention to what the song was saying for once"
t3_2d7otc,cjmy58p,"This isn't even indigenous to the male half of the species: I have seen the same happen with women who simply have not made their intentions known and the guy is simply oblivious to their desire. Then there is the darker side, where people take advantage of each other knowing their intentions, where one party leads another party on reaping the benefits while in no way plans on reciprocating the feeling. Whether you're a ""nice guy"" or not, you are susceptible to this scenario, as long as you're unaware of being lead on."
t3_2d45gd,cjm4puq,Also it would mean the chef has to keep taking people's orders instead of cooking the food. Would you want to wait while 50 people are giving him their orders before he is able to start cooking yours? 
t3_2cwals,cjjmrg7,"It comes down to personal preference, your friends and what games you play at the end of the day, and trying to change a fan boys opinion is often difficult. I myself am a PC gamer and haven't played on console for a while, but I see no need to hate it. If people prefer one over another that's fine for whatever reasons."
t3_2cm5jd,cjguy6j,"That doesn't mean we don't have our problems. There is a nasty strain of anti-intellectualism that rears it's ugly head every once in a while, but that sort of thing always loses out to practical needs in the end. And all of that information we have access to carries with it thousands and thousands of different viewpoints, and world views that can make it seem like individually we don't know much."
t3_2ch2je,cjff0g8,"I still have a ton of nostalgia for Red and Blue though. That being said, while the initial hype has died down, the game has somehow stuck around. People still play them and have fun."
t3_2cflx0,cjfm8m1,Even if Ulfric had somehow peacefully managed to convince several Jarls to switch to his side without him raising a sword for his own cause this would have still lead to the same bloodshed. Would you follow a man that isn't willing to fight for what he believes in while sending you out to do tasks? Ulfric's successor could be voted on democratically by the other Jarls which is the proper tradition.
t3_2cflx0,cjfm8m1,Even if Ulfric had somehow peacefully managed to convince several Jarls to switch to his side without him raising a sword for his own cause this would have still lead to the same bloodshed. Would you follow a man that isn't willing to fight for what he believes in while sending you out to do tasks? Ulfric's successor could be voted on democratically by the other Jarls which is the proper tradition.
t3_2c1mga,cjc4wg5,"EDIT If anyone is still interested and would like to learn more, I would be glad to tell what I know, just send me a PM. Something I wrote on the subject quite awhile ago to answer somebody who had a strong support for Israel while also being bold enough to say they have no idea what is going on over there. This is a writeup to give you the history of the conflict and not a writeup to give you an up to date idea of what is happening."
t3_2c0frm,cjause4,"No, on r/antitheism you aren't going to be downvoted for criticizing popular (the Pope) religious leaders, nor are you going to find love for these people either. It was a topic in the community that r/atheism is at sometimes anti-atheistic and pseudo promoted Islam for a while (although I haven't seen this for a while) and there's little criticism and more so oddly protective of eastern religions. If r/atheism would be renamed to anything, it would be r/antichristianity."
t3_2c0frm,cjbcnuv,This is why I said I haven't seen it a while. This is why I said I haven't seen it a while. 
t3_2bo66v,cj7geua,"Those who support it never have to change or abandon their idea because nothing can contradict it. The big difference between the two is that one is an assumption while the other is an observation. Big Bang proponents don't 'say' that all matter was created and expanded from a single point, they observe it, based on the current makeup and direction of the world."
t3_2bo3al,cj7dkvq,"He then throws a screaming fit because he wants to walk. If I had a leash, it would be a lot easier to keep him in line, while giving him most of the freedom he wants, and still getting my shopping done. The reason I don't is that people like you are so damn judgmental that it's just easier to strap my kid to a cart, give him less freedom and mobility, and avoid criticisms about putting my kid on a leash."
t3_2bmble,cj7fa4w,"I'm in favor of, or at least uncritical of, Howard university's policy. This is counter-intuitive; because, while I value non-discrimination, I value it in the context of our imperfect world. For the bulk of American history, Black Americans were barred from education altogether, then systematically discriminated against, and only now are making headway into being equally represented in our nation's colleges."
t3_2bmble,cj7fa4w,"A school that was 91% white, well, I went to that school, because that's most schools. Even while much of the academic world actively pursues minority students, they remain under-represented. This is all part of an effort to undo years of discrimination."
t3_2bmble,cj72qwx,"In my opinion, it's not ""*intolerance of intolerance*"" that's the issue, it's ""*intolerance of dissenting opinions that's painted as intolerance of intolerance*"". This is something I first noticed while living in a very liberal college town. You could be pro-choice, pro gay marriage and anti-drug war, but if you opposed affirmative action, increased welfare spending or taxes..."
t3_2bkc6k,cj66hhr,"For people living paycheck to paycheck on 15k a year, $180 a year can be a burden. Sex is something that almost all people engage in, and while you may not die without it it, it is a biological imperative and has URL . Sex isnt like checkers, its not some hobby."
