thread_id,comment_id,context
t3_1er14x,ca2w8zb,"This is not incompatible with the view that it's sometimes awful to abort a fetus, especially (for example) if it's a late-term abortion. So while someone may be pro-choice ('you have the right to an abortion') they may not be 'pro-abortion' ('you have the right to an abortion but I don't want you to do it'). Think of it in terms of free speech: I may agree that you have a right to freedom of speech, and that it's good to exercise your rights, but also find what you have to say repugnant and bad."
t3_1er14x,ca2w8zb,"This is not incompatible with the view that it's sometimes awful to abort a fetus, especially (for example) if it's a late-term abortion. So while someone may be pro-choice ('you have the right to an abortion') they may not be 'pro-abortion' ('you have the right to an abortion but I don't want you to do it'). Think of it in terms of free speech: I may agree that you have a right to freedom of speech, and that it's good to exercise your rights, but also find what you have to say repugnant and bad."
t3_1enop4,ca24wnz,"Furthermore, a lot of feminist theory tends to state that the problems that men face - for example, being thrown under the bus in wars and sinking ships, or being the majority of wartime deaths and workplace deaths and suicides are caused by the expectations that society places upon them. Essentially, that while the expectation of men to be stronger / more stoic / less emotional can be beneficial it can also cause problems for them -- a man viewed this way will suffer injustices in custody court, for example, because he is seen as being incapable of being a good caretaker for a child. Also: re the draft, I don't think that many feminists support the draft at all."
t3_1enop4,ca24wnz,"As an example of feminist discussion on one such issue, I present URL . Regarding stuff like child custody laws - I think that while there are definitely major problems with the system as is that need to be rectified, certain stuff like reproductive rights for men and shared custody have a whole host of problems that go beyond equality and tend to have a serious potential for causing harm to the child. So it really isn't quite as much a black and white issue as the MRM tends to make it out to be - personally, I'm of the opinion that while the rights of parents are important, those of the child are moreso."
t3_1enop4,ca24wnz,"Regarding stuff like child custody laws - I think that while there are definitely major problems with the system as is that need to be rectified, certain stuff like reproductive rights for men and shared custody have a whole host of problems that go beyond equality and tend to have a serious potential for causing harm to the child. So it really isn't quite as much a black and white issue as the MRM tends to make it out to be - personally, I'm of the opinion that while the rights of parents are important, those of the child are moreso. "
t3_1enjqf,ca23wny,"Consider this: do you think that if you wanted to, you could choose to stop being bisexual and only be attracted to one sex? Even if it took you a little while? Also, I'm really interested to hear a quick summary of some of the life decisions you made that made you bisexual."
t3_1ekme5,ca1czli,"For example, the question of the elements, logical consistency, whether two objects can be exactly the same, and more plain questions like zeno's paradox, the raven paradox, etc. Because of this some people would say that instead of doing philosophy, we should simply be doing science &amp; mathematics while keeping the philosophical questions in the back of our head. That will get us answers more quickly than by doing philosophy."
t3_1egv4k,ca060ye,"Also, if you have ever seen rape porn, you will instantly know its not real. It is usually a woman combing her hair infront of a mirror, ignoring the camera man, when a guy jumps in through the window with a ski mask on, and then has sex with her, while she tries her best not to look at the camera or smile/laugh. "
t3_1eeqwi,c9zjpoy,"If you like at the Bible and the earlier days of Christianity, the same bigoted and close minded behaviours were found. However, while Islam itself has some problems, it's almost entirely the cultures that encourage these behaviors. From my understanding the Koran barely mentions nor encourages women to wear burqas or anything like that, the cultures themselves do, and this is often mistaken as a byproduct of the religion and thereby wrongly affiliated with it."
t3_1edqbg,c9zayfy,"You can't have a concept of ownership of property without the ability to transfer said ownership, and most humans (and mammals) have both a pragmatic vested interest and a strong emotional desire for the well-being of their children. So while there may be some truth to the idea that property inheritance breaks a strict meritocracy, I'd argue that no matter how true that is, it's the lesser of two evils compared to literally any conceivable enforcement scheme for outlawing inherited property. On top of that, trying to enforce an inability to accumulate wealth, either generationally for a family or for an individual, is never going to work out."
t3_1edqbg,c9zdwam,"They will have any number of advantages not everyone will have. More to the point, the harm of wealth disparity isn't the rich kid getting a Ferrarri, it's the poor kid not getting to go to school, or eat well, or have a place to live while she's looking for a job. I strongly believe that everyone, including and arguably especially the rich - those who have, provably, benefited the most from the existing social order - should do their part to help fix those problems, real problems that actually matter to people."
t3_1edqbg,c9zdwam,"I strongly believe that everyone, including and arguably especially the rich - those who have, provably, benefited the most from the existing social order - should do their part to help fix those problems, real problems that actually matter to people. So while it may be antithetical to some lofty ideal that everyone should have to work to achieve their goals, trying to prevent people from inheriting money is, aside from being futile, ignoring the actual problems that cause wealth disparity in a society. You will be fought tooth and nail by people who just want to be able to give their children the advantages they have, in their minds, earned the right to give them, and even if you succeed, you will have solved a non-problem."
t3_1edqbg,c9zayfy,"You can't have a concept of ownership of property without the ability to transfer said ownership, and most humans (and mammals) have both a pragmatic vested interest and a strong emotional desire for the well-being of their children. So while there may be some truth to the idea that property inheritance breaks a strict meritocracy, I'd argue that no matter how true that is, it's the lesser of two evils compared to literally any conceivable enforcement scheme for outlawing inherited property. On top of that, trying to enforce an inability to accumulate wealth, either generationally for a family or for an individual, is never going to work out."
t3_1edqbg,c9zdwam,"They will have any number of advantages not everyone will have. More to the point, the harm of wealth disparity isn't the rich kid getting a Ferrarri, it's the poor kid not getting to go to school, or eat well, or have a place to live while she's looking for a job. I strongly believe that everyone, including and arguably especially the rich - those who have, provably, benefited the most from the existing social order - should do their part to help fix those problems, real problems that actually matter to people."
t3_1edqbg,c9zdwam,"I strongly believe that everyone, including and arguably especially the rich - those who have, provably, benefited the most from the existing social order - should do their part to help fix those problems, real problems that actually matter to people. So while it may be antithetical to some lofty ideal that everyone should have to work to achieve their goals, trying to prevent people from inheriting money is, aside from being futile, ignoring the actual problems that cause wealth disparity in a society. You will be fought tooth and nail by people who just want to be able to give their children the advantages they have, in their minds, earned the right to give them, and even if you succeed, you will have solved a non-problem."
t3_1e30x9,c9wohh6,"If you truly value all forms of knowledge, then you should be right out there with them, not just complaining, but demanding that our productive infrastructure accommodate the social needs those forms of knowledge represent, rather than merely marketing, distribution, and those fields directly related to the manipulation of markets. You seem to be saying that while you may value all fields of knowledge, the market does not. The prevailing myth of capitalism is that markets will magically self regulate to meet relevant social needs."
t3_1e30x9,c9x7bnj,"The thing is that no one makes it without support of some kind. Career recruiters are greasing the wheels for folks in STEM professions while writers, linguists, and anthropologists are told that no one really gets paid for that outside academia and nobody's funding anything aside from STEM in academia anymore. That's not a statement of what's possible, it's a statement of what our current society will support."
t3_1e30x9,c9x7bnj,Most of the people I went to school with in philosophy were doing it as a pre-law degree. Most of the people in my fine arts classes were taking electives while pursuing degrees that will put them in advertising. I will most likely end up seeking work in advertising.
t3_1duzzk,c9u8yoe,"Your proposed tax violates the principles of URL . Taxpayers who engage in careful planning could easily avoid your tax, while taxpayers with the same amount of assets would lose everything at death to your tax. The difference would occur randomly, because some people would die unexpectedly."
t3_1duzzk,c9u8yoe,"Wealthy people will engage in lifetime giving strategies, which will benefit their children immensely, but middle and lower class people will not be able to do that. At death, the children of wealthy people will be very well off, while the children of middle and lower class people will be screwed. This is a violation of the principle of vertical equity."
t3_1duzzk,c9u8yoe,"Additionally, you must also provide some sort of exemption for middle and lower class families - perhaps an exemption under a certain amount, or perhaps the home can never be taxed. Otherwise, your idea is going to crush the middle and lower classes, while benefiting the rich - hardly the result that I think you are going for. "
t3_1dsz4r,c9tkb6x,"There's also the example of URL Here's wikipedia's definition of rape: So, for instance, if a woman broke into a man's house with a gun, held it on him and made him have sex with her while under the threat of being shot, that would be coercing him into sex with her, which would be rape. Erections are also involuntary."
t3_1dsz4r,c9tkb6x,"Men who have broken their backs and cannot move their lower bodies are still capable of sexual stimulation and having sex. A woman who drugs a man and then has sex with him while he's passed out is raping him, and is having non-consensual vaginal sex. Those are two examples."
t3_1dro9y,c9tb0nm,"-The predetermined objective of life is to reproduce and in doing so you ""succeed"" as far as evolution is concerned at least. ""I mean that humanity will never accomplish a worthwhile goal, one that will result in life having reached its predetermined objective or have truly 'succeeded' in any way."" -The predetermined objective of life is to reproduce and in doing so you ""succeed"" as far as evolution is concerned at least."
t3_1dro9y,c9tb0nm,"-The predetermined objective of life is to reproduce and in doing so you ""succeed"" as far as evolution is concerned at least. ""I mean that humanity will never accomplish a worthwhile goal, one that will result in life having reached its predetermined objective or have truly 'succeeded' in any way."" -The predetermined objective of life is to reproduce and in doing so you ""succeed"" as far as evolution is concerned at least."
t3_1dro9y,c9tb0nm,"-The predetermined objective of life is to reproduce and in doing so you ""succeed"" as far as evolution is concerned at least. ""I mean that humanity will never accomplish a worthwhile goal, one that will result in life having reached its predetermined objective or have truly 'succeeded' in any way."" -The predetermined objective of life is to reproduce and in doing so you ""succeed"" as far as evolution is concerned at least."
t3_1dkubk,c9r9k2n,"And this also creates so many problems such as stereotypes and false perceptions of other people when you force them apart. Besides, you can still preserve your culture while marrying someone of a different one. People do it all the time."
t3_1dilyh,c9qukp7,"TL;DR: Lane-split accidents at reasonable speeds (see CHP guide I linked to) are usually ""owwie class"" as opposed to life-changing. One more interesting point...right this moment on /r/motorcycles we have a guy posting about a crash that just happened to him while lanesplitting in California: http://www.reddit.com/r/motorcycles/comments/1dj6m4/i_was_taken_out_by_a_car_on_the_101_north_bound/ There's a picture of his wound linked but it's really not very bad at all - a single skinned elbow that will not need stitches or other serious care. This is typical of lane-splitting accidents."
t3_1di0zr,c9qvody,"I like to think a fractal patter predicts a repeating series of universes within other universes to infinity, but without evidence I cannot say that my father is completely wrong. He has managed to justify the possibility of a god while still complying with everything science suggests, and I respect that. There will always be an unknown because to eliminate the unknown, we first have to know an infinite amount of things."
t3_1d93tu,c9o5bzv,"Anecdotal evidence, but I have had bad teachers, but because it was an honors class, students got good grades on the standardized tests because they were good at taking standardized tests or because they studied on their own. So while I do agree that there should be evaluations for teachers, I don't think that standardized tests are the way to go because they do have biases. "
t3_1cyk99,c9laccj,"as well as better prepare you to work with other programming languages and platforms. The problem with a language like Python is that, while it is easy to learn and understand, it gives newcomers the wrong idea about how programming works. Python is a scripting language, it was designed solely for programmers to churn out as much code as possible without having to worry about things such as compilers, data types, or optimization."
t3_1cyk99,c9laccj,"I find that Java is the best balance of learning how to program as well as learning how programs work. It provides enough abstraction of tedious computer tasks, such as memory management, while exposing you to some of the lower-level aspects of computing that you need to know to be a successful programmer, such as how data is represented in memory (ints vs floats, etc. ), how a compiler works, what references are and how they work, and a better idea on how I/O works, which is really important to understand."
t3_1c5ps9,c9dg1q3,"I'm willing to bet that the disgust will lessen over time, especially if you make an effort to just be around gay people and watch them be casually affectionate. As a queer person, I appreciate that you're open-minded about this and recognize that your disgust isn't totally rational :) It may help you to know that while your disgust is a gut reaction, it is also heavily culturally reinforced. The fact that it's still with you isn't totally your fault."
t3_1bwu2v,c9auie0,"http://www.allgov.com/news/top-stories/black-americans-given-longer-sentences-than-white-americans-for-same-crimes?news=843984 I'd argue that the problem with this is that while it makes a certain sort of sense, history shows that it would be applied for bad purposes and that the solution proposed causes more problems than it solves. This isn't speculation, but rather the only conclusion that can be drawn from the USA's prior history of judicially mandated sterilization."
t3_1bwu2v,c9auie0,"We live in a nation where the courts and police can be statistically shown to police minority groups more heavily than majority groups [2], we live in a world where the courts give longer sentences to minority groups than to majority groups [3]. Moreover, the courts have a statistically demonstrable tendency to simply not charge rich people, and on the rare occasion rich people do get into legal trouble they get lighter sentences than poor people (if for no other reason than that rich people can afford really great lawyers, while poor people get overworked public defenders). Further, we have historic evidence that the last time it was tried, mandatory sterilization was directed mainly against the poor and black."
t3_1buffw,c9a70o8,"Having fun. I know it's cliche but it's true, some people have fun while drinking, and it is partly due to the drinking. For example, if you go to a club sober you might be a bit self-conscious but if you drink you might not be, and then you'll be able to enjoy yourself more."
t3_1bodtx,c98lik7,"And why girls in long term, committed relationships i.e.e 'nice girls', don't enjoy spending time with 'slutty' girls. So, while I wouldn't argue that its wrong (because right and wrong are so vague, anyways), I would say it is socially unacceptable, and that these are some examples of why. I would also like to point out, that I think it has nothing to do with jealousy."
t3_1bljky,c97rjrx,"Also, this idea that women should prevent rape is another misconception that many women actively against rape try to correct. You can take all those preventative measures that other people suggest (dressing modestly, not getting black out drunk even while all your male friends are, etc), but like your friends who got mugged, it may not really change anything. "
t3_1bkpef,c97m0dm,This would address the issue of killing innocents. Those convicted of violent crimes committed while in prison should be executed. Such behavior puts all inmates and guards at high risk.
t3_1bitj0,c978xo7,"I enjoyed being a brother. It was a worthwhile experience. I might even think it was worth paying for, but the cost was exorbitant."
t3_1bc8lk,c95k5tq,I went from maintaining a solid job at a restaurant waiting tables to doing okay at Kroger to doing poorly at Walmart. I went from getting a 4.0 while taking 18 credit hours and working 30 hours a week to getting a C and an F on my six credit hours while working no hours a week. I do not know if your assertion is correct - perhaps a stronger person than I could have just toughed it out.
t3_1bc8lk,c95k5tq,"I do not know if your assertion is correct - perhaps a stronger person than I could have just toughed it out. However, I can tell you that I used to be a stronger person than I was while I was depressed. I can tell you that depression took everything I liked about myself and shat all over it to the point that I was a literally worthless human being."
t3_1b5h4r,c93sauz,"I'm willing to bet it's significantly less than the white dudes speak up. The other consequence of this, of course, is that if there's a straight white male opinion on an issue you better fucking believe everyone has heard it, because the straight while male opinions are the mainstream opinions. They're the op eds in your newspapers, they're the SCOTUS decisions, they're the authors of your magazine articles, etc."
t3_1b4ngo,c93juyb,"I'm confused... You say but then offer no rebut for why this isn't a valid opinion. Even though you might make foolish decisions while drunk, it is ultimately your responsibility to control and moderate what enters your body and how that affects your decision making. Your actions are still your responsibility because you chose to impair yourself (situations of forced impairment are, of course, different)."
t3_1b4ngo,c93k70e,"I've never driven drunk. I've never raped anyone or killed anyone while drunk. I can control myself, why can't you?"
t3_1aszfk,c90i1xg,"You are not trying to force your beliefs on anyone, you are not trying to cause a ruckus, you are just using the phrase that most accurately describes who you are to yourself, and other people accepting to use the phrase bisexual (or whatever phrase you choose) for you is merely people just respecting your right to be who you are. So while yes, while demanding to be referred to as a specific pronoun might seem pretentious to someone else, if someone called me by the incorrect pronoun I know I would correct them and tell them the pronoun that I feel should be used. Can someone call me he?"
t3_1arnlm,c90957k,"If God does this, wouldn't that make her a deceiver? Some Christians find that characterization of their God unappealing, while your view would glorify a God who is at least as much of a trickster as the talking snake. Still others believe that what is vital about Christianity is not its claims about science, but the possible redemption from sin through the sacrifice of Jesus Christ."
t3_1al299,c8yf6nl,"How will you enforce all this? Lastly, while we understand much more of genetics than they did in the thirties, the last time eugenics was tried on a large scale, that understanding has shown us that genetics is complicated . Some diseases have simple single-gene causes."
t3_1ahaci,c8y9ehd,"They're obviously losing, but they're making it extremely difficult for you to do anything. Meanwhile, the international community has caught wind of you raining bullets on your people for weeks on end as they desperately fight back. You are now much more of a villain, and it is very likely that everything you try to do in the future will be hampered by this ugly incident."
t3_1adnuj,c8wgx6y,"It's the logistics of implementing that nationwide (or even state- or province-wide) that sink this idea for me. It removes too much flexibility in the name of economic simplicity, all the while setting the system up for a sea of red tape. "
t3_1adnuj,c8wgx6y,"It's the logistics of implementing that nationwide (or even state- or province-wide) that sink this idea for me. It removes too much flexibility in the name of economic simplicity, all the while setting the system up for a sea of red tape. "
t3_1960jw,c8lq3vy,"Because you've decided that that's the measurement that determines what's ""best"" you made a subjective judgement. And while you may be able to come up with a logical argument for why its a good measurement, I can come up with an equally valid argument for another measurement. "
t3_18dj9h,c8l7u7y,"They were supposed to have used every part of the buffalo, including all the bones, either to eat or use as tools or make into clothes. My point is that just because you kill something doesn't mean you don't have to respect it or treat it well while it's alive. It is traditional in many religions to have prayers that you say before slaughtering an animals or before a meal."
t3_35007e,cr08now,This means that people dont give a shit about politics. If we took the step and proposed that everyone in office would be held accountable for every offense while in charge ( and before obv.) I think politics would be more appealing to those of us who play by the rules and are pissed of by the government that can do seemingly everything without getting to face cosequenses for their actions.
t3_34dp1h,cqtpbha,"His facial expressions and some of his behaviour make him look like a low-brow village idiot that lives in a pub but the reallity is that he's much more savy than that. One major problem is that while he might be described as an astute politician, the rest of his party is riddled with incompetent gaffe masters who have contributed heavily to the perception that the party is all about ""bashing queers, expelling foreigners and keeping england for the english just like old eunoch would have wanted"" Granted these party members and their gaffes (which are later condemned) have done a great deal to help UKIP get popularist support but those that aren't so keen on the more extreme manifestations of the party are, rightfully, terrified that Nigel has no chance of keeping them in check once they get into parliament. Now the policies: Getting out of the EU because it has a lot of regulations which put a hold on the UK

The EU does have a lot of regulations which the UK is held too, but all the countries in the EU are held to them too."
t3_34dp1h,cqtpbha,"You do, however, IIRC pay NI contributions even when you are under the 10k mark. This is a game British politicians love to play, they make all sorts of promises about income tax while conveniently forgetting that people also pay NI contributions which, in a way, act as a second income tax. Sustaining universal Healthcare and abolishing hospital car park fees."
t3_33txti,cqooew0,"In a sense, all definitions are arbitrary. Why should some sequence of characters / sounds mean one thing while another means another? Well, language developed in order to communicate ideas."
