thread_id,comment_id,context
t3_2d4iry,cjm06yw,"This isn't just the case with age of consent either, but things like Blood Alcohol Level Limit for DUI or Speed Limit. Some people can drive fine above the legal limit, while other people's limitations are below the limit. However in the end, society needs to place the line somewhere and this is where it is chosen."
t3_2czuse,cjkv8v3,"Easy solution. Yes, it's a pain when people write checks while you're in line but as long as the store is okay with taking them then there's no problem with it. Stop using stores that allow checks to be written."
t3_2cy1ho,cjko53x,"While ISPs are an important component of the internet, the real innovation isn't in how the data gets to you it is what the data is. You could have the best internet speeds in the world, but without sites and services that were worthwhile you would never want to use it. A neutral intenet is one that is unlimited in its potential for innovation."
t3_2cwals,cjjmt5t,"I also don't have much of an interest in learning how to do so. With consoles, I can buy one once every 7 or 8 years and be all set while having a laptop for computer uses. Another reason is again, related to casual gaming."
t3_2cwals,cjjmt5t,"A lot of times when I play video games I am playing them with people in the same room. It's much easier to have a console that allows for multiple controllers to be used on one system than to have my friends all bring over their own computer if we all want to play the same game while hanging out with each other. Basically, consoles are generally better for casual gamers while PCs are generally better for serious gamers."
t3_2cwals,cjjmt5t,"It's much easier to have a console that allows for multiple controllers to be used on one system than to have my friends all bring over their own computer if we all want to play the same game while hanging out with each other. Basically, consoles are generally better for casual gamers while PCs are generally better for serious gamers. Neither is a ""master race"", but rather they are both better options for different groups of people."
t3_2cuup8,cjj95ae,"They will often serve as arbiters in these conflicts, facilitating the two (or more) conflicting parties to sit down with each other on neutral ground, such as in the Camp David Peace Accords in 1978. The issue I think you really have is with people making rash decisions while remaining ignorant of all of the facts, and that's a fair criticism to levy. Especially on reddit, people are wont to jump to conclusions based on biased readings of what little facts they have, as well as being very willing to make sweeping generalizations."
t3_2ctoax,cjl2zn4,"Hey man, I think I got a good one, albeit kind of silly, if your still interested: God is the trinity, one being expressed as three separate but equal entities: the father, the son, and the holy spirit. Free will is consistent with an omniscient, omnipotent creator god because while God may be these things, no single entity has all three traits. Now I have never heard this expressesly stated, it us somewhat backed up by scripture."
t3_2csr0e,cjiqsoa,"I yelled ""stop being lazy!"" while knocking him square in the jaw, and he immediately stood up, said ""You're right! I'm gonna get a job!"
t3_2csr0e,cjiqsoa,"People aren't out to completely change homeless people's lives by giving them spare change. It's a simple gesture - ""I feel for you, here's some change to get you through these tough times while you hopefully try to figure things out"". Sure, some homeless people may not use the money correctly, or appreciate it."
t3_2cn87o,cjh65sh,"If you're worried about it, get properly drunk surrounded by trusted friends who are instructed not to let you do anything really, really stupid and find out what kind of drunk you are. Or don't - I happen to know that I am basically perfectly fine while plastered in that I'm not going to cheat on my girlfriend, not going to drive drunk, not going to take my clothes off and run around the neighborhood, and I'm even good enough to my future self that I drink tons of water before I go to sleep even with the drunk knowledge that it'll make me have to get up and pee 10 times through the night... but in general I prefer being buzzed, so I usually limit to being buzzed. But being drunk isn't necessarily irresponsible."
t3_2cmtbr,cjh8tvn,"The distinction is not a fundamentally creative one, but a legal one. Many pieces of fan art can add creatively original and refreshing content to a pre-existing framework, while many legally ""original"" stories feel extremely derivative. If Harry Potter and the Methods of Rationality , is a more innovative, more thought-provoking, more unique, and generally better story than Divergent , why should I care which one is technically a ""fan work"" and which one is a ""New IP""?"
t3_2cmtbr,cjhkk75,"It's all in the perception, the legal approval, the legitimacy, not in something that is objectively different between the works themselves. It would be a pretty strange distinction, if the High Culture is the one that is ok to freely add other works to, while the mundane pop culture is the one that is so untouchable that transformative additions are all inferior. Are we so far gone that the Star Wars canon is more sacred than the Biblical canon?"
t3_2cflx0,cjf6p0a,"The Jarl of Falkreath (a scumbag, but an empowered scumbag) explicitly sides with them, and it's likely that the Forsworn and Black-Briars could be bribed over with promises of power. In 20-30 years, many of the humans in power will not have been in The Great War, while the Altmer will all be veterans and victors, with the desire to dominate and without the animosity of loss. Which is why it's important to end the war quickly and decisively, but which side you choose doesn't affect this point one way or the other."
t3_2cflx0,cjfajp7,"What is left of their government is a mess of corruption, political infighting and assassinations. What faction within the Empire is capable of rebuilding armies sufficient to push back the Aldmeri while under their watchful eye? They cannot even protect their own emperor."
t3_2cfco7,cjf1ihg,"Sorry, you're right! I just read a bunch of journal articles, and it seems that while galactose does make it into the fetal circulation, there is no evidence that a low-galactose diet in pregnant women is beneficial to a galactosemic fetus. I think my point still stands though, that having a near-death experience immediately after birth is exceedingly rare for a galactosemic infant who is not fed lactose-containing food."
t3_2c6m3v,cjctxvy,"There has been substantial amounts of research over the last 50 years on improving critical thinking, and most of the methods that have been tried have been surprisingly ineffective. The most promising method I've seen is the one adopted in a 1st year critical thinking course at the university of Melbourne, known as URL This URL analyzed the effectiveness of philosophy courses on teaching critical thinking and came to the conclusion: ""The meta-analysis results indicate that students do improve while studying philosophy, and apparently more so than general university students, though we cannot be very confidant that this difference is not just the result of random variation. More importantly, studying philosophy is less effective than studying critical thinking, regardless of whether one is being taught in a philosophy department or some other department."
t3_2c1r9q,cjc1g5t,"It is not the 'traditional' branch, though it is definitely similar to Wahabbism in fundamental thought. However, while they are not as accepting of most thoughts, even the Orthodoxy still fall under the school of ""Rabbinic Judaism,"" which means their faith is based upon the interpretation of religious scholars called Rabbi. These are the theological teachers and elder scholars of the faith, though in some sects the Jews allow non-rabbi scholars to present their ideas on the holy word."
t3_2c0frm,cjaq96l,"There already is an /r/Antitheism which gets much more direct about the dislike of religion than /r/atheism does. /r/atheism has a bit of an antitheism tone to it, but it does also cover other aspects of the philosophy of atheism while /r/Antitheism ignores the question of whether god exists, and instead directly question whether religion is good. To be clear, I am not saying that there is not a large amount of overlap in topics, or that most posts from /r/atheism might not also be at home in /r/Antitheism but that /r/Antitheism covers a much narrower range of topics than /r/atheism does."
t3_2bqdam,cj85cmx,"The Consolidation strategy is to get a loan from one source for an amount which lets you pay off all of your other debts. It's only worthwhile if this loan has a lower interest rate than the debts it is paying off, and thus the minimum amount spent per month is less, and the total amount spent overall is less. This is especially true if much of the debt is in credit cards, or if there is a significant collateral for the loan, such as a 2nd mortgage on a home."
t3_2bnfju,cj716f4,"It's their success that we tend to use as a gauge for whether a school is competitive in a sport or not; they're reputable. Also, while this is rapidly changing with each generation, boys' teams tend to have better coaching, farming and general training of athletes. When you consider the quality of athletics between the sexes, only so much can be chalked up to physical differences."
t3_2bmc2p,cj6s9ct,Just because Israel has a much stronger military in an armed conflict doesn't mean that they are committing genocide. If this was truly a genocide then why did Israel agree to a cease-fire agreement before the majority of the fighting had happened while HAMAS didn't? If this was the case then Israel wouldn't be warning Palestinian citizens about where and when their attacks are going to be and they would simply be carpet bombing Gaza instead.
t3_2bk0qs,cj66iuo,"It's just suffering in either case, right? Why is one form of suffering acceptable while another is not? You can point to one and say it's ""justified"" because it's suffering in payment for an act that caused suffering, but that makes the whole thing entirely arbitrary... some actions that cause suffering are okay while others are not... who gets to decide?"
t3_2bk0qs,cj66iuo,"Why is one form of suffering acceptable while another is not? You can point to one and say it's ""justified"" because it's suffering in payment for an act that caused suffering, but that makes the whole thing entirely arbitrary... some actions that cause suffering are okay while others are not... who gets to decide? One other reason I'll toss in is simply that it does no good whatsoever."
t3_2bk0qs,cj64yf0,"Personally, my objection to the death penalty and cruel executions in particular is pretty simple: We're supposed to be better than they are. I think it's exceptionally hypocritical to condemn somebody for violent crimes while you operate a facility built for the purpose of torturing people to death. "
t3_2bhy5s,cj5m2r2,"There's a problem with providing outstanding students compensation commensurate with the value that they bring to a University, in that it undermines a lot of other areas that are inherently non-profitable, but SHOULD be undertaken by Universities. If a hotshot graduate chemistry student discovers some amazing new compound while working for the University, they are more likely than not going to receive any kind of compensation other than recognition for it. Recognition that will go a long way towards them securing themselves a future, even though it may not come immediately in financial terms because their discovery belongs to the University."
t3_2bffjw,cj4wtg8,"So, the main issue with statistics like those is that currently, we simply don't have the data to say one way or another yet. We know that google's cars, while driving autonomously, haven't caused an accident yet , the issue is, that, as you've rightly said, doesn't really mean much. We need them to have driven further before we can make any accurate predictions."
t3_2bbq91,cj3viu7,"However, other milestones - like the capacity for abstract thinking and decision making - don't fully develop until the middle or late teens. Children and young teens tend to be concrete thinkers focused on the immediate present, while older teens become adept at abstract thinking that's focused on the future. So the majority of children and young teens do not have the full mental capacity to evaluate long-term risks and make good decisions."
t3_2bag31,cj3e0bt,I can use the money to not only get more work done but to help someone earn money. Both money and time are important but an organization with no money will not last long while one without volunteer hours can survive just fine. 
t3_2b9bgk,cj31mrh,"If it ran at you full speed and made impact above your center of gravity, there would be very little you could do to stay on your feet. Once on the ground, it would be much harder for you to gain the upper hand while protecting your throat. Even if you kept it off your throat, you would face serious blood loss from your defensive wounds."
t3_2b3qli,cj1lpfi,"In such cases, a successful affirmative defense reduces or even entirely removes culpability for a criminal act. One famous example of an affirmative defense was ""the burning bed"" case, where a battered woman essentially lost her mind and burned up her abusive husband while he slept. She was found not guilty of murder by reason of temporary insanity."
t3_2b3qli,cj1lpfi,"She was found not guilty of murder by reason of temporary insanity. So, while she faced consequences for her actions, the jury decided that she was not of sound mind at the time and therefore not responsible. Prosecutors generally have a fair amount of discretion when deciding whether to bring charges against an individual for criminal actions."
t3_2b3qli,cj1mo1v,"You want this to stop immediately but you don't want the perpetrator to escape justice by fleeing the scene. It's hardly surprising that a parent would respond with violence as opposed to, say, a polite request for the perpetrator to remove him or herself from the child while they call the police. "
t3_2b2yjr,cj1hktf,"dependents). With gentrification, those families may have to travel further - accumulating more costs and less time to make their neighbourhood better - while earning the same amount of money, if they get to keep their jobs at all. "
t3_2aymhj,cj161tw,"You are, in effect, sacrificing entire genomes to get rid of deleterious qualities controlled by a comparatively small number of individual genes. Gene therapy would allow the specifically deleterious alleles of these genes to be targeted and altered while allowing the rest of the genome to survive and contribute to the overall reproductive diversity of the population (and, incidentally, to the spread of the advantageous alleles it's been modified to possess). Governments (and other higher organizations) are made up of individuals, though."
t3_2ayhxt,cj01q09,* In regards to your education point CBI makes it easier to enter education. Someone can choose to work part time while going to school rather then never being able to afford to go as they have to work full time to afford to live. * CBI would result in immediate full employment.
t3_2awahc,cizi03p,"2. Let go of life while they are still coherent, still the same person that they are. Prevent their loved ones from having to watch their slow degredation."
t3_2atkq9,ciyvkn0,"Play It Safe's expectations of the flight. After all, you can still do an action while being afraid that something will go horribly wrong. For example, a construction worker may be afraid of falling off a roof, but still proceeds to work in such a situation."
t3_2ao6r9,cix7iph,"X can mean popular opinion polls, or rolling stones top lists or whatever you choose. Saying the Beatles are overrated means that while they consistently appear at the top of ""best bands"" lists in various media, in the future they will drop in popularity relative to other bands. You are making a prediction about the future."
t3_2am3iw,ciwjejz,"None of this means that the crimes of Hamas are forgivable, they are not. However, the Israeli response is always over the top, and the last time I checked, URL So, I still personally tend to side with Palestinians simply because while I abhor Hamas, they do not represent all of Palestine, while the Israeli government and military ostensibly do represent Israel. Once again, I do not think you should cancel your trip, but use it as an opportunity to learn about the real issues in this part of the world."
t3_2afeix,ciuiq4g,Now you would have a scenario where whoever can hire the largest cadre of amiable glad-handers to engage with the public has a marked advantage over everyone else. So the guy with $100 million can pay a staff of a thousand college debaters while the guy with nothing relies on volunteer used car salesmen. Money still wins by a wide margin.
t3_2a6vk3,cis80dc,"The fact that it's planned gives you some time to organize a nice time off, far away from the office, which is necessary for your mental health and work efficiency. Then, sick days, as illustrated by down42roads, is to send the message that the company understands that everyone gets sick once in a while, and that you don't have to worry about that. You're sick, too tired to work well and potentially contagious: stay at home without having to take on your planned vacation time nor to be less paid."
t3_2a6vk3,cis80dc,"Still not touching on your planned vacation, the company understands that shit happens.. and repairmen don't particularly enjoy working at night, nor do delivery companies. We hope you don't order 32 sofas and washing machine every year that require you to stay at home to wait for the delivery guy, but once in a while, you need some time, like everyone, to wait for some guy, or arrange some personal issue... and the company can understand that. Again, it's not about ""you should take that may days off that are due to you"", it's really ""without touching your vacation, we understand you have some personal duties that can require that you take half a day or a day of sometimes, so we make it easy for you, to show you that we like you and hope you are happy to work with us."
t3_29thke,cioct3t,The government may have all the power it needs to suppress its citizenry brutally. You need to defeat your enemy while they are still weak. 
t3_29r85r,cins4uc,"While these regulatory measures may coincidentally burden someone's religious belief, the measures don't constitute an entanglement of government with religion, don't lend support to any religion, and don't intentionally burden any religion. Neutral Laws of General Applicability is the only worthwhile standard. The more relevant one's religious belief is to whether or not a law is applicable to them, the more the courts become involved in determining what constitutes a valid belief."
t3_29pjwk,cincqfj,"the problem here is a simple one of equivocation the primary issue is that ""authority"" in the common sense consists of people who have the capability to lie induction is based on independently confirmed observations over the course of as many trials as possible so far, we pretty much know that gravity is gravity because so far, while on the ground on planet earth, we have not observed an apple falling up a person who is considered an ""authority"" can say he's seen an apple falling up, and that's quite a different matter than whether or not apples actually fall up on a regular basis and that this fact could be independently observed and confirmed by multiple parties in multiple trials across the planet while it's entirely possible that one person may lie about apples falling up, it becomes (usually) increasingly more and more unlikely that people are lying when multiple independent sources attempt and observe the same phenomena when subject to a panel of people (peer review) who usually by and large would like nothing more than to prove someone else wrong science is self correcting... when ""I tried it a thousand times at a hundred spots across the globe and so far apples don't fall up, so I think you're full of shit"" is the response that comes from dozens or hundreds of different people, you can be fairly (although of course not 100%) assured that apples do not fall up and that gravity behaves as we more or less expect of course you are free to believe that apples fall up based on the evidence that there is a logical fallacy known as the appeal to authority and that you are effectively taking these people's word on the situation and so hundreds of people may be involved in a mass conspiracy to delude you - but I'd pretty much say that's at the very least counter productive, and at the worst kind of stupid in fact you are welcome to try your own experiments to let go of apples and see how many of them fall upwards (pending approval of funding of course), but my guess is that you will observe that they do not fall up and that if you do observe that they fall up there is one of several explanations, either you may have indeed found an anomaly (the least likely) or you are on drugs, or you simply have confirmation bias - and confirmation bias is a primary reason that things like peer review exist, because a person like yourself might not believe the status quo and may wish to try for themselves, and you are welcome to do so, and if you can provide a way for other people to also challenge the theory as you did, and also do the thing, and also see the same results, then maybe you've found an anomaly otherwise you're just crazy - of course you may simply be narcissistic and think that other people are not real or some such other oddity and so their challenges and retesting of the experiments don't count because they're all out to pull the wool over your eyes, but that would basically be psychosis if I've got my terms correct, and you would in that case be suffering from an equally problematic situation in which you think you are, but you are not, an authority the problem here is a simple one of equivocation the primary issue is that ""authority"" in the common sense consists of people who have the capability to lie induction is based on independently confirmed observations over the course of as many trials as possible so far, we pretty much know that gravity is gravity because so far, while on the ground on planet earth, we have not observed an apple falling up a person who is considered an ""authority"" can say he's seen an apple falling up, and that's quite a different matter than whether or not apples actually fall up on a regular basis and that this fact could be independently observed and confirmed by multiple parties in multiple trials across the planet while it's entirely possible that one person may lie about apples falling up, it becomes (usually) increasingly more and more unlikely that people are lying when multiple independent sources attempt and observe the same phenomena when subject to a panel of people (peer review) who usually by and large would like nothing more than to prove someone else wrong science is self correcting... when ""I tried it a thousand times at a hundred spots across the globe and so far apples don't fall up, so I think you're full of shit"" is the response that comes from dozens or hundreds of different people, you can be fairly (although of course not 100%) assured that apples do not fall up and that gravity behaves as we more or less expect of course you are free to believe that apples fall up based on the evidence that there is a logical fallacy known as the appeal to authority and that you are effectively taking these people's word on the situation and so hundreds of people may be involved in a mass conspiracy to delude you - but I'd pretty much say that's at the very least counter productive, and at the worst kind of stupid in fact you are welcome to try your own experiments to let go of apples and see how many of them fall upwards (pending approval of funding of course), but my guess is that you will observe that they do not fall up and that if you do observe that they fall up there is one of several explanations, either you may have indeed found an anomaly (the least likely) or you are on drugs, or you simply have confirmation bias - and confirmation bias is a primary reason that things like peer review exist, because a person like yourself might not believe the status quo and may wish to try for themselves, and you are welcome to do so, and if you can provide a way for other people to also challenge the theory as you did, and also do the thing, and also see the same results, then maybe you've found an anomaly otherwise you're just crazy - of course you may simply be narcissistic and think that other people are not real or some such other oddity and so their challenges and retesting of the experiments don't count because they're all out to pull the wool over your eyes, but that would basically be psychosis if I've got my terms correct, and you would in that case be suffering from an equally problematic situation in which you think you are, but you are not, an authority "
t3_29oi1n,cimz15m,"Few other sports have the same concentration of excitement. Meanwhile, in between the snaps, there is a great deal of strategy and mind games involved as each team tries to guess what the other is going to do and adjust accordingly. As someone who has played all three, I find this idea laughable."
t3_29oi1n,cimz15m,"Soccer has a bit more strategy, but it is still rather simplistic and mostly relies on execution. Meanwhile, a football team will completely change the way they play against different teams. If your opponent has a star wide receiver, then you double cover him."
