thread_id,comment_id,context
t3_1y93n4,cfilbka,"Superman puts an incredible amount of effort into maintaining a civilian life as Clark Kent, probably to the detriment of his crime fighting, because he wants to be human . Batman, meanwhile, often neglects his life as Bruce Wayne in order to be a more effective Batman; in fact, he frequently views his ""ordinary"" life as a distraction from his ""real"" life as Batman. Batman wants to lose himself in the role, to leave his ""human"" side behind as much as possible."
t3_1y6r6n,cfhuqmy,"You say you believe that this god is intelligent and benevolent, but not much other than that, so I'm going to guess your belief is relatively vague; there is a god, but we do not or cannot understand its exact nature or desires. If that's the case, then that's what I believed for a while. I believed that, if there was a god, the most respectful thing I could do for it is not accept any characterization of it that don't make sense to me."
t3_1y6r6n,cfhuqmy,"So why, if you consider yourself a scientist, does it make sense for you to accept something as true without widely supported evidence? For me, I eventually realized it was mostly fear- I didn't want to make any gods angry by denying them, but then I decided that, while I didn't believe in any gods, the only god that would make sense to me is one that didn't care about something as petty as my own personal belief. "
t3_1y0z80,cfggmp9,"Unless someone has been trained to drive safely at high speeds, they should not be trusted to do so, as it puts the lives of others in jeopardy. We tried this out here in Montana a while back, where the speed limit on Interstate Highways was set to ""Reasonable and Prudent."" This changed a few years later, and we now have very specific speed limits, though it still took a few years before we had a state-wide prohibition on driving with an open container of alcohol."
t3_1y0q8w,cfrq7cf,"Hospice in my area pays for: PT, OT, ST, surgeries &amp; hospitalizations for interventions that promote comfort. In the case of Cancer- the PT can have hospice services while undergoing Chemo and Radiation. This is all covered."
t3_1xzpi7,cfg2dzw,"When someone suffers from clinical depression, instead of a jug of water, they have a simple 20 ounce water bottle. And while the container is smaller, the amount of water you need to reach emotions doesn't change. They can be hanging out with friends doing something that they'd normally enjoy, and still feel ""normal,"" because their capacity is reached."
t3_1xvch2,cff03ce,"That is exactly what the original Holmes would do. And while I greatly enjoyed the ""Irene Adler is Moriarity"" twist on Elementary , this is something that simply would not fly for a true fan of the original Doyle stories. Another issue is Lucy Liu's Watson."
t3_1xvch2,cff03ce,"She almost completely lacks the sense of hero worship present in the original source material and the BBC show. Granted, Watson does get irritated with Sherlock on the BBC version, but he definitely assumes the role of an inferior while in Sherlock's presence. I never get the sense that Liu's Watson feels inferior to Sherlock in any way."
t3_1xvch2,cff03ce,"It's clear that she admires him, but she clearly sees herself as an equal in the partnership, because she has skills that he does not (yet) possess. So, while I think Elementary is more fun to watch, I think that it isn't a very faithful adaptation to the source material. As an adaptation and an ""update"" to the Doyle character, I think Sherlock is superior."
t3_1xus3u,cff4s1l,"Many children in foster care were not ""given up."" Most children who are given up while they are babies are adopted - there are waiting lists for babies. Children in the foster care system were generally had by choice (perhaps a few of their crap parents might have gotten abortions if there were a high, immediate monetary incentive or something, but then people would get pregnant just to get abortions as a job so it's not a do-able solution, nor what pro-choice should be about, IMO)."
t3_1xtu9a,cfelt93,"I have never attempted to write a 30-page research paper in one day. But I have written one in a week, while my classmates took a month. If I have 5 hours to do a task that will take 30 minutes, I will start it at the 4 hour 30 minute mark."
t3_1xrsup,cfe9wcm,"Stims are a bit dangerous to use, even for people with ADHD who might benefit from them and/or genuinely need them. Taking stims ""once and awhile"" for tests/focus is VERY bad for brain chemistry. Even people who take them under a doctor's guidance are told not to just take them randomly but in a set schedule."
t3_1xqnjx,cfdr0zs,I do way better when I'm able to tae notes on my laptop. My hand writing is really messy and when I type I can look at the board and pay attention to what is going on while I'm taking notes. I do noticeably better when I don't have to take notes by hand.
t3_1xqnjx,cfdsxp9,"in class. If you post these things online before your classes start, it allows students to preview the material before coming to class, or look at this material on their own device while listening to your lecture/discussion. It makes it easier for students to engage in these things when they have it right there in front of them."
t3_1xp9br,cfddlr2,"Arrogance means different things to different people, but it is essentially the antithesis of being humble. However, it is possible to be confident in one's value and abilities while still remaining humble and remembering that you're just not that special . "
t3_1xml8r,cfcsf0o,"Even if you tacked on another couple billion for the rest of the CEOs in the US and other executives, it's still not enough to pay for all those workers retirements. Not to mention the fact that (while some might be over payed) CEOs and other executives are quite smart at their jobs, and are often able to make their companies even more profitable. I'd start with the $650,000,000,000/year Military-industrial-congressional-complex."
t3_1xk5oo,cfc5hbu,"You learn a lot from any job--no matter how menial it seems--about getting along with other people, accomplishing tasks, being presentable and on time, etc. and while the employed are out there practicing these skills every day, the unemployed person is missing out on a chance to improve herself. "
t3_1xj95w,cfc8jrw,"The relationships between the characters and the internal struggle of these larger than life characters are something I am very intrigued by. In a story I read a while back, The Flash was forced to watch as his enemy caused his wife to miscarry their twins. He made him watch, over and over."
t3_1xauzj,cf9ryoi,"Some of these can be duplicated through a series of other contracts (such as power of attorney or health care proxy), but some of them can't. So, why does this partnership incur such privileges while other partnerships (a joint business venture, roommates, being best friends, etc) do not? There is only one simple reason for this."
t3_1x9drc,cf9aorl,"Gonna put it out there, so do I. My room's a mess and while I haven't had headlice since I was about 11, my bathroom's not great. Obviously this isn't a great thing to be proud of, but am I letting down my gender, or something?"
t3_1x5wrj,cf8fe6i,"I would like to propose that you do not need to change your fundamental belief in order to sustain your friendships: you have other options, the most healthy of which is to cultivate friendships where you can enjoy debating and discussing differences of opinion. And OK, I concede that this may not be the most ''easy'' option in the short term, but the long term rewards are so great that your friendships will be easier and closer and more fulfilling as you grow older, when you feel you can express your views and disagree while maintaining care and respect for each other. You don't have to sell your soul to make friends, you can be true to yourself and make even greater friends."
t3_1x3quk,cf82a08,"They're placed on reddit, and upvoted by redditors, specifically because the posters and voters thought, in their heart of hearts, despite what polite society would have us think, that they could bring joy to a whole lot of people by sharing a simple photo with others. Thus, that picture of a girl's ass filling up most of your front page as you scroll down the page is representative of what makes reddit a beautiful, magical place: that things are shared out of kindness and upvoted with goodwill, and even though we may not agree with everyone on the site, even though we might despise a lot of the content, we know that we're mostly just decent people who are looking to enjoy ourselves for a little while on the internet, and we're not going to spoil some arbitrary rules about what is acceptable in polite company ruin our good time. If the unfortunate side-effect is that you have to occasionally see some naked pictures because you don't want to stick to your front page rather than /r/all AND you don't want to turn of NSFW posts then, well, maybe its something you should just let go."
t3_1wxy0c,cf6e7lp,"In modern times they exist only to feed human beings. Now obviously animals suffer when we kill them, but do most of them suffer while they are alive? And even if they do suffer, does that suffering outweigh the value of life itself?"
t3_1wxy0c,cf6l6sd,Does this make your life meaningless? Does this suddenly make your life not worthwhile? Are the robots acting immorally by keeping your brain alive?
t3_1wqdpz,cf4fnk7,"And sometimes they have shady practices with respect to private data and such that make them hard to trust, but without an example there's nothing really to argue. ...while sometimes abusing the legal system and patents in anticompetitive ways ...and in the process bankrupts people ruining what life they have left. All three of these examples could be a CMV on their own."
t3_1wjljf,cf2mf4d,"You seem to have a well-foundedly cynical view of today's educational system, but you assume that the system will not change. We are using curricula modeled after that of the last century, meaning that we are preparing another generation of highly polarized workers--""smart"" kids get fast tracked and sent on to professional jobs while ""slow"" kids get held back by teachers and then their own lack of faith in themselves, guiding them manufacturing/service level work. Obviously If this trend is to continue, we're going to have lots of problems because so many of the lower end jobs are going to be automated and there are going to be a crap ton of people with nowhere to go."
t3_1wh80m,cf1x8sz,"However, even when studies control for such factors, pay gaps are still readily apparent. For example, a study out of Stanford found that while occupation,industry, and years of experience do explain some of the disparity, even after this was controlled for, 40% of the pay gap could not be explained by these types of ""traditional"" factors. https://www.stanford.edu/group/scspi/_media/pdf/key_issues/gender_research.pdf"
t3_1we3gg,cf1aqki,"If your cancer is, indeed, genetically transmitted (and if we can screen for the genes involved), then you can have children without passing the gene on through IVF. Since you apparently have a clear route to having children while minimizing the risk of inflicting them with your childhood disease, clearly it is not morally wrong for you to reproduce in all cases, thus your original statement is invalid. ;)"
t3_1wdil8,cf0znaq,"What a waste to have struggled through 30 years and just throw away that investment. That whole sacrifice would have been worthwhile if a treatment is found. As for treatment resistant, that's kind of the point."
t3_1wd6jq,cf0vo2d,"The thing with this universal system is that it is chaotic. Being ""chaotic"" has a very precise mathematical sense, and while it is quite technical, I will focus on one very important aspect : For any initial state X at time t, there is another initial state Y arbitrarily close to the first one, the evolution of X will be arbitrarily far from the evolution of Y after some finite time T. This means that however close to X I restrict my search, I will still find such a Y that after some finite time we can distinguish both as being ""different"". This property is called ""Heavy dependance on initial conditions""."
t3_1w6uhl,cezbjga,"That's a pretty big role for most people to leave up to chance. Don't even get me started on children that were raised for a while before being abandoned. If knowing that in raising a child via ivf will make that child more receptive to being raised healthily and happily, if even by a little chance, I think most people see it as a valid reason to forgo adoption."
t3_1vz63d,cex6xzs,"It happens to all companies. Remember that Microsoft was the most prestigious/profitable/innovative company in the world for a while too. So Google is pretty good, but they are on the decline."
t3_1voenh,ceubelw,"You make the point below that it's your choice where your want to be touched, yes - but society has deemed things that are ok, are sometimes ok and are not ok in public/without consent. So I can tap your shoulder from behind to get your attention, I can probably touch your elbow while flirting, I can't really grab your junk without enthusiastic consent. If your lines are different from society's that's something you have to deal with, not society."
t3_1voenh,ceubelw,"This perhaps shouldn't be the case, and i think we are reaching a place where we realise everyone can be sexually harassed, everyone can be the aggressors. But in the past this hasn't been the case and we always take a while to shake off these double standards. So currently a girl grabbing a guy is seen as fun and flirty, and when he doesn't want it 'oops hahahah' whereas when guys grab a girl when she doesn't want there's an inherent perception of danger (if he's willing to do that when I didn't want it what else is he willing to do?)"
t3_1vloic,cetqht9,"There is also another form of freedom thought about called ""positive freedom"" or ""freedom to..."" because the increase in ability, knowledge or access gives you the freedom to do things that you could not have previously done. In this case, a drink driving law impinges upon your negative freedom, because you now no longer have the freedom to drive while drunk. You are restricted."
t3_1vil9h,cesmz2f,"For the sake of argument, let's say it developed the ability to break down other molecules. For a while, it would be the dominant molecule, as the others would have their numbers kept in check by the activity of the first. In order to cope with this new, hostile environment, mutations in the code for replicating molecules are favoured; each mutation takes it further away from a structure that can be broken down by a competitor."
t3_1v97rw,cepz02o,"It's that not everyone interprets the joke the same way. Consider how people listen to biased news sources while separating what's true and what's spun. Even when we know it's from a biased source, when certain information is presented in a way that suggests that it's a commonly-accepted truth, we believe it."
t3_1v6x7z,cepe2tx,"I spent six years active and 18 months in Iraq (one whack, surge deployment advon/trail) and two years National Guard. While I can go on about my experiences while in, the experiences getting out is most relevant. In the Army we have a program called ACAP (Army Career and Alumni Program) that soldiers that are one year from separating from the Army are supposed to start."
t3_1v131d,cenp4nn,"Not like we would spend that free money every month. We already help each other out, that's why we don't split bills 50/50, that's why we both cook and clean, that's why she is the one decorating everything, while I take care of the tech stuff. But those are all things that need to be done."
t3_1uw88g,cema7rn,"Americans saw bullshit and they want people held accountable. The smart representatives see this and know it's time to stop pushing the envelope, at least for a while. As for some local group who decided not to pay taxes... not much of a chance there."
t3_1us3bu,cel70ih,"The same oculd be true of my personal studies of film. while my actual education in the topic is minimal, I have taken free classes, read books, and done a number of other things just from interest. From these classes and the like, I have learned how to put my ideas better into words, communicate better when I collaborate with others, and understand why some of the things I was doing before ""just didn't feel right"" in the final production."
t3_1unqmi,cek6g1o,"Every culture has it's 'acceptable' and it's 'taboo' styles of dress. They vary radically... women in many parts of Africa wear no tops while they are working during the day, that's just ordinary working attire. But in the evenings if they are trying to look good?"
t3_1unqmi,cek6g1o,"There are conventions, styles, norms.... that vary from culture to culture. Now I'm a western male, and in our culture I would garner no odd looks if I took my shirt off while working in the yard, but grocery shopping topless is still frowned upon. The line is completely arbitrary, everywhere and in all cultures."
t3_1ul993,cej9725,"So far so good right? OK, now let's say you run your restaurant for a while, but then get bored and don't want to do it anymore. It's turning a nice profit though, so I tell you I'll buy it from you for 100,000 dollars."
t3_1ueg7f,ceh8q6y,"The problem is that your not that bright and the high stress job you are being set up for is going to make you miserable. Actually, the black girl who couldn't afford to go to Oxford so studied at Liverpool university is much better suited to the job and would be much happier in it than you while you actually would really prefer to go off and work as a farm hand because you enjoy physical work and the outdoors and don't want your work intruding on your free time. Without equality of opportunity that can't happen."
t3_1udzn5,ceh5p69,"/u/quasimoto__ already gave you a good run down of the history of dubstep, so I'm just going to link you to a few songs that take a serious influence from other genres of music URL - This is going to be your reggae/dub influenced dubstep. Mungo's are a soundsystem crew from Glasgow putting out reggae, and reggae mixed with dubstep for quite a while now. This song has a the same vibe as reggae, but has the distinct bass of dubstep and also a bpm of 140."
t3_1udzn5,ceh5p69,"This song has a the same vibe as reggae, but has the distinct bass of dubstep and also a bpm of 140. URL - This is heavily Jazz influenced, has the smooth piano and horns in the back, while once again having deep bass, and a bpm of 140. URL - This one is on the more tribal side with the drums, and has some truly good vocals."
t3_1u8u5z,cefnij9,"Physical contact with another car would not be necessary to fine an individual - causing traffic and congestion via irregular driving would also be met with financial consequences of some sort. But not to get too bogged down with the details, I would still argue that my system is superior to a system of completely automated cars, since it would severely decrease the number of human drivers on the road (almost to the point of non-existence) and thus realize all the benefits that you desire, while maintaining the freedoms of drivers who really, realllyyyy want to continue driving. "
t3_1u87uu,cefgarg,"I know not everyone will find consolation in the analogy, but I hope some will. I once heard it described/handled this way: Remember when you visited an amusement park while you were very young? When you arrived in the morning, you were almost shaking from the excitement and you (perhaps naively) thought that you NEVER wanted to go home."
t3_1u7llg,cefbw53,"Presumably you have sympathy for those who are victims of hurricanes or earthquakes or tornadoes, even though they are responsible for living in areas with an increased risk of natural disaster. If you got robbed while walking in a dangerous part of town, I'd still feel bad for you, even if you presumably could have taken steps to help reduce your risk. I guess my point is, even if you do believe that ""If you do something, you should be prepared to accept the consequences,"" you can still feel bad for the victims."
t3_1u4wxq,ceeovmf,Although experienced with inexperienced is probably a contributing factor I don't think it's one of the larger reasons. I'm going to repost something I threw up a while ago about why I think people rage in LoL: 
t3_1ty0ux,cecvbm3,There are people who think butter clogs your arteries and people who think that it will lower cholesterol. For weight loss there are people who think you must cut carbs and increase fat while others say the opposite. Some say it doesn't matter what you eat as long as you only eat at certain times of day or after certain fasting periods or foods with a certain glycemic load or eating for your body type or eating for your genetics or eating like your ancestors did.
t3_1ty0ux,cecvbm3,"Some say it doesn't matter what you eat as long as you only eat at certain times of day or after certain fasting periods or foods with a certain glycemic load or eating for your body type or eating for your genetics or eating like your ancestors did. There are countless definitions of ""healthy"" eating and, while at the end of the day it comes down to calories in vs calories out it can be a very confusing landscape for someone with little/no dietary knowledge to navigate at first. Healthy eating and weight loss ""industries"" are big bucks and the best way to keep one interested in weight loss products it to keep you from reaching your ideal weight."
t3_1ty0ux,cecvbm3,"Healthy eating and weight loss ""industries"" are big bucks and the best way to keep one interested in weight loss products it to keep you from reaching your ideal weight. The companies that spend big money on advertising weight loss products have their voices heard while the basic concept crowd that don't make or spend money on their message are often the quietest or at least less-heard-from. If I want to go learn to fish I may hear about what spots the best and what lure is best for what fish but at the end of the day all the guides will tell me to dip my net or cast my reel."
t3_1tx0tf,ceca72e,"I think that if you honestly believe something to that effect, it is your job, should you wish to call yourself a decent human being, to do everything in your power to convince everyone you meet that it is the truth, ESPECIALLY your children. Not doing so would be comparable to letting a blind and deaf man walk into a burning building while you're watching, without even attempting to steer him off course, in my opinion. "
t3_1twegt,cecdzz2,Whether the debt is attached to the owner or the property doesn't change that. I don't know about never but not for a while anyway. But this is something that happens in the buying and selling of real estate.
t3_1tt75b,cebccgh,"When teams string together successful possessions with 8-0 runs two aspects of the game are affected simultaneously and noticeably. From one team's perspective, they are not making shots due to poor offense with turnovers and/or missed shots while playing poor defense and not stopping the other team. Other sports don't necessarily have this level of perceptible momentum that readily is observed through the scoreboard."
t3_1tsb39,ceayw9b,"I've had to look a friend in the eyes and be the one to tell him that his fiancee had been killed when he wrecked his car after blowing a 0.09. When you get behind the wheel of a car while intoxicated, you actively endanger other people. So exactly where does it become a crime?"
t3_1ts9zl,ceaz4di,"In essence, they could never be reintroduced to the wild, not really. Now while we could create pharmaceuticals in a lab, we do with almost everything, there has to be a generic start for it. Insulin isn't created from dog pancreas anymore, it is synthesized."
t3_1tqttm,cealwzd,"As for human suffering, I think this is not an argument against vegetarianism at all. It's entirely possible to avoid buying leather shoes while at the same time also avoiding sweatshop labor shoes. It's entirely possible to feed starving individuals and nations with vegetarian diets (in fact, it may be more beneficial to do so)."
t3_1tqlde,ceaj38t,"This is an extreme case of telling the Santa lie, where it starts to overlap with telling your child about a Deity, because when people do that, they do it in order to have them believe it wholeheartedly. In the majority of cases though, the Santa lie is supposed to be figured out by a child, while telling them about your favorite Deity is not. It's the difference between giving them a difficult puzzle which they don't know is a puzzle and giving them a difficult puzzle and telling them it's a painting, so they shouldn't even touch it."
t3_1tku2p,ce92cm3,"And with that comes a lot of disparity in educational goals. Many kids simply don't try, while at the same time there are kids in the same systems taking all AP's and are on track for a high ranking college. Not to mention property taxes heavily favor upper class neighborhoods and districts."
t3_1tk9tm,ce8srhi,It took forty or fifty years for that technology to really mature and hit the mass market. The recent big improvements in computers are going to take a while to develop too. Give them time.
t3_1tk9tm,ce8wapt,"http://en.wikipedia.org/wiki/Crimes_%26_Punishments This upcoming Sherlock Holmes investigation game uses it. http://cs.ecs.baylor.edu/~maurer/CSI5v93CLP/Papers/Risks.pdf It's somewhat erratic whether it will be worthwhile for a component developer to support their component if it's buggy. You have to ensure the component is trustworthy, not filled with viruses, no malware."
