thread_id,comment_id,context
t3_1xqnjx,cfdvwqp,"The 1-2 minute process of looking through a dictionary now takes 1/2 a second. I'll be taking literature and composition next year or the year after that (albeit the college board's ""AP"" edition), and from what I've heard from friends, it reacquires alot of writing and taking notes while you read. Rather than have a book filled with a million doodles and post-it notes, why not have a clearly annotated e-book copy with pins on specific pages and a directory that points out where each pin was placed with a note on why it's there?"
t3_1xj5t3,cfbsvrz,"The idea that we can stop and frisk you because you look foreign is breaking John Locke's ideal government. And if we want to bring up something on reddit often, look at MGM vs FGM, one is banned in all forms, considered horrific, while the other one is encouraged by the CDC. Why, when FGM was banned, didn't we ban MGM?"
t3_1xg9o8,cfb8rco,"because trials. The accidents will have trials, you can't just give teachers immunity for prosecution if the gun they are responsible for kills an innocent student due to their neglect, that would never be upheld by a court (sorry little johnny was killed because Mr. Suckswithguns thought it would be fun to play with what he thought was an unloaded gun while the students were testing, but because he's a teacher he can't be sued and you'll just have to carry the burden of knowing that Johnny's sacrafice made the world safer... seriously not going to fly for public opinion). It would be so absolutely detrimental to the gun rights groups that it would probably end up shifting opinion."
t3_1x5wrj,cf8h4zs,"I think it's possible to advocate for social justice and gender equality without ignoring or silencing such studies. That said though, while such studies like the one cited provide interesting information about general differences between the sexes, how can such information really be applied anywhere? Generalizations can only really support research on general populations - it becomes prejudice when applied to specific people."
t3_1x3jm2,cf7w0x1,"By labeling post-dictions as predictions, he is encouraging people to ignore the one thing that makes science valuable. As such, while one can believe in creationism and still properly use the scientific method, one cannot believe that creationism is science and still claim to understand the scientific method. I think that both Nye and Ham adequately demonstrated that fact, so it's clear that Nye won the debate."
t3_1wxy0c,cf6ij1q,"I will take a swing at this with a fairly different point of view since you dont want arguments for not being a vegetarian, but to keep eating meat. So while i guess it is immoral to eat meat, the fact of the matter is that millions of people do and hundreds of animals are killed for this meat, but like all industries, there is some waste, and it is often in grocery stores where the meat just isnt bought and ends up going bad. So my argument for continuing to eat meat is that its and industry that isnt going to go away, at least not in your lifetime, and by continuing to eat meat, at least you're giving some form of meaning to the animals death and keeping even a little bit more of it from being trashed."
t3_1wvths,cf5ugx7,"Dreams come from the memory and are not able to give you new information. The information is being solved while you dream, making you dream things that make no sense in any way. While dreams are sorting only things that has happened, they can be vital in psychology."
t3_1wvths,cf5ugx7,"They tell what persons mind is doing when subconscious takes the charge, and any kind of dreams tell what is happening there. Usually if something bothers very much while awake, you can get dreams related to that. You shouldn't analyse the dreams like in some lousy books where they say that if you see cat in dream, it means you are gonna be rude to someone."
t3_1wh80m,cf2a6xq,"Here's one example: ""Sexism also arises in the workplace through the beliefs concerning which emotions are appropriate for employees to show. Stereotypically, women are expected to be kind and nurturing, communal, and modest, while they are not expected to display anger. Expressing an emotion that doesn't line up with people's beliefs about gender-appropriate behavior could lead to being given a lower status at work, and consequently, a lower wage."
t3_1wh80m,cf2a6xq,"Expressing an emotion that doesn't line up with people's beliefs about gender-appropriate behavior could lead to being given a lower status at work, and consequently, a lower wage. [4] A 2008 study found that men who expressed anger in the workplace were given a higher status, while women who expressed anger in the workplace were given a lower status, regardless of their actual position in the company. A trainee and a CEO who were female were both given a low status when displaying anger."
t3_1wg82e,cf1p6r9,"It's like saying ""I'm not racist, but I won't date any woman who's not a member of the KKK"". So, for you nieces, you're probably making pro-choice position looks bad because you consider it's a flaw for a woman to hold it while still saying you support it, hence the intellectually dishonest label they give you. Now, if we go simply by your topic's title, yes it's fully possible, but you're playing with cognitive dissonance there."
t3_1we3gg,cf1b9fg,"All life is a gift. And while you went through an agonizing and harrowing experience as a child, you lived. And you stated in another comment that you consider yourself very grateful for your life because of what you went through."
t3_1we3gg,cf1b9fg,"All life is a gift. And while you went through an agonizing and harrowing experience as a child, you lived. And you stated in another comment that you consider yourself very grateful for your life because of what you went through."
t3_1w91jl,cf0javl,"It should also be noted that the music of mainstream America could also be seen as frequently demeaning to women, though perhaps less blatantly. First, we need to decide what 'degenerate' means, because my argument here is essentially that a) there is no such thing as black culture and b) the cultural norms that you've identified, while they certainly exist in some (extremely deprived) places, are the products of their environments and have developed to best suit their situations. I don't think it's reasonable to argue that any culture is 'objectively' worse than any other culture, because worse implies a moral judgement and is thus subjective."
t3_1w3r7a,ceyiqk4,"I think that conclusive counter-arguments have already been presented in this discussion, but I would like to add that the logical problem that you are complaining about is not hypocrisy, it is inconsistency. Hypocrisy would be to publicly oppose contraception while secretly still using it. Hypocrisy is the double standard, requiring others to conform to some standard to which you personal do not conform."
t3_1w3r7a,ceyiqk4,"When you make assertions that contract each other in some way, that is a problem with logical consistency. In any event, while one could argue that it is more consistent to oppose all medical intervention in the reproductive process, it is quite true as others have observed, that you can have a consistent viewpoint that people should reproduce, and therefore medical science should help people to reproduce rather than giving them means to avoid reproducing. That is not my view, but it is a consistent view."
t3_1vloic,cethv0j,"Therefore, sober motorists in a drunken-driver world are not free in that sense. Legislating against drunken driving removes, or at least lessens, the external restriction of death or injury while imposing another external restriction, that is, penalties against drunken driving. One freedom (to drunkenly drive) is lessened, while another (to use the road with less risk of injury/death) grows."
t3_1vloic,cethv0j,"Legislating against drunken driving removes, or at least lessens, the external restriction of death or injury while imposing another external restriction, that is, penalties against drunken driving. One freedom (to drunkenly drive) is lessened, while another (to use the road with less risk of injury/death) grows. "
t3_1vil9h,cesm93p,"Another point to note is that humans are not (yet) perfect, and there is still much room for further evolution. General trend of evolution follows natural selection, in which the stronger survives are reproduce while the weaker slowly die off. We can never say for sure how it all happened but continuously small mutations are always happening in our DNA which could add up after such a long time."
t3_1vil9h,cesm93p,"We can never say for sure how it all happened but continuously small mutations are always happening in our DNA which could add up after such a long time. Mutation in itself is a random process but the process of natural selection weeds out the non-beneficial ones while populating the planet with ones that are helpful for survival and over the many generations, we came out as such. Another point to note is that humans are not (yet) perfect, and there is still much room for further evolution."
t3_1v6x7z,ceplff5,"You have buy new land, hire personal, and essentially make a base for reverse boot camp. I think ultimately in execution it would end up as being as stressful as the regular army being crowded in with other vets, told to wait around in a camp for a month, hear lectures about returning to civilian life while they fish in a pre made pond and basically ordered to do recreational activities. lastly, Yeah, because that's the age range for enlistment, the cut off is 30 something."
t3_1v6x7z,ceplff5,"You have buy new land, hire personal, and essentially make a base for reverse boot camp. I think ultimately in execution it would end up as being as stressful as the regular army being crowded in with other vets, told to wait around in a camp for a month, hear lectures about returning to civilian life while they fish in a pre made pond and basically ordered to do recreational activities. lastly, Yeah, because that's the age range for enlistment, the cut off is 30 something."
t3_1uwx2j,cemhewf,"The vast majority of other good Pokemon had no way to deal with him. If he were allowed, games would end up being focused entirely around him; any team that wasn't based around killing Mega Kangaskhan while protecting its own Mega Kangaskhan would be uncompetitive. That's a problem."
t3_1us404,cel68zm,"It is in our nature to want ""more"". Capitalism incentives this desire, while communism crushes it. In communism, it is only the political class that has the means to get more, while most of society is living devoid of any incentive to succeed."
t3_1us404,cel68zm,"Capitalism incentives this desire, while communism crushes it. In communism, it is only the political class that has the means to get more, while most of society is living devoid of any incentive to succeed. "
t3_1us3bu,celj7rq,"So, you almost have to be an out of the box thinker; an immense creative type to get any where in the art world (there are people who are just in the right place / right time, or have the right connections, but that represents about 5%, and they usually don't even go to art school). Art school presents you with that problem, and does it's best to let you know that while the paint brush, canvas, paint, what have you are certainly important tools, the most important tool is the thing controlling them: your capacity to be creative. You're not going to get good marks / praise / recognition by just being an amazing painter."
t3_1unqmi,cekb5a7,"Like it or not, there is more of a disconnect in men between the sex drive and the rest of our emotional state; this is why it is completely possible for men to get funeral boners. This also means that if we see naked boobs while driving a car, we can get distracted. I have more than once witnessed a revealing top almost cause an accident due to the male gaze."
t3_1umi67,cejtg9p,"In my perspective that's theft, in theirs it wasn't. Some anekdotal evidence as to why you should ask the owner of said trash if it is actually trash: Left my bike (locked) by the side of a suburban road while I was new in the USA - bike was gone when I came back from school. In my perspective that's theft, in theirs it wasn't."
t3_1udlql,cegzp5m,"Peeing in a shower that you share with others is not okay and it should be discouraged at a young age just so it doesn't become a habit that's impossible to break or that they don't know they need to break. I think the problem is that it's habit-forming and while it's okay to pee in your own shower, it becomes a problem when the child who never learned anything against peeing in the shower pees in the shower at the gym or pees in the shower of someone else's house. It becomes then a sanitary issue."
t3_1udlql,cegzp5m,"Peeing in a shower that you share with others is not okay and it should be discouraged at a young age just so it doesn't become a habit that's impossible to break or that they don't know they need to break. I think the problem is that it's habit-forming and while it's okay to pee in your own shower, it becomes a problem when the child who never learned anything against peeing in the shower pees in the shower at the gym or pees in the shower of someone else's house. It becomes then a sanitary issue."
t3_1u7llg,cefb5g9,"We go, but I don't have independent transportation/good directions/ect and wind up getting a ride. Once at the party my friend goes to hang out with people they know, while I catch up with a person I haven't seen in a while. Now, after talking for a bit some people start breaking out alcohol and possibly other drugs."
t3_1tt75b,cebecvh,"So what's the appeal in the sport then? It's highly skilled based, usually has a bunch of very acrobatic or athletic plays made throughout, and while it is high scoring is usually very competitive throughout, as long as the teams matched up are of equal calibre, but that last point can be made for most sports. "
t3_1tsb39,ceb95mw,"If there was no laws surrounding legal limits of blood alcohol levels, do you think that the number of people drinking, then driving home would increase or decrease? Does the negative incentive of punishment prevent people from driving while drunk? I think it does, I think that the possibility of losing my vehicle, license and having a court date prevents myself as well as many other people from contemplating driving under the influence or alcohol or drugs."
t3_1tsb39,cebdye0,"There is no risk assessment involved in drunk driving, there is no manageable level of stupidity here. The fact is, you think you are invincible and enjoy the thrill of driving fast while intoxicated. Whether you are alone, with a 'willing' passenger or on a crowded street in Tokyo is regardless."
t3_1tsb39,ceazxb4,"Trying to prevent this is entirely a positive thing and something we want our laws to do. You could say its limiting our personal freedoms but thats a worthwhile trade off for people dying randomly in car accidents. We limit your right to do drugs, to sell them, to kill people, rape people."
t3_1t9irv,ce5tq64,"1. My 1st point isn't compatible with your post because your post, in line with progressive views of sexuality, assumes the existence of a sexual orientation (in this case, homosexuality) and conceptualizes the homophobia among many Christians as people butthurt over a deviant sexual orientation while my point is that those Christians object over sexual acts, not an explicit sexual orientation. I don't think those Christians even believe in the existence of a sexual orientation as conceptualized by modern gender studies."
t3_1t9irv,ce5putz,"The way the Bible is interpreted is also very different. For example, an evangelical will claim that Genesis is a scientific account that contradicts evolution while a Catholic will tell you that Genesis is a vehicle of spiritual wisdom that supplements the scientific facts of evolution. Christians don't agree on what the Bible is, whether or not the it actually condemns homosexuality or if it even matters."
t3_1t9irv,ce5r134,"Jesus was supposed to have fulfilled the old covenant, anyway, so those rules are generally considered no longer binding. (Note: I am not a Christian, I'm just trying to explain how one can reconcile being one while being a homosexual, practising or otherwise). "
t3_1t8yrt,ce5jxeb,"It seems like a lot more because if you're on this site you're probably more tech oriented than a vast majority of the population. As for your first point, piracy has been around for quite a while, but the biggest blow that has been landed to dvd sales was by online streaming content. Netflix, Hulu, Amazon Prime Instant."
t3_1t1i45,ce40luw,"Ahh, I see. I shouldn't really write while tired, I can see like 3 errors in that now. I'm at the opposite end of the spectrum though advertising is such a small part of my income its basically non-existent and is too inconsistent for me to bother with compared to the much more substantial income from subscribers / Record companies"
t3_1sslvc,ce12asq,"The countries of the world still argue over what is and isn't considered terrorism, but the connotation really hasn't changed that much. It is rooted in a history stretching back over 100 years, and while there have always been people opposed to the thinking of the majority, the majority still rules as far as word connotation goes. Sources: The world cannot come up with a consistent denotative definition of terrorism, as exemplified by the varying definitions in terrorism legislation of different countries: http://en.wikipedia.org/wiki/Anti-terrorism_legislation The origin of the term (make sure to look into the different sources posted here, both for accuracy and some interesting reads): http://en.wikipedia.org/wiki/Terrorism And another http://en.wikipedia.org/wiki/History_of_terrorism"
t3_1rw7vg,cdrq6vt,"&lt;That being said, would it not be better, if you have an overarching egalitarian viewpoint, to operate under egalitarianism so that you don't get caught up in your bias? You'll primarily, still want females to get their rights moreso than anything else, however you would end up helping other groups while dealing with your issues rather than walking overtop of them in pursuit of your own needs and desires. Also under no-bias framework would the solutions you come up with end up being a lot more beneficial in the sense of long-term solutions?"
t3_1rw7vg,cdrq6vt,"People disagree on what would actually make the society equal in the first place. Like some people say having college scholarships for &lt;insert race or gender> is racist/sexist while others do not. Or for instance you have many MRAs saying that false rape accusations are a serious issue that needs addressing, while many feminists contend that it's not a serious issue and trying to address it would constitute an attack on women's rights."
t3_1rw7vg,cdrq6vt,"Like some people say having college scholarships for &lt;insert race or gender> is racist/sexist while others do not. Or for instance you have many MRAs saying that false rape accusations are a serious issue that needs addressing, while many feminists contend that it's not a serious issue and trying to address it would constitute an attack on women's rights. MRA's would come back with ""why is it an attack on women's rights specifically, when rape affects men too""; feminists would say ""the vast majority of rape is done to women by men"" MRAs would disagree and say that rate of who rapes whom is more equal and so on and so forth etc etc."
t3_1rvnty,cdrgcu5,"It's irresponsible to pretend that attitudes towards women in this growing subculture don't have a broader impact on society. I understand that gamers tend to disconnect themselves while playing, after all they're just trying to enjoy a game. But I think it undercuts the messaging that it sends to gamers, especially young ones, that women are sex objects and rape isn't a real problem."
t3_1rqcx7,cdqtzxv,"While the tax payer saves billions, that is billions less in the economy and more people on welfare and unemployment etc. So while it may be an overall gain (I honestly don't know) there will be peoples whose lives would be ruined by it too and the money the government was spending to fund these things will no go into supporting these people while they don't work. That has to be taken into consideration too"
t3_1rj73b,cdo2ywx,"I believe that the purpose of debate is communication, therefore arguments are more effective if they adapt to the opponent's style and abilities. The alternative would be like insisting on arguing in english with someone who doesn't speak english, while complaining about their grammar. Therefore, I maintain that your view on this is wrong, and will hold fast until conclusively stopped by firm and unshakable logic."
t3_1re89d,cdn96m4,"IMO government just another firm, competing with other governments in a truly free-for-all environment, in which I get a tiny little say in how it's managed - unlike most businesses. That said, no I don't think government should be propping up failing businesses at taxpayers expense while the people mismanaging them pay themselves bonuses. That means any bailout money should be in the form of loans, stock options, shares, or even outright nationalization."
t3_1qwg8s,cdh6ozn,"Doesn't that seem irrational and prejudicial to you? That's like me saying, ""A few engineers I've met have been arrogant, judgmental assholes who consider anything other than engineering a worthless pursuit and yet lament their loneliness and lack of social standing while doing nothing to improve their tremendous social ineptitude. Therefore, I dislike most engineers."""
t3_1qtuy4,cdgy31a,"Nobody's being pressured, tricked, or misinformed. It does not automatically mean one person suffer while the other gains great benefit. If you personally don't feel ready for interested in marriage, nobody should be pushing you to get one."
t3_1qiccr,cdd983q,"http://www.forbes.com/sites/theapothecary/2013/09/25/double-down-obamacare-will-increase-avg-individual-market-insurance-premiums-by-99-for-men-62-for-women/?partner=yahootix Thanks to subsidies for women's health, women have less to pay from Obamacare. http://www.theatlantic.com/national/archive/2012/03/whats-wrong-with-the-violence-against-women-act/254678/ Thanks to VAWA, women who are beaten up get support, while men don't. http://www.americanthinker.com/blog/2011/09/did_feminist_groups_derail_the_stimulus_bill.html When mostly men lost their jobs in the depression, feminists successfully campaigned for the stimulus bill to protect female jobs."
t3_1qfy2y,cdcikj0,"Too often in fantasy I feel like female characters are allowed to be skilled warriors or talented mages or clever theives as long as they are still hot. They arn't given the muscles you need to weild a heavy metal sword and wear heavy metal armour and they are expected to contort themselves in such a way as to show off their arse and boobs at the same time while fighting off skeletons or whatever. Briennes character defies gender roles both through her actions in becoming a knight and through defying the expectations of beauty her society, and our society place on her."
t3_1qa50u,cdawda7,"It is an issue inherent with representative government. A direct democracy, for instance, eliminates this issue entirely while being even more purely democratic than anything which currently exists on the planet. Your only real point against democracy itself is #1/2 (They may as well be the same thing), which can be true in some circumstances (such as religious zealots who will not allow their way of life to change, and therefore being oppressed when the minority and the will of the people does not agree with their own)."
t3_1q82wf,cda826v,"So the whole states rights issue was about the ability for states to decided whether slaves could be owned firstly, and later if states had the right to succeed from the union. I'm going to go ahead and say here that while slavery is/was involved in every issue, it wasn't always at the center, and in some cases was simply a catalyst for other issues. So while states rights revolved around slavery, that wouldn't have been necessary for the war to occur, the question of ""how much power to nullify do states have"" came to a head at around the same time that there was a push to end slavery, and both were pushed by each other."
t3_1q82wf,cda826v,"I'm going to go ahead and say here that while slavery is/was involved in every issue, it wasn't always at the center, and in some cases was simply a catalyst for other issues. So while states rights revolved around slavery, that wouldn't have been necessary for the war to occur, the question of ""how much power to nullify do states have"" came to a head at around the same time that there was a push to end slavery, and both were pushed by each other. Same with economics, while slavery did/could play a huge issue in that, northerners also owned slaves and plantations in the north, so it wasn't simply slave based economy vs. non slave based, it was relatively self sufficient manufacturing and farming (with relatively few slaves) vs. trade based tobacco and cotton harvesting (with relatively many slaves), based economies."
